[
    {
        "user_input":"Shrň tento článek do stručného shrnutí.",
        "retrieved_contexts":[
            "Ohnivá vlna u Lincolnova památníkuV New Yorku byla spuštěna na Times Square skleněná koule a krátce nato se náměstí proměnilo ve světelný kotel s vířícímu konfetami ve vzduchu a záblesky ohňostroje. Ve Washingtonu u Lincolnova památníku promluvil deset minut před půlnocí prezident Bill Clinton, poté se od památníku po hladině bazénu přehnala ohnivá vlna, která rozžehla ohňostroje kolem nedalekého Washingtonského obelisku. Světelná koule o průměru 1,8 metrů a váze kolem půl tuny klesala po sloupu jednu minutu a přesně o půlnoci se dotkla půdy Times Square, které se přeměnilo pro tuto chvíli v \"Křižovatku světa\", na níž se setkávají nejrůznější národy. Oficiální silvestrovskou časomírou ovšem nebyla světelná koule v New Yorku, nýbrž její menší sestra, která se spouští po stožáru u budovy Americké námořní observatoře ve Washingtonu. U Clintonů se sešli celebrityV Bílém domě se sešly na pozvání Clintona a jeho manželky Hillary americké celebrity ze světa vědy, umění a byznysu. Pozváni byli mimo jiné herečky Elizabeth Taylorová a Sophia Lorenová, herci Robert De Niro a Jack Nicholson, bývalý boxer Muhammad Ali a někdejší astronaut John Glenn. Latinská Amerika slavila zpěvem a tancemNa celém jiho i severoamerickém kontinentu odbily hodiny půlnoc nejdříve v Brazílii. Miliony lidí oblečených vesměs do bílého tančily v rytmu samby pod vodopádem ohňostrojů nejen na pověstné pláži Copacabana v Riu de Janeiro, ale i na dalších místech. Pětikilometrovou pláž Copacabana zaplnilo zhruba tři milióny osob svíjejících se v rytmu samby. Nepříliš veselý byl příchod nového roku ve Venezuele, která se vzpamatovává z nedávných katastrofálních záplav a sesuvů půdy, které si vyžádaly 50 tisíc mrtvých a 400 tisíc bez přístřeší. Déšť máčející zdevastované karibské pobřeží si vynutil i na konci roku vyhlášení stavu pohotovosti. Peru vítalo rok 2000 Svátkem Luny, mysticko-kulturním divadlem inspirovaným rituály Inků. V záplavě ohňostrojů předvedlo na 1500 umělců podivuhodné představení inspirované životem Inků, přičemž tradiční rituály a tance byly provázeny světelnými a zvukovými efekty vyráběnými za pomoci nejmodernějších technologií. Zvláštním zážitkem bylo pro vyvolené vítání nového roku na Velikonočních ostrovech, kde se bájeslovné a mýty opředené gigantické sochy ocitly na 30 minut v mohutném zářivém osvětlení budícím silné emoce. Součástí oslav byla i produkce hudebních a tanečních skupin a katolická mše. Kuba uvítala Nový rok spíše výzvami k revoluční horlivosti než oslavami jako jinde ve světě. Státní televize na prahu prvního dne roku 2000 odvysílala zvláštní půlnoční poselství začínající slovy: \"Soudruzi, naše socialistická revoluce slaví své 41. výročí mohutněji než jindy.\" Británie: ohnivý rej nad TemžíVelká Británie vstoupila do nového milénia oslnivým ohňovým rejem nad hladinou řeky Temže za úžasu rozjásaných miliónů lidí v centru Londýna. Dvanáctým úderem Big Benu, nejznámějších hodin světa, které oznamují \"univerzální\" čas, vkročily formálně do nového století miliardy lidí na celé světě, protože londýnský Greenwich je se svým nultým poledníkem považován za domov času. Čtvrt hodinu před půlnocí královna Alžběta za přítomnosti 10 tisíc pozvaných hostů otevřela Dóm tisíciletí, kontroverzní, jedněmi zatracovanou, jinými opěvovanou gigantickou stavbu, jehož jednu část navrhla architektka českého původu Eva Jiřičná. Na berlínské megaparty přišlo přes dva miliony lidíNěmecko vstoupilo do roku 2000 dosud nejnákladnějšími oslavami ve své historii. Za nejrůznější petardy, rachejtle a světlice vydali Němci na přelomu roku rekordních 200 milionů marek, o 35 milionů více než před rokem. Kromě toho velké ohňostroje stály jen v Berlíně dalších 20 milionů marek. Účast na berlínské megaparty pak překonala i velmi optimistické předpovědi: celkem se zde oslav pod širým nebem zúčastnilo přes dva miliony lidí, z toho statisíce hostů z celého Německa i ze zahraničí. Vodka i šampaňské v MoskvěZpráva Borise Jelcina, že odstupuje z funkce prezidenta, kterou v pátek ohromil Rusko i svět, nijak nepoznamenala letošní oslavy Silvestra v Rusku. Statisíce Moskvanů zaplnily centrum ruské metropole, tancovaly, zpívaly a připíjely si šampaňským i vodkou na konec roku letošního i na příchod Nového roku. O půlnoci vzplanul v Číně věčný oheňČína oslavila příchod nového roku propagandistickou show v Pekingu za účasti prezidenta Ťiang Ce-mina a obřadnými hranicemi na Velké čínské zdi. Přesně o půlnoci Ťiang Ce-min stlačením tlačítka zapálil \"věčný oheň čínského národa\", který má symbolizovat původ a věčnou povahu čínské civilizace. Indie slavila i osvobození rukojmíchStatisíce obyvatel Indie a zahraničních turistů zvláště v centru Dillí, Bombaje a v bývalé portugalské kolonii Góa slavily příchod nového roku tancem a zpěvem. Další důvod k oslavám jim poskytlo propuštění více než 155 rukojmích z uneseného letadla indických aerolinií, kteří v pátek přiletěli z afghánského Kandaháru do Dillí. Austrálie přivítala rok 2000 nevídaným ohňostrojemObyvatelé Austrálie a Nového Zélandu přivítali rok 2000 velkými ohňostroji. Před kamerami celého světa si v pátek na novozélandských Chathamských ostrovech řekli své \"ano\" Dean Braid a Monique Croonová. Stali se tak prvním manželským párem roku 2000. Oslavovalo se i na jižním póluNa jižním pólu, kde se letopočet změnil ve 12:00 SEČ, oslavilo přes 200 vědců a techniků různých národností příchod roku 2000. Sektem si mohlo ovšem připít pouze uvnitř vědeckovýzkumné stanice, protože venku by se při tamní teplotě mínus 60 stupňů Celsia změnilo během okamžiku v led. První byli na soustroví TongaPřesně v 11:00 středoevropského času přivítali nový rok na tichooceánském ostrově Millennium Island, patřícím do souostroví Kiribati, a prakticky zároveň na jižnějším souostroví Tonga - zde byl už 1. leden 00:00. \"Nechť se svět při této příležitosti sjednotí s námi. Odstraňme vše, co nás rozděluje, a spojme se v lásce a míru,\" prohlásil k příchodu Nového roku kiribatský prezident Teburoro Tito. Chorvatsko - Dubrovník Francie - Paříž (Eiffelova věž) Egypt - Káhira USA - Seattle Itálie - Řím USA - Washington"
        ],
        "response":"Nový rok 1999 se v roce 2100 slaví všemi světovými zeměmi ohnivými výbuchy, světelnou koulí nebo ohňovými reji, zatímco v některých zemích, jako jsou Rusko či Čína, se oslavlí spíše tancemi a zpíváním než velkým zážitkovým ohněm.",
        "reference":"Ohňostroji, veselicemi a s jásotem přivítal svět příchod roku 2000. Jako poslední obyvatelé Země sledovali západ Slunce v roce 1999 obyvatelé tichomořského zámořského území USA, Americké Samoy. Slunce se naposledy v roce 1999 schovalo za duhovým horizontem v pátek 06:57 večer místního času (tj. v sobotu v 07:57 SEČ). Petardy a bengálské ohně usmrtily v Evropě šest lidí a desítky dalších zranily. Oslavy i přesto nepotvrdily chmurné představy policistů, kteří čekali daleko větší potíže a byli ve zvýšené pohotovosti ve všech evropských metropolích",
        "reference_contexts":[
            "Ohnivá vlna u Lincolnova památníkuV New Yorku byla spuštěna na Times Square skleněná koule a krátce nato se náměstí proměnilo ve světelný kotel s vířícímu konfetami ve vzduchu a záblesky ohňostroje. Ve Washingtonu u Lincolnova památníku promluvil deset minut před půlnocí prezident Bill Clinton, poté se od památníku po hladině bazénu přehnala ohnivá vlna, která rozžehla ohňostroje kolem nedalekého Washingtonského obelisku. Světelná koule o průměru 1,8 metrů a váze kolem půl tuny klesala po sloupu jednu minutu a přesně o půlnoci se dotkla půdy Times Square, které se přeměnilo pro tuto chvíli v \"Křižovatku světa\", na níž se setkávají nejrůznější národy. Oficiální silvestrovskou časomírou ovšem nebyla světelná koule v New Yorku, nýbrž její menší sestra, která se spouští po stožáru u budovy Americké námořní observatoře ve Washingtonu. U Clintonů se sešli celebrityV Bílém domě se sešly na pozvání Clintona a jeho manželky Hillary americké celebrity ze světa vědy, umění a byznysu. Pozváni byli mimo jiné herečky Elizabeth Taylorová a Sophia Lorenová, herci Robert De Niro a Jack Nicholson, bývalý boxer Muhammad Ali a někdejší astronaut John Glenn. Latinská Amerika slavila zpěvem a tancemNa celém jiho i severoamerickém kontinentu odbily hodiny půlnoc nejdříve v Brazílii. Miliony lidí oblečených vesměs do bílého tančily v rytmu samby pod vodopádem ohňostrojů nejen na pověstné pláži Copacabana v Riu de Janeiro, ale i na dalších místech. Pětikilometrovou pláž Copacabana zaplnilo zhruba tři milióny osob svíjejících se v rytmu samby. Nepříliš veselý byl příchod nového roku ve Venezuele, která se vzpamatovává z nedávných katastrofálních záplav a sesuvů půdy, které si vyžádaly 50 tisíc mrtvých a 400 tisíc bez přístřeší. Déšť máčející zdevastované karibské pobřeží si vynutil i na konci roku vyhlášení stavu pohotovosti. Peru vítalo rok 2000 Svátkem Luny, mysticko-kulturním divadlem inspirovaným rituály Inků. V záplavě ohňostrojů předvedlo na 1500 umělců podivuhodné představení inspirované životem Inků, přičemž tradiční rituály a tance byly provázeny světelnými a zvukovými efekty vyráběnými za pomoci nejmodernějších technologií. Zvláštním zážitkem bylo pro vyvolené vítání nového roku na Velikonočních ostrovech, kde se bájeslovné a mýty opředené gigantické sochy ocitly na 30 minut v mohutném zářivém osvětlení budícím silné emoce. Součástí oslav byla i produkce hudebních a tanečních skupin a katolická mše. Kuba uvítala Nový rok spíše výzvami k revoluční horlivosti než oslavami jako jinde ve světě. Státní televize na prahu prvního dne roku 2000 odvysílala zvláštní půlnoční poselství začínající slovy: \"Soudruzi, naše socialistická revoluce slaví své 41. výročí mohutněji než jindy.\" Británie: ohnivý rej nad TemžíVelká Británie vstoupila do nového milénia oslnivým ohňovým rejem nad hladinou řeky Temže za úžasu rozjásaných miliónů lidí v centru Londýna. Dvanáctým úderem Big Benu, nejznámějších hodin světa, které oznamují \"univerzální\" čas, vkročily formálně do nového století miliardy lidí na celé světě, protože londýnský Greenwich je se svým nultým poledníkem považován za domov času. Čtvrt hodinu před půlnocí královna Alžběta za přítomnosti 10 tisíc pozvaných hostů otevřela Dóm tisíciletí, kontroverzní, jedněmi zatracovanou, jinými opěvovanou gigantickou stavbu, jehož jednu část navrhla architektka českého původu Eva Jiřičná. Na berlínské megaparty přišlo přes dva miliony lidíNěmecko vstoupilo do roku 2000 dosud nejnákladnějšími oslavami ve své historii. Za nejrůznější petardy, rachejtle a světlice vydali Němci na přelomu roku rekordních 200 milionů marek, o 35 milionů více než před rokem. Kromě toho velké ohňostroje stály jen v Berlíně dalších 20 milionů marek. Účast na berlínské megaparty pak překonala i velmi optimistické předpovědi: celkem se zde oslav pod širým nebem zúčastnilo přes dva miliony lidí, z toho statisíce hostů z celého Německa i ze zahraničí. Vodka i šampaňské v MoskvěZpráva Borise Jelcina, že odstupuje z funkce prezidenta, kterou v pátek ohromil Rusko i svět, nijak nepoznamenala letošní oslavy Silvestra v Rusku. Statisíce Moskvanů zaplnily centrum ruské metropole, tancovaly, zpívaly a připíjely si šampaňským i vodkou na konec roku letošního i na příchod Nového roku. O půlnoci vzplanul v Číně věčný oheňČína oslavila příchod nového roku propagandistickou show v Pekingu za účasti prezidenta Ťiang Ce-mina a obřadnými hranicemi na Velké čínské zdi. Přesně o půlnoci Ťiang Ce-min stlačením tlačítka zapálil \"věčný oheň čínského národa\", který má symbolizovat původ a věčnou povahu čínské civilizace. Indie slavila i osvobození rukojmíchStatisíce obyvatel Indie a zahraničních turistů zvláště v centru Dillí, Bombaje a v bývalé portugalské kolonii Góa slavily příchod nového roku tancem a zpěvem. Další důvod k oslavám jim poskytlo propuštění více než 155 rukojmích z uneseného letadla indických aerolinií, kteří v pátek přiletěli z afghánského Kandaháru do Dillí. Austrálie přivítala rok 2000 nevídaným ohňostrojemObyvatelé Austrálie a Nového Zélandu přivítali rok 2000 velkými ohňostroji. Před kamerami celého světa si v pátek na novozélandských Chathamských ostrovech řekli své \"ano\" Dean Braid a Monique Croonová. Stali se tak prvním manželským párem roku 2000. Oslavovalo se i na jižním póluNa jižním pólu, kde se letopočet změnil ve 12:00 SEČ, oslavilo přes 200 vědců a techniků různých národností příchod roku 2000. Sektem si mohlo ovšem připít pouze uvnitř vědeckovýzkumné stanice, protože venku by se při tamní teplotě mínus 60 stupňů Celsia změnilo během okamžiku v led. První byli na soustroví TongaPřesně v 11:00 středoevropského času přivítali nový rok na tichooceánském ostrově Millennium Island, patřícím do souostroví Kiribati, a prakticky zároveň na jižnějším souostroví Tonga - zde byl už 1. leden 00:00. \"Nechť se svět při této příležitosti sjednotí s námi. Odstraňme vše, co nás rozděluje, a spojme se v lásce a míru,\" prohlásil k příchodu Nového roku kiribatský prezident Teburoro Tito. Chorvatsko - Dubrovník Francie - Paříž (Eiffelova věž) Egypt - Káhira USA - Seattle Itálie - Řím USA - Washington"
        ]
    },
    {
        "user_input":"Shrň tento článek do stručného shrnutí.",
        "retrieved_contexts":[
            "Menšímu chirurgickému zákroku na koleni se v závěru roku podrobil také Pavel Novotný, ale do Františkových Lázní odjel, i když zpočátku bude mít úlevy. Mužstvo doplnili tři mladíci - obránce Tomáš Hübschmann, vracející se z hostování ve Zlíně, - a dva hráči z juniorky - univerzální Michal Zelenka a brankář dorostenecké reprezentace Patrik Kolář, který bude po Čalounově odchodu do Příbrami ve Spartě trojkou. \"V životě fotbalisty je to nejnepříjemnější období. Není na co se těšit,\" povzdechl si před odjezdem sparťatsného autobusu záložník Martin Hašek. Jako jeden z mála hráčů však kvitoval skutečnost, že se do programu přípravy vracejí běžky, jež byly na Letné v minulých letech kvůli riziku zranění téměř tabu. \"Podle mě je to ideální způsob získávání kondice, který nezatěžuje klouby tak jako běhání. Dokonce i když jsem měl problémy s kolenem a nemohl jsem běhat, na běžkách jsem trénoval normálně,\" tvrdí fotbalista, který byl od dětství v Jizerských horách na lyžích jako doma. Ani v prvním období, v němž bude hlavní důraz kladen na kondici však hráči bez míče. \"Uvidí ho každý den. A v sobotu hrajeme první zápas proti Františkovým Lázním,\" prozradil trenér Ivan Hašek. Trenér Cipro věří, že se v Edenu začne stavětS jediným nováčkem, devatenáctiletým Janem Plašilem z divizního Rychnova nad Kněžnou, a téměř po roce také s uzdraveným Lubošem Kozlem i slovenským záložníkem Ondrejem Krištofíkem, začal přípravu jedenavacetičlenný kádr Slavie. \"Vážit se sice hráči budou, ale jak předpokládám, všichni jsou takovými profesionály, že vědí, co si mohou dovolit,\" řekl trenér vedoucího týmu ligy František Cipro. V prvním týdnu čeká tým dvoufázová příprava v Praze, dopoledne tréninky na hlavním stadiónu, odpoledne v tělocvičně a posilovně. Desátého ledna přivítá hráče na týden hotel Sklář v Harrachově a ke slovu přijde především náročná část fyzické přípravy zejména na běžkách. \"Zimní turnaje jsem moc rád nikdy neměl, proto ani letos na žádném hrát nebudeme. Můj model zimní přípravy je stejný - hory a teplo,\" pokračoval Cipro. Za lepším počasím vyrazí Slavia do portugalského Fara 30. ledna a do 9. února tam sehraje tři přípravé zápasy. \"Zatím není jasno s kým, ale předběžně jednáme s Borussií Mönchengladbach, FC St. Pauli, Servette Ženeva a Torpedem Moskva,\" sdělil vedoucímužstva Zdeněk Kudela. \"Budu nejspokojenější, když nikdo neodejde. I když záleží na spoustě věcí a je možné, že nakonec někdo i přijde,\" připustil Cipro, jehož tým čeká už 29. února v Praze na Strahově zápas Poháru UEFA s Udine. \"Doufám, že tato sezóna bude na dědečkovském stadiónu v Edenu poslední, proto se chceme rozloučit co nejdůstojněji. Zatím je předčasné mluvit, kde budeme hrát, ale radikálně to řešit musíme,\" řekl Cipro, který připustil, že na Strahově se hráči cítí dobře a chodí tam i diváci. V Drnovicích se nevejdou do šatnyS posilami začaly Drnovice na svém stadiónu zimní přípravu. Novými hráči v šestadvacetičlenném kádru jsou záložníci Pavel Zavadil z druholigových Ratíškovic, Jaroslav Černý z Bruntálu a Petr Měřínský, přeřazený z béčka. \"Už máme plnou kabinu hráčů, o dalších posilách neuvažuji. Spíš musím kádr postupně redukovat,\" řekl trenér Večeřa. Zápasovou sérii zahájí Drnovice v sobotu ve 13.00 utkáním s vedoucím týmem MSFL Spartakem Jihlava. Příští úterý čekají na Petru hned dvě utkání, ve 12.00 s Holicemi a ve 14.00 s Dolními Kounicemi. Do 13. ledna budou Drnovice trénovat na svém stadióně, ve druhé polovině ledna odjede na soustředění do Luhačovic a Blšan. Trenéra Budějovic trápilo počasíDvě hodiny po poledni zahájí zimní přípravu na svém stadiónu i hráči Českých Budějovic. \"Přemýšlím, kam vyrazíme, počasí nám situaci trochu komplikuje,\" uvažoval v neděli, kdy venku začínala mírná obleva, trenér Pavel Tobiáš. Jihočeši v zimní přestávce hodně využívají hřiště v okolí Českých Budějovic. Tobiáš počítá s kádrem sedmadvaceti hráčů. Přípravu s prvním týmem zahájí i Ludačka z rezervního týmu, a dorostenci Leština se Schánělcem. \"Máme dva gólmany a Schánělec zatím bude trojka.\" Poprvé se mužstvu představí nové posily Vácha, Pospíšil, Polomský a Michal Nehoda. V přípravných zápasech trenér otestuje všechny hráče. Kromě Vrzala, Krejči a Horejše, kteří budou hostovat v Třeboni, mužstvo opustí ještě obránce Veselý. \"Má předpoklady, ale v současnosti se u nás do sestavy nedostal. A hrát za béčko divizi je pro něj málo.\" O Veselého se zajímá druholigová Poštorná. Angažmá v nižší zahraniční soutěži si shání také Krejčí, který ale zatím bude trénovat s Českými Budějovicemi. \"Nemáme moc času na experimenty, příprava trvá jen šest týdnů,\" připomněl Tobiáš. Olomouc začala už v neděliUž v neděli zahájili přípravu fotbalisté olomoucké Sigmy. V neděli po obědě hráči nafasovali novou obuv a vyběhli na tréninkové hřiště. \"Volna už bylo dost. Čeká nás těžké jaro, takže každý den tréninku bude dobrý,\" tvrdí trenér Petr Žemlík, podle něhož se hráči v kabině těšili, až vyběhnou na hřiště. Tréninku předcházelo tradiční vážení po vánočních svátcích. S nadváhou měli problémy pouze dva hráči, které však za kila navíc nečeká pokuta. \"Jsem spokojen, navíc hráče čeká taková příprava, že budou sami usilovat o shození nadbytečných kil. Kdo by chtěl běhat kilometry s nadváhou,\" řekl Žemlík, který měl na prvním tréninku k dispozici naprostou většinu hráčů. Chyběli pouze dva brankaři, o jejichž osudu se bude rozhodovat v prvních lednových dnech. Pižanowski, který se vrátil z hostování, má chřipku a Skácel opět jedná o přestupu. \"Mezi svátky se ozval zájemce o jeho služby. Dnes bude v Praze na zdravotních testech,\" nastínil současný stav jednání sportovní manažer klubu Bořivoj Kresta. Podle dostupných zpráv má o Skácela zájem Borusia Mönchengladbach. První trénink v novém roce absolvoval také Ivan Bartoš, nová posila klubu z Dukly Banská Bystrica, člen slovenské reprezentace do 21 let. \"V přípravě jsou na zkoušku také prostějovští Randa a Opravil,\" doplnil výčet nových hráčů Kresta, který jedná o dalším případném posílení. Sigma se v úvodním lednovém týdnu bude připravovat v domácím prostředí. \"Druhou část kondiční přípravy absolvujeme na soustředění v Horní Bečvě,\" řekl o dalším programu Žemlík. Závěr přípravy stráví tým v chorvatské Pule. Na Žižkově začali se změnami Bez Pavlúse, Hertla, Navrátila a Valkouna, ale s reprezentantem do jedenadvaceti let Martinem Čuprem z Liberce, se sešlo v pondělí na Žižkově dvaadvacetičlenný kádr týmu. K zemětřesení v kádru se však už trenér Zdeněk Ščasný nevracel. \"Není třeba, každý ví, proč k němu došlo, a ti co zůstali, mají šanci ukázat, co v nich je,\" řekl. Čupr prý není poslední posilou, manažer Ivan Horník doufá v příchod ještě dvou hráčů. Jedním z nich by měl být gólman. \"Máme čas až do herního soustředění v závěru ledna,\" prohlásil Horník. Michalíkovo hostování z Baníku Ostrava se změní v nejbližších dnech v přestup, až do léta bylo prodlouženo hostování Luďka Straceného ze Sparty. Zimní přípravu začne Viktoria v areálu Čechie Karlín, 9. ledna odjede tna týden do Špindlerova Mlýna. Potom sehraje několik přípravných zápasů, většinou na turnaji v Karlíně a vrcholem bude týdenní herní soustředění v Portugalsku, kde by měla Viktoria sehrát tři zápasy. Jistým soupeřrem je nyní jen Wolfsburg. Blšany: Vrabec začíná boj o návratBlšany zahájili přípravu v domácím prostředí. V kádru už chybí Libor Došek, který se vrátil do Brna, naopak po delším čase se objevil nejen v asistentské roli, ale i jako hráčrekonvalescent Petr Vrabec, který se bude pokoušet po těžkém zranění o návrat. Vrchol přípravy je naplánován na jih Francie. Staronovými tvářemi jsou v Blšanech po návratu z hostování také brankář Obermajer a záložník Průcha, úplnými nováčky Ivo Zbožínek z Prostějova a talentovaný obránce Jakub Bureš, který coby kmenový hráč Bohemians na podzim působil bez profesionální smlouvy na hostování v Krči. Po týdnu ve vlastním areálu zamíří Blšany na týdenní soustředění do českých hor a před odjezdem za lepším počasím jižní Francie znovu pobydou několik dnů doma. Bohemians chtějí ještě útočníkyTrenér Vlastimil Petržela, vyznavač tvrdé řehole, začal přípravu Bohemians v neděli na běžkách. Hráči jsou na Šumavě, kde polykají kilometry na Špičáku a potí se v posilovně. Už v sobotu hrají v turnaji Čechie Karlín s Plzní, o den později bude jejich soupeřem na umělé trávě Jablonec. V příštím týdnu absolvuje kádr kondiční přípravu v Praze a o víkendu opět v Karlíně hrají Bohemians s Xaverovem a Teplicemi. Devatenáctého ledna odcestuje celek z Vršovic do Drážďan, kde sehraje zápas s domácími fotbalisty a dvanáctidenní přípravu v Německu zakončí střetnutím 31. ledna v Berlíně s Hertou. Mezi těmito zápasy nastoupí prvoligový nováček ještě k pěti halovým turnajům a dvěma zápasům venku. Novým hráčem v týmu, jenž už dříve posílili slovenští reprezentanti do 21 let, brankář Kamil Čontofalský a Karol Kisel, jsou Aleš Bednář z Hradce Králové, který přichází výměnou za Freislera, a stoper Milan Bakeš z Krče,\" řekl Petržela, který usiluje ještě alespoň o dva útočníky."
        ],
        "response":"Fotbalový klub Slavie se v rámci zimní části příprawy vrácí k tréninkům na běžkách a vyrazil do Portugalska na tři zápasové turnaje, zatímco klub Slavia Drnovíc zahájil přípravu s novými posilama a hraje v domácí sezóně. Hrači klubu Slavia Cipro se snaží získat kondici bez zatížení kloubů, zatímčím klub Bohemian v Prahe zahájily zimní tréninky běžkami a připravují se na zápas",
        "reference":"Značně neoblíbené obodobí, tvrdá zimní příprava, začíná fotbalistům v těchto dnech. Už s brankářem Blažkem z Bohemians začínají sparťané přípravu na běžkách ve Františkových Lázních, kde budou v prvním týdnu nabírat kondici. Trenér Ivan Hašek věří, že do konce ledna, kdy je uzávěrka soupisek na Ligu mistrů, získá ještě po jedné posile pro každou řadu. Do hotelu U tří lilií zamířilo 22 hráčů. Doma zůstali jen rekonvalescenti Labant, Prohászka a Vlastimil Svoboda",
        "reference_contexts":[
            "Menšímu chirurgickému zákroku na koleni se v závěru roku podrobil také Pavel Novotný, ale do Františkových Lázní odjel, i když zpočátku bude mít úlevy. Mužstvo doplnili tři mladíci - obránce Tomáš Hübschmann, vracející se z hostování ve Zlíně, - a dva hráči z juniorky - univerzální Michal Zelenka a brankář dorostenecké reprezentace Patrik Kolář, který bude po Čalounově odchodu do Příbrami ve Spartě trojkou. \"V životě fotbalisty je to nejnepříjemnější období. Není na co se těšit,\" povzdechl si před odjezdem sparťatsného autobusu záložník Martin Hašek. Jako jeden z mála hráčů však kvitoval skutečnost, že se do programu přípravy vracejí běžky, jež byly na Letné v minulých letech kvůli riziku zranění téměř tabu. \"Podle mě je to ideální způsob získávání kondice, který nezatěžuje klouby tak jako běhání. Dokonce i když jsem měl problémy s kolenem a nemohl jsem běhat, na běžkách jsem trénoval normálně,\" tvrdí fotbalista, který byl od dětství v Jizerských horách na lyžích jako doma. Ani v prvním období, v němž bude hlavní důraz kladen na kondici však hráči bez míče. \"Uvidí ho každý den. A v sobotu hrajeme první zápas proti Františkovým Lázním,\" prozradil trenér Ivan Hašek. Trenér Cipro věří, že se v Edenu začne stavětS jediným nováčkem, devatenáctiletým Janem Plašilem z divizního Rychnova nad Kněžnou, a téměř po roce také s uzdraveným Lubošem Kozlem i slovenským záložníkem Ondrejem Krištofíkem, začal přípravu jedenavacetičlenný kádr Slavie. \"Vážit se sice hráči budou, ale jak předpokládám, všichni jsou takovými profesionály, že vědí, co si mohou dovolit,\" řekl trenér vedoucího týmu ligy František Cipro. V prvním týdnu čeká tým dvoufázová příprava v Praze, dopoledne tréninky na hlavním stadiónu, odpoledne v tělocvičně a posilovně. Desátého ledna přivítá hráče na týden hotel Sklář v Harrachově a ke slovu přijde především náročná část fyzické přípravy zejména na běžkách. \"Zimní turnaje jsem moc rád nikdy neměl, proto ani letos na žádném hrát nebudeme. Můj model zimní přípravy je stejný - hory a teplo,\" pokračoval Cipro. Za lepším počasím vyrazí Slavia do portugalského Fara 30. ledna a do 9. února tam sehraje tři přípravé zápasy. \"Zatím není jasno s kým, ale předběžně jednáme s Borussií Mönchengladbach, FC St. Pauli, Servette Ženeva a Torpedem Moskva,\" sdělil vedoucímužstva Zdeněk Kudela. \"Budu nejspokojenější, když nikdo neodejde. I když záleží na spoustě věcí a je možné, že nakonec někdo i přijde,\" připustil Cipro, jehož tým čeká už 29. února v Praze na Strahově zápas Poháru UEFA s Udine. \"Doufám, že tato sezóna bude na dědečkovském stadiónu v Edenu poslední, proto se chceme rozloučit co nejdůstojněji. Zatím je předčasné mluvit, kde budeme hrát, ale radikálně to řešit musíme,\" řekl Cipro, který připustil, že na Strahově se hráči cítí dobře a chodí tam i diváci. V Drnovicích se nevejdou do šatnyS posilami začaly Drnovice na svém stadiónu zimní přípravu. Novými hráči v šestadvacetičlenném kádru jsou záložníci Pavel Zavadil z druholigových Ratíškovic, Jaroslav Černý z Bruntálu a Petr Měřínský, přeřazený z béčka. \"Už máme plnou kabinu hráčů, o dalších posilách neuvažuji. Spíš musím kádr postupně redukovat,\" řekl trenér Večeřa. Zápasovou sérii zahájí Drnovice v sobotu ve 13.00 utkáním s vedoucím týmem MSFL Spartakem Jihlava. Příští úterý čekají na Petru hned dvě utkání, ve 12.00 s Holicemi a ve 14.00 s Dolními Kounicemi. Do 13. ledna budou Drnovice trénovat na svém stadióně, ve druhé polovině ledna odjede na soustředění do Luhačovic a Blšan. Trenéra Budějovic trápilo počasíDvě hodiny po poledni zahájí zimní přípravu na svém stadiónu i hráči Českých Budějovic. \"Přemýšlím, kam vyrazíme, počasí nám situaci trochu komplikuje,\" uvažoval v neděli, kdy venku začínala mírná obleva, trenér Pavel Tobiáš. Jihočeši v zimní přestávce hodně využívají hřiště v okolí Českých Budějovic. Tobiáš počítá s kádrem sedmadvaceti hráčů. Přípravu s prvním týmem zahájí i Ludačka z rezervního týmu, a dorostenci Leština se Schánělcem. \"Máme dva gólmany a Schánělec zatím bude trojka.\" Poprvé se mužstvu představí nové posily Vácha, Pospíšil, Polomský a Michal Nehoda. V přípravných zápasech trenér otestuje všechny hráče. Kromě Vrzala, Krejči a Horejše, kteří budou hostovat v Třeboni, mužstvo opustí ještě obránce Veselý. \"Má předpoklady, ale v současnosti se u nás do sestavy nedostal. A hrát za béčko divizi je pro něj málo.\" O Veselého se zajímá druholigová Poštorná. Angažmá v nižší zahraniční soutěži si shání také Krejčí, který ale zatím bude trénovat s Českými Budějovicemi. \"Nemáme moc času na experimenty, příprava trvá jen šest týdnů,\" připomněl Tobiáš. Olomouc začala už v neděliUž v neděli zahájili přípravu fotbalisté olomoucké Sigmy. V neděli po obědě hráči nafasovali novou obuv a vyběhli na tréninkové hřiště. \"Volna už bylo dost. Čeká nás těžké jaro, takže každý den tréninku bude dobrý,\" tvrdí trenér Petr Žemlík, podle něhož se hráči v kabině těšili, až vyběhnou na hřiště. Tréninku předcházelo tradiční vážení po vánočních svátcích. S nadváhou měli problémy pouze dva hráči, které však za kila navíc nečeká pokuta. \"Jsem spokojen, navíc hráče čeká taková příprava, že budou sami usilovat o shození nadbytečných kil. Kdo by chtěl běhat kilometry s nadváhou,\" řekl Žemlík, který měl na prvním tréninku k dispozici naprostou většinu hráčů. Chyběli pouze dva brankaři, o jejichž osudu se bude rozhodovat v prvních lednových dnech. Pižanowski, který se vrátil z hostování, má chřipku a Skácel opět jedná o přestupu. \"Mezi svátky se ozval zájemce o jeho služby. Dnes bude v Praze na zdravotních testech,\" nastínil současný stav jednání sportovní manažer klubu Bořivoj Kresta. Podle dostupných zpráv má o Skácela zájem Borusia Mönchengladbach. První trénink v novém roce absolvoval také Ivan Bartoš, nová posila klubu z Dukly Banská Bystrica, člen slovenské reprezentace do 21 let. \"V přípravě jsou na zkoušku také prostějovští Randa a Opravil,\" doplnil výčet nových hráčů Kresta, který jedná o dalším případném posílení. Sigma se v úvodním lednovém týdnu bude připravovat v domácím prostředí. \"Druhou část kondiční přípravy absolvujeme na soustředění v Horní Bečvě,\" řekl o dalším programu Žemlík. Závěr přípravy stráví tým v chorvatské Pule. Na Žižkově začali se změnami Bez Pavlúse, Hertla, Navrátila a Valkouna, ale s reprezentantem do jedenadvaceti let Martinem Čuprem z Liberce, se sešlo v pondělí na Žižkově dvaadvacetičlenný kádr týmu. K zemětřesení v kádru se však už trenér Zdeněk Ščasný nevracel. \"Není třeba, každý ví, proč k němu došlo, a ti co zůstali, mají šanci ukázat, co v nich je,\" řekl. Čupr prý není poslední posilou, manažer Ivan Horník doufá v příchod ještě dvou hráčů. Jedním z nich by měl být gólman. \"Máme čas až do herního soustředění v závěru ledna,\" prohlásil Horník. Michalíkovo hostování z Baníku Ostrava se změní v nejbližších dnech v přestup, až do léta bylo prodlouženo hostování Luďka Straceného ze Sparty. Zimní přípravu začne Viktoria v areálu Čechie Karlín, 9. ledna odjede tna týden do Špindlerova Mlýna. Potom sehraje několik přípravných zápasů, většinou na turnaji v Karlíně a vrcholem bude týdenní herní soustředění v Portugalsku, kde by měla Viktoria sehrát tři zápasy. Jistým soupeřrem je nyní jen Wolfsburg. Blšany: Vrabec začíná boj o návratBlšany zahájili přípravu v domácím prostředí. V kádru už chybí Libor Došek, který se vrátil do Brna, naopak po delším čase se objevil nejen v asistentské roli, ale i jako hráčrekonvalescent Petr Vrabec, který se bude pokoušet po těžkém zranění o návrat. Vrchol přípravy je naplánován na jih Francie. Staronovými tvářemi jsou v Blšanech po návratu z hostování také brankář Obermajer a záložník Průcha, úplnými nováčky Ivo Zbožínek z Prostějova a talentovaný obránce Jakub Bureš, který coby kmenový hráč Bohemians na podzim působil bez profesionální smlouvy na hostování v Krči. Po týdnu ve vlastním areálu zamíří Blšany na týdenní soustředění do českých hor a před odjezdem za lepším počasím jižní Francie znovu pobydou několik dnů doma. Bohemians chtějí ještě útočníkyTrenér Vlastimil Petržela, vyznavač tvrdé řehole, začal přípravu Bohemians v neděli na běžkách. Hráči jsou na Šumavě, kde polykají kilometry na Špičáku a potí se v posilovně. Už v sobotu hrají v turnaji Čechie Karlín s Plzní, o den později bude jejich soupeřem na umělé trávě Jablonec. V příštím týdnu absolvuje kádr kondiční přípravu v Praze a o víkendu opět v Karlíně hrají Bohemians s Xaverovem a Teplicemi. Devatenáctého ledna odcestuje celek z Vršovic do Drážďan, kde sehraje zápas s domácími fotbalisty a dvanáctidenní přípravu v Německu zakončí střetnutím 31. ledna v Berlíně s Hertou. Mezi těmito zápasy nastoupí prvoligový nováček ještě k pěti halovým turnajům a dvěma zápasům venku. Novým hráčem v týmu, jenž už dříve posílili slovenští reprezentanti do 21 let, brankář Kamil Čontofalský a Karol Kisel, jsou Aleš Bednář z Hradce Králové, který přichází výměnou za Freislera, a stoper Milan Bakeš z Krče,\" řekl Petržela, který usiluje ještě alespoň o dva útočníky."
        ]
    },
    {
        "user_input":"Shrň tento článek do stručného shrnutí.",
        "retrieved_contexts":[
            "Slavia: konečně s Kozlem Ligový půlmistr začal vstup do historického roku bez výrazné posily, přesto vyztužený čtyřmi jmény: poprvé od květnové operace kolena maká naplno reprezentant Kozel, už od konce podzimu s týmem trénují bývalí hráči Krištofík a Hyský a z Rychnova nad Kněžnou přišel devatenáctiletý talent Jan Plašil, jehož bratr hraje v Monaku. \"Třeba Krištofík ukázal výkony za béčko, že by nám měl pomoci v důležitých zápasech,\" ocenil trenér František Cipro. Slávisté se budou připravovat nejen na ligu, ale i Pohár UEFA proti Udine. Oba zápasy byly přesunuty ze čtvrtků na úterý, a to 29. února na Strahově a 7. března v Itálii. Sparta: nechybějí ani běžky Do dvou autobusů, které sparťany včera odvezly na soustředění do Františkových Lázní, se překvapivě nakládaly i běžky. Většina předešlých trenérů se bála, aby na nich \"milionové\" nohy hvězd nepřišly k úhoně. \"Já obavy nemám, běžky jsou pro přípravu jenom doplňkem. Z kopce jezdit nebudeme,\" řekl Ivan Hašek, velící zimní přípravě poprvé v trenérské kariéře. S sebou vzal dvaadvacet hráčů, novou tváří je brankář Blažek z Bohemians. A co další posily? Snad do konce ledna. Ve výpravě chyběl gólman Čaloun, jenž odešel do Příbrami, a ještě tři marodi. Zraněná kolena budou doma léčit Labant s Prohászkou, Vlastimila Svobodu čeká rehabilitace přetržené achillovky. Drnovice: bez velkých změn Nikoliv soustředění na turecké Riviéře, ale místo cesty za teplem tréninkové centrum v Blšanech. To je asi jediná velká změna v přípravném plánu Drnovic, překvapivě bronzového týmu z podzimu. Ani v kádru, v němž se to minulá léta mlelo, se příliš nemění. Trenér Karel Večeřa vítal tři nové hráče: Zavadila, který naposledy hrál v Ratíškovicích, Černého z Bruntálu a Měřínského z béčka. \"O nikom dalším neuvažuji, spíš pustíme někoho na hostování. Teď je v kádru dvacet šest hráčů,\" sdělil Večeřa. Nový klubový vlastník, firma Persport, asi výrazné zásahy nechystá. Svědčí o tom prodloužení smlouvy se sportovním ředitelem Ivanem Kopeckým o rok. Bohemians: ztráta gólmana Příprava startovala už druhý den v novém roce, a to na běžkách. Přísný trenér Vlastimil Petržela nakázal první lyžařské kilometry na šumavském Špičáku. Mužstvo se příliš nezměnilo, největší ztrátou je odchod gólmana Blažka do Sparty. Náhradou by mohl být Kamil Čontofalský, brankář reprezentace Slovenska do 21 let. \"Přicházejí ještě další Slovák Kisel a Bednář z Hradce,\" řekl trenér Petržela. Na Bohemians čeká dost zápasů: absolvují třeba zimní turnaj v pražském Karlíně, čtyři přípravná klání a pět halových turnajů v Německu. Liberec: chybí Argentinec Bez své největší hvězdy útočníka Lazzara Liuniho, jenž se zatím nevrátil z rodné Argentiny, začali fotbalisté Liberce. Pro zranění kolena chyběli i Hrbek s brankářem Hauzrem. Nováčkem je slovenský střelec Vladimír Kožuch, jenž přestoupil z Prešova a během zimy ho kontaktovala i Slavia. \"Snad vylepší naši produktivitu,\" věří asistent trenéra Josef Petřík. Liberečtí si naplánovali tři soustředění: nejprve na běžkách v krkonošském Harrachově, poté v Nymburce a na závěr ve slovenské Dunajské Stredě, kde se utkají například s Rapidem Vídeň. Budějovice: nová čtveřice S kvartetem nových hráčů začali hráči Budějovic. Nejblyštivější jméno z nich nosí Karel Vácha, bývalý útočník Slavie, který přišel na půlroční hostování z rakouského klubu Tirol Innsbruck. \"Snad se nám na jaře povede přiblížit se k historicky nejlepšímu umístění klubu v první lize,\" přál si Vácha, který pamatuje šesté místo, budějovické maximum mezi elitou ze sezony 1993\/94. Dále přišli Nehoda, Pospíšil a Polomský. Na hostování odcházejí mimo jiné Veselý do Poštorné a Krejčí do Zlína. \"Za šest týdnů nás čeká první zápas, musíme se s kratší přípravou, než bývá jindy, vyrovnat,\" řekl kouč Pavel Tobiáš. Teplice: čeká je Florida Třebaže nad sedmým místem nepanuje v Teplicích po podzimu spokojenost, žádné zemětřesení v kádru nenastalo. Jediným nováčkem je bývalý plzeňský brankář Havel, který na podzim hostoval v Olomouci. Uzdravil se záložník Rampáček, který chyběl celý podzim. Přípravu začalo mužstvo už 28. prosince, ale trio Bílek, Pavel Holomek a Sourada ji zahájilo až včera. Dostali svolení od trenéra Pešiceho, protože měli měli už dřív zaplacenou zahraniční dovolenou s rodinou. Tepličtí hrají turnaj v Praze-Karlíně a čeká je atraktivní zájezd na Floridu."
        ],
        "response":"Slavia se připravuje na ligovou sezonu bez významných posil, využívající zkušenosti bývalých hráčků a mladého talenta Jana Plašila, zatímco Spartu čeká návrat běžek a Bohemianští ztratili gólmena Blažeka. Liberce a Budějovici chybějí hlavní hráči, zatímca Teplice očekávají zájem o zahraniční hráče a Floridy.",
        "reference":"Do 19. února, kdy začne jarní část fotbalové ligy, je daleko, ale včera se začalo naplno trénovat téměř ve všech týmech. Ty, které se drží v tabulce nahoře, udělaly několik změn",
        "reference_contexts":[
            "Slavia: konečně s Kozlem Ligový půlmistr začal vstup do historického roku bez výrazné posily, přesto vyztužený čtyřmi jmény: poprvé od květnové operace kolena maká naplno reprezentant Kozel, už od konce podzimu s týmem trénují bývalí hráči Krištofík a Hyský a z Rychnova nad Kněžnou přišel devatenáctiletý talent Jan Plašil, jehož bratr hraje v Monaku. \"Třeba Krištofík ukázal výkony za béčko, že by nám měl pomoci v důležitých zápasech,\" ocenil trenér František Cipro. Slávisté se budou připravovat nejen na ligu, ale i Pohár UEFA proti Udine. Oba zápasy byly přesunuty ze čtvrtků na úterý, a to 29. února na Strahově a 7. března v Itálii. Sparta: nechybějí ani běžky Do dvou autobusů, které sparťany včera odvezly na soustředění do Františkových Lázní, se překvapivě nakládaly i běžky. Většina předešlých trenérů se bála, aby na nich \"milionové\" nohy hvězd nepřišly k úhoně. \"Já obavy nemám, běžky jsou pro přípravu jenom doplňkem. Z kopce jezdit nebudeme,\" řekl Ivan Hašek, velící zimní přípravě poprvé v trenérské kariéře. S sebou vzal dvaadvacet hráčů, novou tváří je brankář Blažek z Bohemians. A co další posily? Snad do konce ledna. Ve výpravě chyběl gólman Čaloun, jenž odešel do Příbrami, a ještě tři marodi. Zraněná kolena budou doma léčit Labant s Prohászkou, Vlastimila Svobodu čeká rehabilitace přetržené achillovky. Drnovice: bez velkých změn Nikoliv soustředění na turecké Riviéře, ale místo cesty za teplem tréninkové centrum v Blšanech. To je asi jediná velká změna v přípravném plánu Drnovic, překvapivě bronzového týmu z podzimu. Ani v kádru, v němž se to minulá léta mlelo, se příliš nemění. Trenér Karel Večeřa vítal tři nové hráče: Zavadila, který naposledy hrál v Ratíškovicích, Černého z Bruntálu a Měřínského z béčka. \"O nikom dalším neuvažuji, spíš pustíme někoho na hostování. Teď je v kádru dvacet šest hráčů,\" sdělil Večeřa. Nový klubový vlastník, firma Persport, asi výrazné zásahy nechystá. Svědčí o tom prodloužení smlouvy se sportovním ředitelem Ivanem Kopeckým o rok. Bohemians: ztráta gólmana Příprava startovala už druhý den v novém roce, a to na běžkách. Přísný trenér Vlastimil Petržela nakázal první lyžařské kilometry na šumavském Špičáku. Mužstvo se příliš nezměnilo, největší ztrátou je odchod gólmana Blažka do Sparty. Náhradou by mohl být Kamil Čontofalský, brankář reprezentace Slovenska do 21 let. \"Přicházejí ještě další Slovák Kisel a Bednář z Hradce,\" řekl trenér Petržela. Na Bohemians čeká dost zápasů: absolvují třeba zimní turnaj v pražském Karlíně, čtyři přípravná klání a pět halových turnajů v Německu. Liberec: chybí Argentinec Bez své největší hvězdy útočníka Lazzara Liuniho, jenž se zatím nevrátil z rodné Argentiny, začali fotbalisté Liberce. Pro zranění kolena chyběli i Hrbek s brankářem Hauzrem. Nováčkem je slovenský střelec Vladimír Kožuch, jenž přestoupil z Prešova a během zimy ho kontaktovala i Slavia. \"Snad vylepší naši produktivitu,\" věří asistent trenéra Josef Petřík. Liberečtí si naplánovali tři soustředění: nejprve na běžkách v krkonošském Harrachově, poté v Nymburce a na závěr ve slovenské Dunajské Stredě, kde se utkají například s Rapidem Vídeň. Budějovice: nová čtveřice S kvartetem nových hráčů začali hráči Budějovic. Nejblyštivější jméno z nich nosí Karel Vácha, bývalý útočník Slavie, který přišel na půlroční hostování z rakouského klubu Tirol Innsbruck. \"Snad se nám na jaře povede přiblížit se k historicky nejlepšímu umístění klubu v první lize,\" přál si Vácha, který pamatuje šesté místo, budějovické maximum mezi elitou ze sezony 1993\/94. Dále přišli Nehoda, Pospíšil a Polomský. Na hostování odcházejí mimo jiné Veselý do Poštorné a Krejčí do Zlína. \"Za šest týdnů nás čeká první zápas, musíme se s kratší přípravou, než bývá jindy, vyrovnat,\" řekl kouč Pavel Tobiáš. Teplice: čeká je Florida Třebaže nad sedmým místem nepanuje v Teplicích po podzimu spokojenost, žádné zemětřesení v kádru nenastalo. Jediným nováčkem je bývalý plzeňský brankář Havel, který na podzim hostoval v Olomouci. Uzdravil se záložník Rampáček, který chyběl celý podzim. Přípravu začalo mužstvo už 28. prosince, ale trio Bílek, Pavel Holomek a Sourada ji zahájilo až včera. Dostali svolení od trenéra Pešiceho, protože měli měli už dřív zaplacenou zahraniční dovolenou s rodinou. Tepličtí hrají turnaj v Praze-Karlíně a čeká je atraktivní zájezd na Floridu."
        ]
    },
    {
        "user_input":"Shrň tento článek do stručného shrnutí.",
        "retrieved_contexts":[
            "ODS slibuje překvapení: změnu taktiky Téměř polovina obyvatel republiky by podle prosincového šetření Institutu pro výzkum veřejného mínění uvítala vytvoření nové vlády. Vytvoření nové vlády by dalo přednost 45 procent dotázaných, naopak zachování současné vlády si přeje 38 procent lidí. Dvacet procent zastánců nové vlády by využilo při jejím sestavení výsledků posledních voleb, patnáct procent by pak preferovalo předčasné volby a deset by vytvořilo dočasnou tzv. úřednickou vládu.Z těch, kteří si přejí zachování současné vlády, by 34 procent lidí vyměnilo jen některé ministry a čtyři procenta dotázačných by neměnila v nynější vládě nic.ODS slibuje na pátek, kdy se mají sejít špičky strany s vedením ČSSD, změnu taktiky, která někoho může překvapit. V pondělí večer o tom čtyři hodiny jednalo grémium ODS, ale jaká novinka domácí politiku čeká a čím ODS na ČSSD vyrukuje, nikdo z jeho členů neprozradil. \"Přijdeme s něčím velmi novým, co možná někoho překvapí,\" řekl mluvčí strany Lukáš Herold. Místopředseda ODS Petr Nečas řekl, že ODS má zájem o změnu politického uspořádání v České republice a bude o ní se sociální demokracií jednat. Na druhou stranu šéf ODS Václav Klaus, když hodnotil třetí návrh státního rozpočtu připravený sociálnědemokratickou vládou, prohlásil, že ho trápí nepoučitelnost ČSSD, která tento třetí návrh zpracovala bez předchozí konzultace s ODS. \"To, že to ČSSD udělala bez těchto jednání, něco ukazuje o její nepoučitelnosti,\" řekl Klaus v Českém rozhlase. Grémium se ztotožnilo s prohlášením šéfa strany Václava Klause, podle něhož ODS již nebude usilovat o vytvoření koalice nekomunistických parlamentních stran, uvedl Herold. Šéf ODS Václav Klaus prohlásil, že jeho strana už nebude usilovat o takzvanou duhovou koalici všech nekomunistických parlamentních stran. V rozhovoru pro Český rozhlas současně připustil, že jednou z možných variant dalšího vývoje je doplnění opoziční smlouvy s vládní ČSSD. \"Nahlas prohlašuji, že už to znovu nabízet... nebudeme,\" řekl Klaus. Neuvedl však, jakou jinou variantu bude nyní jeho strana prosazovat. ODS iniciovala jednání o většinové vládě čtyř parlamentních stran bez KSČM loni na podzim; její návrh však ztroskotal zejména na nesouhlasu lidovců a unionistů. Poslední neúspěšný pokus o vytvoření duhové koalice podle klause ODS učinila po svém prosincovém kongresu v Liberci. Klaus uvedl, že ODS začíná znovu přemýšlet, jak změnit současné politické uspořádání. Připustil, že si dovede představit \"doplněk či dodatek\" opoziční smlouvy, kterou ODS podepsala s vládní ČSSD po volbách v roce 1998. \"Nezastávám slovo prohloubení... Dodatek, doplněk, něco takového bych si dovedl představit. I to Předseda klubu senátorů ODS Mirek Topolánek: \"Představa Miloše Zemana, že bude vládnout s touto vládou nadále, je podle mne mylná.\"Místopředseda ČSSD Zdeněk Škromach se neděsí případnému vypovězení opoziční smlouvy: \"Myslím, že to není nic tragického, je to smlouva jako každá jiná. Sociální demokracie byla před smlouvou o politické stabilitě a bude i po ní.\"Poslanec Michal Kraus (ČSSD) soudí, že jednání budou směřovat k určitému novému definování fungování smlouvy: \"V každém případě mi připadá poněkud nešťastné, že to jednání bude jako už poněkolikáté poté, co vláda dala na stůl čísla státního rozpočtu.\"je jedna z variant, které nepochybně přicházejí v dnešních chvílích v úvahu,\" řekl Klaus. To, že ODS už nebude nabízet superkoalici, však podle Klause neznamená, že ji jeho strana nepovažuje za nejlepší východisko nynější politické situace. Šéf ODS přiznal, že ho nezdar superkoalice osobně mrzí. \"Přece jen jsme hodně vsadili na supervelkou koalici. A když sázíte na jednoho koně, tak nezkoumáte, co udělat s tím druhým, který bude dobíhat alternativně, když ten si zlomí nohu na první překážce... Konstatuji, že dneska večer začínáme,\" řekl Klaus. ODS čeká zřejmě tento pátek takzvané smírčí řízení s ČSSD o dalším osudu opoziční smlouvy, které vyvolali sociální demokraté; původně plánovanými termíny byly úterý či středa. ČSSD před Vánocemi obvinila ODS, že smlouvu porušuje. Klausova strana tovšak popírá. \"Nebude to žádná selanka,\" odhadl v úterý průběh jednání s ČSSD Klaus."
        ],
        "response":"Ods oznámila na páteční schůzku s vedení Čssd změnu strategie a rozhodla se neobnovovat svou minulou „duhovou koalicii\", avšak přiznala, že stále posílá návrhy na vytvoření většinového vládnutí bez komunistické strany československé.",
        "reference":"ODS bude na pátečním jednání s ČSSD požadovat podle předsedy jejího poslaneckého klubu Vlastimila Tlustého rekonstrukci vlády. Bližší informace však nechtěl sdělit. Osobně věří, že sociální demokraté budou požadavky respektovat. Místopřeseda ODS Miroslav Macek i předseda klubu senátorů ODS Mirek Topolánek potvrdili, že jejich strana chce jednat především o stabilizaci poměrů v zemi. Odmítli však konkretizovat zadání, které dostali vyjednávači ODS na pondělním zasedání grémia strany. Místopředseda ČSSD Zdeněk Škromach na schůzce od ODS očekává snahu o určitý vliv na změny ve vládě a upřesnění opoziční smlouvy",
        "reference_contexts":[
            "ODS slibuje překvapení: změnu taktiky Téměř polovina obyvatel republiky by podle prosincového šetření Institutu pro výzkum veřejného mínění uvítala vytvoření nové vlády. Vytvoření nové vlády by dalo přednost 45 procent dotázaných, naopak zachování současné vlády si přeje 38 procent lidí. Dvacet procent zastánců nové vlády by využilo při jejím sestavení výsledků posledních voleb, patnáct procent by pak preferovalo předčasné volby a deset by vytvořilo dočasnou tzv. úřednickou vládu.Z těch, kteří si přejí zachování současné vlády, by 34 procent lidí vyměnilo jen některé ministry a čtyři procenta dotázačných by neměnila v nynější vládě nic.ODS slibuje na pátek, kdy se mají sejít špičky strany s vedením ČSSD, změnu taktiky, která někoho může překvapit. V pondělí večer o tom čtyři hodiny jednalo grémium ODS, ale jaká novinka domácí politiku čeká a čím ODS na ČSSD vyrukuje, nikdo z jeho členů neprozradil. \"Přijdeme s něčím velmi novým, co možná někoho překvapí,\" řekl mluvčí strany Lukáš Herold. Místopředseda ODS Petr Nečas řekl, že ODS má zájem o změnu politického uspořádání v České republice a bude o ní se sociální demokracií jednat. Na druhou stranu šéf ODS Václav Klaus, když hodnotil třetí návrh státního rozpočtu připravený sociálnědemokratickou vládou, prohlásil, že ho trápí nepoučitelnost ČSSD, která tento třetí návrh zpracovala bez předchozí konzultace s ODS. \"To, že to ČSSD udělala bez těchto jednání, něco ukazuje o její nepoučitelnosti,\" řekl Klaus v Českém rozhlase. Grémium se ztotožnilo s prohlášením šéfa strany Václava Klause, podle něhož ODS již nebude usilovat o vytvoření koalice nekomunistických parlamentních stran, uvedl Herold. Šéf ODS Václav Klaus prohlásil, že jeho strana už nebude usilovat o takzvanou duhovou koalici všech nekomunistických parlamentních stran. V rozhovoru pro Český rozhlas současně připustil, že jednou z možných variant dalšího vývoje je doplnění opoziční smlouvy s vládní ČSSD. \"Nahlas prohlašuji, že už to znovu nabízet... nebudeme,\" řekl Klaus. Neuvedl však, jakou jinou variantu bude nyní jeho strana prosazovat. ODS iniciovala jednání o většinové vládě čtyř parlamentních stran bez KSČM loni na podzim; její návrh však ztroskotal zejména na nesouhlasu lidovců a unionistů. Poslední neúspěšný pokus o vytvoření duhové koalice podle klause ODS učinila po svém prosincovém kongresu v Liberci. Klaus uvedl, že ODS začíná znovu přemýšlet, jak změnit současné politické uspořádání. Připustil, že si dovede představit \"doplněk či dodatek\" opoziční smlouvy, kterou ODS podepsala s vládní ČSSD po volbách v roce 1998. \"Nezastávám slovo prohloubení... Dodatek, doplněk, něco takového bych si dovedl představit. I to Předseda klubu senátorů ODS Mirek Topolánek: \"Představa Miloše Zemana, že bude vládnout s touto vládou nadále, je podle mne mylná.\"Místopředseda ČSSD Zdeněk Škromach se neděsí případnému vypovězení opoziční smlouvy: \"Myslím, že to není nic tragického, je to smlouva jako každá jiná. Sociální demokracie byla před smlouvou o politické stabilitě a bude i po ní.\"Poslanec Michal Kraus (ČSSD) soudí, že jednání budou směřovat k určitému novému definování fungování smlouvy: \"V každém případě mi připadá poněkud nešťastné, že to jednání bude jako už poněkolikáté poté, co vláda dala na stůl čísla státního rozpočtu.\"je jedna z variant, které nepochybně přicházejí v dnešních chvílích v úvahu,\" řekl Klaus. To, že ODS už nebude nabízet superkoalici, však podle Klause neznamená, že ji jeho strana nepovažuje za nejlepší východisko nynější politické situace. Šéf ODS přiznal, že ho nezdar superkoalice osobně mrzí. \"Přece jen jsme hodně vsadili na supervelkou koalici. A když sázíte na jednoho koně, tak nezkoumáte, co udělat s tím druhým, který bude dobíhat alternativně, když ten si zlomí nohu na první překážce... Konstatuji, že dneska večer začínáme,\" řekl Klaus. ODS čeká zřejmě tento pátek takzvané smírčí řízení s ČSSD o dalším osudu opoziční smlouvy, které vyvolali sociální demokraté; původně plánovanými termíny byly úterý či středa. ČSSD před Vánocemi obvinila ODS, že smlouvu porušuje. Klausova strana tovšak popírá. \"Nebude to žádná selanka,\" odhadl v úterý průběh jednání s ČSSD Klaus."
        ]
    },
    {
        "user_input":"Shrň tento článek do stručného shrnutí.",
        "retrieved_contexts":[
            "Ostrava: žádné změny Kádr je stejný, zatím zůstávají i Slončík a Baroš, po nichž touží Sparta. Trenérské duo Lička - Páník se rozšířilo o internacionála Rostislava Vojáčka. Z hostování v NH Ostrava se vrátil záložník Knapp a do kádru trenéři zařadili obránce Hoffmanna, jenž byl na vojně v Dukle Hranice. \"Případné další doplnění mužstva bychom zvažovali, kdyby odešel Radek Slončík,\" uvedl trenér Lička. O Slončíka se zajímá Sparta, ale kluby se zatím nedohodly. Vrcholem přípravy bude herní soustředění v Piešťanech od 31. ledna do 4. února, kde Baník sehraje tři utkání s předními slovenskými celky. Příbram: zranění na úvod Nepříjemnost na začátek. První trénink opustil s natrženým lýtkovým svalem stoper Špinar. Trenéru Kotrbovi to pokazilo radost z nových posil. Tou největší je brankář Čaloun ze Sparty. V jednání je příchod záložníka Nováka z 1. FC Košice a dvou ligových borců. \"Hlavní je, že nás po letech konečně nikdo neopustil,\" liboval si majitel klubu Jaroslav Starka. Třiadvacítka hráčů se bude do 26. ledna připravovat doma, odkud bude vyjíždět k zápasům zimního turnaje v Karlíně. Poté tým odcestuje na Kypr. Blšany: veterán Vrabec trénuje Opět s Petrem Vrabcem v sestavě se mohou od jara objevit Blšany. Sedmatřicetiletý ligový veterán se vrací po zlomenině nohy. Kádr rozšířili i další dva defenzivní středopolaři: Zbožínek z Prostějova a Bureš z třetiligové Krče. Hledá se však útočník, protože Libor Došek ukončil hostování a vrátil se do Brna. \"Prověří nás Sparta, Slavie a další kvalitní soupeři. Příprava vyvrcholí soustředěním ve Francii, kde máme sehrát dva zápasy,\" uvedl blšanský manažer Zdeněk Kovář. V pondělí odjede tým trenéra Beránka na běžky do Bezdíkova u Vimperku. Brno: vrací se Pacanda Tři dny trénování k dobru si udělal tým ještě před Silvestrem, ale skutečně naplno začal až v pondělí. Po osmi měsících od operace kolena se vrací velká naděje domácího fotbalu Milan Pacanda. Posílením by měl být vytáhlý útočník Libor Došek z Blšan. Padlo soustředění v Turecku, a tak hráči budou kromě šesti dní v Blšanech pořád doma v Brně, kde je čeká turnaj na umělé trávě. Odchody talentů Poláka nebo Zúbka jsou prý vyloučeny. \"Do konce sezony určitě, musíme je udržet, pohled na tabulku není příjemný,\" říká Karel Kroupa, manažer jedenáctého týmu po podzimu. Opava: hledají se posily Žádné nové tváře, jen navrátilci z hostování či vojny a vlastní odchovanci se objevili na prvním tréninku Opavy. \"Mužstvo však chci ještě doplnit o jednoho nebo dva hráče, kteří rovnou naskočí do základní sestavy,\" uvedl trenér Jiří Bartl. \"Vše ale bude záležet na tom, zda odejde nadějný záložník Lumír Sedláček.\" O reprezentanta do 21 let je zájem, ale klub by ho pustil jen za velké peníze. Kádr zatím doplnili brankáři Kosmál a Vašek, záložníci Pospěch a Černín a odchovanci Paluch se Švejdíkem. Vrchol kondiční přípravy budou mít Opavští od 8. do 12. ledna ve Velkých Losinách, na herní soustředění pojedou do Chorvatska. Jablonec: pomůže i Budka Jedním z tahounů ve hře o záchranu se má stát Václav Budka, bývalý záložník Sparty a naposledy belgického Lokerenu. \"Podepsal s námi smlouvu na dva a půl roku. Hodně na něj spoléháme,\" prohlásil včera klubový šéf Pavel Marek. Změní se gólmanská jednička, protože Pižanowski se vrátil do Olomouce a nahradí ho Podhajský z Hradce Králové. Mužstvo, jež dalo v lize zatím jen 15 gólů, hledá střelce. Posilou je Rott, syn bývalého reprezentanta, a dnes by měl přijet švédský útočník Niclas Norell z druholigové Uppsaly, jehož před půldruhým rokem zkoušela Slavia. V kádru už nejsou Hapiák s Hruškou, naopak Papoušek ze Sparty zůstává. Jablonec se bude připravovat doma, zúčastní se turnaje v Karlíně a koncem ledna odlétá na Kypr. Olomouc: musíme jít nahoru Největší zklamání po podzimu chce co nejdříve opustit v tabulce místa, která jsou nebezpečná. Jediný bod dělí tým, lačný po úspěších v evropských pohárech, od sestupové příčky. Na nedělním srazu měli jen dva hráči nadváhu - paradoxně mladíci Bureš a Kováč. \"Žádné pokuty jim nedám, ztrestá je i to, že budou běhat s kilogramy navíc,\" řekl trenér Petr Žemlík. Ze tří brankářů trénuje jen jeden. Problémový Skácel, o něhož usiluje Mönchengladbach, stále tvrdí, že ho bolí záda. Pižanowski, který ukončil hostování v Jablonci, má chřipku. Klub se zatím nevzdal toho, že ze Španělska přijde Hapal. Konečné slovo padne příští týden. Odešel Slovák Fabuš, místo něj přišel krajan Bartoš, reprezentant do 21 let. Po zranění se připravuje i mladý reprezentant Heinz. Hradec: hlavně budou doma Dva dny před Silvestrem zahájil přípravu na jaro předposlední Hradec. Prvním fyzickým drilem procházejí hráči v Bedřichově. \"Plánujeme deset přípravných utkání proti týmům z první a druhé ligy. Hrát však budeme pouze na hřištích soupeřů nebo v Nymburce,\" konstatoval vedoucí mužstva Václav Kynos. Do přípravy se zapojil i obránce Freisler z Bohemians. Po vyléčení už trénují nedávné opory Dvořák se Zemánkem. Klub jedná o příchodu teplického Sourady a Košča z Rimavské Soboty. Žižkov: kádr se zatřásl Poslední tým soutěže v zimní pauze prodělal ozdravný proces, náročný trenér Zdeněk Ščasný se rozloučil se čtyřmi hráči. Na prvním tréninku scházeli Pavlús a Valkoun i dva hráči ze stabilní sestavy: Hertl s Navrátilem. \"K zemětřesení se není třeba vracet, každý ví, proč k němu došlo, a ti, co zůstali, mají šanci ukázat, co v nich je,\" řekl kouč. Čtyři vyhození hráči se Ščasnému nehodili do boje o záchranu, to je pro Žižkov jediný jarní cíl. Pomoci by měl reprezentant do 21 let Martin Čupr, který přišel z Liberce."
        ],
        "response":"Základní kádrové pozice v české lize zůstaly bez změn, zejména u týmu Ostravy, který již nemá v plném rozsahu své staré hráče. Většina klubů se připravovala na zimní turnaj v Karlínu, zatímco některé, jako Jablونهc nebo Olomouč, hledají nová síla nebo řeší problémy s existujícími hráчи.",
        "reference":"V nesmírně vyrovnané tabulce fotbalové ligy má pátá Ostrava náskok jen sedmi bodů před posledním Žižkovem. Většinu týmů za Ostravou čeká tuhý boj o záchranu, a tak už se na něj připravují",
        "reference_contexts":[
            "Ostrava: žádné změny Kádr je stejný, zatím zůstávají i Slončík a Baroš, po nichž touží Sparta. Trenérské duo Lička - Páník se rozšířilo o internacionála Rostislava Vojáčka. Z hostování v NH Ostrava se vrátil záložník Knapp a do kádru trenéři zařadili obránce Hoffmanna, jenž byl na vojně v Dukle Hranice. \"Případné další doplnění mužstva bychom zvažovali, kdyby odešel Radek Slončík,\" uvedl trenér Lička. O Slončíka se zajímá Sparta, ale kluby se zatím nedohodly. Vrcholem přípravy bude herní soustředění v Piešťanech od 31. ledna do 4. února, kde Baník sehraje tři utkání s předními slovenskými celky. Příbram: zranění na úvod Nepříjemnost na začátek. První trénink opustil s natrženým lýtkovým svalem stoper Špinar. Trenéru Kotrbovi to pokazilo radost z nových posil. Tou největší je brankář Čaloun ze Sparty. V jednání je příchod záložníka Nováka z 1. FC Košice a dvou ligových borců. \"Hlavní je, že nás po letech konečně nikdo neopustil,\" liboval si majitel klubu Jaroslav Starka. Třiadvacítka hráčů se bude do 26. ledna připravovat doma, odkud bude vyjíždět k zápasům zimního turnaje v Karlíně. Poté tým odcestuje na Kypr. Blšany: veterán Vrabec trénuje Opět s Petrem Vrabcem v sestavě se mohou od jara objevit Blšany. Sedmatřicetiletý ligový veterán se vrací po zlomenině nohy. Kádr rozšířili i další dva defenzivní středopolaři: Zbožínek z Prostějova a Bureš z třetiligové Krče. Hledá se však útočník, protože Libor Došek ukončil hostování a vrátil se do Brna. \"Prověří nás Sparta, Slavie a další kvalitní soupeři. Příprava vyvrcholí soustředěním ve Francii, kde máme sehrát dva zápasy,\" uvedl blšanský manažer Zdeněk Kovář. V pondělí odjede tým trenéra Beránka na běžky do Bezdíkova u Vimperku. Brno: vrací se Pacanda Tři dny trénování k dobru si udělal tým ještě před Silvestrem, ale skutečně naplno začal až v pondělí. Po osmi měsících od operace kolena se vrací velká naděje domácího fotbalu Milan Pacanda. Posílením by měl být vytáhlý útočník Libor Došek z Blšan. Padlo soustředění v Turecku, a tak hráči budou kromě šesti dní v Blšanech pořád doma v Brně, kde je čeká turnaj na umělé trávě. Odchody talentů Poláka nebo Zúbka jsou prý vyloučeny. \"Do konce sezony určitě, musíme je udržet, pohled na tabulku není příjemný,\" říká Karel Kroupa, manažer jedenáctého týmu po podzimu. Opava: hledají se posily Žádné nové tváře, jen navrátilci z hostování či vojny a vlastní odchovanci se objevili na prvním tréninku Opavy. \"Mužstvo však chci ještě doplnit o jednoho nebo dva hráče, kteří rovnou naskočí do základní sestavy,\" uvedl trenér Jiří Bartl. \"Vše ale bude záležet na tom, zda odejde nadějný záložník Lumír Sedláček.\" O reprezentanta do 21 let je zájem, ale klub by ho pustil jen za velké peníze. Kádr zatím doplnili brankáři Kosmál a Vašek, záložníci Pospěch a Černín a odchovanci Paluch se Švejdíkem. Vrchol kondiční přípravy budou mít Opavští od 8. do 12. ledna ve Velkých Losinách, na herní soustředění pojedou do Chorvatska. Jablonec: pomůže i Budka Jedním z tahounů ve hře o záchranu se má stát Václav Budka, bývalý záložník Sparty a naposledy belgického Lokerenu. \"Podepsal s námi smlouvu na dva a půl roku. Hodně na něj spoléháme,\" prohlásil včera klubový šéf Pavel Marek. Změní se gólmanská jednička, protože Pižanowski se vrátil do Olomouce a nahradí ho Podhajský z Hradce Králové. Mužstvo, jež dalo v lize zatím jen 15 gólů, hledá střelce. Posilou je Rott, syn bývalého reprezentanta, a dnes by měl přijet švédský útočník Niclas Norell z druholigové Uppsaly, jehož před půldruhým rokem zkoušela Slavia. V kádru už nejsou Hapiák s Hruškou, naopak Papoušek ze Sparty zůstává. Jablonec se bude připravovat doma, zúčastní se turnaje v Karlíně a koncem ledna odlétá na Kypr. Olomouc: musíme jít nahoru Největší zklamání po podzimu chce co nejdříve opustit v tabulce místa, která jsou nebezpečná. Jediný bod dělí tým, lačný po úspěších v evropských pohárech, od sestupové příčky. Na nedělním srazu měli jen dva hráči nadváhu - paradoxně mladíci Bureš a Kováč. \"Žádné pokuty jim nedám, ztrestá je i to, že budou běhat s kilogramy navíc,\" řekl trenér Petr Žemlík. Ze tří brankářů trénuje jen jeden. Problémový Skácel, o něhož usiluje Mönchengladbach, stále tvrdí, že ho bolí záda. Pižanowski, který ukončil hostování v Jablonci, má chřipku. Klub se zatím nevzdal toho, že ze Španělska přijde Hapal. Konečné slovo padne příští týden. Odešel Slovák Fabuš, místo něj přišel krajan Bartoš, reprezentant do 21 let. Po zranění se připravuje i mladý reprezentant Heinz. Hradec: hlavně budou doma Dva dny před Silvestrem zahájil přípravu na jaro předposlední Hradec. Prvním fyzickým drilem procházejí hráči v Bedřichově. \"Plánujeme deset přípravných utkání proti týmům z první a druhé ligy. Hrát však budeme pouze na hřištích soupeřů nebo v Nymburce,\" konstatoval vedoucí mužstva Václav Kynos. Do přípravy se zapojil i obránce Freisler z Bohemians. Po vyléčení už trénují nedávné opory Dvořák se Zemánkem. Klub jedná o příchodu teplického Sourady a Košča z Rimavské Soboty. Žižkov: kádr se zatřásl Poslední tým soutěže v zimní pauze prodělal ozdravný proces, náročný trenér Zdeněk Ščasný se rozloučil se čtyřmi hráči. Na prvním tréninku scházeli Pavlús a Valkoun i dva hráči ze stabilní sestavy: Hertl s Navrátilem. \"K zemětřesení se není třeba vracet, každý ví, proč k němu došlo, a ti, co zůstali, mají šanci ukázat, co v nich je,\" řekl kouč. Čtyři vyhození hráči se Ščasnému nehodili do boje o záchranu, to je pro Žižkov jediný jarní cíl. Pomoci by měl reprezentant do 21 let Martin Čupr, který přišel z Liberce."
        ]
    },
    {
        "user_input":"Shrň tento článek do stručného shrnutí.",
        "retrieved_contexts":[
            "Tříkrálový průvod pořádala v Praze již popáté mezinárodní katolická organizace Mládež Idente spolu s Hradní stráží a španělským velvyslanectvím. Monarchové Kašpar, Melichar a černý Baltazar, kteří se podle legend setkali na cestě za hvězdou, se v doprovodu pážat tentokrát vydali na svou pouť z Arcibiskupského paláce na Hradčanském náměstí. Následováni stovkami přihlížejících lidí dorazili v poklidu na Loretánské náměstí, kde už je očekávala Svatá rodina s Ježíškem a dětský sbor, který zazpíval koledy. Ježíškovi se králové poklonili, poklekli před ním a obdarovali ho symbolem království - zlatem, symbolem božství- kadidlem a symbolem útěchy - myrhou. Poté Kašpar přednesl poselství králů a katolický kněz Alberto poselství kardinála Miroslava Vlka. Zlato, kadidlo a myrhu přinesli podle bible tři mudrci Ježíšovi do Betléma. Za krále byli zaměněni až v roce 1194, kdy byly jejich údajné ostatky přeneseny do Kolína nad Rýnem. Ve 12. století se také poprvé objevila jejich tři jména. Tříkrálovým svátkem, který je 6. ledna, končí západokřesťanské Vánoce a začíná masopust. Ve čtvrtek se tříkrálové oslavy přesunou do vybraných ústavů a nemocnic. Tři králové pozdraví a nadělí dárky například dětemze Speciální školy Jaroslava Ježka a nemocným dětem z psychiatrického a chirurgického oddělení Thomayerovy nemocnice. Král Melichar přijíždí Král Kašpar s darem v ruce zdraví přihlížející davy Královský průvod pomalu směřoval na Loretánské náměstí Panna Marie s Jezulátkem v náručí přijímá dary od králů"
        ],
        "response":"Mezinárodná katolické organizace „Mládeže Idente\" v Prazi pořádal třetí tříkrárový průvoz, při kterém se monarchové pod vedením kardinálu Mirosla Vlka poklonily Ježíši a obdrželi symboly králowání. Světový den tříkrálů, který končí Vánocní svátky a začínà masopusty, byl oslavován v nemocnicích i školách, kde se děti a nemocní dívali na královské",
        "reference":"Kdo by neznal tříkrálovou píseň: \"My tři králové, jdeme k vám, štěstí zdraví vinšujem Vám...\", ten si ji mohl ve středu odpoledne připomenout. Kašpar, Melichar i černý Baltazar, doprovázení pážaty, totiž projížděli na velbloudech Loretánskou ulicí do spodní části Loretánského náměstí. Tam se u živého betléma poklonili Jezulátku a předali mu své dary - kadidlo, zlato a myrhu. Průvod tří králů najdete na videu i ve fotogalerii",
        "reference_contexts":[
            "Tříkrálový průvod pořádala v Praze již popáté mezinárodní katolická organizace Mládež Idente spolu s Hradní stráží a španělským velvyslanectvím. Monarchové Kašpar, Melichar a černý Baltazar, kteří se podle legend setkali na cestě za hvězdou, se v doprovodu pážat tentokrát vydali na svou pouť z Arcibiskupského paláce na Hradčanském náměstí. Následováni stovkami přihlížejících lidí dorazili v poklidu na Loretánské náměstí, kde už je očekávala Svatá rodina s Ježíškem a dětský sbor, který zazpíval koledy. Ježíškovi se králové poklonili, poklekli před ním a obdarovali ho symbolem království - zlatem, symbolem božství- kadidlem a symbolem útěchy - myrhou. Poté Kašpar přednesl poselství králů a katolický kněz Alberto poselství kardinála Miroslava Vlka. Zlato, kadidlo a myrhu přinesli podle bible tři mudrci Ježíšovi do Betléma. Za krále byli zaměněni až v roce 1194, kdy byly jejich údajné ostatky přeneseny do Kolína nad Rýnem. Ve 12. století se také poprvé objevila jejich tři jména. Tříkrálovým svátkem, který je 6. ledna, končí západokřesťanské Vánoce a začíná masopust. Ve čtvrtek se tříkrálové oslavy přesunou do vybraných ústavů a nemocnic. Tři králové pozdraví a nadělí dárky například dětemze Speciální školy Jaroslava Ježka a nemocným dětem z psychiatrického a chirurgického oddělení Thomayerovy nemocnice. Král Melichar přijíždí Král Kašpar s darem v ruce zdraví přihlížející davy Královský průvod pomalu směřoval na Loretánské náměstí Panna Marie s Jezulátkem v náručí přijímá dary od králů"
        ]
    },
    {
        "user_input":"Shrň tento článek do stručného shrnutí.",
        "retrieved_contexts":[
            "\"Jeden z deseti lidí na zemi má problémy s vysokým krevním tlakem,\" nepřikládá Correa potížím fotbalisty velkou důležitost. \"Můžeme rovněž potvrdit, že jeho potíže se srdcem nemají souvislost s užíváním drog,\" prohlásil. \"Drogy s touto příhodou nemají nic společného,\" přidal se manažer hráče Guillermo Coppola, podle něhož Maradona do nemocnice dojel autem sám. Nevolal lékaře, prostě se mu přitížilo, tak sedl do auta a odjel do nemocnice,\" vysvětlil. \"Každý ví, že Maradona trpí vysokým krevním tlakem,\" dodal. Devětatřicetiletý Maradona byl kapitánem Argentiny, která v roce 1986 ve finále fotbalového mistrovství světa porazila Německo. Za užívání kokainu mu však byla v roce 1991 na patnáct měsíců, kdy působil v Neapoli, zastavena činnost. V roce 1997 ukončil kariéru."
        ],
        "response":"Maradona, který měl v minulosti užívání drog, nyní trpící vysokým krvním tlukem, nepředkládá své zdravotní potíží velkou záležitosť. Podle informací o jeho cestě do nemocničního oddělení se jednalo o samostatnou událost bez ohledu na užívání látek.",
        "reference":"Se srdeční arytmií a vysokým krevním tlakem byl v úterý večer hospitalizován bývalý argentinský fotbalista Diego Maradona v uruguayské nemocnici. \"Momentální prognóza je dobrá,\" uvedl Waldemar Correa, ředitel nemocnice ve městě Punta del Este. \"Je na přístrojích a jeho srdeční činnost je monitorována. Nemělo by dojít ke komplikacím, v nemocnici zůstane jen chvíli,\" domnívá se lékař, jenž příčinu Maradonových potíží zatím nezná",
        "reference_contexts":[
            "\"Jeden z deseti lidí na zemi má problémy s vysokým krevním tlakem,\" nepřikládá Correa potížím fotbalisty velkou důležitost. \"Můžeme rovněž potvrdit, že jeho potíže se srdcem nemají souvislost s užíváním drog,\" prohlásil. \"Drogy s touto příhodou nemají nic společného,\" přidal se manažer hráče Guillermo Coppola, podle něhož Maradona do nemocnice dojel autem sám. Nevolal lékaře, prostě se mu přitížilo, tak sedl do auta a odjel do nemocnice,\" vysvětlil. \"Každý ví, že Maradona trpí vysokým krevním tlakem,\" dodal. Devětatřicetiletý Maradona byl kapitánem Argentiny, která v roce 1986 ve finále fotbalového mistrovství světa porazila Německo. Za užívání kokainu mu však byla v roce 1991 na patnáct měsíců, kdy působil v Neapoli, zastavena činnost. V roce 1997 ukončil kariéru."
        ]
    },
    {
        "user_input":"Shrň tento článek do stručného shrnutí.",
        "retrieved_contexts":[
            "\"Jednání se Spartou o případném Slončíkově přestupu by se měla dotáhnout do konce pravděpodobně již začátkem příštího týdne,\" potvrdil možný odchod tvůrce hry Baníku předseda představenstva Zdeněk Rygel. Ostravský klub opět odložil termín valné hromady, která se měla uskutečnit ve čtvrtek 6. ledna, tentokrát až na 31. ledna.\"Akciová společnost Quantum, která připravuje podklady pro vstup nového majitele z Ostravska do fotbalového klubu, se již stala majoritním vlastníkem akcií Baníku, takže není již důvod ke spěchu. Před valnou hromadou chceme pečlivě připravit veškeré záležitosti spojené s převodem majetku,\" objasnil přesun termínu na konec ledna Rygel."
        ],
        "response":"Zdeněk Rýgel, předsada představy klubu Baník Ostrava, potvrzuje, že jednání o možnému přestupovi tvůrc hry Slončička do Spartaku bude probíhat v nejhorším případě už začátkou příští týdne. Termín valného hromadního shromáždění akcií byl proto odložen ze začátku ledna na konec roku.",
        "reference":"V nejbližších dnech budou zástupci českých prvoligových klubů Sparta Praha a Baník Ostrava znovu jednat o přestupu záložníka Radka Slončíka z Moravy do hlavního města. Sparťané obnovili zájem o klíčového hráče svého soupeře, na sklonku loňského roku nebyli ve svých nabídkách úspěšní",
        "reference_contexts":[
            "\"Jednání se Spartou o případném Slončíkově přestupu by se měla dotáhnout do konce pravděpodobně již začátkem příštího týdne,\" potvrdil možný odchod tvůrce hry Baníku předseda představenstva Zdeněk Rygel. Ostravský klub opět odložil termín valné hromady, která se měla uskutečnit ve čtvrtek 6. ledna, tentokrát až na 31. ledna.\"Akciová společnost Quantum, která připravuje podklady pro vstup nového majitele z Ostravska do fotbalového klubu, se již stala majoritním vlastníkem akcií Baníku, takže není již důvod ke spěchu. Před valnou hromadou chceme pečlivě připravit veškeré záležitosti spojené s převodem majetku,\" objasnil přesun termínu na konec ledna Rygel."
        ]
    },
    {
        "user_input":"Shrň tento článek do stručného shrnutí.",
        "retrieved_contexts":[
            "Obě federace se podle této zprávy již obrátily na příslušné orgány Evropské unie, která jediná může rozhodnout o zmírnění dopadu rozsudku evropského soudu v případu Bosman. Podle něho je totiž omezování počtu cizinců zákazem výkonu povolání a ohrožením volného pohybu pracovních sil uvnitř unie, včetně zemí, které jsou jen asociovanými zeměmi jako česká republika. Například na soupiskách týmů německé bundesligy je 46 procent cizinců a třeba Schalke nebo Stuttgart nastupují až s devíti zahraničními hráči. To podle mnohých brání mladým domácím hráčům v růstu."
        ],
        "response":"Evropská federace fotbalu a německo-česká federace právníků se již k řešení dopadů rozsudků Evropského soudního dvora v případě Bosman připojila. Rozsudek stanovuje, že zákaz výkonu sportovního povolání pro cizince a omezení jejich pohyblivosti v rámci EU představují zásah do volného pohybů pracovních síl, což je kritické zejména pro asociované země jako Česká repUBLIKA. Na soupiskových tabulích Bundesligy domin",
        "reference":"Znovu zavést pravidlo omezující počet cizinců v jednotlivých klubech chtějí podle německého deník Bild nejvyšší představitelé evropské a světové fotbalové federace Lennart Johansson (UEFA) a Sepp Blatter (FIFA). Oba prý navrhují, aby v dresu klubových týmu bylo současně na hřišti minimálně šest hráčů ze země, z níž klub pochází, a mohli by teoreticky zemi reprezentovat. To znamená, že v mužstvech by mohlo hrát maximálně pět cizinců",
        "reference_contexts":[
            "Obě federace se podle této zprávy již obrátily na příslušné orgány Evropské unie, která jediná může rozhodnout o zmírnění dopadu rozsudku evropského soudu v případu Bosman. Podle něho je totiž omezování počtu cizinců zákazem výkonu povolání a ohrožením volného pohybu pracovních sil uvnitř unie, včetně zemí, které jsou jen asociovanými zeměmi jako česká republika. Například na soupiskách týmů německé bundesligy je 46 procent cizinců a třeba Schalke nebo Stuttgart nastupují až s devíti zahraničními hráči. To podle mnohých brání mladým domácím hráčům v růstu."
        ]
    },
    {
        "user_input":"Shrň tento článek do stručného shrnutí.",
        "retrieved_contexts":[
            "\"Věřím, že Lengyel nebude jedinou posilou, kterou v zimě přivedeme,\" řekl Miroslav Pelta a potvrdil, že s jihočeským klubem už je Sparta na všem domluvená. \"Ve čtvrtek s Lengyelem podepíšeme pětiletou smlouvu.\" Další manažerovy kroky povedou na Moravu: \"Příští týden se chystám do Ostravy, Olomouce a do Brna,\" uvedl Pelta. Sparta si v těchto městech vytipovala celou řadu hráčů: Slončíka s Barošem z Ostravy, Heinze z Olomouce a Poláka z Brna."
        ],
        "response":"Sparta již uzavřela pětletou s mladánskou reprezentací Lengyela a připravuje se na další transferové akce v Praze, Ostravě, Olomuči i Brně.",
        "reference":"Roman Lengyel, obránce české olympijské reprezentace, je první posilou, kterou získala v novém roce pražská Sparta. České Budějovice uvolní svého odchovance za 12 milionů korun a za příslib 25procentního podílu z příštího fotbalistova přestupu. Už v průběhu podzimu si Sparta předem zajistila přestup brankáře Blažka z Bohemians, nyní se letenský manažer Pelta chystá lovit posily na Moravu",
        "reference_contexts":[
            "\"Věřím, že Lengyel nebude jedinou posilou, kterou v zimě přivedeme,\" řekl Miroslav Pelta a potvrdil, že s jihočeským klubem už je Sparta na všem domluvená. \"Ve čtvrtek s Lengyelem podepíšeme pětiletou smlouvu.\" Další manažerovy kroky povedou na Moravu: \"Příští týden se chystám do Ostravy, Olomouce a do Brna,\" uvedl Pelta. Sparta si v těchto městech vytipovala celou řadu hráčů: Slončíka s Barošem z Ostravy, Heinze z Olomouce a Poláka z Brna."
        ]
    },
    {
        "user_input":"Shrň tento článek do stručného shrnutí.",
        "retrieved_contexts":[
            "Úvodem jedna malá poznámka. Když v návodu uvedu, abyste si s někým promluvili, mám tím na mysli, abyste při daném rozhovoru vyčerpali všechna možná témata. Pochopitelně na ta témata, na které jste se již dříve vyptávali a které máte v zápisníčku odškrtnutá, se již znova ptát nemusíte. Jachta: Promluvte si se Scarlet. Otočte se doleva, jděte za Greenem a promluvte si s ním. Vejděte do kajuty lodě a promluvte si s paní Peacockovou. Popojděte k paní Whitové a promluvte si s ní. Sejděte po schodech dolů, kde si nejdříve promluvte s Kell. Jděte k piánu (šikmo doleva) - se slečnou Popov si zatím nelze pohovořit, takže se otočte doprava a promluvte si se Sabatou. Otočte se o 180 stupňů a promluvte si s Plumem sedícím v křesle. Otočte se doleva a jděte k baru (šikmo doprava), kde si promluvte s Mustardem - hlavně o pití, abyste dostali sklenici vína. Otočte se doleva ke kouzelníku Urfovi - jakmile od něj dostanete klíč, promluvte si s ním. Nyní se vraťte na palubu za Scarlet a dejte jí sklenici vína. Vraťte se do kajuty, jděte ke schodům a otočte se doleva - budete stát před uzamčenou skříňkou. Odemkněte ji klíčkem a seberte horní čínskou puzzle-skříňku. Sejděte dolů k Masqueovi - nemá cenu s ním hovořit, rovnou mu dejte čínskou skříňku. Po Masqueově smrti je na čase si znova promluvit se všemi cestujícími - začněte u Kell, pak si konečně promluvte s Popov, která přestala hrát na piáno, a to hlavně o kouzlech - dostanete ESP karty. Promluvte si se Sabatou - bude po vás chtít předvést nějaký trik. Promluvit s Plumem, Mustardem a hlavně Urfem - ten vás naučí trik s kartami. Promluvte si se Sabatou o kouzlech a ukažte mu karetní trik (ta pravá karta je ta, která je jako jediná otočená lícem) - dostanete obrázek, který si v inventáři prohlédněte. Vyjděte po schodech nahoru a jděte za paní Whitovou - ta z ničeho nic upustí na zem vázu. Zohněte se k zemi k rozbité váze, odklopte střep a seberte dva artefakty ve tvaru knoflíků. Promluvte si s paní Whitovou a s paní Peacockovou. Jděte ven na palubu, kde si pohovořte se Scarlet o ESP a udělejte jí test - bude mít vidinu, jejíž výsledkem bude dnešní datum - 31.12.38. Jděte do kajuty, sejděte po schodech, přistupte k velkým dřevěným dveřím a otevřete je. Jděte ke dveřím napravo a prozkoumejte číselný zámek. Na zámku nastavte kód 12,31,38 takto: točte po směru hodinových ručiček na 12, pak proti směru HR přes 12 na 31 (musíte tedy udělat dvě otáčky!!!) a nakonec po směru HR na 38. Stiskněte kliku a vejděte do skladu. Přistupte k poličce, ze které seberte rukavice. Jděte k velké truhlici na podlaze a otevřete ji - vyruší vás Green, po rozhovoru s ním otevřete truhlici znova a seberte z ní ozubené kolo. Vraťte se až ke schodišti (ke Kell) a podívejte se na podlahu - leží zde skříňka. Použijte na skříňku rukavice - seberete tak nejen ji, ale i již třetí artefakt ve tvaru knoflíku. V inventáři použijte sebraný artefakt na skříňku - ta se vám zvětší přes celou obrazovku. Do otvoru na přední straně znova vložte tentýž artefakt - ve skříňce se otevře přihrádka, ze které seberte listinu. Do dalších otvorů vložte zbylé dva artefakty - nakonec objevíte podivné zařízení, které seberte. Opět projděte velkými dřevěnými dveřmi naproti schodišti, tentokrát ale pokračujte chodbou šikmo doleva a pak nahoru po schůdcích. Do podivného mechanizmu na dveřích vložte zařízení ze skříňky. Objevíte se ve strojovně. V její pravé části je skříň s elektrickým rozvodem (viz obrázek). Otevřete skříň a stiskněte tlačítko \"Power\". Přistupte k umělému kormidelníkovi za mříží a použijte na něj ozubené kolo. Vraťte se k rozvodové skříňce a stiskněte \"Power\", pak \"Blow Downs\", \"Valve\", \"Cross Conn\" a nakonec \"Feed Valves\"... Lanovka: Promluvte si s Greenem. Vejděte do boudy a jděte šikmo doleva. Otevřete kredenc a seberte z něj baterku, trychtýř a kanystr. Nastupte do lanovky, otočte se doprava k sedadlům a použijte baterku. Posviťte na levou část zadní sedačky, pak baterku schovejte (pravé myšítko) a seberte z osvíceného místa roztrhané papírky. Složte papírky tak, abyste získali návod ke zprovoznění lanovky. Jděte k nádrži u vstupních dveří boudy a použijte na ni nejdříve trychtýř a posléze kanistr. Jděte k ovládacímu panelu napravo od lanovky a přepněte všechny tři páčky nalevo a následně pohněte s velkou pákou uprostřed doleva (viz obrázek). V lanovce potom pohněte s levou pákou doleva a s pravou pákou nahoru. Ledu, který stojí lanovce v cestě, se zbavíte tak, že asi dvakrát po sobě s lanovkou couvnete (pravou páku dolů) a ihned zase vyjedete nahoru (pravou páku nahoru). Zámek 1 - nalezení drahokamů: Promluvte si s paní Peacockovou, ale ta vám zatím svoji hádanku neprozradí. Pokračujte sálem až ke Greenovi a promluvte si s ním - řekne vám svou hádanku. Jděte do zadní části sálu až ke krbu, kde seberte ohořelou fotografii. Vyjděte ze sálu na chodbu, udělejte krok dopředu a vejděte do dveří nalevo od schodiště. Vejděte do mrazírny, otevřete chladící box a seberte z něj čtvrtý tácek shora. Otočte se doleva k mrtvole Masqueho a prozkoumejte jeho tetování na krku. Vyjděte z mrazírny a zamiřte ke sporáku nalevo. Zapněte vařič (třetím tlačítkem zleva na zadním panelu) a vhoďte do hrnce tácek s ledem. Jakmile se led roztopí, měl by na dně hrnce ležet zelený Greenův drahokam. Pokud ne, vzali jste z boxu v mrazírně špatný tácek a celý proces musíte opakovat a jiným táckem znova. Promluvte si s paní Whitovou - hádanku vám sice neprozradí, nicméně vám poví o své noční můře. Vyjděte z kuchyně na chodbu, kde si můžete promluvit se Sabatou, ale nic kloudného se nedozvíte. Vystoupejte po schodech do patra a vejděte do dveří nalevo, kde si pohovořte s Kell - hlavně o snu paní Whitové. Jděte zpět do kuchyně za paní Whitovou a promluvte si s ní o jejím snu - prozradí vám svou hádanku. Jděte zpět do pokoje za Kell, přistupte k posteli, otočte se doleva a prozkoumejte skříň s mnoha šuplíky. Vaším cílem je otevřít ten největší spodní šuplík, ve kterém je ukrytý drahokam. Abyste jej ale mohli otevřít, musíte nejdříve otevřít i všechny ostatní šuplíky. To uděláte tak, že vysunete v první řadě (shora) druhý šuplík (zleva), v druhé řadě čtvrtý šuplík, v třetí řadě první šuplík a nakonec v poslední řadě třetí šuplík. Nyní již můžete otevřít spodní šuplík a sebrat z něj bílý drahokam paní Whitové. Vraťte se zpět na chodbu a pokračujte dále úzkou chodbou až k dalším dveřím, za nimiž se nachází Scarlet. Promluvte si s ní hlavně o tetování a o fotografii - prozradí vám tak svoji hádanku. Sejděte do přízemí a pokračujte dlouhou chodbou - zhruba v jejím středu se otočte doleva, kde uvidíte Mustarda. Promluvte si s ním hlavně o jeho hádance. Otočte se o 180 stupňů a vejděte do místnosti s elektrickým křeslem. Přistupte až ke křeslu a promluvte si s Urfem hlavně o hostech - naučí vás další trik. Otočte se a promluvte si s agentkou Popov o hádankách - bude po vás chtít přívěšek. Vyjděte na chodbu, otočte se doprava a dveřmi na konci chodby vejděte do místnosti, ve které se nachází pan Plum. Jděte šikmo doprava k soše tygra a klikněte postupně na oči, pravou nohu, nos a uši. Následujte červený paprsek a na jeho konci seberte Scarletin rudý drahokam (viz obrázek). Nyní si promluvte s Plumem, pak se otočte doleva a z velké sochy seberte přívěšek. Jděte za slečnou Popov a dejte jí přívěšek - naučí vás jak správně postupovat při hypnóze. Jděte zpět za Plumem a zhypnotizujte ho. Jakmile se na obrazovce objeví přívěšek, musíte jej rozkmitat tak, aby se vychyloval do stran pod úhlem zhruba 30 stupňů. Toho docílíte tak, že budete nejdříve myší rychle pohybovat do stran a pak přejdete do \"houpavého\" pohybu. (zhypnotizovat můžete i Scarlet, ale pro dohrání hry to není důležité) Vyjděte z místnosti a otočte se doleva - uvidíte sarkofág. Prozkoumejte sarkofág a vyřešte puzzle (viz obrázek), jehož výsledkem je zisk Plumova fialového drahokamu. Jděte ke schodišti za Sabatou a ukažte mu váš nový trik s kalendářem - Sabata nakreslí obrázek s Mustardovou hádankou (jedná se asi o nejsložitější puzzle: z poloviny naplněná sklenice znamená \"half\", hodiny znamenají \"an hour\" a okousané jablko znamená \"ate\", což se vyslovuje stejně jako \"eight\" - výsledek je tedy \"půl hodiny po osmé\". Ehmm. Přistupte k hodinám uprostřed chodby (pouze směrem od Mustarda, nikoli od schodiště!) a nastavte na nich čas 8:30. Klikněte na číselník hodin a objevíte Mustardův drahokam. Jděte do jídelny za paní Peacockovou a promluvte si s ní - tentokráte vám již svoji hádanku prozradí. Jděte do místnosti s elektrickým křeslem, hned za dveřmi zahněte doprava a přistupte k malému stolečku. Vašim cílem bude postupně odstranit všechny bariéry v pravé části bludiště a dostat kuličku do horní pravé díry. S kuličkou pohybujete tak, že stisknete levé myšítko a pohnete myší tím směrem, kde se má kulička pohybovat. Popravdě řečeno, jednoduché do zrovna není J. Každopádně zde využijte přiloženého obrázku, na kterém jsou číselně označeny díry, do kterých musíte kuličku dostat. Nakonec se ve středu bludiště objeví bílý drahokam paní Peacockové. Nyní již vlastníte všechny nalezené drahokamy - vraťte je tedy jejim vlastníkům a jděte do místnosti s elektrickým křeslem... Zámek 2: tajné podzemí: Po Urfově smrti si promluvte s Popov - bude po vás chtít \"ouiji\" desku. Jděte do jídelny na místo, kde dříve stál Green, otočte se doleva a otevřete skříň. Ze skříně seberte \"ouiji\" desku a odneste ji slečně Popov. Jděte zpět do jídelny - začne seance. Vaším úkolem bude vyspelovat jména těch hostů, kteří vlastní jeden z drahokamů (Green, Peacock, White, Plum, Mustard, Scarlet) a nakonec ještě Popov. Jakmile seance skončí, jděte za Plumem a promluvte si s ním. Jděte nahoru po schodech do Scarletina pokoje (na konci chodby). Po menším přepadení si promluvte se Scarlet - dostanete od ní klíč. Jděte zpět ke schodům, nescházejte však dolů ale otočte se zpět do dlouhé chodby. Napravo uvidíte zamčené dveře, které odemkněte klíčkem od Scarlet. Projděte dveřmi, jděte šikmo doprava a projděte dalšími dveřmi - objevíte se zpět v téže místnosti. Tentokráte jděte šikmo doleva a klikněte na pohrabáče před krbem - ten se otevře a vy jím projděte do tajné místnosti. Jděte šikmo doprava, kde si důkladně pročtěte diář. Otevřete šuplík a seberte z něj všechny drahokamy. Otočte se doleva, jděte dopředu a dveřmi odejděte z místnosti. Sejděte po točitém schodišti až k červeným dveřím, za kterými naleznete menší bludiště chodeb. Bludištěm jděte vlevo, vlevo, vpravo, vpravo, vpravo, vlevo, vlevo a dostanete se do místnosti se sarkofágem. Prozkoumejte sarkofág a na mističky vah položte drahokamy podle obrázku. Z otevřeného sarkofágu seberte nůž a listinu. Jakmile budete uvězněni, stiskněte kameny u dveří v pořadí uvedeném na obrázku, čímž se zbavíte mříží. Vyjděte ven a jděte k východu z bludiště (doprava, doprava, doleva, doleva, doleva, doprava, doprava). Výbušniny se zbavíte tak, že nejdříve nožem přeříznete všechny dráty uprostřed a posléze dva červené drátky vedoucí k pantům u dveří (viz obrázek). Vystoupejte nahoru po točitém schodišti a vychutnejte si závěr celé hry..."
        ],
        "response":"V této interaktivní hře se hráčem navrhují různé scénáře, včetně rozhovorů s postavami, řešení hádek, hledání drahokoamů a pokus o hypnozu nebo hypnagogii. Hra využívá myš a klávesnici pro pohyby a interakci s variousmi objekty, jako jsou skřínce, dveře a technické zařízení. Cílem je najít všechny drafokamy a splnit požadavky jednotlivých postav.",
        "reference":"Kdopak asi zabil pana Masqueho? Snad plukovník Mustard... nebo že by to byla ta záhadná kráska Scarlett? Můžete to vyřešit pomocí našeho návodu, s nímž hra Clue Chronicles: Fatal Illusion nebude tak těžká, jak se může zdát",
        "reference_contexts":[
            "Úvodem jedna malá poznámka. Když v návodu uvedu, abyste si s někým promluvili, mám tím na mysli, abyste při daném rozhovoru vyčerpali všechna možná témata. Pochopitelně na ta témata, na které jste se již dříve vyptávali a které máte v zápisníčku odškrtnutá, se již znova ptát nemusíte. Jachta: Promluvte si se Scarlet. Otočte se doleva, jděte za Greenem a promluvte si s ním. Vejděte do kajuty lodě a promluvte si s paní Peacockovou. Popojděte k paní Whitové a promluvte si s ní. Sejděte po schodech dolů, kde si nejdříve promluvte s Kell. Jděte k piánu (šikmo doleva) - se slečnou Popov si zatím nelze pohovořit, takže se otočte doprava a promluvte si se Sabatou. Otočte se o 180 stupňů a promluvte si s Plumem sedícím v křesle. Otočte se doleva a jděte k baru (šikmo doprava), kde si promluvte s Mustardem - hlavně o pití, abyste dostali sklenici vína. Otočte se doleva ke kouzelníku Urfovi - jakmile od něj dostanete klíč, promluvte si s ním. Nyní se vraťte na palubu za Scarlet a dejte jí sklenici vína. Vraťte se do kajuty, jděte ke schodům a otočte se doleva - budete stát před uzamčenou skříňkou. Odemkněte ji klíčkem a seberte horní čínskou puzzle-skříňku. Sejděte dolů k Masqueovi - nemá cenu s ním hovořit, rovnou mu dejte čínskou skříňku. Po Masqueově smrti je na čase si znova promluvit se všemi cestujícími - začněte u Kell, pak si konečně promluvte s Popov, která přestala hrát na piáno, a to hlavně o kouzlech - dostanete ESP karty. Promluvte si se Sabatou - bude po vás chtít předvést nějaký trik. Promluvit s Plumem, Mustardem a hlavně Urfem - ten vás naučí trik s kartami. Promluvte si se Sabatou o kouzlech a ukažte mu karetní trik (ta pravá karta je ta, která je jako jediná otočená lícem) - dostanete obrázek, který si v inventáři prohlédněte. Vyjděte po schodech nahoru a jděte za paní Whitovou - ta z ničeho nic upustí na zem vázu. Zohněte se k zemi k rozbité váze, odklopte střep a seberte dva artefakty ve tvaru knoflíků. Promluvte si s paní Whitovou a s paní Peacockovou. Jděte ven na palubu, kde si pohovořte se Scarlet o ESP a udělejte jí test - bude mít vidinu, jejíž výsledkem bude dnešní datum - 31.12.38. Jděte do kajuty, sejděte po schodech, přistupte k velkým dřevěným dveřím a otevřete je. Jděte ke dveřím napravo a prozkoumejte číselný zámek. Na zámku nastavte kód 12,31,38 takto: točte po směru hodinových ručiček na 12, pak proti směru HR přes 12 na 31 (musíte tedy udělat dvě otáčky!!!) a nakonec po směru HR na 38. Stiskněte kliku a vejděte do skladu. Přistupte k poličce, ze které seberte rukavice. Jděte k velké truhlici na podlaze a otevřete ji - vyruší vás Green, po rozhovoru s ním otevřete truhlici znova a seberte z ní ozubené kolo. Vraťte se až ke schodišti (ke Kell) a podívejte se na podlahu - leží zde skříňka. Použijte na skříňku rukavice - seberete tak nejen ji, ale i již třetí artefakt ve tvaru knoflíku. V inventáři použijte sebraný artefakt na skříňku - ta se vám zvětší přes celou obrazovku. Do otvoru na přední straně znova vložte tentýž artefakt - ve skříňce se otevře přihrádka, ze které seberte listinu. Do dalších otvorů vložte zbylé dva artefakty - nakonec objevíte podivné zařízení, které seberte. Opět projděte velkými dřevěnými dveřmi naproti schodišti, tentokrát ale pokračujte chodbou šikmo doleva a pak nahoru po schůdcích. Do podivného mechanizmu na dveřích vložte zařízení ze skříňky. Objevíte se ve strojovně. V její pravé části je skříň s elektrickým rozvodem (viz obrázek). Otevřete skříň a stiskněte tlačítko \"Power\". Přistupte k umělému kormidelníkovi za mříží a použijte na něj ozubené kolo. Vraťte se k rozvodové skříňce a stiskněte \"Power\", pak \"Blow Downs\", \"Valve\", \"Cross Conn\" a nakonec \"Feed Valves\"... Lanovka: Promluvte si s Greenem. Vejděte do boudy a jděte šikmo doleva. Otevřete kredenc a seberte z něj baterku, trychtýř a kanystr. Nastupte do lanovky, otočte se doprava k sedadlům a použijte baterku. Posviťte na levou část zadní sedačky, pak baterku schovejte (pravé myšítko) a seberte z osvíceného místa roztrhané papírky. Složte papírky tak, abyste získali návod ke zprovoznění lanovky. Jděte k nádrži u vstupních dveří boudy a použijte na ni nejdříve trychtýř a posléze kanistr. Jděte k ovládacímu panelu napravo od lanovky a přepněte všechny tři páčky nalevo a následně pohněte s velkou pákou uprostřed doleva (viz obrázek). V lanovce potom pohněte s levou pákou doleva a s pravou pákou nahoru. Ledu, který stojí lanovce v cestě, se zbavíte tak, že asi dvakrát po sobě s lanovkou couvnete (pravou páku dolů) a ihned zase vyjedete nahoru (pravou páku nahoru). Zámek 1 - nalezení drahokamů: Promluvte si s paní Peacockovou, ale ta vám zatím svoji hádanku neprozradí. Pokračujte sálem až ke Greenovi a promluvte si s ním - řekne vám svou hádanku. Jděte do zadní části sálu až ke krbu, kde seberte ohořelou fotografii. Vyjděte ze sálu na chodbu, udělejte krok dopředu a vejděte do dveří nalevo od schodiště. Vejděte do mrazírny, otevřete chladící box a seberte z něj čtvrtý tácek shora. Otočte se doleva k mrtvole Masqueho a prozkoumejte jeho tetování na krku. Vyjděte z mrazírny a zamiřte ke sporáku nalevo. Zapněte vařič (třetím tlačítkem zleva na zadním panelu) a vhoďte do hrnce tácek s ledem. Jakmile se led roztopí, měl by na dně hrnce ležet zelený Greenův drahokam. Pokud ne, vzali jste z boxu v mrazírně špatný tácek a celý proces musíte opakovat a jiným táckem znova. Promluvte si s paní Whitovou - hádanku vám sice neprozradí, nicméně vám poví o své noční můře. Vyjděte z kuchyně na chodbu, kde si můžete promluvit se Sabatou, ale nic kloudného se nedozvíte. Vystoupejte po schodech do patra a vejděte do dveří nalevo, kde si pohovořte s Kell - hlavně o snu paní Whitové. Jděte zpět do kuchyně za paní Whitovou a promluvte si s ní o jejím snu - prozradí vám svou hádanku. Jděte zpět do pokoje za Kell, přistupte k posteli, otočte se doleva a prozkoumejte skříň s mnoha šuplíky. Vaším cílem je otevřít ten největší spodní šuplík, ve kterém je ukrytý drahokam. Abyste jej ale mohli otevřít, musíte nejdříve otevřít i všechny ostatní šuplíky. To uděláte tak, že vysunete v první řadě (shora) druhý šuplík (zleva), v druhé řadě čtvrtý šuplík, v třetí řadě první šuplík a nakonec v poslední řadě třetí šuplík. Nyní již můžete otevřít spodní šuplík a sebrat z něj bílý drahokam paní Whitové. Vraťte se zpět na chodbu a pokračujte dále úzkou chodbou až k dalším dveřím, za nimiž se nachází Scarlet. Promluvte si s ní hlavně o tetování a o fotografii - prozradí vám tak svoji hádanku. Sejděte do přízemí a pokračujte dlouhou chodbou - zhruba v jejím středu se otočte doleva, kde uvidíte Mustarda. Promluvte si s ním hlavně o jeho hádance. Otočte se o 180 stupňů a vejděte do místnosti s elektrickým křeslem. Přistupte až ke křeslu a promluvte si s Urfem hlavně o hostech - naučí vás další trik. Otočte se a promluvte si s agentkou Popov o hádankách - bude po vás chtít přívěšek. Vyjděte na chodbu, otočte se doprava a dveřmi na konci chodby vejděte do místnosti, ve které se nachází pan Plum. Jděte šikmo doprava k soše tygra a klikněte postupně na oči, pravou nohu, nos a uši. Následujte červený paprsek a na jeho konci seberte Scarletin rudý drahokam (viz obrázek). Nyní si promluvte s Plumem, pak se otočte doleva a z velké sochy seberte přívěšek. Jděte za slečnou Popov a dejte jí přívěšek - naučí vás jak správně postupovat při hypnóze. Jděte zpět za Plumem a zhypnotizujte ho. Jakmile se na obrazovce objeví přívěšek, musíte jej rozkmitat tak, aby se vychyloval do stran pod úhlem zhruba 30 stupňů. Toho docílíte tak, že budete nejdříve myší rychle pohybovat do stran a pak přejdete do \"houpavého\" pohybu. (zhypnotizovat můžete i Scarlet, ale pro dohrání hry to není důležité) Vyjděte z místnosti a otočte se doleva - uvidíte sarkofág. Prozkoumejte sarkofág a vyřešte puzzle (viz obrázek), jehož výsledkem je zisk Plumova fialového drahokamu. Jděte ke schodišti za Sabatou a ukažte mu váš nový trik s kalendářem - Sabata nakreslí obrázek s Mustardovou hádankou (jedná se asi o nejsložitější puzzle: z poloviny naplněná sklenice znamená \"half\", hodiny znamenají \"an hour\" a okousané jablko znamená \"ate\", což se vyslovuje stejně jako \"eight\" - výsledek je tedy \"půl hodiny po osmé\". Ehmm. Přistupte k hodinám uprostřed chodby (pouze směrem od Mustarda, nikoli od schodiště!) a nastavte na nich čas 8:30. Klikněte na číselník hodin a objevíte Mustardův drahokam. Jděte do jídelny za paní Peacockovou a promluvte si s ní - tentokráte vám již svoji hádanku prozradí. Jděte do místnosti s elektrickým křeslem, hned za dveřmi zahněte doprava a přistupte k malému stolečku. Vašim cílem bude postupně odstranit všechny bariéry v pravé části bludiště a dostat kuličku do horní pravé díry. S kuličkou pohybujete tak, že stisknete levé myšítko a pohnete myší tím směrem, kde se má kulička pohybovat. Popravdě řečeno, jednoduché do zrovna není J. Každopádně zde využijte přiloženého obrázku, na kterém jsou číselně označeny díry, do kterých musíte kuličku dostat. Nakonec se ve středu bludiště objeví bílý drahokam paní Peacockové. Nyní již vlastníte všechny nalezené drahokamy - vraťte je tedy jejim vlastníkům a jděte do místnosti s elektrickým křeslem... Zámek 2: tajné podzemí: Po Urfově smrti si promluvte s Popov - bude po vás chtít \"ouiji\" desku. Jděte do jídelny na místo, kde dříve stál Green, otočte se doleva a otevřete skříň. Ze skříně seberte \"ouiji\" desku a odneste ji slečně Popov. Jděte zpět do jídelny - začne seance. Vaším úkolem bude vyspelovat jména těch hostů, kteří vlastní jeden z drahokamů (Green, Peacock, White, Plum, Mustard, Scarlet) a nakonec ještě Popov. Jakmile seance skončí, jděte za Plumem a promluvte si s ním. Jděte nahoru po schodech do Scarletina pokoje (na konci chodby). Po menším přepadení si promluvte se Scarlet - dostanete od ní klíč. Jděte zpět ke schodům, nescházejte však dolů ale otočte se zpět do dlouhé chodby. Napravo uvidíte zamčené dveře, které odemkněte klíčkem od Scarlet. Projděte dveřmi, jděte šikmo doprava a projděte dalšími dveřmi - objevíte se zpět v téže místnosti. Tentokráte jděte šikmo doleva a klikněte na pohrabáče před krbem - ten se otevře a vy jím projděte do tajné místnosti. Jděte šikmo doprava, kde si důkladně pročtěte diář. Otevřete šuplík a seberte z něj všechny drahokamy. Otočte se doleva, jděte dopředu a dveřmi odejděte z místnosti. Sejděte po točitém schodišti až k červeným dveřím, za kterými naleznete menší bludiště chodeb. Bludištěm jděte vlevo, vlevo, vpravo, vpravo, vpravo, vlevo, vlevo a dostanete se do místnosti se sarkofágem. Prozkoumejte sarkofág a na mističky vah položte drahokamy podle obrázku. Z otevřeného sarkofágu seberte nůž a listinu. Jakmile budete uvězněni, stiskněte kameny u dveří v pořadí uvedeném na obrázku, čímž se zbavíte mříží. Vyjděte ven a jděte k východu z bludiště (doprava, doprava, doleva, doleva, doleva, doprava, doprava). Výbušniny se zbavíte tak, že nejdříve nožem přeříznete všechny dráty uprostřed a posléze dva červené drátky vedoucí k pantům u dveří (viz obrázek). Vystoupejte nahoru po točitém schodišti a vychutnejte si závěr celé hry..."
        ]
    },
    {
        "user_input":"Shrň tento článek do stručného shrnutí.",
        "retrieved_contexts":[
            "Každý, kdo si u ní pořídil povinné ručení, přispěl na reklamu přibližně 62 korunami. V případě pojišťovny Generali dosáhla tato suma 378 korun, u Allianz 219 korun.Další část investovaných peněz představuje výroba reklam a organizování různých soutěží. Vysoké náklady odůvodňují reklamní experti mimořádností situace na konci loňského roku. \"Tyto výdaje si vyžádal pád monopolu České pojišťovny. Její konkurenti se po získání licence rychle snažili získat část jejích zákazníků,\" míní ředitel Asociace reklamních agentur Jiří Mikeš. Podle zástupců jednotlivých pojišťoven lze v příštích letech očekávat již menší kampaně. POVINNÉ RUČENÍ OŽIVILO REKLAMNÍ TRH Jedním z nejvýznamnějších impulsů, který loni rozhýbal tuzemský reklamní trh a vynesl celkové výdaje na propagaci na rekordní úroveň zhruba třinácti miliard korun, byla kampaň pojišťoven na povinné ručení. Tato reklama se sice na celkovém objemu podílí asi jen 750 miliony, odborníci však označují povinné ručení za jeden z nejvýznamnějších nabízených produktů. \"Společně s lepšími zprávami o vývoji ekonomiky a reklamními akcemi okolo udělení třetí licence mobilního operátora vytvořily prostředí pro růst trhu, k němuž se postupně přidali zadavatelé z jiných oborů,\" říká Štěpán Wolde z mediální agentury IP Praha.Důvodem celkové výše výdajů pojišťoven na přilákání klientů, která po započtení výrobních nákladů a cen z rozličných soutěží zřejmě přesáhne jednu miliardu, je jedinečnost situace - pád monopolu České pojišťovny. \"Když chcete změnit něco, na co byli lidé léta zvyklí, stojí to značné úsilí a z tohoto pohledu jsou marketingové náklady opodstatněné,\" tvrdí ředitel Asociace reklamních agentur Jiří Mikeš. Snaha prosadit jiné značky do povědomí motoristů byla také jedním z hlavních rysů kampaně na povinné ručení. \"Bylo to hodně o image jednotlivých pojišťoven a touze ukázat, že jsou i další alternativy k donedávna existujícímu monopolu,\" soudí Wolde. Snaze představit na trhu odlišné značky a vybudovat tržní pozici přičítá Mikeš i relativně menší podíl prostředků vynaložených na spotřebitelské soutěže. \"Losování espézetek a zlatí kapři sice vyvolávají okamžitou reakci, ale při souboji s Českou pojišťovnou se více sázelo na jiné způsoby. Výdaje na reklamu podle mě ukously z marketingových rozpočtů až osmdesát procent,\" míní Mikeš. Již dříve odborníci oceňovali, že se v rámci reklamních akcí pojišťovny nenapadaly a kampaně vedly eticky. V současné době pojišťovny vyhodnocují návratnost investic do propagace a úspěšnost při získávání klientů. Zda se opravdu vyplatily milionové náklady, zatím nikdo komentovat nechce. Všichni se však shodují, že je letošní situace výjimečná. \"Během několika málo měsíců se koncem minulého roku dělil trh. Do budoucna už reklama tak intenzivní nebude. Máme nyní 2,2 milionu klientů a těm se budeme snažit nabízet takový věrnostní program, aby u nás setrvali,\" uvedl mluvčí České pojišťovny Michal Urban. \"Teď se stane ručení spíše denní záležitostí. A pokud bude řidič spokojen, asi jen tak pojišťovnu nezmění,\" dodává Květa Voglová, mluvčí pojišťovny Allianz."
        ],
        "response":"Výrazným impulsem loni byl kampaní na povinnost ručení pojištěných, která využila unikátní situaci po pádu monopolu české pojištovny České poajišťovnej. Celková výdaji na reklámu a soutěži přesáhly jedno miliardy korun, což vedlo k rychlému rozdělení trhu mezi konkurenty jako Generali, Allianz a ostatní.",
        "reference":"Podstatná část peněz, které pojišťovny vybraly za povinné ručení, zamíří do kapes reklamních společností. Boj o zákazníka na přelomu roku spolkl podle odhadů mediální agentury IP Praha 600 až 750 milionů korun. Největší částku přitom investovala do reklamy Česká pojišťovna - podle odhadů založených na údajích agentury A-Connect jen za poslední tři loňské měsíce bezmála 137 milionů korun. Přesvědčila ovšem bezkonkurenčně nejvíce klientů - dva miliony a dvě stě tisíc",
        "reference_contexts":[
            "Každý, kdo si u ní pořídil povinné ručení, přispěl na reklamu přibližně 62 korunami. V případě pojišťovny Generali dosáhla tato suma 378 korun, u Allianz 219 korun.Další část investovaných peněz představuje výroba reklam a organizování různých soutěží. Vysoké náklady odůvodňují reklamní experti mimořádností situace na konci loňského roku. \"Tyto výdaje si vyžádal pád monopolu České pojišťovny. Její konkurenti se po získání licence rychle snažili získat část jejích zákazníků,\" míní ředitel Asociace reklamních agentur Jiří Mikeš. Podle zástupců jednotlivých pojišťoven lze v příštích letech očekávat již menší kampaně. POVINNÉ RUČENÍ OŽIVILO REKLAMNÍ TRH Jedním z nejvýznamnějších impulsů, který loni rozhýbal tuzemský reklamní trh a vynesl celkové výdaje na propagaci na rekordní úroveň zhruba třinácti miliard korun, byla kampaň pojišťoven na povinné ručení. Tato reklama se sice na celkovém objemu podílí asi jen 750 miliony, odborníci však označují povinné ručení za jeden z nejvýznamnějších nabízených produktů. \"Společně s lepšími zprávami o vývoji ekonomiky a reklamními akcemi okolo udělení třetí licence mobilního operátora vytvořily prostředí pro růst trhu, k němuž se postupně přidali zadavatelé z jiných oborů,\" říká Štěpán Wolde z mediální agentury IP Praha.Důvodem celkové výše výdajů pojišťoven na přilákání klientů, která po započtení výrobních nákladů a cen z rozličných soutěží zřejmě přesáhne jednu miliardu, je jedinečnost situace - pád monopolu České pojišťovny. \"Když chcete změnit něco, na co byli lidé léta zvyklí, stojí to značné úsilí a z tohoto pohledu jsou marketingové náklady opodstatněné,\" tvrdí ředitel Asociace reklamních agentur Jiří Mikeš. Snaha prosadit jiné značky do povědomí motoristů byla také jedním z hlavních rysů kampaně na povinné ručení. \"Bylo to hodně o image jednotlivých pojišťoven a touze ukázat, že jsou i další alternativy k donedávna existujícímu monopolu,\" soudí Wolde. Snaze představit na trhu odlišné značky a vybudovat tržní pozici přičítá Mikeš i relativně menší podíl prostředků vynaložených na spotřebitelské soutěže. \"Losování espézetek a zlatí kapři sice vyvolávají okamžitou reakci, ale při souboji s Českou pojišťovnou se více sázelo na jiné způsoby. Výdaje na reklamu podle mě ukously z marketingových rozpočtů až osmdesát procent,\" míní Mikeš. Již dříve odborníci oceňovali, že se v rámci reklamních akcí pojišťovny nenapadaly a kampaně vedly eticky. V současné době pojišťovny vyhodnocují návratnost investic do propagace a úspěšnost při získávání klientů. Zda se opravdu vyplatily milionové náklady, zatím nikdo komentovat nechce. Všichni se však shodují, že je letošní situace výjimečná. \"Během několika málo měsíců se koncem minulého roku dělil trh. Do budoucna už reklama tak intenzivní nebude. Máme nyní 2,2 milionu klientů a těm se budeme snažit nabízet takový věrnostní program, aby u nás setrvali,\" uvedl mluvčí České pojišťovny Michal Urban. \"Teď se stane ručení spíše denní záležitostí. A pokud bude řidič spokojen, asi jen tak pojišťovnu nezmění,\" dodává Květa Voglová, mluvčí pojišťovny Allianz."
        ]
    },
    {
        "user_input":"Shrň tento článek do stručného shrnutí.",
        "retrieved_contexts":[
            "\"Podpis odložila o chvíli jen pražská mlha, kvůli níž letadlo s hráčem přistálo později,\" popisoval Pelta svoje čekání na další posilu. Hapal přichází na půlroční hostování, které se v létě promění v přestup, protože tehdy Hapalovi vyprší smlouva s týmem z největšího Kanárského ostrova. Sparta stejně jako v případě Lengyela přiznala, kolik jí celá transakce stála. \"V přepočtu náš klub musí uhradit Tenerife 8,5 milionu korun,\" uvedl Pelta, který si pochvaloval vstřícné jednání Španělů, s nimiž jako prostředník vše dohodl Václav Halama, jenž řadu let působí jako mezinárodní manažer Olomouce a pomáhá i řadě hráčů. Jedenatřicetinásobný reprezentant odešel do zahraničí v roce 1993 do němckého Bayeru Leverkusen. Po třech letech však přestoupil do Tenerife, kde v květnu šestadevadesátého roku utrpěl těžkou zlomeninu nohy a přišel tak o start na mistrovství Evropy v Anglii, kam pak sice s týmem odcestoval jako člen výpravy, ale nastoupit nemohl. Léčba jeho zraněné nohy se pak po řadě komplikací protáhla a definitivní uzdravení přišlo až v závěru roku 1998. Proto se dohodl s Olomoucí na tom, že se zde na jaře následujícího rokuběhem půlročního hostování rozehraje. Jeho návrat byl impozantní, stal se okamžitě ústřední postavou Hanáků a pomohl jim k cestě do Poháru UEFA. Tam si už museli poradit bez jeho přispění, protože jedenáct odehraných zápasů a osm vstřelených branek bylo pro Tenerife dostatečným důvodem k tomu, aby povolalo Hapala zpět do týmu, bojujícího o návrat do španělské ligy. \"Do Španělska jsem se vrátil s natrženým svalem, který jsem si přivezl ještě z Olomouce, a tak jsem nebyl schopen zapojit se do přípravy,\" popsal svoje letní trampoty Hapal, který proto stačil na podzim odehrát jen několik zápasů za rezervu, a definitivně se rozhodl pro návrat domů. \"Už jsem byl venku dost dlouho a věřím, že mohu se Spartou ještě řady věcí dosáhnout,\" prohlásil zkušený fotbalista, který nastupoval v národním týmu ještě vedle svého budoucího trenéra Ivana Haška. Hapal nasbíral v dresu Olomouce 139 ligových startů a vstřelil 38 branek. V minulosti několikrát prokázal vlastnosti univerzála. V Olomouci kdysi působil jako ofenzivní záložník, ať už ze středu, či z kraje sestavy. byl ochoten zaskočit i jako obránce, čehož nejednou využil reprezentační trenér Dušan Uhrin. Ve Španělsku se z něho stal spíše útočník, dokáže svých zkušeností využít i střelecky. To si od něho bezpochyby slibují i ve Spartě, kde hledají pohyblivé typy útočníků k vysokému Lokvencovi. Ani Hapalův příchod prý ještě nemusí znamenat konec sparťanských nákupů. Dalšími jmény, která jsou skloňována v souvislosti s letenským klubem, jsou Slončík a Baroš, patřící ostravským hráčům, dále jsou na pořadu dne jednání s nedávným Hapalovým spoluhráčem z Olomouce Heinzem, i s Polákem z Brna, ocitnuvšího se ve finančních problémech."
        ],
        "response":"Pražský mlha způsobila, že letadlo se zastavilo a Hapál přestěhoval do Olomouc, kde se bude v létu hrát jako host. Svého původního klubu Tenerife musel uhraditi 850 tisíc korun za svůj půlrokový pobyt.\n\nHapál, který pro Spartu nastoupil 149x a vstal 37x, se vrací do Olouce, aby mohl pokračovat ve své kariéry, zatímco jeho bývalý tým Tenerife",
        "reference":"Fotbalová Sparta angažovala do svého širokého kádru třicetiletého Pavla Hapala, dosud hráče CD Tenerife. Dnes odpoledne se jí tento záložník upsal na 2,5 roku a definitivně ukončil své působení v druholigovém španělském klubu. Ředitel klubu Miroslav Pelta v poledne hráče vyzvedl na letišti po jeho návratu z Kanárských ostrovů. Za odstupné 8,5 milionu korun bude Hapal ve Spartě půlroku hostovat, v červnu po vypršení starého kontraktu se stane jejím kmenovým hráčem s dvouletou smlouvou",
        "reference_contexts":[
            "\"Podpis odložila o chvíli jen pražská mlha, kvůli níž letadlo s hráčem přistálo později,\" popisoval Pelta svoje čekání na další posilu. Hapal přichází na půlroční hostování, které se v létě promění v přestup, protože tehdy Hapalovi vyprší smlouva s týmem z největšího Kanárského ostrova. Sparta stejně jako v případě Lengyela přiznala, kolik jí celá transakce stála. \"V přepočtu náš klub musí uhradit Tenerife 8,5 milionu korun,\" uvedl Pelta, který si pochvaloval vstřícné jednání Španělů, s nimiž jako prostředník vše dohodl Václav Halama, jenž řadu let působí jako mezinárodní manažer Olomouce a pomáhá i řadě hráčů. Jedenatřicetinásobný reprezentant odešel do zahraničí v roce 1993 do němckého Bayeru Leverkusen. Po třech letech však přestoupil do Tenerife, kde v květnu šestadevadesátého roku utrpěl těžkou zlomeninu nohy a přišel tak o start na mistrovství Evropy v Anglii, kam pak sice s týmem odcestoval jako člen výpravy, ale nastoupit nemohl. Léčba jeho zraněné nohy se pak po řadě komplikací protáhla a definitivní uzdravení přišlo až v závěru roku 1998. Proto se dohodl s Olomoucí na tom, že se zde na jaře následujícího rokuběhem půlročního hostování rozehraje. Jeho návrat byl impozantní, stal se okamžitě ústřední postavou Hanáků a pomohl jim k cestě do Poháru UEFA. Tam si už museli poradit bez jeho přispění, protože jedenáct odehraných zápasů a osm vstřelených branek bylo pro Tenerife dostatečným důvodem k tomu, aby povolalo Hapala zpět do týmu, bojujícího o návrat do španělské ligy. \"Do Španělska jsem se vrátil s natrženým svalem, který jsem si přivezl ještě z Olomouce, a tak jsem nebyl schopen zapojit se do přípravy,\" popsal svoje letní trampoty Hapal, který proto stačil na podzim odehrát jen několik zápasů za rezervu, a definitivně se rozhodl pro návrat domů. \"Už jsem byl venku dost dlouho a věřím, že mohu se Spartou ještě řady věcí dosáhnout,\" prohlásil zkušený fotbalista, který nastupoval v národním týmu ještě vedle svého budoucího trenéra Ivana Haška. Hapal nasbíral v dresu Olomouce 139 ligových startů a vstřelil 38 branek. V minulosti několikrát prokázal vlastnosti univerzála. V Olomouci kdysi působil jako ofenzivní záložník, ať už ze středu, či z kraje sestavy. byl ochoten zaskočit i jako obránce, čehož nejednou využil reprezentační trenér Dušan Uhrin. Ve Španělsku se z něho stal spíše útočník, dokáže svých zkušeností využít i střelecky. To si od něho bezpochyby slibují i ve Spartě, kde hledají pohyblivé typy útočníků k vysokému Lokvencovi. Ani Hapalův příchod prý ještě nemusí znamenat konec sparťanských nákupů. Dalšími jmény, která jsou skloňována v souvislosti s letenským klubem, jsou Slončík a Baroš, patřící ostravským hráčům, dále jsou na pořadu dne jednání s nedávným Hapalovým spoluhráčem z Olomouce Heinzem, i s Polákem z Brna, ocitnuvšího se ve finančních problémech."
        ]
    },
    {
        "user_input":"Shrň tento článek do stručného shrnutí.",
        "retrieved_contexts":[
            "Když se předseda komise Luděk Macela snažil novinářům vnutit myšlenku, že na Žižkově se zase tak moc nestalo a že to zveličily sdělovací prostředky, mimo jiné se ptal: \"A za co bych ho měl vyhodit? Za co?\" Pro odpověď na sugestivně položenou otázku lze sáhnout do léta 1995, které fotbal poznamenalo úplatkářskou aférou. Tehdy byli z prvoligové listiny vyřazeni hned čtyři rozhodčí a na fotbalovém svazu to odmítl komentovat kdekdo, včetně jeho předsedy Františka Chvalovského. V kuloárech ovšem, jako ostatně vždycky, bylo jasno. Především pánové Puček, Berbr a Zvonič neměli důvěru ligových klubů a ni fotbalového vedení. Důkazy o jejich nekalých činech opět chyběly, a tak se zvolil vyhazov bez vysvětlení. Puček a Berbr vzápětí promluvili, když několik prvoligových činovníků obvinili z nečestného jednání a z pokusů o uplácení. O pár dní později, po anonymních výhrůžkách, všechno odvolali. Pučkovi prý přitom kdosi neznámý naznačil, že když bude rozumný, za rok se do první ligy vrátí. Puček rozumný byl a po roce se vrátil. To Zvonič věděl rovnou, že mlčeti je zlato, a za rok byl zpátky také. Ruka ruku umyla. Aby se předešlo uplácení rozhodčích, což však tehdy neprokázali ani kriminalisté, koncem července 1995 se odměna hlavním rozhodčím zvedla z tří tisíc na deset. A Chvalovský zahřímal: \"Pokud se teď rozhodčí dopustí chyb opakovaně, neřkuli úmyslně, budou se muset této atraktivní práce zříci.\" Škoda jen, že nedodal recept, jak úmysl rozeznat. Právě dnes by se náramně hodil. Výkony rozhodčích se potom výrazně zlepšily, ubylo postranních úmyslů jak přijít k penězům. Po necelých dvou letech ale začalo všeobecně platit rčení, že s jídlem roste chuť. Nikdo to neříkal nahlas, ale všichni věděli, že čím víc mají sudí oficiálně, tím víc žádají po straně. \"Krula patřil vždycky k těm, kteří nic nelámali přes koleno. Když jsem ale viděl, co udělal na Žižkově, napadlo mě, že buď jeho motivace musela být obrovská, nebo že se zbláznil,\" řekl současný ligový trenér, který si nepřál být jmenován. Má obavy, že kdyby Krula na jaře přece jen ještě pískal, mohl by se jeho mužstvu mstít. Luděk Macela se snaží hájit rozhodčí námitkou, že za nekalostmi stojí funkcionáři. Pravda, jsou známy případy, kdy si trenér angažmá vybíral i podle toho, zda se klub patřičně stará o rozhodčí. Ale už někdejší benešovský mecenáš Miroslav Švarc před čtyřmi roky tvrdil, že sudí si o peníze sami říkají a že berou až sto padesát tisíc korun za to, že budou pískat na rovinu. Dnes, kdy hlavní rozhodčí má za zápas 15 000 korun (asi 10 000 čistého), se proto těžko divit hlasům, které tvrdí, že sudí klidně vezme i tři sta tisíc bokem. Pokud někdo může kvůli věkové hranici pískat maximálně ještě půldruhého roku, taková kompenzace za případný předčasný vyhazov tomu odpovídá."
        ],
        "response":"V roce 1895 byla na žižkově rozhodčí Krulová vyřazen bez vysvědění kvůli podezření z úplatků, což vedlo k dramatickému posunu ve výši odměn rozhodčů. I když se odhaduje, že dnešní rozhodčí získávají více než dvojnásobnou částku za svůj výkon, stále se domnívá, že jejich motivace je příliš vysoká a že se jim stále něco stane.",
        "reference":"Co se vleče, neuteče, říkává se. Jako by se právě tohle rčení líbilo komisi rozhodčích fotbalového svazu. Ta případ rozhodčího Josefa Kruly, který skandálně ovlivnil nedávný ligový zápas Žižkov - Sparta (2:3) v neprospěch domácích, odročila v úterý až na 11. ledna. Proč? Na zhlédnutí videozáznamu utkání z 4. prosince neměli tři členové komise z nejrůznějších důvodů čas. Co na tom, že liga jim přihrála případ, nad nímž kroutí hlavou celá fotbalová veřejnost. Inu, co se vleče...",
        "reference_contexts":[
            "Když se předseda komise Luděk Macela snažil novinářům vnutit myšlenku, že na Žižkově se zase tak moc nestalo a že to zveličily sdělovací prostředky, mimo jiné se ptal: \"A za co bych ho měl vyhodit? Za co?\" Pro odpověď na sugestivně položenou otázku lze sáhnout do léta 1995, které fotbal poznamenalo úplatkářskou aférou. Tehdy byli z prvoligové listiny vyřazeni hned čtyři rozhodčí a na fotbalovém svazu to odmítl komentovat kdekdo, včetně jeho předsedy Františka Chvalovského. V kuloárech ovšem, jako ostatně vždycky, bylo jasno. Především pánové Puček, Berbr a Zvonič neměli důvěru ligových klubů a ni fotbalového vedení. Důkazy o jejich nekalých činech opět chyběly, a tak se zvolil vyhazov bez vysvětlení. Puček a Berbr vzápětí promluvili, když několik prvoligových činovníků obvinili z nečestného jednání a z pokusů o uplácení. O pár dní později, po anonymních výhrůžkách, všechno odvolali. Pučkovi prý přitom kdosi neznámý naznačil, že když bude rozumný, za rok se do první ligy vrátí. Puček rozumný byl a po roce se vrátil. To Zvonič věděl rovnou, že mlčeti je zlato, a za rok byl zpátky také. Ruka ruku umyla. Aby se předešlo uplácení rozhodčích, což však tehdy neprokázali ani kriminalisté, koncem července 1995 se odměna hlavním rozhodčím zvedla z tří tisíc na deset. A Chvalovský zahřímal: \"Pokud se teď rozhodčí dopustí chyb opakovaně, neřkuli úmyslně, budou se muset této atraktivní práce zříci.\" Škoda jen, že nedodal recept, jak úmysl rozeznat. Právě dnes by se náramně hodil. Výkony rozhodčích se potom výrazně zlepšily, ubylo postranních úmyslů jak přijít k penězům. Po necelých dvou letech ale začalo všeobecně platit rčení, že s jídlem roste chuť. Nikdo to neříkal nahlas, ale všichni věděli, že čím víc mají sudí oficiálně, tím víc žádají po straně. \"Krula patřil vždycky k těm, kteří nic nelámali přes koleno. Když jsem ale viděl, co udělal na Žižkově, napadlo mě, že buď jeho motivace musela být obrovská, nebo že se zbláznil,\" řekl současný ligový trenér, který si nepřál být jmenován. Má obavy, že kdyby Krula na jaře přece jen ještě pískal, mohl by se jeho mužstvu mstít. Luděk Macela se snaží hájit rozhodčí námitkou, že za nekalostmi stojí funkcionáři. Pravda, jsou známy případy, kdy si trenér angažmá vybíral i podle toho, zda se klub patřičně stará o rozhodčí. Ale už někdejší benešovský mecenáš Miroslav Švarc před čtyřmi roky tvrdil, že sudí si o peníze sami říkají a že berou až sto padesát tisíc korun za to, že budou pískat na rovinu. Dnes, kdy hlavní rozhodčí má za zápas 15 000 korun (asi 10 000 čistého), se proto těžko divit hlasům, které tvrdí, že sudí klidně vezme i tři sta tisíc bokem. Pokud někdo může kvůli věkové hranici pískat maximálně ještě půldruhého roku, taková kompenzace za případný předčasný vyhazov tomu odpovídá."
        ]
    },
    {
        "user_input":"Shrň tento článek do stručného shrnutí.",
        "retrieved_contexts":[
            "Telefon má spoustu zajímavých funkcí. Jednou z nich je například i funkce hlasového vytáčení a ovládání telefonu. Mobil má paměť na 15 hlasových povelů, které jsou volně sdílené mezi povely pro vytočení určitého čísla a dále mohou být přiřazeny až k 25 dalším funkcím (příkazům) telefonu. V souvislosti s hlasovými funkcemi je zde i paměť na 20 sekundovou hlasovou nahrávku, což není mnoho, ale pro občasnou potřebu to bohatě stačí. Hmotnostně patří Xenium spíše ke kolibříkům. Považte sami, 95 gramů ještě dnes nemá kdejaký telefon. Rozměry 109x41x20 mm jsou přijatelné celkem i pro kapsičku u košile. Další funkcí, kterou disponuje Xenium je vibrační zvonění, což není dnes již neobvyklé. Snad jen, kdyby se tento telefon zaměřil na střední cenovou třídu. Skládání vlastních melodií se dnes již vyžaduje také snad od každého mobilu. Tento přístroj editorem na melodie rovněž disponuje. Dále je zde tzv. Brick game, což my spektristé známe pod jménem Arkanoid. Je až s podivem, jak rychle se tito plýtvači energie a snižovači životnosti zabydleli v nových typech mobilních telefonů. Takové hry ovšem vyžadují poměrně kvalitní displej, který je zde plně grafický o rozlišení 87x64 bodů. Displej je modře podsvícen. Velmi dobře je řešeno rovněž ovládání telefonu, které se odehrává podobně jako u telefonů Sony pomocí hlavního tlačítka, které se jmenuje Pilot Key. Výdrž mobilu závisí na použité baterii. S 800 mAh baterií vydrží telefon ve standby modu 150-250 hodin a v talk režimu 2 hodiny a 30 minut až 3 hodiny a 50 minut. S vibrační 1200 mAh baterií se časy zvyšují o polovinu. Další \"aplikací\" je kalkulačka, která vám pomůže \"everywhere at any time\", jak píší na webové prezentaci. Osobně bych ale chtěl vidět kalkulačku, která by mi \"everywhere at any time\" nepomohla (kromě rozbité). Konverze měny z\/do Euro již dnes není zase tak obvyklá, ale pomalu a jistě se v našich mobilech zabydluje. Osobní organizér, kalendář a plánovač jsou dnes stále nadstandardnějšími funkcemi, které již považuji pro sebe jako nezbytné. Je lepší s sebou nosit jen mobil a ne další haldu papírků, někdy svázanou do poznákmového bločku, či osobní organizér. Stále je pohodlnější nosit jen jeden přístroj. Vypadá to, že pokud se dostane Xenium 939 na náš trh, bude to nejspíš velmi slušný mobil pro předplacené sady obou našich operátorů. Telefon, jako dnes většina moderních GSM telefonů, pracuje jak v GSM-900, tak v DCS-1800 pásmu. Další informace, včetně zkoušky hry Bricks naleznete zde."
        ],
        "response":"Mobil Xenium se pohybuje v kolibřících rozměrech a nabízí základní funkce jako hlasový ovladač, vibrační zvonek a vlastní hudbu, avšak jeho grafický displej a menší kapacita baterie jsou jeho slabými body.\n\nZde je stručné shromažďování klíčových informací:\n\n*   **Xenium** je hmotný model s rozměry 9,5 cm, který kombinuje základní telefony s funkcemi jako hlasové ovládací prv",
        "reference":"Firma Philips, výrobce spotřební elektroniky, včetně mobilních telefonů, přichází na světový trh s dalším modelem mobilního telefonu řady Xenium",
        "reference_contexts":[
            "Telefon má spoustu zajímavých funkcí. Jednou z nich je například i funkce hlasového vytáčení a ovládání telefonu. Mobil má paměť na 15 hlasových povelů, které jsou volně sdílené mezi povely pro vytočení určitého čísla a dále mohou být přiřazeny až k 25 dalším funkcím (příkazům) telefonu. V souvislosti s hlasovými funkcemi je zde i paměť na 20 sekundovou hlasovou nahrávku, což není mnoho, ale pro občasnou potřebu to bohatě stačí. Hmotnostně patří Xenium spíše ke kolibříkům. Považte sami, 95 gramů ještě dnes nemá kdejaký telefon. Rozměry 109x41x20 mm jsou přijatelné celkem i pro kapsičku u košile. Další funkcí, kterou disponuje Xenium je vibrační zvonění, což není dnes již neobvyklé. Snad jen, kdyby se tento telefon zaměřil na střední cenovou třídu. Skládání vlastních melodií se dnes již vyžaduje také snad od každého mobilu. Tento přístroj editorem na melodie rovněž disponuje. Dále je zde tzv. Brick game, což my spektristé známe pod jménem Arkanoid. Je až s podivem, jak rychle se tito plýtvači energie a snižovači životnosti zabydleli v nových typech mobilních telefonů. Takové hry ovšem vyžadují poměrně kvalitní displej, který je zde plně grafický o rozlišení 87x64 bodů. Displej je modře podsvícen. Velmi dobře je řešeno rovněž ovládání telefonu, které se odehrává podobně jako u telefonů Sony pomocí hlavního tlačítka, které se jmenuje Pilot Key. Výdrž mobilu závisí na použité baterii. S 800 mAh baterií vydrží telefon ve standby modu 150-250 hodin a v talk režimu 2 hodiny a 30 minut až 3 hodiny a 50 minut. S vibrační 1200 mAh baterií se časy zvyšují o polovinu. Další \"aplikací\" je kalkulačka, která vám pomůže \"everywhere at any time\", jak píší na webové prezentaci. Osobně bych ale chtěl vidět kalkulačku, která by mi \"everywhere at any time\" nepomohla (kromě rozbité). Konverze měny z\/do Euro již dnes není zase tak obvyklá, ale pomalu a jistě se v našich mobilech zabydluje. Osobní organizér, kalendář a plánovač jsou dnes stále nadstandardnějšími funkcemi, které již považuji pro sebe jako nezbytné. Je lepší s sebou nosit jen mobil a ne další haldu papírků, někdy svázanou do poznákmového bločku, či osobní organizér. Stále je pohodlnější nosit jen jeden přístroj. Vypadá to, že pokud se dostane Xenium 939 na náš trh, bude to nejspíš velmi slušný mobil pro předplacené sady obou našich operátorů. Telefon, jako dnes většina moderních GSM telefonů, pracuje jak v GSM-900, tak v DCS-1800 pásmu. Další informace, včetně zkoušky hry Bricks naleznete zde."
        ]
    },
    {
        "user_input":"Shrň tento článek do stručného shrnutí.",
        "retrieved_contexts":[
            "Brno je po Drnovicích už druhým jihomoravským prvoligovým celkem zasaženým konkursní hrozbou. Situace v obou klubech je však jiná. V Drnovicích nebyl vypsán konkurs na společnost Petra, která řídí fotbal, nýbrž na jejího \"nemocného otce\" firmu Chemapol. Petra, která byla jeho dceřinou společností, se po vyhlášení konkursu musela téměř rok živit sama. Díky schopnému managementu se jí podařilo přežít a fotbal v Drnovicích je zřejmě zachráněn. V případě brněnského klubu ale vypsal Krajský obchodní soud v Brně konkurs přímo na společnost, která živí fotbal. Co to znamená? \"Nemělo by to mít podstatný význam,\" míní mluvčí fotbalového svazu Jaroslav Kolář. \"Konkursní správce se zřejmě bude snažit z majetku, k němuž patří i fotbalisté, získat co nejvíc. Nemůže ale mužstvo rozprodat bez souhlasu hráčů a fotbalového svazu. Fotbal v Brně by neměl konkursem utrpět,\" věří. Ředitel drnovického klubu Vladimír Krejčí o konkursu FC Boby nevěděl. Protože se však v poslední době podobnými problémy zabýval, má o konkursech hluboké znalosti. Kolářovým tvrzením si tak jistý není. \"Pokud se konkursní správce například domluví se Spartou, že jí prodá některého hráče a fotbalista s tím bude souhlasit, nikdo mu nemůže v přestupu zabránit. Konkursní správce totiž přebírá veškeré pravomoce představenstva a dozorčí rady. Jeho povinností je uspokojit věřitele. A to může udělat buď tím, že bude provozovat fotbalový klub tak dobře, že bude vydělávat, nebo rozprodá všechno co půjde a z výnosu zaplatí věřitelům,\" vysvětlil Krejčí. \"Takový drastický krok může v podstatě udělat každý majitel fotbalového klubu. Když ho přestane chtít sponzorovat, rozpustí ho,\" připustil Kolář. Podle Krejčího by byl ale konkursní správce sám proti sobě, kdyby neplnil hráčům smlouvy. \"Pak by je mohli fotbalisté vypovědět a byli by volní za tabulkové hodnoty. Což jsou většinou směšně malé sumy. Proto by měl být konkursní správce natolik chytrý, aby plnil podmínky fotbalistů a tím je v týmu udržel. Pak buď najde někoho, kdo klub koupí, nebo postupně umožní hráčům přestupovat. Šikovný správce bude klub půl roku živit a pak na něm vydělá,\" míní Krejčí. Konkursní správce Kateřina Pavlíková se začala teprve včera případem zabývat. Jaké kroky s brněnským fotbalem učiní, zatím nevěděla ani ona sama."
        ],
        "response":"Drnovické fotbalové kluby uniknou konkursnímu postihu, protože se jedná o konkurz firmy ředitele, nikoliv přímo o klub. Mluvčí fotbalovému svazu tvrdí, že v Brnu by se situace změnila pouze tehdy, pokud by konkursní správa využila právo převzetí všech rozhodovacích práv, což by mohlo vést k rozprodání majetků a ztrátě hráčských práv.",
        "reference":"Konkurs na zadluženou společnost FC Boby-sport, jejíž součástí je i fotbalový klub Boby Brno, vypsal Krajský obchodní soud v Brně. Kontroly nad chodem společnosti podnikatele Lubomíra Hrstky se ujala správkyně konkursní podstaty Kateřina Pavlíková. \"Neznamená to, že by klub vypsáním konkursu končil. Zatím o společnosti nic nevím, budu teprve studovat materiály,\" uvedla včera advokátka Pavlíková. Rýsuje se mnoho možností, co bude s klubem dál. Od dalšího fungování, třeba pod novým majitelem, až po rozprodej a zrušení",
        "reference_contexts":[
            "Brno je po Drnovicích už druhým jihomoravským prvoligovým celkem zasaženým konkursní hrozbou. Situace v obou klubech je však jiná. V Drnovicích nebyl vypsán konkurs na společnost Petra, která řídí fotbal, nýbrž na jejího \"nemocného otce\" firmu Chemapol. Petra, která byla jeho dceřinou společností, se po vyhlášení konkursu musela téměř rok živit sama. Díky schopnému managementu se jí podařilo přežít a fotbal v Drnovicích je zřejmě zachráněn. V případě brněnského klubu ale vypsal Krajský obchodní soud v Brně konkurs přímo na společnost, která živí fotbal. Co to znamená? \"Nemělo by to mít podstatný význam,\" míní mluvčí fotbalového svazu Jaroslav Kolář. \"Konkursní správce se zřejmě bude snažit z majetku, k němuž patří i fotbalisté, získat co nejvíc. Nemůže ale mužstvo rozprodat bez souhlasu hráčů a fotbalového svazu. Fotbal v Brně by neměl konkursem utrpět,\" věří. Ředitel drnovického klubu Vladimír Krejčí o konkursu FC Boby nevěděl. Protože se však v poslední době podobnými problémy zabýval, má o konkursech hluboké znalosti. Kolářovým tvrzením si tak jistý není. \"Pokud se konkursní správce například domluví se Spartou, že jí prodá některého hráče a fotbalista s tím bude souhlasit, nikdo mu nemůže v přestupu zabránit. Konkursní správce totiž přebírá veškeré pravomoce představenstva a dozorčí rady. Jeho povinností je uspokojit věřitele. A to může udělat buď tím, že bude provozovat fotbalový klub tak dobře, že bude vydělávat, nebo rozprodá všechno co půjde a z výnosu zaplatí věřitelům,\" vysvětlil Krejčí. \"Takový drastický krok může v podstatě udělat každý majitel fotbalového klubu. Když ho přestane chtít sponzorovat, rozpustí ho,\" připustil Kolář. Podle Krejčího by byl ale konkursní správce sám proti sobě, kdyby neplnil hráčům smlouvy. \"Pak by je mohli fotbalisté vypovědět a byli by volní za tabulkové hodnoty. Což jsou většinou směšně malé sumy. Proto by měl být konkursní správce natolik chytrý, aby plnil podmínky fotbalistů a tím je v týmu udržel. Pak buď najde někoho, kdo klub koupí, nebo postupně umožní hráčům přestupovat. Šikovný správce bude klub půl roku živit a pak na něm vydělá,\" míní Krejčí. Konkursní správce Kateřina Pavlíková se začala teprve včera případem zabývat. Jaké kroky s brněnským fotbalem učiní, zatím nevěděla ani ona sama."
        ]
    },
    {
        "user_input":"Shrň tento článek do stručného shrnutí.",
        "retrieved_contexts":[
            "Klubu s největším diváckým zázemím se teď naskýtají dvě varianty. Buď padne dolů o několik fotbalových pater, ne-li na samé dno, anebo některá z domácích společností využije situace a odkupem krachující firmy se sama bude chtít dostat na místo, z něhož dosud vládl Hrstka. Pokusit se znovu rozjet v Brně fotbalový boom může být pro někoho lákavé. Je však otázka, zda o to kromě fanoušků vůbec někdo bude mít zájem. Šanci, i když malou, nabízí nedávný příklad z blízkých Drnovic. Ty však při konkursu Chemapolu byly s postaveným moderním stadionem a s přehledným hospodařením v zádech v jiné situaci. Zpráva, že je jejich klub v konkursu, překvapila fotbalisty FC Boby i jejich trenéra Karla Jarůška. Ten reagoval svérázně: \"Já jsem se už lekl, že je pryč Polák. Ještě před chvílí s námi běhal po lese v Soběšicích. Když jste se ale tak tajuplně ptal, jestli vím, co je nového, pomyslel jsem si, že na něho někdo čekal před stadionem a on přestoupí. Z konkursu se snad dá vybruslit,\" doufá trenér. Říci, co si myslí o konkursu, je těžké pro brankáře Luboše Přibyla, vystudovaného inženýra ekonomie. \"Nedokážu posoudit, jestli to bude mít na klub nějaký dopad. Ani se mně o tom nechce přemýšlet. Je to dost složitá věc a my hráči ji těžko můžeme nějak ovlivnit,\" řekl Přibyl. Kapitán týmu Jan Palinek, stejně jako ostatní fotbalisté, o ničem nevěděl. V létě mu končí smlouva, a tak informaci přijal bez emocí. \"S končící smlouvou to nemá nic společného. Ale copak teď nadělám,\" položil Palinek řečnickou otázku. Že se k něčemu schylovalo, tušil bývalý trenér Brna a nyní kouč Drnovic Karel Večeřa, jemuž vedení brněnského klubu stále dluží značnou sumu. \"Konkurs je pro mě překvapením, ale náznaky, že se něco musí stát, tady byly. Takhle se hospodařit nedá,\" tvrdí muž, který situaci v Boby dobře zná."
        ],
        "response":"Fotbalový klub s nejvyšší podporou se nachází v konkursové situaci, což vyvolalo obavy u fanoušků i trenéra, který očekává návrat do hry. Během letního období se však smluvní dohoda mezi klubem a bývalým trenérem Karlem Večeříem zrušila, čímž vznikla právní váha, která by mohla vést k dalšímu pokusu o obnovu klubu.",
        "reference":"O uvalení konkursu si majitel fotbalového klubu Lubomír Hrstka koledoval už řadu let. Buď tentokrát jeho dluhy narostly do takových rozměrů, že už jej nedokázal žádnými pákami zvrátit, anebo dva z věřitelů, zkrachovalá Velkomoravská banka a Komerční banka, která má nyní svoje vnitřní problémy, byli nuceni přitvrdit na pilu",
        "reference_contexts":[
            "Klubu s největším diváckým zázemím se teď naskýtají dvě varianty. Buď padne dolů o několik fotbalových pater, ne-li na samé dno, anebo některá z domácích společností využije situace a odkupem krachující firmy se sama bude chtít dostat na místo, z něhož dosud vládl Hrstka. Pokusit se znovu rozjet v Brně fotbalový boom může být pro někoho lákavé. Je však otázka, zda o to kromě fanoušků vůbec někdo bude mít zájem. Šanci, i když malou, nabízí nedávný příklad z blízkých Drnovic. Ty však při konkursu Chemapolu byly s postaveným moderním stadionem a s přehledným hospodařením v zádech v jiné situaci. Zpráva, že je jejich klub v konkursu, překvapila fotbalisty FC Boby i jejich trenéra Karla Jarůška. Ten reagoval svérázně: \"Já jsem se už lekl, že je pryč Polák. Ještě před chvílí s námi běhal po lese v Soběšicích. Když jste se ale tak tajuplně ptal, jestli vím, co je nového, pomyslel jsem si, že na něho někdo čekal před stadionem a on přestoupí. Z konkursu se snad dá vybruslit,\" doufá trenér. Říci, co si myslí o konkursu, je těžké pro brankáře Luboše Přibyla, vystudovaného inženýra ekonomie. \"Nedokážu posoudit, jestli to bude mít na klub nějaký dopad. Ani se mně o tom nechce přemýšlet. Je to dost složitá věc a my hráči ji těžko můžeme nějak ovlivnit,\" řekl Přibyl. Kapitán týmu Jan Palinek, stejně jako ostatní fotbalisté, o ničem nevěděl. V létě mu končí smlouva, a tak informaci přijal bez emocí. \"S končící smlouvou to nemá nic společného. Ale copak teď nadělám,\" položil Palinek řečnickou otázku. Že se k něčemu schylovalo, tušil bývalý trenér Brna a nyní kouč Drnovic Karel Večeřa, jemuž vedení brněnského klubu stále dluží značnou sumu. \"Konkurs je pro mě překvapením, ale náznaky, že se něco musí stát, tady byly. Takhle se hospodařit nedá,\" tvrdí muž, který situaci v Boby dobře zná."
        ]
    },
    {
        "user_input":"Shrň tento článek do stručného shrnutí.",
        "retrieved_contexts":[
            "Kožuchův přestup do Liberce se seběhl velice rychle. \"Manažeři mi volali, že je o mě zájem v Čechách. Já jsem kývl a kluby se velice brzy dohodly,\" vysvětluje Kožuch. \"Důležité pro mě bylo, že Liberec hraje v popředí české ligové tabulky a nikdy mu nehrozil sestup. Prešov byl navíc ve finanční tísni,\" přiznává. Podle informací z fotbalových kuloárů měly o Vladimíra Kožucha zájem i pražské velkokluby Sparta a Slavie, Liberec byl však nejrychlejší. \"O Spartě i Slavii jsem slyšel od slovenských manažerů, ale byly to jen ústní informace. Osobně se mnou nikdo nejednal,\" říká slovenský útočník. \"Že jsem nešel do Prahy, pro mě není vůbec žádné zklamání. Vždyť Liberec hraje o Pohár UEFA,\" tvrdí nováček v libereckém Slovanu. Vladimír Kožuch začal hrát fotbal v rodných Malackách, v dospělém věku pak rok hájil barvy Interu Bratislava a poslední tři a půl sezony oblékal dres Tatranu Prešov. V Liberci bude bydlet spolu se svou manželkou a dvouletou dcerkou. Liberec znamená pro slovenského útočníka zcela nové prostředí, v němž zatím nikoho nezná. \"Se slovenskými hráči Michalíkem a Klagem jsme proti sobě hráli v domácí lize, ale osobně je poznám až tady,\" říká. Rodák z Malacek je už čtvrtým cizincem v dresu Liberce - po svých dvou krajanech a Argentinci Lazzaru Liunim. Nová akvizice Slovanu bere zimní přípravu stejně jako většina hráčů, tedy jako nepříjemnou nutnost. \"Je jasné, že každý fotbalista radši hraje, než běhá, ale na jaře se nám bude fyzická kondice velice hodit,\" ví Vladimír Kožuch."
        ],
        "response":"Slovenský fotbalista Vladimir Kožuh přestoupil do Liborce za účelem vyhrávání Poháru UEFA, protože klub hraje ve prospěchu české tabulce a má lepší finanční situaci než jeho předchozí klub. Kožohov zájem o další velkokluby, včetně Sparty a Slavy, odmítal, avšak rozhodl se pro rychlou integraci do nového prostředí.",
        "reference":"Jedním z největších zimních přestupů v první fotbalové lize je zatím příchod slovenského útočníka Vladimíra Kožucha do Slovanu Liberec. S osmi brankami nejlepší střelec podzimní části slovenské ligy podepsal před Vánocemi s libereckým klubem dvouapůlletou profesionální smlouvu a v pondělí se hlásil trenéru Škorpilovi na prvním tréninku zimní přípravy. \"Jsem rád, že si budu moci vyzkoušet českou ligu,\" těší se čtyřiadvacetiletý kanonýr",
        "reference_contexts":[
            "Kožuchův přestup do Liberce se seběhl velice rychle. \"Manažeři mi volali, že je o mě zájem v Čechách. Já jsem kývl a kluby se velice brzy dohodly,\" vysvětluje Kožuch. \"Důležité pro mě bylo, že Liberec hraje v popředí české ligové tabulky a nikdy mu nehrozil sestup. Prešov byl navíc ve finanční tísni,\" přiznává. Podle informací z fotbalových kuloárů měly o Vladimíra Kožucha zájem i pražské velkokluby Sparta a Slavie, Liberec byl však nejrychlejší. \"O Spartě i Slavii jsem slyšel od slovenských manažerů, ale byly to jen ústní informace. Osobně se mnou nikdo nejednal,\" říká slovenský útočník. \"Že jsem nešel do Prahy, pro mě není vůbec žádné zklamání. Vždyť Liberec hraje o Pohár UEFA,\" tvrdí nováček v libereckém Slovanu. Vladimír Kožuch začal hrát fotbal v rodných Malackách, v dospělém věku pak rok hájil barvy Interu Bratislava a poslední tři a půl sezony oblékal dres Tatranu Prešov. V Liberci bude bydlet spolu se svou manželkou a dvouletou dcerkou. Liberec znamená pro slovenského útočníka zcela nové prostředí, v němž zatím nikoho nezná. \"Se slovenskými hráči Michalíkem a Klagem jsme proti sobě hráli v domácí lize, ale osobně je poznám až tady,\" říká. Rodák z Malacek je už čtvrtým cizincem v dresu Liberce - po svých dvou krajanech a Argentinci Lazzaru Liunim. Nová akvizice Slovanu bere zimní přípravu stejně jako většina hráčů, tedy jako nepříjemnou nutnost. \"Je jasné, že každý fotbalista radši hraje, než běhá, ale na jaře se nám bude fyzická kondice velice hodit,\" ví Vladimír Kožuch."
        ]
    },
    {
        "user_input":"Shrň tento článek do stručného shrnutí.",
        "retrieved_contexts":[
            "\"Byl jsem vedením nemocnice pověřen, abych o této skutečnosti informoval. Testy odhalily v Maradonově těle přítomnost kokainu,\" řekl šéf policie v Montevideu Maximo Costa Rocha, jenž speciální vyšetření na přítomnost drog v krvi nařídil. \"Lékaři provedou další dva nebo tři testy, aby potvrdili pozitivní nález. Pak z celé situace vyvodíme patřičné závěry,\" dodal Costa Rocha. Podle něj budou výsledky známy do dvou dnů, do té doby policisté vyslechnou několik lidí. V Uruguayi není užívání drog nelegální, Maradonovi proto nehrozí trestní stíhání. \"Mohl je ale distribuovat,\" namítá policista, který už vyslechl hráčova manažera Guillerma Coppolu. Maradonův stav se podle ošetřujícího lékaře Franka Torrese zlepšil a fotbalista by mohl být za několik hodin přeložen z jednotky intenzivní péče na normální pokoj. Kapitán mistrů světa z roku 1986 byl poprvé usvědčen z užívání kokainu v roce 1991, kdy působil v Neapoli. O šest let později ukončil kariéru, ale před několika dny na sebe opět upoutal pozornost prohlášením, že Mezinárodní fotbalová federace je mafie a sekta, jejímž jediným cílem je krást peníze. Sám sebe pak označil za nejlepšího argentinského sportovce století. Tím byl také v anketě deníku Clarin vyhlášen."
        ],
        "response":"Uruguayský fotbalista Maradona byl při kontroli drogy v krvi po prvních negativních testech potvrzen na přítommnost kokaine. Závěr o jeho čistotě zatím není znám, protože výsledky čekají ještě dva dny.",
        "reference":"Bývalá fotbalová hvězda Diego maradona se jak se zdá ještě nedokázal vymanit ze závislosti na drogách. V moči a krvi slavného Argentince, který byl v úterý hospitalizován v urguayské nemocnici s vysokým krevním tlakem a srdeční arytmií, objevili lékaři při kompletním vyšetření stopy kokainu",
        "reference_contexts":[
            "\"Byl jsem vedením nemocnice pověřen, abych o této skutečnosti informoval. Testy odhalily v Maradonově těle přítomnost kokainu,\" řekl šéf policie v Montevideu Maximo Costa Rocha, jenž speciální vyšetření na přítomnost drog v krvi nařídil. \"Lékaři provedou další dva nebo tři testy, aby potvrdili pozitivní nález. Pak z celé situace vyvodíme patřičné závěry,\" dodal Costa Rocha. Podle něj budou výsledky známy do dvou dnů, do té doby policisté vyslechnou několik lidí. V Uruguayi není užívání drog nelegální, Maradonovi proto nehrozí trestní stíhání. \"Mohl je ale distribuovat,\" namítá policista, který už vyslechl hráčova manažera Guillerma Coppolu. Maradonův stav se podle ošetřujícího lékaře Franka Torrese zlepšil a fotbalista by mohl být za několik hodin přeložen z jednotky intenzivní péče na normální pokoj. Kapitán mistrů světa z roku 1986 byl poprvé usvědčen z užívání kokainu v roce 1991, kdy působil v Neapoli. O šest let později ukončil kariéru, ale před několika dny na sebe opět upoutal pozornost prohlášením, že Mezinárodní fotbalová federace je mafie a sekta, jejímž jediným cílem je krást peníze. Sám sebe pak označil za nejlepšího argentinského sportovce století. Tím byl také v anketě deníku Clarin vyhlášen."
        ]
    },
    {
        "user_input":"Shrň tento článek do stručného shrnutí.",
        "retrieved_contexts":[
            "Tobiáš ocenil práci mládežnických trenérů, kteří podobné hráče vychovávají. České Budějovice jsou prý klubem z periférie, který má právě za úkol připravovat fotbalisty pro další výkonnostní postup. \"A Lengyelův případ dokázal, že předvádíme slušnou práci.\" Odchodem jednoho z klíčových hráčů se podle Tobiáše nezhroutí svět. \"Vždy jsem se snažil víc stavět na kolektivním pojetí než na výkonu jednotlivce.\" Tobiáš se navíc na podobnou variantu chystal. Proto usiloval o získání Pospíšila a Polomského, kteří mohou Lengyela nahradit. \"Bylo mi jasné, že u nás dlouho nevydrží. V poslední době o něj byl mimořádný zájem.\" Sparta zaplatí za Lengyela 12 milionů korun. Českobudějovický trenér se domnívá, že pro samotného hráče nastal ideální čas pro odchod. První ligu začal hrát před třemi lety, když patřil věkem ještě mezi dorostence. \"Samozřejmě, že nám by stále ještě moc pomohl, ale má schopnosti na to, aby se prosadil i ve Spartě. Moc mu to přeji.\""
        ],
        "response":"Českobudějevecký trenér Jiří Tobiás ocenil mláдеžnické trenéry za přípravu hráčích na další vývojové fáze a vyjádřil naději, že odchod legendárního hráče Zdenka Lengyla nezahrne konec české fotbalové historie. Prohloubení v klubu Sparta za 10 milionů eur však není jediným důvodem k jeho odechodu, který se podle trenéra dostavil k ideálnímu času.",
        "reference":"Trenér fotbalistů SK České Budějovice Pavel Tobiáš se ve středu v podvečer chystal na další fázi zimní přípravy s pocitem, že ho čeká poslední trénink, ve kterém bude mít k dispozici Romana Lengyela. Pár hodin předtím se dozvěděl, že jedenadvacetiletý talent odchází do Sparty Praha. \"Tušil jsem to,\" poznamenal Tobiáš hlasem beze známky skepse a zklamání. \"Pro všechny je Romanův přestup odměnou. Bude reprezentovat českobudějovický fotbal ve špičkovém klubu.\"",
        "reference_contexts":[
            "Tobiáš ocenil práci mládežnických trenérů, kteří podobné hráče vychovávají. České Budějovice jsou prý klubem z periférie, který má právě za úkol připravovat fotbalisty pro další výkonnostní postup. \"A Lengyelův případ dokázal, že předvádíme slušnou práci.\" Odchodem jednoho z klíčových hráčů se podle Tobiáše nezhroutí svět. \"Vždy jsem se snažil víc stavět na kolektivním pojetí než na výkonu jednotlivce.\" Tobiáš se navíc na podobnou variantu chystal. Proto usiloval o získání Pospíšila a Polomského, kteří mohou Lengyela nahradit. \"Bylo mi jasné, že u nás dlouho nevydrží. V poslední době o něj byl mimořádný zájem.\" Sparta zaplatí za Lengyela 12 milionů korun. Českobudějovický trenér se domnívá, že pro samotného hráče nastal ideální čas pro odchod. První ligu začal hrát před třemi lety, když patřil věkem ještě mezi dorostence. \"Samozřejmě, že nám by stále ještě moc pomohl, ale má schopnosti na to, aby se prosadil i ve Spartě. Moc mu to přeji.\""
        ]
    },
    {
        "user_input":"Shrň tento článek do stručného shrnutí.",
        "retrieved_contexts":[
            "Rozhodčí Josef Krula byl při posuzování nedovolených zákroků mnohem přísnější na domácí, což se markantně projevilo zejména v 84. minutě, kdy za stavu 2:2 neodpískal proti hostím evidentní penaltu za faul Gabriela na Kinského. Předtím ve 45. minutě za stavu 1:0 pro Žižkov nařídil pokutový kop proti domácím po mnohem mírnějším zákroku Mlejnského na Lokvence. Měl by být sudí Krula vyřazen z listiny prvoligových rozhodčích, či by měl nejvyšší soutěž řídit i na jaře? V anketě a chatu nám můžete sdělit svůj názor."
        ],
        "response":"Soudce Josef Krul byl při rozhodování o nedovolaných zákrocích přísněji na domácí straně než na hostech, což mu ohrožuje kvalifikaci jako rozhodčí.",
        "reference":"Komise rozhodčích fotbalového svazu rozhodne v úterý 11. ledna o potrestání sudího Josefa Kruly. Ten hrubě ovlivnil výsledek utkání 16. kola první fotbalové ligy Žižkov - Sparta (2:3). Bezprostředně po prosincovém utkání se mnoho fotbalových odborníků vyslovilo pro vyškrtnutí Kruly z listiny rozhodčích, šéf svazové komise Luděk Macela však naznačil, že o tak přísném trestu neuvažuje",
        "reference_contexts":[
            "Rozhodčí Josef Krula byl při posuzování nedovolených zákroků mnohem přísnější na domácí, což se markantně projevilo zejména v 84. minutě, kdy za stavu 2:2 neodpískal proti hostím evidentní penaltu za faul Gabriela na Kinského. Předtím ve 45. minutě za stavu 1:0 pro Žižkov nařídil pokutový kop proti domácím po mnohem mírnějším zákroku Mlejnského na Lokvence. Měl by být sudí Krula vyřazen z listiny prvoligových rozhodčích, či by měl nejvyšší soutěž řídit i na jaře? V anketě a chatu nám můžete sdělit svůj názor."
        ]
    },
    {
        "user_input":"Shrň tento článek do stručného shrnutí.",
        "retrieved_contexts":[
            "Počátky tohoto ojedinělého projektu sledování čápů sahají až do května roku 1995, kdy se expedice vydala po stopách vybrané trojice čápů černých poporvé. Samičce Kristýně byl na tělo připevněn miniaturní batůžek s maličkým radarem, který umožňoval nejen zmapovat její let do zimoviště, nýbrž i následný pobyt ve východním Senegalu, kde se posléze mohlo uskutečnit samotné filmování. Kristýna se na své zimoviště vydala takzvanou západní cestou, jenž vede přes Německo, Francii, Španělsko, Maroko, Mauritánii až do Senegalu. Tomu zůstala věrná následující čtyři roky a domů do rodných Brd, kde byla roce 1995 označena, se pokaždé vracela malým okruhem přes Mali. Druzí dva čápi -Viktor a Zuzana, si naopak vybrali cestu východní, která vede okolo Černého moře přes Turecko, Egypt, Súdán do Etiopie. Stejnou cestou by se na jaře 1996 vrátili zpět, ale Zuzana byla bohužel v Etiopii místními lidmi zabita a Viktor sice dorazil zpět do rodného Rakovnicka, ale tam se našim pozorovatelům ztratil. Až do dnešní zimy expedice sledovala život těchto výjimečných ptáků a několikrát podnikla výpravy do srdce Afriky, během kterých studovala a filmovala život a chování i jiných ptačích druhů a ostatní zvěře. Ze všech sledovaných čápů zůstala do letošní výpravy pouze Kristýna, a tak k ní připojili tři nováčky. Všechno dopadlo dobře a expedice se vrátila se spoustou nových informací, které se chystá uplatnit při psaní vlastní knihy, v níž budou podrobně popsána veškerá jejich dobrodružství. Více informací najdete na vlastních stránkách expedice, jejichž adresu najdete pod ikonkou web. Tady na tom místě v Senegalu našla koncem prosince expedice čápa Kryštofa. Čápi černí kroužící nad jezerem. Místa, kam se v polovině prosince vydali členové expedice Odysea. Kromě čápa Kryštofa se tady zdržovala spousta dalších černých čápů."
        ],
        "response":"Expedice Odisea od roku 2004 sleduje život jediné zachované samice černého čápe Kristíny, která se v Africe pohybuje na dvě různé cesty a pravidelně návratila do svých rodné Brdy. Expedice také zaznamenala dalšího čápu Kryštova, který se v prosinci 21. století nachází nad jezorem v Senegalu.",
        "reference":"Expedice Africká Odysea se ve čtvrtek ráno vrátila ze svého zatím posledního měsíčního pátrání po čápech černých. Díky moderní technice je možno jejich osudy zachytit doslova krok za krokem až do jejich zimovišť, která jsou soustředěna převážně ve střední Africe. Ve fotogalerii najdete aktuální snímky z expedice",
        "reference_contexts":[
            "Počátky tohoto ojedinělého projektu sledování čápů sahají až do května roku 1995, kdy se expedice vydala po stopách vybrané trojice čápů černých poporvé. Samičce Kristýně byl na tělo připevněn miniaturní batůžek s maličkým radarem, který umožňoval nejen zmapovat její let do zimoviště, nýbrž i následný pobyt ve východním Senegalu, kde se posléze mohlo uskutečnit samotné filmování. Kristýna se na své zimoviště vydala takzvanou západní cestou, jenž vede přes Německo, Francii, Španělsko, Maroko, Mauritánii až do Senegalu. Tomu zůstala věrná následující čtyři roky a domů do rodných Brd, kde byla roce 1995 označena, se pokaždé vracela malým okruhem přes Mali. Druzí dva čápi -Viktor a Zuzana, si naopak vybrali cestu východní, která vede okolo Černého moře přes Turecko, Egypt, Súdán do Etiopie. Stejnou cestou by se na jaře 1996 vrátili zpět, ale Zuzana byla bohužel v Etiopii místními lidmi zabita a Viktor sice dorazil zpět do rodného Rakovnicka, ale tam se našim pozorovatelům ztratil. Až do dnešní zimy expedice sledovala život těchto výjimečných ptáků a několikrát podnikla výpravy do srdce Afriky, během kterých studovala a filmovala život a chování i jiných ptačích druhů a ostatní zvěře. Ze všech sledovaných čápů zůstala do letošní výpravy pouze Kristýna, a tak k ní připojili tři nováčky. Všechno dopadlo dobře a expedice se vrátila se spoustou nových informací, které se chystá uplatnit při psaní vlastní knihy, v níž budou podrobně popsána veškerá jejich dobrodružství. Více informací najdete na vlastních stránkách expedice, jejichž adresu najdete pod ikonkou web. Tady na tom místě v Senegalu našla koncem prosince expedice čápa Kryštofa. Čápi černí kroužící nad jezerem. Místa, kam se v polovině prosince vydali členové expedice Odysea. Kromě čápa Kryštofa se tady zdržovala spousta dalších černých čápů."
        ]
    },
    {
        "user_input":"Shrň tento článek do stručného shrnutí.",
        "retrieved_contexts":[
            "\"Je to neuvěřitelné, že město, kde chodí na fotbal nejvíc lidí v celé republice, by bylo bez fotbalu,\" vzdychá Josef Masopust. Legenda, jež v roli trenéra přivedla Brno k jedinému mistrovskému titulu v roce 1978. Podnikatel Lubomír Hrstka, jehož společnost FC Boby-sport ovládá brněnský fotbalový klub, si před lety nabral úvěry a nesplácel je. Dluží miliardy korun, hraje si na mrtvého brouka, nekomunikuje nejen s bankami, ale ani s médii. Brno je ve špatné finanční situaci, hráčům se zpožďují výplaty i prémie. Když nedávno přestupoval Pavel Holomek do Teplic, dlužili mu v Brně za šest měsíců. \"Já hráče obdivoval, kolik snesou,\" říká hráčský agent Zdeněk Nehoda. \"Jsem rád, že tam nezastupuji už žádného hráče. V Brně to bylo problematické.\" Hrstka, který počátkem devadesátých let přitáhl klub zpět do ligy, ho poslední dobou ruinoval. Z nouze prodával hráče, jako byli Wagner za 33 milionů korun do Rapidu Vídeň, Dostálek za 22 milionů do Slavie, odcházeli i další, například Valnoha, Kolomazník nebo Pavel Holomek. Nyní přijde doba vyrovnání s věřiteli. Co hodnotného může nabídnout fotbalový klub? Stadion má na rozpadnutí, a když se o něj nedávno chtělo postarat město, což je snem každého klubu, požadoval Hrstka odstupné 40 milionů korun. Pozemky nevlastní. \"Věřitelé budou tlačit konkursního správce, aby se hráči prodávali. Druhá varianta, že jeden z věřitelů se stane majitelem klubu, je málo pravděpodobná, protože každý chce teď peníze,\" tvrdí Pavel Zíka, další hráčský agent. Na trhu je vysoko ceněn mladý reprezentant Polák, o něhož má zájem Sparta i kluby z Itálie. Atraktivní jsou ještě jména Zúbek, Švancara, Pacanda či Patrik Siegl, jimž pomáhá osobní manažer Pavel Paska. Hráčský kapitál je letmým pohledem oceňován na 100 až 150 milionů korun. Když před půl rokem měnila Sparta majitele, zněl audit na všechny její hráče dohromady 667,5 milionu korun. \"Nemyslím si, že teď bude pro nás jednodušší získat Poláka,\" tuší sparťanský manažer Miroslav Pelta. \"Naopak. S prodejem hráče musí souhlasit soud.\" Brno je v lize až jedenácté, čeká ho boj o záchranu. Konkurs otřese všemi, i když se teď tváří, jako by se nic nedělo. \"Normálně trénujeme, žádnou stávku nechystáme,\" tvrdí záložník Jan Maroši. Jeden fotbalový patriot z Moravy, který nechce být jmenován, odhaduje, že do dvou měsíců se musí někdo v klubu výrazně angažovat, jinak bude zle. Sehnat deset sponzorů, kteří dají po třech milionech ročně, a brněnský fotbal tak zachrání. Jinak hráči prchnou. Jsou sice pod dlouhodobými smlouvami, ale dokážou se vykličkovat. \"Život pod nucenou správou může být za určitých okolností pro hráče přínosem, protože by se jim konečně plnily smlouvy,\" odhaduje manažer Nehoda. Konkursní správce, který přebírá pravomoci představenstva i dozorčí rady, na tom bude mít zájem. Hráč, jemuž by nikdo neplnil smlouvu, by ji vypověděl a odešel za pakatel. A věřitelé potřebují co nejvíc peněz zpět."
        ],
        "response":"Brněnská fotbalová liga je ohrožena bankovními dluhy miliardové společnosti FC Bobysport, které způsobily, že klub hraje na mizivém stavu, hráče prodává za nízké ceny a stadion se připravuje na rozklad. Klub se snaží zachránit pomocí prodej hráčského kapitálu a hledání nových sponzorek, zatímco věřelé vyžadují okamžitou likvidaci a konkrétní odměny.",
        "reference":"Hráči budou rozprodáni, sláva brněnského fotbalu pohřbena a klub FC Boby, dříve Zbrojovka, zmizí. Nebo se najde nový majitel, který vše v dobré obrátí. Mezi těmito póly se nyní pohybuje budoucnost prvoligového mužstva. Poprvé v historii českého fotbalu se ocitl velký klub v konkursu, který vypsal Krajský obchodní soud v Brně. Nedávno měly potíže Drnovice kvůli Chemapolu, ovšem dceřiná společnost Petra, řídící fotbal, hrozbu přežila",
        "reference_contexts":[
            "\"Je to neuvěřitelné, že město, kde chodí na fotbal nejvíc lidí v celé republice, by bylo bez fotbalu,\" vzdychá Josef Masopust. Legenda, jež v roli trenéra přivedla Brno k jedinému mistrovskému titulu v roce 1978. Podnikatel Lubomír Hrstka, jehož společnost FC Boby-sport ovládá brněnský fotbalový klub, si před lety nabral úvěry a nesplácel je. Dluží miliardy korun, hraje si na mrtvého brouka, nekomunikuje nejen s bankami, ale ani s médii. Brno je ve špatné finanční situaci, hráčům se zpožďují výplaty i prémie. Když nedávno přestupoval Pavel Holomek do Teplic, dlužili mu v Brně za šest měsíců. \"Já hráče obdivoval, kolik snesou,\" říká hráčský agent Zdeněk Nehoda. \"Jsem rád, že tam nezastupuji už žádného hráče. V Brně to bylo problematické.\" Hrstka, který počátkem devadesátých let přitáhl klub zpět do ligy, ho poslední dobou ruinoval. Z nouze prodával hráče, jako byli Wagner za 33 milionů korun do Rapidu Vídeň, Dostálek za 22 milionů do Slavie, odcházeli i další, například Valnoha, Kolomazník nebo Pavel Holomek. Nyní přijde doba vyrovnání s věřiteli. Co hodnotného může nabídnout fotbalový klub? Stadion má na rozpadnutí, a když se o něj nedávno chtělo postarat město, což je snem každého klubu, požadoval Hrstka odstupné 40 milionů korun. Pozemky nevlastní. \"Věřitelé budou tlačit konkursního správce, aby se hráči prodávali. Druhá varianta, že jeden z věřitelů se stane majitelem klubu, je málo pravděpodobná, protože každý chce teď peníze,\" tvrdí Pavel Zíka, další hráčský agent. Na trhu je vysoko ceněn mladý reprezentant Polák, o něhož má zájem Sparta i kluby z Itálie. Atraktivní jsou ještě jména Zúbek, Švancara, Pacanda či Patrik Siegl, jimž pomáhá osobní manažer Pavel Paska. Hráčský kapitál je letmým pohledem oceňován na 100 až 150 milionů korun. Když před půl rokem měnila Sparta majitele, zněl audit na všechny její hráče dohromady 667,5 milionu korun. \"Nemyslím si, že teď bude pro nás jednodušší získat Poláka,\" tuší sparťanský manažer Miroslav Pelta. \"Naopak. S prodejem hráče musí souhlasit soud.\" Brno je v lize až jedenácté, čeká ho boj o záchranu. Konkurs otřese všemi, i když se teď tváří, jako by se nic nedělo. \"Normálně trénujeme, žádnou stávku nechystáme,\" tvrdí záložník Jan Maroši. Jeden fotbalový patriot z Moravy, který nechce být jmenován, odhaduje, že do dvou měsíců se musí někdo v klubu výrazně angažovat, jinak bude zle. Sehnat deset sponzorů, kteří dají po třech milionech ročně, a brněnský fotbal tak zachrání. Jinak hráči prchnou. Jsou sice pod dlouhodobými smlouvami, ale dokážou se vykličkovat. \"Život pod nucenou správou může být za určitých okolností pro hráče přínosem, protože by se jim konečně plnily smlouvy,\" odhaduje manažer Nehoda. Konkursní správce, který přebírá pravomoci představenstva i dozorčí rady, na tom bude mít zájem. Hráč, jemuž by nikdo neplnil smlouvu, by ji vypověděl a odešel za pakatel. A věřitelé potřebují co nejvíc peněz zpět."
        ]
    },
    {
        "user_input":"Shrň tento článek do stručného shrnutí.",
        "retrieved_contexts":[
            "Pro brankáře není cestování z klubu do klubu obvyklé ani jednoduché. \"Situaci komplikuje, že nastupujete vždy s jinými spoluhráči, na které si musíte zvyknout a rychle se s nimi dokonale sehrát. Pro gólmana je důležité, aby dokázal ve spolupráci s obránci číst hru. Když přijde nový útočník, musí také vědět, kam si naběhnout, ovšem brankáři mají situaci po přestupu do jiného klubu složitější,\" konstatuje nová akvizice, která zvýšila teplickému brankáři Macháčkovi konkurenci. Ředitel teplického klubu František Hrdlička se dohodl s Radkem Havlem již loni v červenci. Ještě před začátkem sezony. \"Na konci roku mi totiž končila v Plzni smlouva. Nabídky jsem měl z více klubů, ale rozhodl jsem se pro celek ze Stínadel.\" Ligový podzim odehrál v Olomouci. \"Byla to jen krátká štace na výpomoc. Měly problémy. Plzeň se ke mně nezachovala po avizovaném podpisu Teplicím dobře, a tak jsou s hostováním na Hané rychle souhlasil. Tři měsíce mi pomohly, stabilně jsem chytal. Sedmkrát jsem nastoupil za olomouckou rezervu v Moravskoslezské fotbalové lize, šestkrát v nejvyšší soutěži a jednou v Poháru UEFA. Poznal jsem jiný klub, zkušenosti jsem nasbíral i na evropském kolbišti. Věřím, že se v Olomouci vyřeší interní problémy a klub se dostane z nelichotivého čtrnáctého místa. V tabulce bude výše,\" prorokuje Havel. Předčasného oznámení odchodu do Teplic nelituje. Bývalý plzeňský trenér Šíp ho přemlouval, aby ještě na podzim zůstal v Plzni a pomohl jí po sestupu do druhé ligy bojovat o návrat mezi elitu. Pak však usedl na trenérskou lavičku kouč Michálek a postavil se k věci obráceně. \"Byl jsem pro něj neperspektivní. Kdybych věděl o Šípově odchodu, bylo by aktuální řešit můj přestup do Teplic už v létě,\" souhlasně přikyvuje. Místo na výsluní, nemá oproti předchozím letům v Plzni zajištěné. Na Stínadlech je dlouholetou jedničkou Libor Macháček který v anketě o Cenu Františka Pláničky pro nejlepšího českého gólmana obsadil lichotivé sedmé místo. V hodnocení minutové neprůstřelnosti v nejvyšší české soutěži skončil s velkým náskokem první. \"Musím přesvědčit dobrými výkony, a pak je na trenérovi, koho vybere do základní sestavy. Kvalitní brankářskou dvojici Tomáš Poštulka - Jaromír Blažek mají i v pražské Spartě. Konkurence není na škodu. Pokud je program nahuštěný nebo přijdou zranění, tak je dobře, když může naskočit kvalitní náhrada. Vždy chytá lepší, ve fotbalovém životě je to zvykem.\" Havel se během úvodních dnů zimní přípravy přesvědčil o vyhlášeném zázemí teplického fotbalového stánku. \"Prakticky vše je na stadionu nové nebo zrekonstruované. I v Plzni jsme měli dobrou rehabilitační linku, ale Na Stínadlech je modernější. Po materiální stránce bylo vše v pořádku v Plzni, Olomouci a je rovněž nyní v Teplicích.\""
        ],
        "response":"Radko Havl, bývalý trenér Plzně, se stal novým brankárom Teplic a odvolává se na tři měsíce působení v Olomuči jako na klíčovou dobu pro získání potřebných zkušeností. Jeho nová pozice v Tepicích nahrazuje dlouho letního brankára Libora Macháčka, který byl v Plzi vyhlazen.",
        "reference":"Šestadvacetiletý fotbalista Radek Havel se postaral o nevšední rekord a může kandidovat na zápis do Guinnessovy knihy rekordů: Za sedm měsíců stihl nastoupit ve třech prvoligových klubech. Jaro odchytal nýřanský odchovanec v Plzni, kde výkonnostně rostl od čtrnácti let. O prázdninách se dohodl na přestupu s Teplicemi, a jako neperspektivní byl poslán z Plzně na hostování do Olomouce. V prosinci se představil na halovém turnaji v Libouchci už ve žlutomodrém dresu nového teplického chlebodárce",
        "reference_contexts":[
            "Pro brankáře není cestování z klubu do klubu obvyklé ani jednoduché. \"Situaci komplikuje, že nastupujete vždy s jinými spoluhráči, na které si musíte zvyknout a rychle se s nimi dokonale sehrát. Pro gólmana je důležité, aby dokázal ve spolupráci s obránci číst hru. Když přijde nový útočník, musí také vědět, kam si naběhnout, ovšem brankáři mají situaci po přestupu do jiného klubu složitější,\" konstatuje nová akvizice, která zvýšila teplickému brankáři Macháčkovi konkurenci. Ředitel teplického klubu František Hrdlička se dohodl s Radkem Havlem již loni v červenci. Ještě před začátkem sezony. \"Na konci roku mi totiž končila v Plzni smlouva. Nabídky jsem měl z více klubů, ale rozhodl jsem se pro celek ze Stínadel.\" Ligový podzim odehrál v Olomouci. \"Byla to jen krátká štace na výpomoc. Měly problémy. Plzeň se ke mně nezachovala po avizovaném podpisu Teplicím dobře, a tak jsou s hostováním na Hané rychle souhlasil. Tři měsíce mi pomohly, stabilně jsem chytal. Sedmkrát jsem nastoupil za olomouckou rezervu v Moravskoslezské fotbalové lize, šestkrát v nejvyšší soutěži a jednou v Poháru UEFA. Poznal jsem jiný klub, zkušenosti jsem nasbíral i na evropském kolbišti. Věřím, že se v Olomouci vyřeší interní problémy a klub se dostane z nelichotivého čtrnáctého místa. V tabulce bude výše,\" prorokuje Havel. Předčasného oznámení odchodu do Teplic nelituje. Bývalý plzeňský trenér Šíp ho přemlouval, aby ještě na podzim zůstal v Plzni a pomohl jí po sestupu do druhé ligy bojovat o návrat mezi elitu. Pak však usedl na trenérskou lavičku kouč Michálek a postavil se k věci obráceně. \"Byl jsem pro něj neperspektivní. Kdybych věděl o Šípově odchodu, bylo by aktuální řešit můj přestup do Teplic už v létě,\" souhlasně přikyvuje. Místo na výsluní, nemá oproti předchozím letům v Plzni zajištěné. Na Stínadlech je dlouholetou jedničkou Libor Macháček který v anketě o Cenu Františka Pláničky pro nejlepšího českého gólmana obsadil lichotivé sedmé místo. V hodnocení minutové neprůstřelnosti v nejvyšší české soutěži skončil s velkým náskokem první. \"Musím přesvědčit dobrými výkony, a pak je na trenérovi, koho vybere do základní sestavy. Kvalitní brankářskou dvojici Tomáš Poštulka - Jaromír Blažek mají i v pražské Spartě. Konkurence není na škodu. Pokud je program nahuštěný nebo přijdou zranění, tak je dobře, když může naskočit kvalitní náhrada. Vždy chytá lepší, ve fotbalovém životě je to zvykem.\" Havel se během úvodních dnů zimní přípravy přesvědčil o vyhlášeném zázemí teplického fotbalového stánku. \"Prakticky vše je na stadionu nové nebo zrekonstruované. I v Plzni jsme měli dobrou rehabilitační linku, ale Na Stínadlech je modernější. Po materiální stránce bylo vše v pořádku v Plzni, Olomouci a je rovněž nyní v Teplicích.\""
        ]
    },
    {
        "user_input":"Shrň tento článek do stručného shrnutí.",
        "retrieved_contexts":[
            "V Jablonci prověří švédského útočníkaPosilu ze severu Evropy, švédského útočníka Niclase Norella, testují v Jablonci nad Nisou. \"Hráče vyzkoušíme ve víkendových zápasech zimního turnaje Čechie Karlín v Praze,\" potvrdil kouč jabloneckých fotbalistů Zdeněk Klucký. \"Útočníka potřebujeme, ale neviděli jsme ho v akci na vlastní oči,\" řekl na adresu Švéda z druholigové Uppsaly, o něhož se před rokem a půl zajímala i pražská Slavia, trenér Klucký. Dnes by se měl do prvního tréninku na Střelnici zapojit i středopolař Václav Budka z belgického Lokerenu. Romário a Edmundo vyhlásili smírBrazilští útočníci Romário a Edmundo, spoluhráči z brazilského fotbalového týmu Vasco da Gama, kteří se více než rok nemohli snést, se údajně usmířili na tréninku před dnešním zápasem mistrovství světa klubů proti australskému South Melbourne. Obě kontroverzní postavy brazilského fotbalu si nemohly přijít na jméno od té doby, co se na záchodových dveřích Romáriova baru \"Café de Gol\" vyjímá Edmundova karikatura, která jej zpodobňuje s jeho bývalou přítelkyní, s níž se rozešel a nechal jí na krku dítě. Komentátoři se sice mírovou náladu mezi oběma hráči snaží zpochybnit, Romário je však rezolutní. \"Tyto fámy rozsívají lidé, kteří nám chtějí způsobit problémy,\" řekl kanonýr."
        ],
        "response":"Jablonec nad Nísou v rámci zimního mistrů světa Čechy provede testování švédských útočníků Niclasesa Norellie a Posilua ze Severní Evropy. Simultánně se v klubu objevil také belgický středopólár Václave Budka, zatímco brazilští útokáři Romário z Vasco da Gamu a Edmund z South Melbournu se po dlouhé kontroverzii usmírili.",
        "reference":"Luise van Gaala, trenéra fotbalistů Barcelony, označují španělská média za vítěze souboje s brazilským záložníkem Rivaldem, kterého kvůli projevu neposlušnosti vyřadil z kádru. Čerstvý držitel Zlatého míče pro nejlepšího fotbalistu Evropy se uklidnil a řekl, že je připraven zase hrát. Rivaldovi se nelíbilo, že by měl nastupovat na místě levého křídla. \"Rozhodl jsem se udělat to, co si přeje trenér,\" prohlásil neochotně sedmadvacetiletý fotbalista na tiskové konferenci",
        "reference_contexts":[
            "V Jablonci prověří švédského útočníkaPosilu ze severu Evropy, švédského útočníka Niclase Norella, testují v Jablonci nad Nisou. \"Hráče vyzkoušíme ve víkendových zápasech zimního turnaje Čechie Karlín v Praze,\" potvrdil kouč jabloneckých fotbalistů Zdeněk Klucký. \"Útočníka potřebujeme, ale neviděli jsme ho v akci na vlastní oči,\" řekl na adresu Švéda z druholigové Uppsaly, o něhož se před rokem a půl zajímala i pražská Slavia, trenér Klucký. Dnes by se měl do prvního tréninku na Střelnici zapojit i středopolař Václav Budka z belgického Lokerenu. Romário a Edmundo vyhlásili smírBrazilští útočníci Romário a Edmundo, spoluhráči z brazilského fotbalového týmu Vasco da Gama, kteří se více než rok nemohli snést, se údajně usmířili na tréninku před dnešním zápasem mistrovství světa klubů proti australskému South Melbourne. Obě kontroverzní postavy brazilského fotbalu si nemohly přijít na jméno od té doby, co se na záchodových dveřích Romáriova baru \"Café de Gol\" vyjímá Edmundova karikatura, která jej zpodobňuje s jeho bývalou přítelkyní, s níž se rozešel a nechal jí na krku dítě. Komentátoři se sice mírovou náladu mezi oběma hráči snaží zpochybnit, Romário je však rezolutní. \"Tyto fámy rozsívají lidé, kteří nám chtějí způsobit problémy,\" řekl kanonýr."
        ]
    },
    {
        "user_input":"Shrň tento článek do stručného shrnutí.",
        "retrieved_contexts":[
            "Trenér Manchesteru United Alex Ferguson, který byl při zápase v Brazílii také vykázán ze hřiště, Beckhama hájí, tisk nicméně nepochybuje o tom, že záložník Manchesteru byl vyloučen oprávněně. \"Bylo to, jako by ho poslali ven soupeřovi hráči,\" zlobil se Ferguson. Televizní záznam však jasně prokázal Beckhamovu vinu, trenér ale neoblomně tvrdí, že situace byla sporná. \"Konec světa pro Beckhama,\" nadepsal reportáž z utkání mistrovství světa klubů list The Times, který hodnotí Beckhamův zákrok jako záludný. Důsledky vyloučení budou pro Beckhama kruté - zákaz startu v příštím zápase proti Vasku da Gama, možná i proti australskému celku South Melbourne a dokonce i v celém turnaji. List The Mirror napsal, že okamžik šílenství Beckhama zostudil. \"Kdy se tento chybující génius konečně poučí?\" táže se deník. Sportovní komentátor nedělníku The Observer John Duncan v televizi BBC k Beckhamově zákroku řekl, že opravdu velcí hráči si něco takového v klíčových mezinárodních zápasech nemohou dovolit. Zápas na Maracaná skončil nerozhodně 1:1, oba týmy v utkání zahodily penaltu."
        ],
        "response":"Alex Ferguson vyrazil z hřišti kvůli zákroku záložníka Mančestere United Marka Beckhame, který podle reportáže z The Times učinil chybový zásah během mezinálestního utkání. Tento incident, který televizní zpráva jasným způsobem dokázala, vedl k vážným důsledkům pro Beckhma, včetně zákazů na další zápasy a celkový výkonnostní pokles v tomto turnaji, zatímco Ferguson tvrdil, že se jednalo o správné rozhodnutí",
        "reference":"Beckham v Brazílii zcvoknul, láteří britský bulvární list The Sun nad vyloučením fotbalisty Manchesteru United Davida Beckhama v zápase mistrovství světa fotbalových klubů proti mexickému klubu Necaxa. Beckham musel s ostudou opustit ve 43. minutě hřiště, protože do souboje s mexickým hráčem Milianem šel šlapákem a na protihráčově stehně zanechal otisky špuntů své kopačky. The Sun hráče vyzval, aby už konečně dospěl",
        "reference_contexts":[
            "Trenér Manchesteru United Alex Ferguson, který byl při zápase v Brazílii také vykázán ze hřiště, Beckhama hájí, tisk nicméně nepochybuje o tom, že záložník Manchesteru byl vyloučen oprávněně. \"Bylo to, jako by ho poslali ven soupeřovi hráči,\" zlobil se Ferguson. Televizní záznam však jasně prokázal Beckhamovu vinu, trenér ale neoblomně tvrdí, že situace byla sporná. \"Konec světa pro Beckhama,\" nadepsal reportáž z utkání mistrovství světa klubů list The Times, který hodnotí Beckhamův zákrok jako záludný. Důsledky vyloučení budou pro Beckhama kruté - zákaz startu v příštím zápase proti Vasku da Gama, možná i proti australskému celku South Melbourne a dokonce i v celém turnaji. List The Mirror napsal, že okamžik šílenství Beckhama zostudil. \"Kdy se tento chybující génius konečně poučí?\" táže se deník. Sportovní komentátor nedělníku The Observer John Duncan v televizi BBC k Beckhamově zákroku řekl, že opravdu velcí hráči si něco takového v klíčových mezinárodních zápasech nemohou dovolit. Zápas na Maracaná skončil nerozhodně 1:1, oba týmy v utkání zahodily penaltu."
        ]
    },
    {
        "user_input":"Shrň tento článek do stručného shrnutí.",
        "retrieved_contexts":[
            "Podle Kopeckého dal Kinder moravskému klubu přednost, protože z Bratislavy, kde bydlí, dojede do Drnovic autem za dvě hodiny. Nejlepší slovenský fotbalista roku 1994 byl nespokojený, že málo nastupuje v základní sestavě, a hovořilo se o jeho odchodu do Slovanu Bratislava, a zájem o něj měla mít i Slavia. Návrat třicetiletého hráče vázl na průtazích s ukončením platnosti jeho pracovního povolení na britských ostrovech, nyní je vše vyřešeno."
        ],
        "response":"Slovenský reprezentant Martin Kopeček dal Kinder Moravskoslezský klub přednost nad jinými kandidáty na nejlepšího slovenského fotbalistu roku 2025. Hráč, který působil v Bratislavě, dorazil do Drňovic autem během dvou hodin a jeho návrat na britské ostrovy byl dokončen po vyřešení právních dotazů.",
        "reference":"Smlouvu na dva roky s roční opcí podepíše v sobotu v poledne slovenský reprezentant Vladimír Kinder s Drnovicemi. Po třech letech opouští anglický prvoligový FC Middlesbrough, kde se mu v poslední době nedařilo prosadit se do základní sestavy. \"Vyřešili jsme problém s obsazením postu v obraně,\" řekl drnovický sportovní ředitel Ivan Kopecký",
        "reference_contexts":[
            "Podle Kopeckého dal Kinder moravskému klubu přednost, protože z Bratislavy, kde bydlí, dojede do Drnovic autem za dvě hodiny. Nejlepší slovenský fotbalista roku 1994 byl nespokojený, že málo nastupuje v základní sestavě, a hovořilo se o jeho odchodu do Slovanu Bratislava, a zájem o něj měla mít i Slavia. Návrat třicetiletého hráče vázl na průtazích s ukončením platnosti jeho pracovního povolení na britských ostrovech, nyní je vše vyřešeno."
        ]
    },
    {
        "user_input":"Shrň tento článek do stručného shrnutí.",
        "retrieved_contexts":[
            "\"Já jsem s ním na toho téma nehovořil, to je v kompetenci vedení klubu,\" řekl stručně liberecký trenér Ladislav Škorpil. Podle jeho informací by se měl Jihoameričan vrátit z vlasti v sobotu. Fakt, že Lazzaro zmeškal týden přípravy, nemusí podle kouče Slovanu ještě nutně znamenat, že mu bude chybět fyzická kondice. \"O tu se může postarat každý hráč sám, zvlášť, když má možnost přípravy v teplých krajích,\" míní Škorpil, který si chce na Lazzarovu fyzičku důkladně posvítit. \"Až přijede, prověříme si, jak strávil doma volný čas. S vedením klubu se taky musíme bavit, zda mu za absenci náleží nějaký postih.\" Lazzarovy výpadky v přípravě nejsou nového data. Například vloni v létě místo tréninku putoval pod vedením svého manažera Zíky za vidinou zahraničního angažmá po celé Evropě. \"Chraň pánbůh, aby se to opakovalo. O škodě, která tím v létě vznikla, netřeba diskutovat. Nedostatečná příprava se jasně podepsala na jeho výkonnosti v prvních čtyřech ligových zápasech,\" myslí si trenér Slovanu Liberec. \"Takové testování je navíc velice pochybné. Jestli má někdo o Lazzara zájem, nechť si sedne na tribunu a sleduje ho. Na tréninku při testech ho eventuální budoucí konkurenti akorát nakopou a balón mu nepřihrají.\" Po Lazzarově příjezdu budou v Liberci řešit i otázku, co se čtyřmi cizinci v mužstvu. V zápase totiž podle regulí mohou zároveň nastoupit jen tři. Kromě Lazzara oblékají dres Liberce Slováci Michalík, Klago a nově i Kožuch."
        ],
        "response":"Libereckému trenéro Ladislavovi Škorpionovi nelze připustit, že by se Lazzaron Lazzaros zmeškaly přípravné cviky, protože on sám musí být zodpovědný za své vlastní zdraví a kondici. Trenér zdůrazňuje, že absence hráče není nová a předchozí zkušenosti s podobným problémem již byly zaznamenány.\n\nVýpadky Lazzareho v přípravách jsou však považovány za vážnou chybu, která negativně ovlivnil",
        "reference":"Nebývá zvykem, aby prvoligový fotbalista v tuzemsku či zahraničí zameškal část přípravy na sezonu, pokud jej právě netrápí závažné zdravotní problémy. V případě libereckého střelce Lazzara Liuniho se to však už pomalu stává pravidlem. Zatímco jeho spoluhráči od pondělka kroužili na běžeckých tratích v okolí stadionu a trénovali na umělé trávě, Lazzaro dostal privilegium užívat si ještě týdne klidu doma v argentinském Buenos Aires",
        "reference_contexts":[
            "\"Já jsem s ním na toho téma nehovořil, to je v kompetenci vedení klubu,\" řekl stručně liberecký trenér Ladislav Škorpil. Podle jeho informací by se měl Jihoameričan vrátit z vlasti v sobotu. Fakt, že Lazzaro zmeškal týden přípravy, nemusí podle kouče Slovanu ještě nutně znamenat, že mu bude chybět fyzická kondice. \"O tu se může postarat každý hráč sám, zvlášť, když má možnost přípravy v teplých krajích,\" míní Škorpil, který si chce na Lazzarovu fyzičku důkladně posvítit. \"Až přijede, prověříme si, jak strávil doma volný čas. S vedením klubu se taky musíme bavit, zda mu za absenci náleží nějaký postih.\" Lazzarovy výpadky v přípravě nejsou nového data. Například vloni v létě místo tréninku putoval pod vedením svého manažera Zíky za vidinou zahraničního angažmá po celé Evropě. \"Chraň pánbůh, aby se to opakovalo. O škodě, která tím v létě vznikla, netřeba diskutovat. Nedostatečná příprava se jasně podepsala na jeho výkonnosti v prvních čtyřech ligových zápasech,\" myslí si trenér Slovanu Liberec. \"Takové testování je navíc velice pochybné. Jestli má někdo o Lazzara zájem, nechť si sedne na tribunu a sleduje ho. Na tréninku při testech ho eventuální budoucí konkurenti akorát nakopou a balón mu nepřihrají.\" Po Lazzarově příjezdu budou v Liberci řešit i otázku, co se čtyřmi cizinci v mužstvu. V zápase totiž podle regulí mohou zároveň nastoupit jen tři. Kromě Lazzara oblékají dres Liberce Slováci Michalík, Klago a nově i Kožuch."
        ]
    },
    {
        "user_input":"Shrň tento článek do stručného shrnutí.",
        "retrieved_contexts":[
            "Vy jako patriot, který nedá na Olomouc dopustit, jdete do Prahy. S jakými pocity? Abych pravdu řekl, vítám to. Dřív mi toho hodně uteklo, teď mám velkou šanci získat ligový titul a hrát Ligu mistrů. Sparta je nejlepší klub u nás, takže si téhle možnosti cením. Pak mám malou šanci, že bych se mohl ještě jednou dostat do reprezentace.Loni na jaře jste přišel do Olomouce rozehrát se po těžkém zranění, které vám vzalo tři roky fotbalového života. Mateřský klub teď může cítit křivdu, že míříte do Sparty. Hodně si věřil, že bude mít Hapala zpátky.I já jsem věřil, ale prostě mě nevykoupili. Osm a půl milionu korun zaplatila Sparta. Spousta lidí tím není nadšená, kdekdo mě za ten krok odsoudí. To jsem očekával.Nemám ale povinnost vrátit se do Olomouce. Jsem profesionál.Je ještě v profesionálním fotbale vůbec místo pro pocit, že srdcem patříte ke klubu, který vás vychoval? Určitě. S Olomoucí jsem sblížený, pořád budu klukům fandit, budu s nimi. Až skončím, chci v Olomouci žít, cítím se tam být doma.Těžko se ale od fanoušků dočkáte vřelého přijetí, až bude Sparta hrát v Olomouci. Reakce může být až zlostná. Nebojíte se jí? Pár křiklounů přežiju. Lidi mě tam měli vždycky rádi, věřím, že budou i dál.Možná jsou to ale plané představy. Nevím.Měl jste i jiné východisko než jít do Sparty?Vlastně ne. Chtěl jsem být co nejblíž sedmiletému synovi, který v Olomouci žije se svou mámou.Spíš jsem si myslel, že zpátky do Olomouce nechcete proto, že se rozvádíte.To vůbec ne. S manželkou jsme se sice rozešli, ale to nic neznamená. Stále se respektujeme. S Lukášem bych chtěl být co nejčastěji, poslední půlrok mi šíleně chyběl. Kromě společných čtrnácti dnů na Tenerife a vánočních svátků jsem byl bez něho.Teď ale budete bydlet v Praze, to je téměř tři stovky kilometrů od syna.Oproti Tenerife je to strašně blízko.Sednu do auta, vyjedu na dálnici a za chvilku jsem u něho.Co vám kromě rodiny na Kanárských ostrovech chybělo? Díval jsem se na zápasy jenom z tribuny. Nehrál jsem, a tak jsem ztratil chuť. Přitom jsem byl zdravý a celkem ve formě. Na klub jsem zanevřel. Když jsem ráno vstával, nechtělo se mi vůbec na trénink. To jsem nikdy dřív nezažíval. Musel jsem jinam.Co rozhodlo pro Spartu? Byla rychlá a schopná splnit požadavky Tenerife. Stačil třeba den dva, a buď jsem zůstal, nebo šel do německého Freiburgu.Prezident Tenerife mě chtěl udržet, ale zároveň slíbil, že mi umožní odchod, pokud někdo zaplatí. Jsem šťastný, že to vyšlo."
        ],
        "response":"Fotbalista Petr Hapal, který na Tenerife ztratil zájem o klub kvůli vzdálenosti od rodiny, se nyní rozhodl odejít do němé německo-italské Sparty za osm miliony korun, aby mohl hrát za nejlepší český tým a znovu získat možnost reprezentovat ČR.",
        "reference":"Pokaždé, co přiletěl z Kanárských ostrovů, kde hrál za Tenerife, upaloval Pavel Hapal rychle do Olomouce. Tam se cítí být doma. Tam chodí jeho syn do školy, odtud to má blízko i k rodičům do nedaleké vesnice Břest. Angažmá v Tenerife právě ukončil, ale olomouckému klubu své síly neodevzdává. Dřív skvělého záložníka reprezentace, který dlouho marodil se zlomenou holení, zlákala Sparta. V pondělí dopoledne bude na Letné připraven k prvnímu tréninku",
        "reference_contexts":[
            "Vy jako patriot, který nedá na Olomouc dopustit, jdete do Prahy. S jakými pocity? Abych pravdu řekl, vítám to. Dřív mi toho hodně uteklo, teď mám velkou šanci získat ligový titul a hrát Ligu mistrů. Sparta je nejlepší klub u nás, takže si téhle možnosti cením. Pak mám malou šanci, že bych se mohl ještě jednou dostat do reprezentace.Loni na jaře jste přišel do Olomouce rozehrát se po těžkém zranění, které vám vzalo tři roky fotbalového života. Mateřský klub teď může cítit křivdu, že míříte do Sparty. Hodně si věřil, že bude mít Hapala zpátky.I já jsem věřil, ale prostě mě nevykoupili. Osm a půl milionu korun zaplatila Sparta. Spousta lidí tím není nadšená, kdekdo mě za ten krok odsoudí. To jsem očekával.Nemám ale povinnost vrátit se do Olomouce. Jsem profesionál.Je ještě v profesionálním fotbale vůbec místo pro pocit, že srdcem patříte ke klubu, který vás vychoval? Určitě. S Olomoucí jsem sblížený, pořád budu klukům fandit, budu s nimi. Až skončím, chci v Olomouci žít, cítím se tam být doma.Těžko se ale od fanoušků dočkáte vřelého přijetí, až bude Sparta hrát v Olomouci. Reakce může být až zlostná. Nebojíte se jí? Pár křiklounů přežiju. Lidi mě tam měli vždycky rádi, věřím, že budou i dál.Možná jsou to ale plané představy. Nevím.Měl jste i jiné východisko než jít do Sparty?Vlastně ne. Chtěl jsem být co nejblíž sedmiletému synovi, který v Olomouci žije se svou mámou.Spíš jsem si myslel, že zpátky do Olomouce nechcete proto, že se rozvádíte.To vůbec ne. S manželkou jsme se sice rozešli, ale to nic neznamená. Stále se respektujeme. S Lukášem bych chtěl být co nejčastěji, poslední půlrok mi šíleně chyběl. Kromě společných čtrnácti dnů na Tenerife a vánočních svátků jsem byl bez něho.Teď ale budete bydlet v Praze, to je téměř tři stovky kilometrů od syna.Oproti Tenerife je to strašně blízko.Sednu do auta, vyjedu na dálnici a za chvilku jsem u něho.Co vám kromě rodiny na Kanárských ostrovech chybělo? Díval jsem se na zápasy jenom z tribuny. Nehrál jsem, a tak jsem ztratil chuť. Přitom jsem byl zdravý a celkem ve formě. Na klub jsem zanevřel. Když jsem ráno vstával, nechtělo se mi vůbec na trénink. To jsem nikdy dřív nezažíval. Musel jsem jinam.Co rozhodlo pro Spartu? Byla rychlá a schopná splnit požadavky Tenerife. Stačil třeba den dva, a buď jsem zůstal, nebo šel do německého Freiburgu.Prezident Tenerife mě chtěl udržet, ale zároveň slíbil, že mi umožní odchod, pokud někdo zaplatí. Jsem šťastný, že to vyšlo."
        ]
    },
    {
        "user_input":"Shrň tento článek do stručného shrnutí.",
        "retrieved_contexts":[
            "KSČM by volilo 13,2 procenta lidí, ČSSD 8,2 procenta a KDU-ČSL 7,6 procenta respondentů. Unii svobody by preferovalo 6,7 procenta voličů. V případě Unie svobody by byl úbytek voličů způsobený kandidaturou \"studentské\" strany relativně největší: činil by téměř dvě pětiny stoupenců. Pokud by existujícím stranám nekonkuroval nový subjekt, preferovalo by ODS 20,1 procenta, KSČM 15,9 procenta a Unii svobody 11,4 procenta dotázaných. ČSSD by dalo hlas 11,2 procenta lidí. KDU-ČSL by získala 9,9 procenta hlasů. Stranu vzniklou na základě výzvy někdejších studentských vůdců by volili především lidé ve věku od 18 do 29 let, středoškoláci, zaměstnanci v nedělnických profesích, podnikatelé a lidé s hrubým příjmem domácnosti nad 30.000 korun. Pramen: Sofres-Factum Jedenapadesát procent občanů však podle v pátek zveřejněného šetření Institutu pro výzkum veřejného mínění nepovažuje vznik nové strany za východisko ze současné politické situace. Opačný názor má 30 procent lidí. Signatáři výzvy se v sešli v sobotu 8. ledna a schválili založení občanského sdružení s názvem Sdružení Děkujeme odejděte. Do tří týdnů by mělo být sdružení zaregistrováno ministerstvem vnitra."
        ],
        "response":"Výsledky šetřícího institutu ukazují, že nově vznikající strana Sdružení Děkujte odejdete by měla získat přibližně 10 % hlasů, zatímco tradiční strany by byly v tomto případě méně populární. Přestože signatáří výzva k založení této strany shodně schválily její registraci, 70 % respondentů považuje tuto akci za nezbytné řešení současné politiky.",
        "reference":"Strana, která by vznikla ze studentské výzvy \"Děkujeme, odejděte!\", by nyní mohla vyhrát případné parlamentní volby. Na její kandidaturu by přitom nejvíce doplatily Unie svobody a ODS. Účast nové strany by navíc zvýšila předpokládanou volební účast o šest procent na 85,7 procenta občanů. Vyplývá to z exkluzivního prosincového šetření agentury Sofres-Factum pro ČTK. \"Studentskou\" stranu by těsně před Vánocemi volilo 24,7 procenta občanů. Na druhém místě by skončila ODS, které by dalo hlas 14,4 procenta dotázaných",
        "reference_contexts":[
            "KSČM by volilo 13,2 procenta lidí, ČSSD 8,2 procenta a KDU-ČSL 7,6 procenta respondentů. Unii svobody by preferovalo 6,7 procenta voličů. V případě Unie svobody by byl úbytek voličů způsobený kandidaturou \"studentské\" strany relativně největší: činil by téměř dvě pětiny stoupenců. Pokud by existujícím stranám nekonkuroval nový subjekt, preferovalo by ODS 20,1 procenta, KSČM 15,9 procenta a Unii svobody 11,4 procenta dotázaných. ČSSD by dalo hlas 11,2 procenta lidí. KDU-ČSL by získala 9,9 procenta hlasů. Stranu vzniklou na základě výzvy někdejších studentských vůdců by volili především lidé ve věku od 18 do 29 let, středoškoláci, zaměstnanci v nedělnických profesích, podnikatelé a lidé s hrubým příjmem domácnosti nad 30.000 korun. Pramen: Sofres-Factum Jedenapadesát procent občanů však podle v pátek zveřejněného šetření Institutu pro výzkum veřejného mínění nepovažuje vznik nové strany za východisko ze současné politické situace. Opačný názor má 30 procent lidí. Signatáři výzvy se v sešli v sobotu 8. ledna a schválili založení občanského sdružení s názvem Sdružení Děkujeme odejděte. Do tří týdnů by mělo být sdružení zaregistrováno ministerstvem vnitra."
        ]
    },
    {
        "user_input":"Shrň tento článek do stručného shrnutí.",
        "retrieved_contexts":[
            "Za Jablonec zatím stihl čtyři tréninky a jeden přípravný zápas na umělé trávě v pražském Karlíně. Proti Bohemians včera ukázal, jak je šikovný. Když ostatní tlačili míč do houfu, Budka se snažil vymyslet kličku nebo originální přihrávku. Po utkání si zmožen sedl na židli, a když chtěl vstát, sténal, jak ho bolí nohy. Od tvrdé zimní přípravy si za tři a půl roku v Lokerenu odvykl. \"Tam se tomu moc nedává. Všechno se dělá s míčem, žádné velké běhání. Vždyť Lokeren hraje už ve středu mistrovský zápas.\" V březnu bude Budkovi jedenatřicet, už je dost zkušený, aby přestup z Belgie nebral nijak dramaticky. Chybět mu budou jen čeští fotbaloví kamarádi Vonášek, Pěnička a Koller a možná ještě větší volnost. \"Nepotrpěli si tam na žádná soustředění před zápasem. Sešli jsme se ve čtyři odpoledne, dali si večeři, narvali do sebe špagety nebo i krokety a v osm jsme hráli. Pro nás Čechy to bylo zprvu dost divné,\" zavzpomínal. V blízké době bude muset do Lokerenu ještě jednou, aby dokončil stěhování do Ústí, kde s rodinou bydlí. \"To je šílené, kolik máme krabic. Pro jednu várku se musím ještě vrátit zpět. Ale byt a auto už jsem klubu odevzdal.\""
        ],
        "response":"Vojtěch Budka, který pro Bohemian FC v Praze nastoupil po zimním pobytu v Lókerenu, vykonal čtyři domácí tréninky včetně jednoho přípraveňského zápasu. Přestup ze švýcarské ligy do české nejvyšší soutěže byl dokončen bez dramatických problémů, avšak hráč si uvedomuje, že v Lókernu se více než doma tělí s míчем a má stále mnoho krabic, které musí dorazit do Ústu.",
        "reference":"Šest let trvalo, než se malý černovlasý záložník Václav Budka znovu vrátil do Jablonce. Mezitím vyzkoušel dresy Sparty a belgického Lokerenu. \"Čekáme druhý přírůstek do rodiny, proto jsem zase doma,\" říkal. V Belgii pobýval v poslední době bez manželky, to jeho rozhodnutí jen uspíšilo",
        "reference_contexts":[
            "Za Jablonec zatím stihl čtyři tréninky a jeden přípravný zápas na umělé trávě v pražském Karlíně. Proti Bohemians včera ukázal, jak je šikovný. Když ostatní tlačili míč do houfu, Budka se snažil vymyslet kličku nebo originální přihrávku. Po utkání si zmožen sedl na židli, a když chtěl vstát, sténal, jak ho bolí nohy. Od tvrdé zimní přípravy si za tři a půl roku v Lokerenu odvykl. \"Tam se tomu moc nedává. Všechno se dělá s míčem, žádné velké běhání. Vždyť Lokeren hraje už ve středu mistrovský zápas.\" V březnu bude Budkovi jedenatřicet, už je dost zkušený, aby přestup z Belgie nebral nijak dramaticky. Chybět mu budou jen čeští fotbaloví kamarádi Vonášek, Pěnička a Koller a možná ještě větší volnost. \"Nepotrpěli si tam na žádná soustředění před zápasem. Sešli jsme se ve čtyři odpoledne, dali si večeři, narvali do sebe špagety nebo i krokety a v osm jsme hráli. Pro nás Čechy to bylo zprvu dost divné,\" zavzpomínal. V blízké době bude muset do Lokerenu ještě jednou, aby dokončil stěhování do Ústí, kde s rodinou bydlí. \"To je šílené, kolik máme krabic. Pro jednu várku se musím ještě vrátit zpět. Ale byt a auto už jsem klubu odevzdal.\""
        ]
    },
    {
        "user_input":"Shrň tento článek do stručného shrnutí.",
        "retrieved_contexts":[
            "Český Mobil si datum nevybral sám - ke komerčnímu spuštění sítě do tří měsíců se zavázal Výběrové komisi a když vyhrál tendr, začal mu od dne udělení licence, tedy od 8. října 1999 neúprosně odtikávat vyměřená čas. Již dnes je nesporné, že slib spuštění sítě do tří měsíců byl spíše líbivou pózou vystavenou na odiv Výběrové komisi bažící po rychlém udělení licence, než vážně míněným pokusem o světový rekord. Stav sítě ke dni 8. 1. 2000 tomu také odpovídal - a stejně tak připravenost po stránce obchodní. Nebylo tedy čemu se divit, že na infolinkách Českého Mobilu operátoři nabádali koupěchtivé zájemce, aby si nákup rozmysleli a posečkali do března, kdy síť vystartuje naplno. Síť Českého Mobilu tedy odstartuje fakticky až k 1. březnu 2000 - tedy ve stejný termín, jaký nabízel Orange, CrysTel i VlnaPlus, další účastníci tendru v pořadí. Do té doby si lze sice služby sítě nakoupit, ale pouze objednávkou na telefonním čísle 0800-177100 (Zelená linka, volání je zdarma). Operátorka si poznamená vámi vybraný tarif a SIM karta vám přijde poštou na dobírku. Zaplatíte 1000 Kč jako zálohu a již držíte v ruce bělostnou SIM kartu Českého Mobilu s defaultně přednastaveným PINem 1234. Tarify a ceny služeb Ceník hovorného u jednotlivých tarifů vidíte na následujícím obrázku. Podrobné srovnání tarifů Českého Mobilu s konkurujícími tarify RadioMobilu a EuroTelu jsou předmětem dalších článků. Již nyní je ale jasné, že dva tarify dostanou jméno Výherní - tarif Jednička a tarif Čtyřka. Ty se totiž staly základem vítězství Českého Mobilu v tendru a je vidět, že Český Mobil není moc nadšen, že je musí nabízet. Oba tyto tarify jsou omezeny na fyzické osoby, oba jsou silně znevýhodněny tarifikací a Čtyřka je dokonce vázána na nesmyslný čtyřletý úpis. Přehledné srovnání tarifů: Srovnání tarifů: Jednička, Twist a Go Srovnani tarifu 2: Dvojka, Paegas 20 a EuroTel Relax Srovnání tarifů 3: Trojka, Paegas 60 a 120, EuroTel Global Srovnání tarifů 4: Čtyřka, Pětka, Paegas 300 a EuroTel Business Ostatní tarify vycházejí obecně příznivěji, než tarify konkurentů. Zejména u EuroTelu je velmi patrné, že s cenami zaspal dobu a ani jeho setrvalé odvolávání se na údajně vysokou kvalitu sítě a služeb nezachrání některé jeho tarify od nutnosti rychlé aktualizace. Stejně tak ale platí, že na rozhodnutí o nejvýhodnějším tarifu potřebujete dobrou kalkulačku a značnou dávku trpělivosti, protože propočet komplikuje mnoho faktorů. Nejenom, že jsou všude jinak stanovené špičky (Český Mobil má od 8-18, tedy ještě o hodinu kratší špička, než u RadioMobilu), ale jiné jsou i tarifikační impulsy či volné minuty a sazby za volání mezi sítěmi jsou ještě zmatenější (jiné je volání mezi sítěmi EuroTelu\/RadioMobilu a jiné EuroTelu\/Českého Mobilu). Problematické jsou pro Výherní tarify také ceny mezinárodních hovorů - nepatří mezi nejnižší. Zajímavé ale je, že existuje také možnost volat do zahraničí přes internet. Pro podrobný soupis služeb a cen včetně hovorného doporučuji stáhnout si tyto PDF soubory (1. - služby a 2. - ceny), kde jsou přímo originální informace od Českého Mobilu. Obchodní strategie ČM Jak již jsme si řekli, zatím si nelze služby Českého Mobilu objednat jinak, než-li zavoláním na infolinku a poštou na dobírku. Postupem času se objeví síť firemních obchodů i dealerů, ve velké míře ale bude Český Mobil spoléhat na přímý prodej. Hlídání nákladů a platební morálky je vidět na každém kroku s Českým Mobilem. Zákazník dopředu složí zálohu - obvykle ve výši 1000 Kč. A nyní pozor - měsíčně smíte využít služeb pouze do výše této zálohy, pokud byste ji měli překročit, je oprávněn Český Mobil (dle Všeobecných podmínek) odepřít vám možnost čerpání této služby. Pokud byste tedy chtěli mít vysokou útratu, budete si muset dopředu navýšit zálohu. Český Mobil zálohu slibuje vrátit nejpozději do 60 kalendářních dnů, pokud přestanete jeho služeb používat. Český Mobil také ve Všeobecných podmínkách naznačuje, že pokud bude zákazník dobře platit, může mu být vrácena případně nemusí být požadována v plném rozsahu. Nicméně to samé v bleděmodrém to je se zálohou na mezinárodní hovory - ta je požadována ve výši 5000 Kč a slouží i pro případný roaming (až bude Český Mobil mít roamingové smlouvy). Podobně jako RadioMobil bude i Český Mobil více dbát na včasnou úhradu faktur - vámi složená záloha mu slouží jako \"rukojmí\" pro případ, že byste se ku placení neměl a Všeobecné podmínky určují splatnost faktury 15 dní od data vystavení. Za vyřazení ze seznamu neplatičů zaplatíte 150 Kč, reaktivace zablokované SIM karty přijde na 1000 Kč. Penalizace za vaší vinou neprovedené inkaso (málo peněz) je 500 Kč. Březnový ostrý start se rovněž promítá do obchodní politiky firmy. Pokud si SIM kartu koupíte nyní, neplatíte sice žádný aktivační poplatek, ale za číslo na přání zaplatíte 2000 Kč, jinak dostanete číslo z řady 0608-020xxx, která je právě aktuální. Od března bude číslo na přání zdarma! Absence aktivačního poplatku potěší. U dotovaných telefonů v síti Paegas či EuroTel dosahuje aktivační poplatek 3600 Kč, což při rozpočtení na dva roky dělá 150 Kč měsíčně. O ty telefonujete tedy v síti Českého Mobilu laciněji a není to vůbec zanedbatelná suma! Také číslo zdarma je výborné - můžete se rozhodnout, zda ve vašem novém mobilu budete mít pouze jinou předvolbu, nebo zda si zvolíte číslo úplně dle vašeho přání. Jen na okraj - podobnou službu nabízí EuroTel (za cca. 3500 Kč), RadioMobil nabízí výrazně omezenou možnost výběru a pouze pro Twist za podobnou sumu. Co se vám bude líbit Věc, která příjemně překvapí, je SIM karta. První dostupné jsou čistě bílé, ale mají místo pro 250 telefonních čísel. Drobnou nevýhodou je, že maximální délka jména může být 10 písmen. K SIM kartě dostanete PIN1 a PUK1, pokud byste někdy potřebovali PIN2, dají vám ho na infolince, pokud si zavoláte a nadiktujete sériové číslo SIM karty. Příjemné také je, že Český Mobil hodlá jako běžnou službu pro všechny tarify nabízet Informaci o ceně hovoru (AoC) - tu, kterou mají Go karty a zpravidla i Twisty, ale ne normální tarify obou ostatních operátorů. Je to velmi příjemné, mít po ukončení hovoru alespoň hrubou představu o jeho ceně i o výši provolané částky za měsíc. Pravda - Český Mobil upozorňuje, že informace je jen přibližná a nezapočítává ani volné minuty, ani mezinárodní hovory. Jednoduché jsou také ceny - u Českého Mobilu až na výjimku tarifů Jednička a Čtyřka jsou ceny pro volání do všech sítí ve všech časech stejné a jiné ceny má zpravidla jen přístup do hlasové schránky. A další fajnová věc - převádění neprovolaných volných minut. Pokud vám něco zbude, můžete si to provolat příště, pokud nemáte tarif Jednička nebo čtyřka. Co se vám líbit nebude Věc, nad kterou se v ceníku pozastavíte, jsou periody tarifikačních impulsů. Ve všech tarifech Českého Mobilu je nejdříve účtována částka za celou minutu hovoru. U konkurentů se účtuje vždy částka za 30 vteřin hovoru. Co to znamená? Pokud hovoříte třeba 20 vteřin, zaplatíte u RadioMobilu a EuroTelu polovinu minutové ceny hovoru (tedy platíte vždy za započatých 30 vteřin), zatímco u Českého Mobilu zaplatíte celou minutu, protože první minuta vám je naúčtována celá. To ale značně prodražuje krátké hovory, případně omyly a nechtěná dovolání se na záznamník. U některých tarifů se po minutě účtuje již ve vteřinovém intervalu, tedy pro zákazníka značně výhodněji, tarif Jednička pokračuje ve třicetivteřinovém účtování a tarif Čtyřka v krajně nevýhodném minutovém účtování. Co se vám asi nebude líbit nejvíce, je pokrytí a značná \"syrovost\" sítě. U pokrytí je jasné, o co jde - není signál, kde by být měl, tedy u vás doma, v práci a na chalupě. Ve svých informačních materiálech pro zákazníky má Český Mobil mapu pokrytí, která ale dosti nesouhlasí se skutečným stavem. K 8. lednu 2000 měl Český Mobil řádově k sedmi desítkám zintegrovaných základnových stanic (tedy již v provozu) - převážně pak pracujících na 900 MHz. Pokrytí většiny lokalit je tedy spíše symbolické, města mají nezřídka i jednu BTSku, která se stará o kompletní pokrytí okruhu dvaceti kilometrů. O kvalitní síti se tedy zatím nedá mluvit - na síti se podepsal spěch i to, že je zatím téměř výhradně stavěna jako GSM-900, nikoliv DCS-1800. Nižší frekvenci dostal Český Mobil pro vykrytí mimoměstských oblastí, nikoliv na výstavbu základního pokrytí, jak je používá dnes. Použitím GSM-900 sice potřebuje výrazně méně BTSek pro výstavbu slíbeného pokrytí, děje se tak ale na úkor kapacity a kvality signálu. Také služeb je v síti funkčních pomálu - do března by se jich ale mělo urodit dostatek. Kromě posílání SMS zpráv (den po spuštění sítě ještě nechodily do sítě EuroTelu ani RadioMobilu) zákazníky potěší možnost aktivace datových i faxových služeb bez poplatků, dále pak expertní hlasová i faxová schránka nebo konferenční hovory. Dotované telefony zatím nejsou a je otázka, jaké Český Mobil bude nabízet od března. Již nyní je téměř jisté, že dotace k telefonům budou - v jaké výši a jakých značek, to se ještě uvidí. Jako první seznámení se sítí Českého Mobilu by vám tyto informace snad mohly stačit. V době, kdy tento článek vznikal, byla síť na světě pouhé dva dny a ne vše bylo tak jasné, jak bychom si přáli. Zelená linka Českého Mobilu je zdarma - tak ji můžete využít pro další informace."
        ],
        "response":"Českému Mobilu bylo dáno tři měsíce na spuštění síti, která byla vyhrazena v tendr a oficiálně zahájena 8 října, avšak fiktivní termín pro úplný provoz byl 1 březno 2 00 0. Zároveň však firma nabídla zákazníkům pouze dvě nízkopracovního tarifní „Výherní\" produkty, které byly zneužívány k získání licencování.\n\nSdílené sítě Českého Mobilem s konkurencí",
        "reference":"Jaké jsou ceny, služby, vyýhody a nevýhody Českého Mobilu? Pokusili jsme se sem sumarizovat vše, co by se vám mohlo hodit při uvažování o Českém Mobilu",
        "reference_contexts":[
            "Český Mobil si datum nevybral sám - ke komerčnímu spuštění sítě do tří měsíců se zavázal Výběrové komisi a když vyhrál tendr, začal mu od dne udělení licence, tedy od 8. října 1999 neúprosně odtikávat vyměřená čas. Již dnes je nesporné, že slib spuštění sítě do tří měsíců byl spíše líbivou pózou vystavenou na odiv Výběrové komisi bažící po rychlém udělení licence, než vážně míněným pokusem o světový rekord. Stav sítě ke dni 8. 1. 2000 tomu také odpovídal - a stejně tak připravenost po stránce obchodní. Nebylo tedy čemu se divit, že na infolinkách Českého Mobilu operátoři nabádali koupěchtivé zájemce, aby si nákup rozmysleli a posečkali do března, kdy síť vystartuje naplno. Síť Českého Mobilu tedy odstartuje fakticky až k 1. březnu 2000 - tedy ve stejný termín, jaký nabízel Orange, CrysTel i VlnaPlus, další účastníci tendru v pořadí. Do té doby si lze sice služby sítě nakoupit, ale pouze objednávkou na telefonním čísle 0800-177100 (Zelená linka, volání je zdarma). Operátorka si poznamená vámi vybraný tarif a SIM karta vám přijde poštou na dobírku. Zaplatíte 1000 Kč jako zálohu a již držíte v ruce bělostnou SIM kartu Českého Mobilu s defaultně přednastaveným PINem 1234. Tarify a ceny služeb Ceník hovorného u jednotlivých tarifů vidíte na následujícím obrázku. Podrobné srovnání tarifů Českého Mobilu s konkurujícími tarify RadioMobilu a EuroTelu jsou předmětem dalších článků. Již nyní je ale jasné, že dva tarify dostanou jméno Výherní - tarif Jednička a tarif Čtyřka. Ty se totiž staly základem vítězství Českého Mobilu v tendru a je vidět, že Český Mobil není moc nadšen, že je musí nabízet. Oba tyto tarify jsou omezeny na fyzické osoby, oba jsou silně znevýhodněny tarifikací a Čtyřka je dokonce vázána na nesmyslný čtyřletý úpis. Přehledné srovnání tarifů: Srovnání tarifů: Jednička, Twist a Go Srovnani tarifu 2: Dvojka, Paegas 20 a EuroTel Relax Srovnání tarifů 3: Trojka, Paegas 60 a 120, EuroTel Global Srovnání tarifů 4: Čtyřka, Pětka, Paegas 300 a EuroTel Business Ostatní tarify vycházejí obecně příznivěji, než tarify konkurentů. Zejména u EuroTelu je velmi patrné, že s cenami zaspal dobu a ani jeho setrvalé odvolávání se na údajně vysokou kvalitu sítě a služeb nezachrání některé jeho tarify od nutnosti rychlé aktualizace. Stejně tak ale platí, že na rozhodnutí o nejvýhodnějším tarifu potřebujete dobrou kalkulačku a značnou dávku trpělivosti, protože propočet komplikuje mnoho faktorů. Nejenom, že jsou všude jinak stanovené špičky (Český Mobil má od 8-18, tedy ještě o hodinu kratší špička, než u RadioMobilu), ale jiné jsou i tarifikační impulsy či volné minuty a sazby za volání mezi sítěmi jsou ještě zmatenější (jiné je volání mezi sítěmi EuroTelu\/RadioMobilu a jiné EuroTelu\/Českého Mobilu). Problematické jsou pro Výherní tarify také ceny mezinárodních hovorů - nepatří mezi nejnižší. Zajímavé ale je, že existuje také možnost volat do zahraničí přes internet. Pro podrobný soupis služeb a cen včetně hovorného doporučuji stáhnout si tyto PDF soubory (1. - služby a 2. - ceny), kde jsou přímo originální informace od Českého Mobilu. Obchodní strategie ČM Jak již jsme si řekli, zatím si nelze služby Českého Mobilu objednat jinak, než-li zavoláním na infolinku a poštou na dobírku. Postupem času se objeví síť firemních obchodů i dealerů, ve velké míře ale bude Český Mobil spoléhat na přímý prodej. Hlídání nákladů a platební morálky je vidět na každém kroku s Českým Mobilem. Zákazník dopředu složí zálohu - obvykle ve výši 1000 Kč. A nyní pozor - měsíčně smíte využít služeb pouze do výše této zálohy, pokud byste ji měli překročit, je oprávněn Český Mobil (dle Všeobecných podmínek) odepřít vám možnost čerpání této služby. Pokud byste tedy chtěli mít vysokou útratu, budete si muset dopředu navýšit zálohu. Český Mobil zálohu slibuje vrátit nejpozději do 60 kalendářních dnů, pokud přestanete jeho služeb používat. Český Mobil také ve Všeobecných podmínkách naznačuje, že pokud bude zákazník dobře platit, může mu být vrácena případně nemusí být požadována v plném rozsahu. Nicméně to samé v bleděmodrém to je se zálohou na mezinárodní hovory - ta je požadována ve výši 5000 Kč a slouží i pro případný roaming (až bude Český Mobil mít roamingové smlouvy). Podobně jako RadioMobil bude i Český Mobil více dbát na včasnou úhradu faktur - vámi složená záloha mu slouží jako \"rukojmí\" pro případ, že byste se ku placení neměl a Všeobecné podmínky určují splatnost faktury 15 dní od data vystavení. Za vyřazení ze seznamu neplatičů zaplatíte 150 Kč, reaktivace zablokované SIM karty přijde na 1000 Kč. Penalizace za vaší vinou neprovedené inkaso (málo peněz) je 500 Kč. Březnový ostrý start se rovněž promítá do obchodní politiky firmy. Pokud si SIM kartu koupíte nyní, neplatíte sice žádný aktivační poplatek, ale za číslo na přání zaplatíte 2000 Kč, jinak dostanete číslo z řady 0608-020xxx, která je právě aktuální. Od března bude číslo na přání zdarma! Absence aktivačního poplatku potěší. U dotovaných telefonů v síti Paegas či EuroTel dosahuje aktivační poplatek 3600 Kč, což při rozpočtení na dva roky dělá 150 Kč měsíčně. O ty telefonujete tedy v síti Českého Mobilu laciněji a není to vůbec zanedbatelná suma! Také číslo zdarma je výborné - můžete se rozhodnout, zda ve vašem novém mobilu budete mít pouze jinou předvolbu, nebo zda si zvolíte číslo úplně dle vašeho přání. Jen na okraj - podobnou službu nabízí EuroTel (za cca. 3500 Kč), RadioMobil nabízí výrazně omezenou možnost výběru a pouze pro Twist za podobnou sumu. Co se vám bude líbit Věc, která příjemně překvapí, je SIM karta. První dostupné jsou čistě bílé, ale mají místo pro 250 telefonních čísel. Drobnou nevýhodou je, že maximální délka jména může být 10 písmen. K SIM kartě dostanete PIN1 a PUK1, pokud byste někdy potřebovali PIN2, dají vám ho na infolince, pokud si zavoláte a nadiktujete sériové číslo SIM karty. Příjemné také je, že Český Mobil hodlá jako běžnou službu pro všechny tarify nabízet Informaci o ceně hovoru (AoC) - tu, kterou mají Go karty a zpravidla i Twisty, ale ne normální tarify obou ostatních operátorů. Je to velmi příjemné, mít po ukončení hovoru alespoň hrubou představu o jeho ceně i o výši provolané částky za měsíc. Pravda - Český Mobil upozorňuje, že informace je jen přibližná a nezapočítává ani volné minuty, ani mezinárodní hovory. Jednoduché jsou také ceny - u Českého Mobilu až na výjimku tarifů Jednička a Čtyřka jsou ceny pro volání do všech sítí ve všech časech stejné a jiné ceny má zpravidla jen přístup do hlasové schránky. A další fajnová věc - převádění neprovolaných volných minut. Pokud vám něco zbude, můžete si to provolat příště, pokud nemáte tarif Jednička nebo čtyřka. Co se vám líbit nebude Věc, nad kterou se v ceníku pozastavíte, jsou periody tarifikačních impulsů. Ve všech tarifech Českého Mobilu je nejdříve účtována částka za celou minutu hovoru. U konkurentů se účtuje vždy částka za 30 vteřin hovoru. Co to znamená? Pokud hovoříte třeba 20 vteřin, zaplatíte u RadioMobilu a EuroTelu polovinu minutové ceny hovoru (tedy platíte vždy za započatých 30 vteřin), zatímco u Českého Mobilu zaplatíte celou minutu, protože první minuta vám je naúčtována celá. To ale značně prodražuje krátké hovory, případně omyly a nechtěná dovolání se na záznamník. U některých tarifů se po minutě účtuje již ve vteřinovém intervalu, tedy pro zákazníka značně výhodněji, tarif Jednička pokračuje ve třicetivteřinovém účtování a tarif Čtyřka v krajně nevýhodném minutovém účtování. Co se vám asi nebude líbit nejvíce, je pokrytí a značná \"syrovost\" sítě. U pokrytí je jasné, o co jde - není signál, kde by být měl, tedy u vás doma, v práci a na chalupě. Ve svých informačních materiálech pro zákazníky má Český Mobil mapu pokrytí, která ale dosti nesouhlasí se skutečným stavem. K 8. lednu 2000 měl Český Mobil řádově k sedmi desítkám zintegrovaných základnových stanic (tedy již v provozu) - převážně pak pracujících na 900 MHz. Pokrytí většiny lokalit je tedy spíše symbolické, města mají nezřídka i jednu BTSku, která se stará o kompletní pokrytí okruhu dvaceti kilometrů. O kvalitní síti se tedy zatím nedá mluvit - na síti se podepsal spěch i to, že je zatím téměř výhradně stavěna jako GSM-900, nikoliv DCS-1800. Nižší frekvenci dostal Český Mobil pro vykrytí mimoměstských oblastí, nikoliv na výstavbu základního pokrytí, jak je používá dnes. Použitím GSM-900 sice potřebuje výrazně méně BTSek pro výstavbu slíbeného pokrytí, děje se tak ale na úkor kapacity a kvality signálu. Také služeb je v síti funkčních pomálu - do března by se jich ale mělo urodit dostatek. Kromě posílání SMS zpráv (den po spuštění sítě ještě nechodily do sítě EuroTelu ani RadioMobilu) zákazníky potěší možnost aktivace datových i faxových služeb bez poplatků, dále pak expertní hlasová i faxová schránka nebo konferenční hovory. Dotované telefony zatím nejsou a je otázka, jaké Český Mobil bude nabízet od března. Již nyní je téměř jisté, že dotace k telefonům budou - v jaké výši a jakých značek, to se ještě uvidí. Jako první seznámení se sítí Českého Mobilu by vám tyto informace snad mohly stačit. V době, kdy tento článek vznikal, byla síť na světě pouhé dva dny a ne vše bylo tak jasné, jak bychom si přáli. Zelená linka Českého Mobilu je zdarma - tak ji můžete využít pro další informace."
        ]
    },
    {
        "user_input":"Shrň tento článek do stručného shrnutí.",
        "retrieved_contexts":[
            "\"Když budeme chtít do zahraničí, můžeme i na Slovensko. Ale tam najednou přijde sněhová kalamita nebo dvacetistupňový mráz. V tom se práce s míčem, rychlost a výbušnost moc trénovat nedají,\" míní teplický trenér Josef Pešice. Proto neváhal, když se objevila nabídka odletět na deset dní na slunnou Floridu. Navíc klub hradí jen letenky, které vyjdou tak na tři sta tisíc korun, o zbylé náklady se postará tamní pořadatel. Jinak by americké soustředění přišlo aspoň na milion korun. Není to jen výsada bohatých odjet k přípravě za teplem. Do Portugalska jede kromě Slavie také Žižkov, Příbram s Jabloncem mají na konci ledna namířeno na Kypr.\"Vždycky je výhodné jednou za zimu odjet za teplem. Pro herní soustředění je to nejlepší,\" myslí si sparťanský trenér Ivan Hašek. Neskrývá, že Dubaj ve Spojených arabských emirátech zvolil pro dokonalé podmínky: pětadvacet stupňů nad nulou, komfortní ubytování, ale především výborné trávníky a silní soupeři. \"Budou tam třeba Rapid Vídeň nebo Zenit Petrohrad, tahle konfrontace se nám může hodit.\" Obvykle se za teplem jezdí na deset dní nebo dva týdny. Pro kluby to bývá ještě finančně dostupné. Třeba za čtrnáct dní v Portugalsku se platí kolem milionu korun. Pokud je tamní pohodlí na vyšší úrovni, cena se zvyšuje. Mimořádně dlouhé soustředění v teplu zažil snad jen Hradec Králové před sedmi lety. Strávil měsíc v Mexiku. Dodnes si hráči pamatují, jak se nemohli dočkat, až přiletí zpátky.\"To byla hrůza,\" vzpomíná tehdejší záložník Richard Jukl. \"Tak dlouho a daleko pryč? Utrpení.\" Hráčům se stýskalo po rodinách, Juklova manželka byla už čtyři měsíce těhotná, chtěl být s ní. \"Měsíční kemp je dlouhý. To už musí být kluci hrozně nervózní,\" tvrdí teplický kouč Pešice. Pocity nářku umocňovala ještě strava. \"Tamní kuchaři dlouho k snídani i večeři podávali jen marmeládu, plátky sýra a šunky,\" nezapomněl dodnes Jukl. Hradecký tým bydlel v tréninkovém centru v horách nad městem Guadalajara, dvacet kilometrů od civilizace. Trenér Ladislav Škorpil si lebedil. Zimní přípravu vedl tak, jako by se udála uprostřed roku. \"Byla to paráda. Místo ve sněhu jsme měsíc strávili v létě. Byl to nejkrásnější leden mého života, prostě sen.\" Naučené dovednosti z Mexika pomohly týmu k devátému místu v posledním ročníku federální ligy, což byl pro Hradec výsledek nad poměry. \"Soustředění mělo rub a líc, ale klady daleko převažovaly,\" myslí si dnes kouč Škorpil. Trenéři si chválí letní prostředí uprostřed zimy. Rozehranost z kvalitních terénů je totiž znát. Změna přijet na zmrzlá hřiště bývá ošidná, protože se na nich těžko uplatňuje získaná technika s míčem. \"Přechod z lepšího na horší bývá jednodušší než naopak,\" zdůrazňuje však Ivan Hašek ze Sparty. Až samotná soutěž, jejíž jarní část startuje 18. února, ukáže, nakolik byla příprava v teple přínosná. Podle kdekoho by měly být v nevýhodě kluby, které zůstanou celou zimu doma. \"Jedeme do Německa, a už to považuju za velký klad, protože tam jsou trávníky mnohem lepší než tady,\" říká Vlastimil Petržela, trenér Bohemians. \"Tam si v přípravných zápasech nikdo nedovolí nic vypustit, protože jde o prestiž.\" Na jaře se uvidí, zda budou tratit týmy, které zůstanou přes zimu doma: České Budějovice, Drnovice, Brno a Hradec."
        ],
        "response":"Trenéři a hráči si často preferují zimní období pro tréninky, protože teplota umožňuje lepší výkon než studené počasí. I když některé kluby navštívily teplá místa jako Florida nebo Mexiko, většina týmů se stále rozhodne zimu trénovat v přírodních podmínkách, kde se hraje na suchém trávníku bez ohledu na zima.",
        "reference":"Zatím jen fyzickou otročinu zakoušejí fotbalisté vesměs po prvním týdnu zimní přípravy. Když jim pod nohama plynou naběhané kilometry, utěšují se, že přijdou lepší časy. Mnoho týmů brzy odjede do teplých krajů, tam, kde se dá na zelených trávnících pilovat práce s míčem, cit pro přihrávku. Kde se hráči nemusí brodit roztátým sněhem nebo klouzat na zmrzlé škváře. To je prvořadý důvod, proč se Sparta chystá do exotické Dubaje, proč na Teplice čeká historický zájezd na Floridu",
        "reference_contexts":[
            "\"Když budeme chtít do zahraničí, můžeme i na Slovensko. Ale tam najednou přijde sněhová kalamita nebo dvacetistupňový mráz. V tom se práce s míčem, rychlost a výbušnost moc trénovat nedají,\" míní teplický trenér Josef Pešice. Proto neváhal, když se objevila nabídka odletět na deset dní na slunnou Floridu. Navíc klub hradí jen letenky, které vyjdou tak na tři sta tisíc korun, o zbylé náklady se postará tamní pořadatel. Jinak by americké soustředění přišlo aspoň na milion korun. Není to jen výsada bohatých odjet k přípravě za teplem. Do Portugalska jede kromě Slavie také Žižkov, Příbram s Jabloncem mají na konci ledna namířeno na Kypr.\"Vždycky je výhodné jednou za zimu odjet za teplem. Pro herní soustředění je to nejlepší,\" myslí si sparťanský trenér Ivan Hašek. Neskrývá, že Dubaj ve Spojených arabských emirátech zvolil pro dokonalé podmínky: pětadvacet stupňů nad nulou, komfortní ubytování, ale především výborné trávníky a silní soupeři. \"Budou tam třeba Rapid Vídeň nebo Zenit Petrohrad, tahle konfrontace se nám může hodit.\" Obvykle se za teplem jezdí na deset dní nebo dva týdny. Pro kluby to bývá ještě finančně dostupné. Třeba za čtrnáct dní v Portugalsku se platí kolem milionu korun. Pokud je tamní pohodlí na vyšší úrovni, cena se zvyšuje. Mimořádně dlouhé soustředění v teplu zažil snad jen Hradec Králové před sedmi lety. Strávil měsíc v Mexiku. Dodnes si hráči pamatují, jak se nemohli dočkat, až přiletí zpátky.\"To byla hrůza,\" vzpomíná tehdejší záložník Richard Jukl. \"Tak dlouho a daleko pryč? Utrpení.\" Hráčům se stýskalo po rodinách, Juklova manželka byla už čtyři měsíce těhotná, chtěl být s ní. \"Měsíční kemp je dlouhý. To už musí být kluci hrozně nervózní,\" tvrdí teplický kouč Pešice. Pocity nářku umocňovala ještě strava. \"Tamní kuchaři dlouho k snídani i večeři podávali jen marmeládu, plátky sýra a šunky,\" nezapomněl dodnes Jukl. Hradecký tým bydlel v tréninkovém centru v horách nad městem Guadalajara, dvacet kilometrů od civilizace. Trenér Ladislav Škorpil si lebedil. Zimní přípravu vedl tak, jako by se udála uprostřed roku. \"Byla to paráda. Místo ve sněhu jsme měsíc strávili v létě. Byl to nejkrásnější leden mého života, prostě sen.\" Naučené dovednosti z Mexika pomohly týmu k devátému místu v posledním ročníku federální ligy, což byl pro Hradec výsledek nad poměry. \"Soustředění mělo rub a líc, ale klady daleko převažovaly,\" myslí si dnes kouč Škorpil. Trenéři si chválí letní prostředí uprostřed zimy. Rozehranost z kvalitních terénů je totiž znát. Změna přijet na zmrzlá hřiště bývá ošidná, protože se na nich těžko uplatňuje získaná technika s míčem. \"Přechod z lepšího na horší bývá jednodušší než naopak,\" zdůrazňuje však Ivan Hašek ze Sparty. Až samotná soutěž, jejíž jarní část startuje 18. února, ukáže, nakolik byla příprava v teple přínosná. Podle kdekoho by měly být v nevýhodě kluby, které zůstanou celou zimu doma. \"Jedeme do Německa, a už to považuju za velký klad, protože tam jsou trávníky mnohem lepší než tady,\" říká Vlastimil Petržela, trenér Bohemians. \"Tam si v přípravných zápasech nikdo nedovolí nic vypustit, protože jde o prestiž.\" Na jaře se uvidí, zda budou tratit týmy, které zůstanou přes zimu doma: České Budějovice, Drnovice, Brno a Hradec."
        ]
    },
    {
        "user_input":"Shrň tento článek do stručného shrnutí.",
        "retrieved_contexts":[
            "Po několika odkladech jsme se díky olomouckému týmu Ignitron konečně dočkali nové české logické freewarové hry Dáma, kterou snad ani není třeba představovat. Na hře samotné se pracovalo asi třičtvrtě roku a za tu dobu byla asi pětkrát předělávána až do současné podoby. Až do listopadu loňského roku autoři nevěděli, jakým způsobem bude přesně hra distribuována, ale právě v tomto měsíci byla uzavřena dohoda a Dáma oficiálně vznikala pod hlavičkou BonusWebu. Také díky tomu se podařilo spojit autory s Českou Unií dámy, díky čemuž se sice vydání hry poněkud opozdilo, ale na druhou stranu získala nový rozměr a po konzultaci s lidmi zběhlými v její \"deskové podobě\" byla také dopilována pravidla a herní model. Dáma je titul určený úplně pro všechny lidi pracující na počítači a je vhodným odreagováním při práci i díky některým svým funkcím, k čemuž se dostaneme později. Po spuštění vás kromě podmanivé, vkusně vybrané hudby přivítá líbivá grafika s přehlednými menu, v nichž si budete moci vybrat, jakou hru chcete hrát. Autoři připravili jak hru pro jednoho, tak pro dva hráče s možností hrát ji na jednom počítači nebo po síti. Po příslušném vybrání si herního módu, barvy figurek a úrovně obtížnosti se přesouváte do hry samotné, o které nevím, co bych zde měl napsal, neboť se jedná o tak samozřejmou záležitost, že mě nic originálního nenapadá. Prostě jenom táhnete tak, jak nejlépe uznáte za vhodné a snažíte se počítač porazit, což není nikterak jednoduché, ale ani nemožné. Umělá inteligence počítačového protivníka v Dámě je totiž vskutku vysoká a nastavíte-li si nejtěžší obtížnost, nemáte dle mého názoru šanci nad ním zvítězit, neboť nad některými tahy bloumá, resp. je propočítává i několik dlouhých minut. Jak už jsem zmínil, hra je určena úplně pro všechny a pro hraní jak doma, tak v práci, nebo ve škole a to díky několika šikovným funkčním klávesám. Kromě standardních F2 (ulož) a F3 (nahrej) je možnost shlédnutí posledního protivníkova tahu (F5) a hlavně jedinečným způsobem vyřešeného odskoku do Windows tak, aby se vám na liště neobjevila informace o tom, že hrajete Dámu, což oceníte zejména v práci při kontrole šéfa, nebo ve škole při vyučování. Autoři totiž k tomuto účelu vyčlenili klávesu F12, kterou nazvali Tlačítkem poslední záchrany, neboť po jejím stisknutí vás hra automaticky přepne do Windows a nezanechá za sebou jedinou stopu, navíc ani nepřijdete o rozehranou hru a po opětovném stisku klávesy F12 se do ní zase vrátíte. Šikovná věcička. Zmínit je nutno také obsáhlou nápovědu, která by u takto jednoduché hry vlastně ani vůbec nemusela být k dispozici, avšak autoři byli jiného názoru a pro její oživení v ní naleznete také historii této deskové hry a největší úspěchy českých borců sdružujících se v České Unii dámy. Vše samozřejmě i v nápovědě doprovází nevtíravá, uchu lahodící melodie okořeněná spoustou zajímavých dobových obrázků dokreslujících poutavé vyprávění o vzniku a vývoji Dámy. Vyplatí se tedy platit Telecomu telefonní impulsy za čas, po který byste si stahovali tuto jedinečnou hru, či nikoliv? Jednoznačně ano a vyplatí se nešetřit a stáhnout si verzi se zvuky i s hudbou, protože Dáma skutečně stojí za to!"
        ],
        "response":"Autoři hry Dámou, která prošla více než třemi předelami, spolupracují s Českým svazem dámy a nyní vydávají svou verzi pod hlavicí BonusWeb. Hra nabízí dvě postavy, umělou inteligenci s vysokou obtížností a unikátní funkci tlačítka „Poslední záchrana\", které přepíná obrazovku do režimu Windows bez záznamu.",
        "reference":"Jedna z nejrozšířenějších stolních her se konečně dočkala své elektronické podoby díky olomouckému týmu Ignitron a magazínu BonusWeb. Nenechte se tedy pobízet, neváhejte, klikněte si, poklekněte, začněte stahovat a čtěte: Dáma přichází...",
        "reference_contexts":[
            "Po několika odkladech jsme se díky olomouckému týmu Ignitron konečně dočkali nové české logické freewarové hry Dáma, kterou snad ani není třeba představovat. Na hře samotné se pracovalo asi třičtvrtě roku a za tu dobu byla asi pětkrát předělávána až do současné podoby. Až do listopadu loňského roku autoři nevěděli, jakým způsobem bude přesně hra distribuována, ale právě v tomto měsíci byla uzavřena dohoda a Dáma oficiálně vznikala pod hlavičkou BonusWebu. Také díky tomu se podařilo spojit autory s Českou Unií dámy, díky čemuž se sice vydání hry poněkud opozdilo, ale na druhou stranu získala nový rozměr a po konzultaci s lidmi zběhlými v její \"deskové podobě\" byla také dopilována pravidla a herní model. Dáma je titul určený úplně pro všechny lidi pracující na počítači a je vhodným odreagováním při práci i díky některým svým funkcím, k čemuž se dostaneme později. Po spuštění vás kromě podmanivé, vkusně vybrané hudby přivítá líbivá grafika s přehlednými menu, v nichž si budete moci vybrat, jakou hru chcete hrát. Autoři připravili jak hru pro jednoho, tak pro dva hráče s možností hrát ji na jednom počítači nebo po síti. Po příslušném vybrání si herního módu, barvy figurek a úrovně obtížnosti se přesouváte do hry samotné, o které nevím, co bych zde měl napsal, neboť se jedná o tak samozřejmou záležitost, že mě nic originálního nenapadá. Prostě jenom táhnete tak, jak nejlépe uznáte za vhodné a snažíte se počítač porazit, což není nikterak jednoduché, ale ani nemožné. Umělá inteligence počítačového protivníka v Dámě je totiž vskutku vysoká a nastavíte-li si nejtěžší obtížnost, nemáte dle mého názoru šanci nad ním zvítězit, neboť nad některými tahy bloumá, resp. je propočítává i několik dlouhých minut. Jak už jsem zmínil, hra je určena úplně pro všechny a pro hraní jak doma, tak v práci, nebo ve škole a to díky několika šikovným funkčním klávesám. Kromě standardních F2 (ulož) a F3 (nahrej) je možnost shlédnutí posledního protivníkova tahu (F5) a hlavně jedinečným způsobem vyřešeného odskoku do Windows tak, aby se vám na liště neobjevila informace o tom, že hrajete Dámu, což oceníte zejména v práci při kontrole šéfa, nebo ve škole při vyučování. Autoři totiž k tomuto účelu vyčlenili klávesu F12, kterou nazvali Tlačítkem poslední záchrany, neboť po jejím stisknutí vás hra automaticky přepne do Windows a nezanechá za sebou jedinou stopu, navíc ani nepřijdete o rozehranou hru a po opětovném stisku klávesy F12 se do ní zase vrátíte. Šikovná věcička. Zmínit je nutno také obsáhlou nápovědu, která by u takto jednoduché hry vlastně ani vůbec nemusela být k dispozici, avšak autoři byli jiného názoru a pro její oživení v ní naleznete také historii této deskové hry a největší úspěchy českých borců sdružujících se v České Unii dámy. Vše samozřejmě i v nápovědě doprovází nevtíravá, uchu lahodící melodie okořeněná spoustou zajímavých dobových obrázků dokreslujících poutavé vyprávění o vzniku a vývoji Dámy. Vyplatí se tedy platit Telecomu telefonní impulsy za čas, po který byste si stahovali tuto jedinečnou hru, či nikoliv? Jednoznačně ano a vyplatí se nešetřit a stáhnout si verzi se zvuky i s hudbou, protože Dáma skutečně stojí za to!"
        ]
    },
    {
        "user_input":"Shrň tento článek do stručného shrnutí.",
        "retrieved_contexts":[
            "Jak dlouho jste byl v Anglii?Necelé tři roky. Odešel jsem tam tenkrát z bratislavského Slovanu, kde nebylo dobré klima. Klub rozprodával hráče, aby měl peníze. Smlouvu jsem v Middlesbroughu podepsal na tři a půl roku, končit mi měla letos v létě. Proč jste odešel dřív?Minulou sezonu jsem moc nehrál. Do mužstva přišli noví hráči, trenér dával přednost jim. A já potřebuji hrávat, dostat se znovu do formy. Proto jsem prostřednictvím svého manažera Pavla Zíky sháněl nové angažmá. Kolik jste odehrál za Middlesbrough zápasů v nejvyšší anglické soutěži a na jakém postu jste nastupoval?Hrál jsem přibližně šedesát utkání, zpočátku na levé straně čtyřčlenné obrany. Když jsme později přešli k systému 3-5-2, hrál jsem staženého záložníka. Myslíte, že na levé straně obrany budete hrát i v Drnovicích?To bude záležet na trenérovi. Ale slyšel jsem, že si mě právě kvůli tomu vyhlédli. Co vám dalo anglické angažmá?Když hrajete proti takovým fotbalistům, jako jsou například Overmars nebo Bergkamp, tak je to velká škola. Co se mi však v Anglii nejvíc líbilo, to byla skvělá kulisa při zápasech. Diváci jsou tam fantastičtí. Co dělá fotbalista v Anglii, když rok nehraje za první mužstvo. Může nastupovat třeba za rezervu?Nedělá nic, prostě nehraje. Proto jsem chtěl honem pryč. Stalo se vám někdy předtím, že jste tak dlouho nehrál, třeba kvůli zranění?Ne, zatím podobnou zkušenost nemám. Myslím ale, že se do toho zase rychle dostanu. Teď přes zimu hlavně potřebuji nabrat kondici. Kdy jste nastoupil naposledy za slovenskou reprezentaci?To bych musel vzpomínat. Platí tedy ve vašem případě rčení sejde z očí, sejde z mysli?Přesně tak. Ale věřím, že teď budu v Drnovicích pravidelně hrát a trenérovi národního týmu Adamcovi dokážu, že na reprezentaci ještě mám. Měl jste ještě jiné nabídky kromě Drnovic?Měl, nějaké byly ze Slovenska, ještě jedna ze zahraničí. Ale drnovičtí funkcionáři jednali rychle a seriózně. Proto jsem se rozhodl takto."
        ],
        "response":"Slovenský fotbalista Pavel Adamc odešel do Anglie po necelých třech letech, protože potřebuje obnovit formu a získat zkušenosti u silnějšího soupeřství. Jeho klub Drnovice ho vyhledává právě kvůli jeho kvalitě a schopnosti hrát v různých pozicích, což mu umožňuje rychle se vrátit do reprezentačního týmu.",
        "reference":"Pompézně, ozařován blesky fotoreportérů, obklopen dvěma televizními štáby a napjatě sledován představiteli klubu, podepsal v sobotu krátce po poledni třicetiletý fotbalista Vladimír Kinder smlouvu s prvoligovými Drnovicemi. Sportovní manažer Ivan Kopecký přiznal, že v noci na sobotu špatně spal, protože dokud není všechno černé na bílém, není prý nikdy klidný. \"V pondělí přijdu na trénink,\" řekl Kinder, naposledy hráč anglického Middlesbroughu, krátce po podpisu smlouvy Miroslavu Kadlecovi, jenž ho přišel pozdravit. Oba fotbalisté se znají z federální reprezentace, za níž začátkem devadesátých let hráli",
        "reference_contexts":[
            "Jak dlouho jste byl v Anglii?Necelé tři roky. Odešel jsem tam tenkrát z bratislavského Slovanu, kde nebylo dobré klima. Klub rozprodával hráče, aby měl peníze. Smlouvu jsem v Middlesbroughu podepsal na tři a půl roku, končit mi měla letos v létě. Proč jste odešel dřív?Minulou sezonu jsem moc nehrál. Do mužstva přišli noví hráči, trenér dával přednost jim. A já potřebuji hrávat, dostat se znovu do formy. Proto jsem prostřednictvím svého manažera Pavla Zíky sháněl nové angažmá. Kolik jste odehrál za Middlesbrough zápasů v nejvyšší anglické soutěži a na jakém postu jste nastupoval?Hrál jsem přibližně šedesát utkání, zpočátku na levé straně čtyřčlenné obrany. Když jsme později přešli k systému 3-5-2, hrál jsem staženého záložníka. Myslíte, že na levé straně obrany budete hrát i v Drnovicích?To bude záležet na trenérovi. Ale slyšel jsem, že si mě právě kvůli tomu vyhlédli. Co vám dalo anglické angažmá?Když hrajete proti takovým fotbalistům, jako jsou například Overmars nebo Bergkamp, tak je to velká škola. Co se mi však v Anglii nejvíc líbilo, to byla skvělá kulisa při zápasech. Diváci jsou tam fantastičtí. Co dělá fotbalista v Anglii, když rok nehraje za první mužstvo. Může nastupovat třeba za rezervu?Nedělá nic, prostě nehraje. Proto jsem chtěl honem pryč. Stalo se vám někdy předtím, že jste tak dlouho nehrál, třeba kvůli zranění?Ne, zatím podobnou zkušenost nemám. Myslím ale, že se do toho zase rychle dostanu. Teď přes zimu hlavně potřebuji nabrat kondici. Kdy jste nastoupil naposledy za slovenskou reprezentaci?To bych musel vzpomínat. Platí tedy ve vašem případě rčení sejde z očí, sejde z mysli?Přesně tak. Ale věřím, že teď budu v Drnovicích pravidelně hrát a trenérovi národního týmu Adamcovi dokážu, že na reprezentaci ještě mám. Měl jste ještě jiné nabídky kromě Drnovic?Měl, nějaké byly ze Slovenska, ještě jedna ze zahraničí. Ale drnovičtí funkcionáři jednali rychle a seriózně. Proto jsem se rozhodl takto."
        ]
    },
    {
        "user_input":"Shrň tento článek do stručného shrnutí.",
        "retrieved_contexts":[
            "Báječné ženy u vodyFinsko 1998Režie: Claes Olsson104 min.finská verze, anglické titulkyHrají: Marika Krook, Asa Karlin, Nicke Lignell, Onni Thulesius.Průměrná finská rodina, Kajus, Bella a syn Thomas, se vydává na dovolenou do oblíbeného letoviska. Tam se Bella seznámí s šarmantní Rosou, její podivnou dcerou Renée a manželem Gabbem. Bella pomalu odhazuje roli ženy v domácnosti a společně s Rosou utíkají do Kodaně, aby se jim vyplnily jejich společné sny. Suzie WashingtonRakousko 1997Režie: Florian Flicker87 min.německá verze, španělské titulkyHrají: Birgit Doll, August Zirner, Karl Ferdinand Kratzl, Wolfram Berger.Učitelka z východní Evropy, Nana Iaschwili, alias Suzie Washington, chce emigrovat do Ameriky, aby tam začla nový život. Při mezipřistání ve Vídni odhalí ale úřady její falešné vízum, zatknou ji a hodlají ji deportovat. Naně se podaří uprchnout a míří s dalšími cizinci s podobným osudem k hranici mezi Východem a Západem. Film získal cenu za nejlepší rakouský film roku 1998 a hlavní představitelka za nejlepší herečku na festivalu ve Fort Lauderdale.Červený trpaslíkBelgie, Francie, Itálie 1998Režie: Yvan Le Moine103 min.francouzská verze, anglické titulkyHrají: Jean-Yves Thual, Anita Ekberg, Dyna Gauzy, Michel Peyrelon, Arno Chevrier.Lucien Lhotte je liliput a pracuje v advokátní kanceláři, kde píše urážlivé dopisy k rozvodovým řízením. Sám nepoznal lásku, a tak alespoň zatrpkle rozbíjí cizí manželství. Jednoho dne se stane milencem zvrhlé bohaté klientky, nakonec však stejně zjišťuje, že obři mezi sebe trpaslíka nikdy nepřijmou.Snímek byl vyznamenán cenami na festivalech v Monctonu, Pescaře a Kyjevě. Získal také Evropskou filmovou cenu za nejlepší kameru.PokušeníPortugalsko, Brazílie 1997Režie: Joaquim Leitao115 min.portugalská verze, anglické titulkyHrají: Joaquim de Almeida, Cristina Câmara, Diogo Infante, Sofial Leite.Katolický kněz klidného městečka Vila Daires na severu Portugalska se potýká se svými vnitřní konflikty, které se objevily poté, co poznal Lenu, černou ovci v jinak tichém a klidném společenství. Kněz, do té doby zcela oddaný svému poslání, teprve nyní zjišťuje, že vůbec něco takového jako touha existuje.Já šéf, ty teniskaNěmecko 1997Režie: Hussi Kutlucan90 min.německá verze, bez titulkůHrají: Hussi Kutlucan, Wiebke Inn, Senta Moira, Jules Grund.Tragikomický příběh Arména Dudieho, který se svou dívkou Nanií usadí v Německu. Jen co přijedou do Hamburku, Nanie mu uteče se svým novým německým přítelem a chce si ho vzít. Dudie odjíždí do Berlína, ale ani tam ho smůla neopouští a vzápětí se zaplete do stávky, s bývalou manželkou svého šéfa, policií a neodbytnou sousedkou.Režisér a představitel hlavní role Hussi Kutlucan líčí těžký úděl utečenců, který zná ze své vlastní zkušenosti.Ohnivý jezdecNěmecko, Francie, Polsko 1998Režie: Nina Grosse130 min.německá verze, anglické titulkyHrají: Martin Feifel, Marianne Denicourt, Ulrich Matthes.Romantický básník Friedrich Hölderin je na doporučení svého přítele a tajného ctitele barona von Sinclaira přijat jako učitel u bankovního magnáta Gontarda. Tam se zamiluje do paní domu Sussett a tajně se s ní schází. Žárlivý von Sinclair to prozradí Gontardovi, který Hölderina okamžitě propustí. Citlivý básník, sužován svou vášní pro poezii, Sussett a neodbytností svého ctitele rezignuje na realitu a v šestatřicetiletech odchází do konce života do blázince.SuperhvězdyNizozemí 1997Režie: Jean van der Velde105 min.nizozemská verze, anglické titulkyHrají: Antonie Kamerling, Danny de Munk, Daniel Boissevain, Paul Muller.Skupina přátel spolu již od dětství tvoří fotbalový tým. Nyní, po x letech, je pro ně stále složitější setkat se k pravidelným zápasům. Někteří jsou již ženatí, jiní mají problém s těhotnou přítelkyní, svou sexuální orientací nebo rodiči. Večer před jubilejním 500. utkáním začnou pochybovat, proč jsou vůbec přáteli a zda mají ještě dnes něco společného.Superhvězdy byly v Holandsku nejnavštěvovanějším filmem roku 1997.Vedlejší cestyŠpanělsko 1997Režie: Emilio Martínez Lázaro108 min.španělská verze, anglické titulkyHrají: Antonio Resines, Fernando Ramallo, Maribel Verdú, Miriam Díaz Daroca.Road-movie o cestě Lozana se synem Felipem po španělském pobřeží. Cestují luxusním Citroenem, poslední vzpomínkou na zašlé lepší časy, po odlehlých silničkách a zjišťují, že si vůbec nerozumí a že se ten rozdíl mezi nimi s přibývajícími kilometry jen prohlubuje. Zamotaná linka příběhu směřuje přes komické i srdcervoucí situace k nečekanému konci. Láska prokletáVelká Británie 1998Režie: John Maybury90 min.anglická verze bez titulkůHrají: Derek Jacobi, Daniel Craig, Tilda Swinton.Malír Francis Bacon přijíždí v roce 1971 do Paříže, kde se koná velká retrospektiva výtvarného umění 20.století, jehož je významnou součástí. Zatímco se Bacon účastní slavnostního ceremoniálu, konzumuje v hotelovém pokoji jeho milenec a model George Dryer smrtelnou dávku drog a alkoholu. Film vypráví celý příběh tragického milostného vztahu mezi Baconem a Dryerem na pozadí bohémské společnosti londýnské čtvrti Soho.Gádžo dilo Francie 1997Režie: Tony Gatlif100 min.romsko-rumunsko-francouzská verze, české titulkyHrají: Romain Duris, Rona Hartner, Izidor Serban.Stephane pátrá v Rumunsku po rómské zpěvačce, jejíž kazetu mu předal jeho umírající otec. Stále však nenachází žádné stopy, až se jednoho dne setká s Izidorem, který ho zavede do klasické rómské osady a ukáže mu zcela jiný způsob života. Stephane získá přes počáteční bariéry důvěru místních obyvatel a žije s nimi, jako by byl jedním z nich. Právě proto mu přezdívají bláznivý gádžo\", ze zkušeností totiž vědí, že se tak normální\" bílý nechová. Záběr z holandského filmu Superhvězdy Záběr z finského filmu Báječné ženy u vody Záběr ze španělského filmu Vedlejší cesty Záběr z francouzského filmu Gádžo dilo Záběr z francouzského filmu Gádžo dilo Záběr z britského filmu Láska je prokletá Záběr německo francouzsko polského filmu Ohnivý jezdec Záběr z portugalsko brazilského filmu Pokušení Záběr z německého filmu Já šéf, ty teniska Záběr z rakouského filmu Suzie Washington Záběr z belgicko francouzsko italského filmu Červený trpaslík"
        ],
        "response":"Filmové pořadí obsahuje řadu dokumentárních a krátkometrážních produkcí z různých zemí, včetně finských „Bájných žen u vody\", rakouské „Suzie Washington\" a belgofrancouzskoitalské „Červeného trpaslíka\". Mezi další patří portugalští „Pokuseni\", německy napsané „Ohnivý jezdce\" a „Já šef, ty tenisista\", francouzský „Gádžo dió\" a britský „Láska jest proklet",
        "reference":"O víkendu můžete U Hradeb shlédnout filmy Báječné ženy u vody, Červený trpaslík, Já šéf, ty teniska, Superhvězdy, Vedlejší cesty a Gádžo dilo. V Lucerně se bude promítat Suzie Washington, Pokušení, Ohnivý jezdec, Láska prokletá a také Báječné ženy u vody a Červeného trpaslíka. Všechny z uvedených filmů stojí za shlédnutí, rozhodně byste si ale neměli nechat ujít francouzský snímek Gádžo dilo",
        "reference_contexts":[
            "Báječné ženy u vodyFinsko 1998Režie: Claes Olsson104 min.finská verze, anglické titulkyHrají: Marika Krook, Asa Karlin, Nicke Lignell, Onni Thulesius.Průměrná finská rodina, Kajus, Bella a syn Thomas, se vydává na dovolenou do oblíbeného letoviska. Tam se Bella seznámí s šarmantní Rosou, její podivnou dcerou Renée a manželem Gabbem. Bella pomalu odhazuje roli ženy v domácnosti a společně s Rosou utíkají do Kodaně, aby se jim vyplnily jejich společné sny. Suzie WashingtonRakousko 1997Režie: Florian Flicker87 min.německá verze, španělské titulkyHrají: Birgit Doll, August Zirner, Karl Ferdinand Kratzl, Wolfram Berger.Učitelka z východní Evropy, Nana Iaschwili, alias Suzie Washington, chce emigrovat do Ameriky, aby tam začla nový život. Při mezipřistání ve Vídni odhalí ale úřady její falešné vízum, zatknou ji a hodlají ji deportovat. Naně se podaří uprchnout a míří s dalšími cizinci s podobným osudem k hranici mezi Východem a Západem. Film získal cenu za nejlepší rakouský film roku 1998 a hlavní představitelka za nejlepší herečku na festivalu ve Fort Lauderdale.Červený trpaslíkBelgie, Francie, Itálie 1998Režie: Yvan Le Moine103 min.francouzská verze, anglické titulkyHrají: Jean-Yves Thual, Anita Ekberg, Dyna Gauzy, Michel Peyrelon, Arno Chevrier.Lucien Lhotte je liliput a pracuje v advokátní kanceláři, kde píše urážlivé dopisy k rozvodovým řízením. Sám nepoznal lásku, a tak alespoň zatrpkle rozbíjí cizí manželství. Jednoho dne se stane milencem zvrhlé bohaté klientky, nakonec však stejně zjišťuje, že obři mezi sebe trpaslíka nikdy nepřijmou.Snímek byl vyznamenán cenami na festivalech v Monctonu, Pescaře a Kyjevě. Získal také Evropskou filmovou cenu za nejlepší kameru.PokušeníPortugalsko, Brazílie 1997Režie: Joaquim Leitao115 min.portugalská verze, anglické titulkyHrají: Joaquim de Almeida, Cristina Câmara, Diogo Infante, Sofial Leite.Katolický kněz klidného městečka Vila Daires na severu Portugalska se potýká se svými vnitřní konflikty, které se objevily poté, co poznal Lenu, černou ovci v jinak tichém a klidném společenství. Kněz, do té doby zcela oddaný svému poslání, teprve nyní zjišťuje, že vůbec něco takového jako touha existuje.Já šéf, ty teniskaNěmecko 1997Režie: Hussi Kutlucan90 min.německá verze, bez titulkůHrají: Hussi Kutlucan, Wiebke Inn, Senta Moira, Jules Grund.Tragikomický příběh Arména Dudieho, který se svou dívkou Nanií usadí v Německu. Jen co přijedou do Hamburku, Nanie mu uteče se svým novým německým přítelem a chce si ho vzít. Dudie odjíždí do Berlína, ale ani tam ho smůla neopouští a vzápětí se zaplete do stávky, s bývalou manželkou svého šéfa, policií a neodbytnou sousedkou.Režisér a představitel hlavní role Hussi Kutlucan líčí těžký úděl utečenců, který zná ze své vlastní zkušenosti.Ohnivý jezdecNěmecko, Francie, Polsko 1998Režie: Nina Grosse130 min.německá verze, anglické titulkyHrají: Martin Feifel, Marianne Denicourt, Ulrich Matthes.Romantický básník Friedrich Hölderin je na doporučení svého přítele a tajného ctitele barona von Sinclaira přijat jako učitel u bankovního magnáta Gontarda. Tam se zamiluje do paní domu Sussett a tajně se s ní schází. Žárlivý von Sinclair to prozradí Gontardovi, který Hölderina okamžitě propustí. Citlivý básník, sužován svou vášní pro poezii, Sussett a neodbytností svého ctitele rezignuje na realitu a v šestatřicetiletech odchází do konce života do blázince.SuperhvězdyNizozemí 1997Režie: Jean van der Velde105 min.nizozemská verze, anglické titulkyHrají: Antonie Kamerling, Danny de Munk, Daniel Boissevain, Paul Muller.Skupina přátel spolu již od dětství tvoří fotbalový tým. Nyní, po x letech, je pro ně stále složitější setkat se k pravidelným zápasům. Někteří jsou již ženatí, jiní mají problém s těhotnou přítelkyní, svou sexuální orientací nebo rodiči. Večer před jubilejním 500. utkáním začnou pochybovat, proč jsou vůbec přáteli a zda mají ještě dnes něco společného.Superhvězdy byly v Holandsku nejnavštěvovanějším filmem roku 1997.Vedlejší cestyŠpanělsko 1997Režie: Emilio Martínez Lázaro108 min.španělská verze, anglické titulkyHrají: Antonio Resines, Fernando Ramallo, Maribel Verdú, Miriam Díaz Daroca.Road-movie o cestě Lozana se synem Felipem po španělském pobřeží. Cestují luxusním Citroenem, poslední vzpomínkou na zašlé lepší časy, po odlehlých silničkách a zjišťují, že si vůbec nerozumí a že se ten rozdíl mezi nimi s přibývajícími kilometry jen prohlubuje. Zamotaná linka příběhu směřuje přes komické i srdcervoucí situace k nečekanému konci. Láska prokletáVelká Británie 1998Režie: John Maybury90 min.anglická verze bez titulkůHrají: Derek Jacobi, Daniel Craig, Tilda Swinton.Malír Francis Bacon přijíždí v roce 1971 do Paříže, kde se koná velká retrospektiva výtvarného umění 20.století, jehož je významnou součástí. Zatímco se Bacon účastní slavnostního ceremoniálu, konzumuje v hotelovém pokoji jeho milenec a model George Dryer smrtelnou dávku drog a alkoholu. Film vypráví celý příběh tragického milostného vztahu mezi Baconem a Dryerem na pozadí bohémské společnosti londýnské čtvrti Soho.Gádžo dilo Francie 1997Režie: Tony Gatlif100 min.romsko-rumunsko-francouzská verze, české titulkyHrají: Romain Duris, Rona Hartner, Izidor Serban.Stephane pátrá v Rumunsku po rómské zpěvačce, jejíž kazetu mu předal jeho umírající otec. Stále však nenachází žádné stopy, až se jednoho dne setká s Izidorem, který ho zavede do klasické rómské osady a ukáže mu zcela jiný způsob života. Stephane získá přes počáteční bariéry důvěru místních obyvatel a žije s nimi, jako by byl jedním z nich. Právě proto mu přezdívají bláznivý gádžo\", ze zkušeností totiž vědí, že se tak normální\" bílý nechová. Záběr z holandského filmu Superhvězdy Záběr z finského filmu Báječné ženy u vody Záběr ze španělského filmu Vedlejší cesty Záběr z francouzského filmu Gádžo dilo Záběr z francouzského filmu Gádžo dilo Záběr z britského filmu Láska je prokletá Záběr německo francouzsko polského filmu Ohnivý jezdec Záběr z portugalsko brazilského filmu Pokušení Záběr z německého filmu Já šéf, ty teniska Záběr z rakouského filmu Suzie Washington Záběr z belgicko francouzsko italského filmu Červený trpaslík"
        ]
    },
    {
        "user_input":"Shrň tento článek do stručného shrnutí.",
        "retrieved_contexts":[
            "Macela našel na Krulově výkonu ještě další drobné chyby, po shlédnutí videa však nesouhlasil s všeobecným názorem většiny odborníků a fotbalové veřejnosti, že sudí Spartě stranil většinu zápasu, a že ovlivnil výsledek v její prospěch. \"Co to je, ovlivnění výsledku? Já takový termín neznám,\" hrál si Macela v prosinci na mrtvého brouka. \"Na Krulovo vyhození z listiny rozhodčích to ale určitě není,\" reagoval dále šéf sudích na doporučení delegáta svazu Ladislava Vízka, jenž sice zápas na Žižkově na vlastní oči neviděl, ale byl zcela v obraze po konzultaci s experty, kteří Krulův výkon sledovali přímo na stadionu. \"Jestli si členové komise rozhodčích chtějí zachovat tvář, musí Krulu velmi tvrdě potrestat,\" poznamenal k zápasu znalec z nejpovolanějších, internacionál a trenér Tomáš Pospíchal, jenž Krulovu podivnému představení přihlížel v hledišti. Macelova prosincová zatvrzelost šla tak daleko, že Vízkovi, bývalému spoluhráči z Dukly, dokonce pohrozil disciplinární komisí. Po pár dnech ale na přímý dotaz odpověděl, že o ničem neví. Vízek totiž mimo jiné spekuloval o tom, že Krulův výkon vyvolával podezření, že by mohl být podplacený. \"Jsem přesvědčen, že rozhodčí podpláceni nejsou,\" řekl tehdy Macela. Zároveň však mnohoznačně nastínil: \"Ale nejrůznější tlaky od klubových funkcionářů právě na rozhodčí si představit dovedu.\" Sice neupřesnil, co těmito tlaky myslí, avšak tím pádem Vízek alespoň nezůstal se svými podezřeními tak úplně osamocen. Samotný zápas na Žižkově musel zákonitě vyvolat zdání, že tlak sparťanských funkcionářů na Krulu byl enormní. Je nasnadě, že verdiktu komise bude odpovídat průběh jarní ligy. Z Krulova trestu si vezmou poučení ostatní sudí i kluboví činovníci. Zamnou si všichni rukama, nebo vyhlásí stav ohrožení?"
        ],
        "response":"Soudce Krulovy výkon na zápasу Spartanky proti Mladé Bolesnici byl kritizován jako nedůvěryhodný a pravděpodobně podplaceny, což vedlo k velkým tlakům od klubového vedení. Šéf sudí Ladislaus Vízek však odmítal podezřívat o podplatách a upozorňoval, že existuje riziko tlaku od funkcionárů, které může vést k diskriminaci.",
        "reference":"Komise rozhodčích Českomoravského fotbalového svazu dnes rozhodne o výši trestu pro sudího Josefa Krulu. Tento rozhodčí loni 4. prosince řídil ligový zápas 16. kola Žižkov - Sparta (2:3), který hrubým způsobem ovlivnil ve prospěch hostí. \"Krula měl ve čtyřiaosmdesáté minutě zapískat penaltu proti Spartě, tím spíš, když za podobný zákrok ji předtím zapískal proti Žižkovu,\" prohlásil 14. prosince po jednání komise rozhodčích její předseda Luděk Macela, který tehdy případ odložil na 11. ledna s tím, že tři členové komise dosud nezhlédli videozáznam utkání",
        "reference_contexts":[
            "Macela našel na Krulově výkonu ještě další drobné chyby, po shlédnutí videa však nesouhlasil s všeobecným názorem většiny odborníků a fotbalové veřejnosti, že sudí Spartě stranil většinu zápasu, a že ovlivnil výsledek v její prospěch. \"Co to je, ovlivnění výsledku? Já takový termín neznám,\" hrál si Macela v prosinci na mrtvého brouka. \"Na Krulovo vyhození z listiny rozhodčích to ale určitě není,\" reagoval dále šéf sudích na doporučení delegáta svazu Ladislava Vízka, jenž sice zápas na Žižkově na vlastní oči neviděl, ale byl zcela v obraze po konzultaci s experty, kteří Krulův výkon sledovali přímo na stadionu. \"Jestli si členové komise rozhodčích chtějí zachovat tvář, musí Krulu velmi tvrdě potrestat,\" poznamenal k zápasu znalec z nejpovolanějších, internacionál a trenér Tomáš Pospíchal, jenž Krulovu podivnému představení přihlížel v hledišti. Macelova prosincová zatvrzelost šla tak daleko, že Vízkovi, bývalému spoluhráči z Dukly, dokonce pohrozil disciplinární komisí. Po pár dnech ale na přímý dotaz odpověděl, že o ničem neví. Vízek totiž mimo jiné spekuloval o tom, že Krulův výkon vyvolával podezření, že by mohl být podplacený. \"Jsem přesvědčen, že rozhodčí podpláceni nejsou,\" řekl tehdy Macela. Zároveň však mnohoznačně nastínil: \"Ale nejrůznější tlaky od klubových funkcionářů právě na rozhodčí si představit dovedu.\" Sice neupřesnil, co těmito tlaky myslí, avšak tím pádem Vízek alespoň nezůstal se svými podezřeními tak úplně osamocen. Samotný zápas na Žižkově musel zákonitě vyvolat zdání, že tlak sparťanských funkcionářů na Krulu byl enormní. Je nasnadě, že verdiktu komise bude odpovídat průběh jarní ligy. Z Krulova trestu si vezmou poučení ostatní sudí i kluboví činovníci. Zamnou si všichni rukama, nebo vyhlásí stav ohrožení?"
        ]
    },
    {
        "user_input":"Shrň tento článek do stručného shrnutí.",
        "retrieved_contexts":[
            "Vedle Bulharska, S. Irska a Malty jsou našimi dalšími soupeři ve skupině Dánsko a Island. Chovanec zatím stále ještě nemá prodlouženou smlouvu na nový kvalifikační cyklus. S předsedou ČMFS Františkem Chvalovským by se měl sejít 21. ledna, ale sám říká, že podpis smlouvy je jen formalitou. Čtvrtého února odletí reprezentační mužstvo na turnaj do Hongkongu a Chovanec by prý s sebou rád vzal co nejsilnější výběr. \"Ale většiny legionářů se budu muset vzdát, protože jim pokračují ligové soutěže, a nechceme zbytečně čerpat kvótu, na niž jsou kluby povinny hráče uvolnit,\" řekl Chovanec a potvrdil tak, že většinu ve výpravě do Hongkongu budou tvořit hráči z domácí soutěže. Ani s nimi to však nebude tak jednoduché, neboť ve stejném termínu vrcholí herní příprava v klubech a většina mužstev bude na zahraničním soustředění. \"V klubech to ale věděli dopředu a musejí s tím počítat,\" odmítl Chovanec úvahy na téma, že se kluby budou bránit své hráče uvolnit. V jarních přípravných zápasech čeká české fotbalisty v únoru Irsko venku a v březnu Austrálie doma. Dubnový termín stále zůstává volný, Řekové, kteří měli zájem, odřekli. Generálkou na ME bude 3. června zápas s Německem, ale zatím není jisté, kde se bude hrát. Závěrečnou přípravu na fotbalové mistrovství Evropy absolvují čeští reprezentanti pravděpodobně ve švýcarském St. Gallenu, kde se před čtyřmi lety chystali na EURO v Anglii. O prostředí ve Švýcarsku, kde v roce 1996 začala pro Uhrinův výběr cesta ke stříbrným medailím, slyšel Chovanec vyprávět v superlativech. Příští měsíc se kouč do St. Gallenu vypraví sám, aby se přesvědčil na vlastní oči, a pak se definitivně rozhodne."
        ],
        "response":"Česká fotbalová reprezentace se připravuje na fotbalový mistrovský turnaj Evropy v Hongkong, kde bude v rámci kvalifikace bojovat proti Dánskemu, Islandu, Bulgarii, Sýrii a Malta. Předseda Českého federálního míčového svazu František Chvalovec tvrdí, že smluvní podmínky pro tento cyklus nejsou splněny, avšak reprezentantům se bude muset účastnit i bez dlouhodobé smlouvky.\n\nGenerálna reprezent",
        "reference":"Už příští úterý přijedou do Prahy představitelé pěti fotbalových svazů, jejichž týmy byly při prosincovém losování v Tokiu zařazeny do stejné kvalifikační skupiny MS 2002 jako čeští reprezentanti. Tématem schůzky bude vytvoření kalendáře zápasů. Chovanec nastínil své představy: začít by chtěl v září v Bulharsku a během podzimu odehrát ještě zápasy v Severním Irsku a doma s Maltou",
        "reference_contexts":[
            "Vedle Bulharska, S. Irska a Malty jsou našimi dalšími soupeři ve skupině Dánsko a Island. Chovanec zatím stále ještě nemá prodlouženou smlouvu na nový kvalifikační cyklus. S předsedou ČMFS Františkem Chvalovským by se měl sejít 21. ledna, ale sám říká, že podpis smlouvy je jen formalitou. Čtvrtého února odletí reprezentační mužstvo na turnaj do Hongkongu a Chovanec by prý s sebou rád vzal co nejsilnější výběr. \"Ale většiny legionářů se budu muset vzdát, protože jim pokračují ligové soutěže, a nechceme zbytečně čerpat kvótu, na niž jsou kluby povinny hráče uvolnit,\" řekl Chovanec a potvrdil tak, že většinu ve výpravě do Hongkongu budou tvořit hráči z domácí soutěže. Ani s nimi to však nebude tak jednoduché, neboť ve stejném termínu vrcholí herní příprava v klubech a většina mužstev bude na zahraničním soustředění. \"V klubech to ale věděli dopředu a musejí s tím počítat,\" odmítl Chovanec úvahy na téma, že se kluby budou bránit své hráče uvolnit. V jarních přípravných zápasech čeká české fotbalisty v únoru Irsko venku a v březnu Austrálie doma. Dubnový termín stále zůstává volný, Řekové, kteří měli zájem, odřekli. Generálkou na ME bude 3. června zápas s Německem, ale zatím není jisté, kde se bude hrát. Závěrečnou přípravu na fotbalové mistrovství Evropy absolvují čeští reprezentanti pravděpodobně ve švýcarském St. Gallenu, kde se před čtyřmi lety chystali na EURO v Anglii. O prostředí ve Švýcarsku, kde v roce 1996 začala pro Uhrinův výběr cesta ke stříbrným medailím, slyšel Chovanec vyprávět v superlativech. Příští měsíc se kouč do St. Gallenu vypraví sám, aby se přesvědčil na vlastní oči, a pak se definitivně rozhodne."
        ]
    },
    {
        "user_input":"Shrň tento článek do stručného shrnutí.",
        "retrieved_contexts":[
            "Rozhodnutí soudu však neznamená, že s penězi a majetkem může ČSSD okamžitě disponovat. Obecné soudy musí totiž ve sporu rozhodnout znovu, avšak v souladu s názorem Ústavního soudu. Jádro sporu spočívalo mimo jiné i v tom, jestli současná ČSSD je pokračovatelkou exilové a předválečné strany. \"ČSSD nelze upřít důvodnost tvrzení, že byla v roce 1948 umlčena násilím a že jistá část stranické základny se ukryla v zahraničí, aby v činnosti mohla pokračovala,\" řekl soudce Ústavního soudu Vlastimil Ševčík. Potvrdil tím, že Ústavní soud uznává kontinuitu mezi někdejší a současnou ČSSD. \"Rozhodnutí soudu beru jako hluboké zadostiučení, neboť to není rozhodnutí jenom ve věci soukromé, ale je to spravedlivé zvážení celé poválečné historie Československé repbuliky a českého státu. Znamená to alespoň pro mne hluboké zadostiučení,\" prohlásil po vynesení rozsudku místopředseda strany Vladimír Špidla a dodal: \"A myslím, že i pro všechny sociální demokraty.\""
        ],
        "response":"Soudní rozhodnutí potvrzuje kontinuity mezi exilovou a současnou ČSSDs, čímž uznává její původní důvodnosti a historický význam. Místopředsedou strany Vladislav Špidlou byl tento zápis vnímán jako hloubkové zadostioučení pro celou poválečnou historii a pro všechny socialisty.",
        "reference":"Ústavní soud v Brně rozhodl, že ČSSD je právoplatným vlastníkem Lidového domu v centru Prahy. Rozhodnutí soudu znamená, že všechny předchozí verdikty obecných soudů, které sociální demokracii právo na budovu upíraly, jsou neplatné. Vítězství u Ústavního soudu otevírá ČSSD i cestu k přibližně 180 milionům korun za pronájem objektu, které kvůli sporu odcházely na blokovaný účet",
        "reference_contexts":[
            "Rozhodnutí soudu však neznamená, že s penězi a majetkem může ČSSD okamžitě disponovat. Obecné soudy musí totiž ve sporu rozhodnout znovu, avšak v souladu s názorem Ústavního soudu. Jádro sporu spočívalo mimo jiné i v tom, jestli současná ČSSD je pokračovatelkou exilové a předválečné strany. \"ČSSD nelze upřít důvodnost tvrzení, že byla v roce 1948 umlčena násilím a že jistá část stranické základny se ukryla v zahraničí, aby v činnosti mohla pokračovala,\" řekl soudce Ústavního soudu Vlastimil Ševčík. Potvrdil tím, že Ústavní soud uznává kontinuitu mezi někdejší a současnou ČSSD. \"Rozhodnutí soudu beru jako hluboké zadostiučení, neboť to není rozhodnutí jenom ve věci soukromé, ale je to spravedlivé zvážení celé poválečné historie Československé repbuliky a českého státu. Znamená to alespoň pro mne hluboké zadostiučení,\" prohlásil po vynesení rozsudku místopředseda strany Vladimír Špidla a dodal: \"A myslím, že i pro všechny sociální demokraty.\""
        ]
    },
    {
        "user_input":"Shrň tento článek do stručného shrnutí.",
        "retrieved_contexts":[
            "Komise na svém dnešním zasedání vytkla Krulovi nejednotné posuzování držení v pokutovém území a neudělení karet za nesportovní chování hráčů. Známku delegáta pět snížila na čtyři, která značí neuspokojivý výkon. \"V řadě případů si nedokázal na hřišti zjednat pořádek, třeba po odpískání penalty měl rozdat žluté karty za nesportovní chování,\" zdůvodnil trest předseda komise rozhodčích Luděk Macela. Dodal, že Krula bude po skončení trestu nasazován na zápasy druhé ligy. \"A pokud dokáže, že jeho výkonnost patří výš, tak se může vrátit,\" uvedl Macela. Pět hlavních rozhodčích první a druhé ligy dnes komise přeřadila na listinu asistentů, naopak čtyři dosavadní asistenti a sudí Kafka z ČFL budou napříště hlavními. Macela však jména rozhodčích, kteří přišli o post hlavních, ani postupujících asistentů zatím nechtěl prozradit. \"Zatím to nevědí ani oni sami, veřejnosti je prozradíme za dva dny,\" uvedl šéf komise rozhodčích."
        ],
        "response":"Komise rozhodců v Praze na svom zasedании vytkl Luděku Maceli nejednohodnotné postavení a nedostatečné tresty za nespolupráci hráčků. Trest delegátiho Kruly byl snížen z pěti na čtyřku, což znamená neuspokojitelný výkon, a on bude nasazen do druhé ligové sezóny. Hlavní rozhodcové a asistenté jsou nyní přerozdeleni mezi novou a starší generaci, jejichž přesná slo",
        "reference":"Komise rozhodčích Českomoravského fotbalového svazu potrestala sudího Josefa Krulu zastavením činnosti na pět utkání za chyby, kterých se dopustil v zápasu 16. kola první ligy mezi Viktorií Žižkov a Spartou. V jarní části sezóny navíc Krula nebude nasazován v zápasech nejvyšší soutěže",
        "reference_contexts":[
            "Komise na svém dnešním zasedání vytkla Krulovi nejednotné posuzování držení v pokutovém území a neudělení karet za nesportovní chování hráčů. Známku delegáta pět snížila na čtyři, která značí neuspokojivý výkon. \"V řadě případů si nedokázal na hřišti zjednat pořádek, třeba po odpískání penalty měl rozdat žluté karty za nesportovní chování,\" zdůvodnil trest předseda komise rozhodčích Luděk Macela. Dodal, že Krula bude po skončení trestu nasazován na zápasy druhé ligy. \"A pokud dokáže, že jeho výkonnost patří výš, tak se může vrátit,\" uvedl Macela. Pět hlavních rozhodčích první a druhé ligy dnes komise přeřadila na listinu asistentů, naopak čtyři dosavadní asistenti a sudí Kafka z ČFL budou napříště hlavními. Macela však jména rozhodčích, kteří přišli o post hlavních, ani postupujících asistentů zatím nechtěl prozradit. \"Zatím to nevědí ani oni sami, veřejnosti je prozradíme za dva dny,\" uvedl šéf komise rozhodčích."
        ]
    },
    {
        "user_input":"Shrň tento článek do stručného shrnutí.",
        "retrieved_contexts":[
            "Několik komentářů k mapě - Český Mobil mapu publikuje poněkud střízlivěji, než je v těchto krajích zvykem a tak do prvního kvartálu (tedy s pokrytím na březen 2000) nejsou zahrnuta i některá města, která již dnes jsou pokryta - například Pardubice či Chrudim v mapě jsou braná jako nepokrytá. Také vás možná zaujme světlá dělící čára - ta vymezuje oblasti působnosti Siemensu (západ) a Ericssonu (východ)."
        ],
        "response":"Český mobil oznámil pokles v rychlosti aktualizace své mapy, což vede k tomu, že města jako PardubICE nebo ChrudIM jsou v prvním kvartále roku 2.00 stále označena jako neprokryté. Zároveň se zmínili o světelném rozdělení oblastí působnosti mezi firmy Siemens a Ericson.",
        "reference":"Jaké pokrytí Český Mobil plánuje? Podívejme se do mapy pokrytí",
        "reference_contexts":[
            "Několik komentářů k mapě - Český Mobil mapu publikuje poněkud střízlivěji, než je v těchto krajích zvykem a tak do prvního kvartálu (tedy s pokrytím na březen 2000) nejsou zahrnuta i některá města, která již dnes jsou pokryta - například Pardubice či Chrudim v mapě jsou braná jako nepokrytá. Také vás možná zaujme světlá dělící čára - ta vymezuje oblasti působnosti Siemensu (západ) a Ericssonu (východ)."
        ]
    },
    {
        "user_input":"Shrň tento článek do stručného shrnutí.",
        "retrieved_contexts":[
            "Nabídku Projektu 100 2000 tvoří opět filmy, které je možné z různých důvodů považovat za důležité v rámci vývoje celosvětové kinematografie. Nemusí se jednat o stěžejní či průlomové snímky, každopádně si však vybraná díla postupem času získala určitou popularitu a obestřela se kultovním oparem. Další společnou vlastností deseti filmů je skutečnost, že ač některé vznikly již před několika desetiletími, stále je tuzemský divák na plátnech kin nemohl spatřit. Jiří Králík, který je autorem celého projektu a de facto sestavuje výběr uváděných snímků, se tak snaží vyplnit mezery českých a slovenských diváků, které vznikly čtyřicetiletou ideologickou blokádou. Letos ke světové desítce přibyla ještě jedna tuzemská klasika, celovečerní loutkový film Jiřího Trnky Sen noci svatojánské z roku 1959. SatyriconItálie 1969, 138 min.Režie: Federico Fellini, scénář: Federico Fellini, Bernardino Zapponi, kamera: Giuseppe Rotunno, hrají: Martin Potter, Hiram Keller, Max Born, Fanfula, Salvo RandoneFelliniho snímek vychází ze zlomků Satyriconu, mravokárného díla, které sepsal Petronius v prvním století na dvoře císaře Nerona. Snímek zachycuje v metaforách a podobenstvích úpadek kdysi blahobytné společnosti a ve své době vyvolal značný rozruch tabuizovanými tématy, především homosexualitou nebo šokujícími brutálními scénami. DekameronItálie 1970, 111 min.Režie a scénář: Pier Paolo Pasolini, kamera: Tonino Delli Colli, hrají: Franco Citti, Ninetto Davoli, Jovan Jovanovich, Angela Luceová, Patrizia CapperelliováSpolu s Canteburskými povídkami a Kyticí z tisíce a jedné noci tvoří Dekameron takzvanou Trilogii života, v níž se Passolini zaměřuje na nejnižší lidovou vrstvu a na fenomén, který nazývá lidovým živlem. Značně originální interpretace Bocacciova díla odhaluje náboženské pokrytectví, tupou nadřazenost a rasismus středověké aristokracie.Muž který spadl na ZemiVelká Británie 1976, 140 min.Režie: Nicolas Roeg, scénář: Paul Mayersberg, kamera: Anthony Richmond, hrají: David Bowie, Rip Torn, Candy Clarková, Buck Henry, Bernie Casey, Jackson CaneSci-fi o humanoidním mimozemšťanovi Thomasovi Newtonovi, který přiletěl na Zemi kvůli vodě, která jeho domovské planetě tragicky chybí. Newton se ocitá úplně sám ve světě, který znal až dosud jen z televize, kterou sledoval patnáct let. Najednou se sám uprostřed zdánlivě bezproblémové americké společnosti cítí úzkostně a vykořeněn a hledá únik právě v idealizující televizi a v zautomatizovaném sexu. Thomas Newton byl první filmovou rolí Davida Bowieho. Láska prokletáVelká Británie 1998, 90 min.Režie a scénář: John Maybury, kamera: John Mathieson , hrají: Derek Jacobi, Daniel Craig, Tilda SwintonMalíř Francis Bacon přijíždí v roce 1971 do Paříže, kde se koná velká retrospektiva výtvarného umění 20.století, jehož je významnou součástí. Zatímco se Bacon účastní slavnostního ceremoniálu, konzumuje v hotelovém pokoji jeho milenec a model George Dryer smrtelnou dávku drog a alkoholu. Film vypráví celý příběh tragického milostného vztahu mezi Baconem a Dryerem na pozadí bohémské společnosti londýnské čtvrti Soho.Věčnost a denŘecko- Francie – Itálie – Německo 1998, 133 min.Režie a scénář: Theo Angelopulos, spolupráce na scénáři: Tonino Guerra, Petros Markaris, kamera: Giorgos Arvantis, Andreas Sinanos, hrají: Bruno Ganz, Vassilis Seimenis, Isabelle Renauldová, Achilleas SkevisTěžce nemocný básník Alexander má už pouze jediný den, aby dal své věci do pořádku a mohl v klidu umřít. Tento poslední den svého života bilancuje, vzpomíná a snaží se dokončit epos básníka Dionýsia Solomose, jak si kdysi předsevzal. Náhodou však zachrání albánského chlapce před policií a obchodníky s dětmi a smiřuje se tak se svým okolím a se sebou samým.Pod sluncem SatanovýmFranice 1987, 103 min.Režie: Maurice Pialat, scénář: Sylvie Dantonová, Maurice Pialat, kamera: Gil Noir, hrají: Gérard Depardieu, Sandrine Bonnaireová, Maurice pialat, Alain Artur, Yann DedetAdaptace románu Georgese Bernanose. Venkovský farář Donissan vede ve svém deníku těžký vnitřní zápas mezi hmotou a duchem. Pochybnosti o existenci boha střídá víra v ďáblovu moc. Asketickým životem se snaží bojovat s vnitřní nejistotou a pochybnostmi. Od sebemrskačství však postupně přechází do otevřeného boje proti zlu. KlíčÍrán 1986, 70 min.Režie: Ebráhím Forúzeš, scénář: Abbás Kiárostamí, kamera: Mohammad Alad-Púš, hrají: Amír Mohammad Hassan-Púr, Emád Táherí, Mahnáz AnsárjánČtyřletý Amír Mohammad zůstane se svým šestiměsíčním sourozencem sám v bytě. Všechny nastalé problémy dokáže vyřešit sám, jak se ale vypořádá s jedním, způsobí tím vždy další. Poté, co začne unikat plyn, snaží se oba dostat ven, klíč jim však spadne pod uzamčené dveře. Malý chlapec však nepropadá zoufalství a řeší jeden problém za druhým.JuhaFinsko 1998, 78 min.Režie, scénář: Aki Kaurismaki, kamera: Timo Salminen, hrají: Sakari Kuosmanen, Kati Outinenová, André Wilms, Markku Peltola, Elina Salová\"Poslední němý film druhého tisíciletí.\" Další zfilmování románu Juhani Ahoa vypráví příběh klasického milostného trojúhelníku v prostředí malé skandinávské vesničky. Kaurismakiho pocta němému filmu 20. let využívá většinu výrazových prostředků této éry, včetně zatmívaček, mezititulků a přehnaných hereckých gest.Sud prachuJugoslávie 1998, 100 min.Režie: Goran Paskaljevič, scénář: Goran Paskaljevič, Dejan Dukovski, kamera: Milan Spasič, hrají: Aleksander Berček, Nebojša Glogovac, Bogdan Diklič, Mirjana Karanovičová, Miki ManojlovičSnímek se odehrává během čtyřiadvaceti hodin v Bělehradě v době krvavého válečného konfliktu. Paskaljevič se velmi sugestivně zamýšlí nad tím, jak mohla tato bratrovražedná nenávist vůbec vzniknout a stále přetrvávat. Celý příběh se postupně mozaikovitě skládá z dvanácti epizod, které zažil jeden mladý taxikář. Tři sezónyUSA-Vietnam 1999, 113 min.Režie a scénář: Tony Bui, kamera: Lisa Rinzlerová, hrají: Don Duong, Nguyen Ngoc Hiep, Tran Manh Cuong, Harvey Keitel, Zoe Buiová, Ngyuen Huu DuocNízkorozpočtový snímek amerického režiséra vietnamského původu je prvním americkým filmem natočeným přímo ve Vietnamu, a to dokonce ve spolupráci s tamním státním studiem. Možná právě proto se vyhýbá jakémukoliv politizování a soustřeďuje se jen na příběhy hlavních postav. Čtyři povídky, o prodavačce lotosových květů, prostitutce, prodavači suvenýrů a americkém vojákovi, který hledá svou dceru, se odehrávají během tří sezón – období sucha, dešťů a vegetace."
        ],
        "response":"Projekt 1 002 0 0 je výběrem deseti tuzemských filmů, jejichž tvorba byla možná jen díky tomu, že diváci v minulosti neviděli tyto díly. Jednotlivé projekty zahrnují řadu klasiků jako Jiří Trnka, Federico Felliniová a Pier Paolo Passoliniová.",
        "reference":"Třináctého ledna odstartuje v pražské Městské knihovně další, již šestá část unikátní filmové přehlídky Projekt 100. Společná akce Asociací českých a slovenských filmových klubů a Městských divadel v Uherském Hradišti se zrodila před čtyřmi lety při příležitosti stého výročí vzniku kinematografie, nyní se s šestou desítkou filmů dostává již do své druhé poloviny",
        "reference_contexts":[
            "Nabídku Projektu 100 2000 tvoří opět filmy, které je možné z různých důvodů považovat za důležité v rámci vývoje celosvětové kinematografie. Nemusí se jednat o stěžejní či průlomové snímky, každopádně si však vybraná díla postupem času získala určitou popularitu a obestřela se kultovním oparem. Další společnou vlastností deseti filmů je skutečnost, že ač některé vznikly již před několika desetiletími, stále je tuzemský divák na plátnech kin nemohl spatřit. Jiří Králík, který je autorem celého projektu a de facto sestavuje výběr uváděných snímků, se tak snaží vyplnit mezery českých a slovenských diváků, které vznikly čtyřicetiletou ideologickou blokádou. Letos ke světové desítce přibyla ještě jedna tuzemská klasika, celovečerní loutkový film Jiřího Trnky Sen noci svatojánské z roku 1959. SatyriconItálie 1969, 138 min.Režie: Federico Fellini, scénář: Federico Fellini, Bernardino Zapponi, kamera: Giuseppe Rotunno, hrají: Martin Potter, Hiram Keller, Max Born, Fanfula, Salvo RandoneFelliniho snímek vychází ze zlomků Satyriconu, mravokárného díla, které sepsal Petronius v prvním století na dvoře císaře Nerona. Snímek zachycuje v metaforách a podobenstvích úpadek kdysi blahobytné společnosti a ve své době vyvolal značný rozruch tabuizovanými tématy, především homosexualitou nebo šokujícími brutálními scénami. DekameronItálie 1970, 111 min.Režie a scénář: Pier Paolo Pasolini, kamera: Tonino Delli Colli, hrají: Franco Citti, Ninetto Davoli, Jovan Jovanovich, Angela Luceová, Patrizia CapperelliováSpolu s Canteburskými povídkami a Kyticí z tisíce a jedné noci tvoří Dekameron takzvanou Trilogii života, v níž se Passolini zaměřuje na nejnižší lidovou vrstvu a na fenomén, který nazývá lidovým živlem. Značně originální interpretace Bocacciova díla odhaluje náboženské pokrytectví, tupou nadřazenost a rasismus středověké aristokracie.Muž který spadl na ZemiVelká Británie 1976, 140 min.Režie: Nicolas Roeg, scénář: Paul Mayersberg, kamera: Anthony Richmond, hrají: David Bowie, Rip Torn, Candy Clarková, Buck Henry, Bernie Casey, Jackson CaneSci-fi o humanoidním mimozemšťanovi Thomasovi Newtonovi, který přiletěl na Zemi kvůli vodě, která jeho domovské planetě tragicky chybí. Newton se ocitá úplně sám ve světě, který znal až dosud jen z televize, kterou sledoval patnáct let. Najednou se sám uprostřed zdánlivě bezproblémové americké společnosti cítí úzkostně a vykořeněn a hledá únik právě v idealizující televizi a v zautomatizovaném sexu. Thomas Newton byl první filmovou rolí Davida Bowieho. Láska prokletáVelká Británie 1998, 90 min.Režie a scénář: John Maybury, kamera: John Mathieson , hrají: Derek Jacobi, Daniel Craig, Tilda SwintonMalíř Francis Bacon přijíždí v roce 1971 do Paříže, kde se koná velká retrospektiva výtvarného umění 20.století, jehož je významnou součástí. Zatímco se Bacon účastní slavnostního ceremoniálu, konzumuje v hotelovém pokoji jeho milenec a model George Dryer smrtelnou dávku drog a alkoholu. Film vypráví celý příběh tragického milostného vztahu mezi Baconem a Dryerem na pozadí bohémské společnosti londýnské čtvrti Soho.Věčnost a denŘecko- Francie – Itálie – Německo 1998, 133 min.Režie a scénář: Theo Angelopulos, spolupráce na scénáři: Tonino Guerra, Petros Markaris, kamera: Giorgos Arvantis, Andreas Sinanos, hrají: Bruno Ganz, Vassilis Seimenis, Isabelle Renauldová, Achilleas SkevisTěžce nemocný básník Alexander má už pouze jediný den, aby dal své věci do pořádku a mohl v klidu umřít. Tento poslední den svého života bilancuje, vzpomíná a snaží se dokončit epos básníka Dionýsia Solomose, jak si kdysi předsevzal. Náhodou však zachrání albánského chlapce před policií a obchodníky s dětmi a smiřuje se tak se svým okolím a se sebou samým.Pod sluncem SatanovýmFranice 1987, 103 min.Režie: Maurice Pialat, scénář: Sylvie Dantonová, Maurice Pialat, kamera: Gil Noir, hrají: Gérard Depardieu, Sandrine Bonnaireová, Maurice pialat, Alain Artur, Yann DedetAdaptace románu Georgese Bernanose. Venkovský farář Donissan vede ve svém deníku těžký vnitřní zápas mezi hmotou a duchem. Pochybnosti o existenci boha střídá víra v ďáblovu moc. Asketickým životem se snaží bojovat s vnitřní nejistotou a pochybnostmi. Od sebemrskačství však postupně přechází do otevřeného boje proti zlu. KlíčÍrán 1986, 70 min.Režie: Ebráhím Forúzeš, scénář: Abbás Kiárostamí, kamera: Mohammad Alad-Púš, hrají: Amír Mohammad Hassan-Púr, Emád Táherí, Mahnáz AnsárjánČtyřletý Amír Mohammad zůstane se svým šestiměsíčním sourozencem sám v bytě. Všechny nastalé problémy dokáže vyřešit sám, jak se ale vypořádá s jedním, způsobí tím vždy další. Poté, co začne unikat plyn, snaží se oba dostat ven, klíč jim však spadne pod uzamčené dveře. Malý chlapec však nepropadá zoufalství a řeší jeden problém za druhým.JuhaFinsko 1998, 78 min.Režie, scénář: Aki Kaurismaki, kamera: Timo Salminen, hrají: Sakari Kuosmanen, Kati Outinenová, André Wilms, Markku Peltola, Elina Salová\"Poslední němý film druhého tisíciletí.\" Další zfilmování románu Juhani Ahoa vypráví příběh klasického milostného trojúhelníku v prostředí malé skandinávské vesničky. Kaurismakiho pocta němému filmu 20. let využívá většinu výrazových prostředků této éry, včetně zatmívaček, mezititulků a přehnaných hereckých gest.Sud prachuJugoslávie 1998, 100 min.Režie: Goran Paskaljevič, scénář: Goran Paskaljevič, Dejan Dukovski, kamera: Milan Spasič, hrají: Aleksander Berček, Nebojša Glogovac, Bogdan Diklič, Mirjana Karanovičová, Miki ManojlovičSnímek se odehrává během čtyřiadvaceti hodin v Bělehradě v době krvavého válečného konfliktu. Paskaljevič se velmi sugestivně zamýšlí nad tím, jak mohla tato bratrovražedná nenávist vůbec vzniknout a stále přetrvávat. Celý příběh se postupně mozaikovitě skládá z dvanácti epizod, které zažil jeden mladý taxikář. Tři sezónyUSA-Vietnam 1999, 113 min.Režie a scénář: Tony Bui, kamera: Lisa Rinzlerová, hrají: Don Duong, Nguyen Ngoc Hiep, Tran Manh Cuong, Harvey Keitel, Zoe Buiová, Ngyuen Huu DuocNízkorozpočtový snímek amerického režiséra vietnamského původu je prvním americkým filmem natočeným přímo ve Vietnamu, a to dokonce ve spolupráci s tamním státním studiem. Možná právě proto se vyhýbá jakémukoliv politizování a soustřeďuje se jen na příběhy hlavních postav. Čtyři povídky, o prodavačce lotosových květů, prostitutce, prodavači suvenýrů a americkém vojákovi, který hledá svou dceru, se odehrávají během tří sezón – období sucha, dešťů a vegetace."
        ]
    },
    {
        "user_input":"Shrň tento článek do stručného shrnutí.",
        "retrieved_contexts":[
            "Před krátkou dobou jsem popisoval program pro technické kreslení na Psionu. Jmenoval se CADmx. Tento program dokázal, že i na malých počítačích se dají dělat velké věci. Dnes je zde další takový program, který nám opětovně ukáže, jak se na malých strojích dělá velká grafika. Program, který je pro svět Psionu stejný jako Photoshop pro svět PC uvedla na trh firma PalmScape. Je jím editor Photo5, se kterým lze pracovat s fotografiemi téměř jako na PC. Program podporuje například i grafické formáty jpeg, bitmap a GIF (k importu těchto formátů je nutné mít registrovanou verzi MBMview). Načítat data lze ovšem také přímo z digitálního fotoaparátu. Někdo by mohl namítnout, že zde může být omezení velikosti obrázku, ale opak je pravdou. Samotní tvůrci programu hovoří o tom, že lze v Photo5 pracovat s obrázky i většími, než je 1200x1200 bodů. To nám dává dostatečně velký prostor pro práci s nimi. Ovšem nemyslím, že na Psionu 5 bychom chtěli pracovat s takovýmto obrázkem. Už jen menší displej, na kterém by bylo zapotřebí častého rolování je dosti omezujícím faktorem. Funkce programu: Kreslení Kreslení je řešeno velmi efektivně. Menu pro kreslení je dynamické a lze jej rozšiřovat například o vlastní nadefinované štětce. Při prvním spuštění programu je zde nadefinováno standardně 30 různých štětců, které lze doplňovat o vlastní. Při kreslení štětcem lze používat i různé styly, které lze rovněž individuálně modifikovat. V poslední verzi programu je i nový nástroj - Flood Fill. S ním je možné vyplňovat plochy barvou, či dokonce texturou, kterou si sami zvolíme. Editace Editace je jednou z hlavních částí tohoto programu. Photo5 zachovává až 20 obrazů v clipboardu. To umožňuje snadnou tvorbu komplexních kreseb pomocí clipboardu. S pomocí těchto \"vrstev\" lze obraz duplikovat, používat na jeho části různé masky a transformace. V tomto ohledu se práce v Photo5 podobá trochu práci v programu Photoshop. Nově zavedené jsou na kapesních počítačích FILTRY S filtry jsme byli zvyklí pracovat pouze na \"velkých\" počítačích, jak je dnes známe klasicky (bedna, obrazovka, klávesnice). S Photo5 se ovšem tato vlastnost přenáší i na kapesní počítače a tím je uvádí ještě hlouběji do světa digitálního zpracování obrazů. Photo5 podporuje většinu běžně používaných filtrů (Emboss, Solarize, Mosaic, Fracture, Warp, Line Art, Wave Distort,Pattern, Wet Glow, Charcoal). To je jen část filtrů, které lze použít ve Photo5. Animace S touto funkcí lze jednoduše vytvářet animace, které lze pak kompresovat, reverzně převracet, importovat z PC a dále exportovat. Jejich tvorba je poměrně jednoduchá. Buď stačí kopírovat frejmy do dalších a nebo vytvářet každý další frame zvlášť. Ve Photo5 jsou integrovány také předdefinované cesty nebo spíše pluginy, které vytvoří animaci objektu, který se odráží uvnitř určitého objektu od strany ke straně atd.... Plug-in Velkým plusem tohoto programu je také to, že je rozšiřitelný a modifikovatelný. Chybí vám zde něco? Není nic jednoduššího, než si potřebnou funkci vytvořit vlastnoručně. Pluginy, které jsou napsány dalšími lidmi nebo firmami mohou například podporovat BMP konverzi, Texture TV, sketch a jiné funkce. Mezi další funkce, které nyní Photo5 nově podporuje je vestavěný picture browser, což umožňuje rychle prohledávat v adresářích obrázky, takže se k nim zrychlí přístup. Dále program umožňuje kopírovat obrázky přímo do systémového clipboardu, takže je lze vkládat přímo do Wordu, či jiných aplikací. Tato funkce se typicky hodí pro vytváření prezentací. Od starších verzí se prý zvedla i nahrávací doba obrázků, která se pohybuje většinou v rozmezí několika málo sekund. Program lze stáhnout opět na stránkách výrobce (PalmScape) a nebo na našem serveru (Photo5). Registrace programu stojí 18 liber."
        ],
        "response":"Firma PalmSpace představila na trhu program Photo5 pro psionické stroje, který nabízí funkce editora PhotoShopu včetně možnosti pracovat se s obrázy až 1440×1400 pixelů, animacemi a rozšiřením pomocí plug-ínů.",
        "reference":"Program, který je pro svět Psionu stejný jako Photoshop pro svět PC uvedla na trh firma PalmScape. Je jím editor Photo5, se kterým lze pracovat s fotografiemi téměř jako na PC",
        "reference_contexts":[
            "Před krátkou dobou jsem popisoval program pro technické kreslení na Psionu. Jmenoval se CADmx. Tento program dokázal, že i na malých počítačích se dají dělat velké věci. Dnes je zde další takový program, který nám opětovně ukáže, jak se na malých strojích dělá velká grafika. Program, který je pro svět Psionu stejný jako Photoshop pro svět PC uvedla na trh firma PalmScape. Je jím editor Photo5, se kterým lze pracovat s fotografiemi téměř jako na PC. Program podporuje například i grafické formáty jpeg, bitmap a GIF (k importu těchto formátů je nutné mít registrovanou verzi MBMview). Načítat data lze ovšem také přímo z digitálního fotoaparátu. Někdo by mohl namítnout, že zde může být omezení velikosti obrázku, ale opak je pravdou. Samotní tvůrci programu hovoří o tom, že lze v Photo5 pracovat s obrázky i většími, než je 1200x1200 bodů. To nám dává dostatečně velký prostor pro práci s nimi. Ovšem nemyslím, že na Psionu 5 bychom chtěli pracovat s takovýmto obrázkem. Už jen menší displej, na kterém by bylo zapotřebí častého rolování je dosti omezujícím faktorem. Funkce programu: Kreslení Kreslení je řešeno velmi efektivně. Menu pro kreslení je dynamické a lze jej rozšiřovat například o vlastní nadefinované štětce. Při prvním spuštění programu je zde nadefinováno standardně 30 různých štětců, které lze doplňovat o vlastní. Při kreslení štětcem lze používat i různé styly, které lze rovněž individuálně modifikovat. V poslední verzi programu je i nový nástroj - Flood Fill. S ním je možné vyplňovat plochy barvou, či dokonce texturou, kterou si sami zvolíme. Editace Editace je jednou z hlavních částí tohoto programu. Photo5 zachovává až 20 obrazů v clipboardu. To umožňuje snadnou tvorbu komplexních kreseb pomocí clipboardu. S pomocí těchto \"vrstev\" lze obraz duplikovat, používat na jeho části různé masky a transformace. V tomto ohledu se práce v Photo5 podobá trochu práci v programu Photoshop. Nově zavedené jsou na kapesních počítačích FILTRY S filtry jsme byli zvyklí pracovat pouze na \"velkých\" počítačích, jak je dnes známe klasicky (bedna, obrazovka, klávesnice). S Photo5 se ovšem tato vlastnost přenáší i na kapesní počítače a tím je uvádí ještě hlouběji do světa digitálního zpracování obrazů. Photo5 podporuje většinu běžně používaných filtrů (Emboss, Solarize, Mosaic, Fracture, Warp, Line Art, Wave Distort,Pattern, Wet Glow, Charcoal). To je jen část filtrů, které lze použít ve Photo5. Animace S touto funkcí lze jednoduše vytvářet animace, které lze pak kompresovat, reverzně převracet, importovat z PC a dále exportovat. Jejich tvorba je poměrně jednoduchá. Buď stačí kopírovat frejmy do dalších a nebo vytvářet každý další frame zvlášť. Ve Photo5 jsou integrovány také předdefinované cesty nebo spíše pluginy, které vytvoří animaci objektu, který se odráží uvnitř určitého objektu od strany ke straně atd.... Plug-in Velkým plusem tohoto programu je také to, že je rozšiřitelný a modifikovatelný. Chybí vám zde něco? Není nic jednoduššího, než si potřebnou funkci vytvořit vlastnoručně. Pluginy, které jsou napsány dalšími lidmi nebo firmami mohou například podporovat BMP konverzi, Texture TV, sketch a jiné funkce. Mezi další funkce, které nyní Photo5 nově podporuje je vestavěný picture browser, což umožňuje rychle prohledávat v adresářích obrázky, takže se k nim zrychlí přístup. Dále program umožňuje kopírovat obrázky přímo do systémového clipboardu, takže je lze vkládat přímo do Wordu, či jiných aplikací. Tato funkce se typicky hodí pro vytváření prezentací. Od starších verzí se prý zvedla i nahrávací doba obrázků, která se pohybuje většinou v rozmezí několika málo sekund. Program lze stáhnout opět na stránkách výrobce (PalmScape) a nebo na našem serveru (Photo5). Registrace programu stojí 18 liber."
        ]
    },
    {
        "user_input":"Shrň tento článek do stručného shrnutí.",
        "retrieved_contexts":[
            "\"Ostrava nám naznačila, že je Baroš neprodejný, podobná je i situace s olomouckým Heinzem a Polákem z Brna,\" prozradil Miroslav Pelta. Ostrava a Olomouc nehodlají své mladé útočníky za žádnou cenu uvolňovat, Brno má momentálně v souvislosti s vyhlášeným kunkursem zablokované veškeré přestupy. \"V pátek, nejpozději v sobotu bych chtěl mít jasno o Slončíkovi, abychom mohli o víkendu uzavřít soupisku pro jarní sezonu,\" plánuje sparťanský ředitel, který už v zimě přivedl na Letnou Blažka (Bohemians), Lengyela (Č. Budějovice) a Hapala (Tenerife), a to považuje za dostačující. Pižanowski odmítl na Hané prodloužit smlouvu Olomoucký brankář Petr Pižanowski pravděpodobně posílí poslední celek tabulky fotbalové ligy Viktorii Žižkov, odkud by měl naopak zamířit na Hanou středopolař Pavel Zbožínek. Jednání o hráčské výměně se podle slov ředitele olomouckého klubu Jiřího Kubíčka uzavře v nejbližších dnech. Pižanowski hostoval v podzimní části ligy v Jablonci, kde měl zůstat až do konce sezóny. Vedení severočeského klubu však Sigmě oznámilo, že již nemá o další služby pětadvacetiletého gólmana zájem. \"Pižanowski po návratu do Olomouce odmítl prodloužit smlouvu s naším klubem, a proto představenstvo rozhodlo, že mu umožní odejít. Předběžně jsme se již dohodli s pražskou Viktorkou na jeho výměně za Zbožínka,\" řekl Kubíček a dodal, že pětadvacetiletý žižkovský hráč by se měl objevit v Olomouci již ve čtvrtek."
        ],
        "response":"Ostravský klub Odra Ostrau oznámil, že neprodejí mladých útočence a brankáře, zatímco Olomouch a Brno mají kvůli vyhlášené kunkursaci blokovány všechny přestupy. Ředitel Olomouna Jiří Kubíčk informoval, že Petr Pižiánowski odmítne prodlužování smlouvou a bude nahrazen Pavlem Zboženkem, který se očekává ve čtvrte.",
        "reference":"Z dvoudenní cesty po Moravě, během které jednal v Ostravě, Olomouci a Brně o přestupu celkem čtyř fotbalistů, se vrací ředitel Sparty Miroslav Pelta s prázdnou. \"Nejschůdnější se zdá jednání o příchodu Slončíka,\" doufá Pelta, šance na získání dalších vyhlédnutých hráčů vidí nulové. O změnách jednají i další kluby, Olomouc se pravděpodobně dohodne se Žižkovem o výměně Pižanovského za P. Zbožínka",
        "reference_contexts":[
            "\"Ostrava nám naznačila, že je Baroš neprodejný, podobná je i situace s olomouckým Heinzem a Polákem z Brna,\" prozradil Miroslav Pelta. Ostrava a Olomouc nehodlají své mladé útočníky za žádnou cenu uvolňovat, Brno má momentálně v souvislosti s vyhlášeným kunkursem zablokované veškeré přestupy. \"V pátek, nejpozději v sobotu bych chtěl mít jasno o Slončíkovi, abychom mohli o víkendu uzavřít soupisku pro jarní sezonu,\" plánuje sparťanský ředitel, který už v zimě přivedl na Letnou Blažka (Bohemians), Lengyela (Č. Budějovice) a Hapala (Tenerife), a to považuje za dostačující. Pižanowski odmítl na Hané prodloužit smlouvu Olomoucký brankář Petr Pižanowski pravděpodobně posílí poslední celek tabulky fotbalové ligy Viktorii Žižkov, odkud by měl naopak zamířit na Hanou středopolař Pavel Zbožínek. Jednání o hráčské výměně se podle slov ředitele olomouckého klubu Jiřího Kubíčka uzavře v nejbližších dnech. Pižanowski hostoval v podzimní části ligy v Jablonci, kde měl zůstat až do konce sezóny. Vedení severočeského klubu však Sigmě oznámilo, že již nemá o další služby pětadvacetiletého gólmana zájem. \"Pižanowski po návratu do Olomouce odmítl prodloužit smlouvu s naším klubem, a proto představenstvo rozhodlo, že mu umožní odejít. Předběžně jsme se již dohodli s pražskou Viktorkou na jeho výměně za Zbožínka,\" řekl Kubíček a dodal, že pětadvacetiletý žižkovský hráč by se měl objevit v Olomouci již ve čtvrtek."
        ]
    },
    {
        "user_input":"Shrň tento článek do stručného shrnutí.",
        "retrieved_contexts":[
            "\"Máme doma Bradford, ten je o dvě místa před námi, a když vyhrajeme, budeme na něj ztrácet už jen čtyři body. A předposlední Watford, který je před námi o čtyři body teď, hraje doma s Liverpoolem. Takže je jasné, že budu držet palce hlavně Patrikovi Bergrovi s Vláďou Šmicrem.\" Co byste řekl k současným neúspěchům vašeho mužstva?Špatně jsme v létě odstartovali, k tomu se přidala finanční krize klubu, prodávají se hráči, kádr se pořád mění. Přestali i chodit lidi, máme stadion pro čtyřicet tisíc a poslední dobou jich chodí kolem pětadvaceti tisíc.Začátkem roku proběhla tiskem zpráva, že Sheffield koupil švédského brankáře.Byl na pár trénincích a už je zase pryč. Zkouší tady někoho každou chvíli, nejen brankáře. On totiž ten můj náhradník je problémový typ, tak myslím, že ke mně hledají pořádnou dvojku.Není poněkud stresující chytat za poslední tým ligy? Nic příjemného to není, ale jsem vděčný za každý zápas, ve kterém nastoupím. Ligu jsem začal jako jednička, ale přišlo horší období, trenér začal s brankáři točit, potom jsem na pár utkání vypadl úplně. Musím ale přiznat, že mi to opravdu moc nešlo.Teď už jste na tom líp? Vypadá to tak. Chytal jsem posledních šest zápasů, prohráli jsme jen na Aston Ville a s Chelsea.Blíží se první letošní sraz národního mužstva. Láká vás start na únorovém turnaji v Hongkongu, nebo byste raději chytal anglickou ligu? Nerad bych vypadl z klubové sestavy, protože by se mi národní mužstvo vzdálilo podobně, jako když jsem před dvěma lety nechytal v Newcastlu. Proto bych teď ten Hongkong raději oželel. Moje cesta na mistrovství vede přes Sheffield.O červnovém mistrovství Evropy ale určitě smýšlíte jinak.V březnu mi bude dvaatřicet, a i když pár let ještě na nejvyšší úrovni chytat chci, zase tak moc času mi nezbývá. Mistrovství by pro mě proto nejspíš bylo vyvrcholením kariéry.Jaká je vaše brankářská filozofie? Gólmana beru jako nejkrásnější post v mužstvu. Je poslední instancí a právě tohle postavení mě pořád strašně láká a žene dopředu. Pak také tvrdím, že sebelepší brankář zůstane vždycky jen dobrým, pokud nemá štěstí. Když ale takový gólman štěstí má, často se stane vynikajícím.Co vlastně u brankáře považujete za štěstí? Z mnoha věcí mě napadají momenty při vyražených či odražených míčích. Když jsme v listopadu remizovali v Nizozemsku, měl jsem tam pár vyražených míčů, ale všechny šly ke spoluhráčům. V Sheffieldu když střelu vyrazím, míč tutově skončí u soupeře a je z toho stejně gól. Celkově si ale na nedostatek štěstí naříkat nemůžu."
        ],
        "response":"Vojtěch Šmíd, bývalý reprezentant, nyní působící v Anglii, se snaží udržet klid po dlouhé řadě neúspeších a zaměřuje se především na brankára Patrika Bergrova. Jeho brankárskou filozofií je považování gólmana za nejkrástější post v týmu, kde se očekává, že i když má štěstím, dokáže být vynikající. Na otázku, zda ho čeká další úspěch, odpověděl, že ho sportovní kari",
        "reference":"Zatímco většina fotbalových reprezentantů se připravuje na jaro, brankář Pavel Srníček jde v anglické Premier League bez přestávky od zápasu k zápasu. \"V sobotu nás čeká první z klíčových utkání v novém roce,\" připomíná gólman Sheffieldu Wednesday, posledního týmu soutěže",
        "reference_contexts":[
            "\"Máme doma Bradford, ten je o dvě místa před námi, a když vyhrajeme, budeme na něj ztrácet už jen čtyři body. A předposlední Watford, který je před námi o čtyři body teď, hraje doma s Liverpoolem. Takže je jasné, že budu držet palce hlavně Patrikovi Bergrovi s Vláďou Šmicrem.\" Co byste řekl k současným neúspěchům vašeho mužstva?Špatně jsme v létě odstartovali, k tomu se přidala finanční krize klubu, prodávají se hráči, kádr se pořád mění. Přestali i chodit lidi, máme stadion pro čtyřicet tisíc a poslední dobou jich chodí kolem pětadvaceti tisíc.Začátkem roku proběhla tiskem zpráva, že Sheffield koupil švédského brankáře.Byl na pár trénincích a už je zase pryč. Zkouší tady někoho každou chvíli, nejen brankáře. On totiž ten můj náhradník je problémový typ, tak myslím, že ke mně hledají pořádnou dvojku.Není poněkud stresující chytat za poslední tým ligy? Nic příjemného to není, ale jsem vděčný za každý zápas, ve kterém nastoupím. Ligu jsem začal jako jednička, ale přišlo horší období, trenér začal s brankáři točit, potom jsem na pár utkání vypadl úplně. Musím ale přiznat, že mi to opravdu moc nešlo.Teď už jste na tom líp? Vypadá to tak. Chytal jsem posledních šest zápasů, prohráli jsme jen na Aston Ville a s Chelsea.Blíží se první letošní sraz národního mužstva. Láká vás start na únorovém turnaji v Hongkongu, nebo byste raději chytal anglickou ligu? Nerad bych vypadl z klubové sestavy, protože by se mi národní mužstvo vzdálilo podobně, jako když jsem před dvěma lety nechytal v Newcastlu. Proto bych teď ten Hongkong raději oželel. Moje cesta na mistrovství vede přes Sheffield.O červnovém mistrovství Evropy ale určitě smýšlíte jinak.V březnu mi bude dvaatřicet, a i když pár let ještě na nejvyšší úrovni chytat chci, zase tak moc času mi nezbývá. Mistrovství by pro mě proto nejspíš bylo vyvrcholením kariéry.Jaká je vaše brankářská filozofie? Gólmana beru jako nejkrásnější post v mužstvu. Je poslední instancí a právě tohle postavení mě pořád strašně láká a žene dopředu. Pak také tvrdím, že sebelepší brankář zůstane vždycky jen dobrým, pokud nemá štěstí. Když ale takový gólman štěstí má, často se stane vynikajícím.Co vlastně u brankáře považujete za štěstí? Z mnoha věcí mě napadají momenty při vyražených či odražených míčích. Když jsme v listopadu remizovali v Nizozemsku, měl jsem tam pár vyražených míčů, ale všechny šly ke spoluhráčům. V Sheffieldu když střelu vyrazím, míč tutově skončí u soupeře a je z toho stejně gól. Celkově si ale na nedostatek štěstí naříkat nemůžu."
        ]
    },
    {
        "user_input":"Shrň tento článek do stručného shrnutí.",
        "retrieved_contexts":[
            "Jistě si uživatelé PC vzpomínají na známou real-time strategii na PC, která nesla název Command and Conquer. Tato \"rýltajmovka\" si získala srdce mnoha hráčů. Tak se stalo především díky své svižnosti, rozmanitosti jednotek a dalším příznakům, které jen zvyšovaly hratelnost. Na Psion nyní přichází jakýsi klon této geniální hry. Imperium je totiž název pro menší verzi C&C, která se vejde na Psion. Jedná se o akční realtime strategii. Hru lze nainstalovat jak na disk C:, tak na disk D:. Pokud Imperium vlastníte neregistrované, lze stavět pouze některé základní jednotky, se kterými lze dohrát každý level, ale jste ochuzeni o další, rozšířené jednotky. Bez těch je pak poměrně těžké dohrát pokročilejší levely ve hře. Registraci si může zařídit každý po zaplacení 15 liber, což není na hru mnoho, ale na druhou stranu je otázka, zda si raději koupíte hru na PC nebo na Psiona. Imperium má jednu velkou výhodu oproti C&C a to, že se nechá hrát téměř všude, jelikož si s sebou svého miláčka většinou nosíme. Pokud tedy nemůžete vydržet bez akce a taktiky, není problém si nosit s sebou vlastní miniarmádu vojáčků a autíček z tekutých krystalů. To je menší nevýhoda, jelikož na PC měly vojenské jednotky alespoň barevné odlišení, ale na Psionu je již musíme rozeznávat podle stupně světlosti\/šedosti, abychom si nemysleli, že ti, co jdou k nám do základny nejdou na průzkum, ale zničit silo nebo heavy factory. Pro ty, kterým by nestačily úrovně implementované ve hře jsou na našem serveru (Mapy pro Imperium) a nebo na domovské stránce Imperia ke stažení další mapy a pro ty nejzarytější hráče je zde i editor map na PC ((Imperium map editor pro PC). Samotnou hru lze stáhnout rovněž na domovské stránce a nebo na našem serveru (Imperium pro Psion). Sám si myslím, že tato hra stojí alespoň za ozkoušení, protože minipočítače přeci neslouží 100% vždy pouze k práci. Stejně tak, jako osobní počítače, kde minimálně jednou každý z nás spustil ."
        ],
        "response":"Psion představuje klon real-time strategie Command & Conquer v podobě menšího „Imperia\", který se vejде na kompaktními disky C: a D:. Hra nabízí unikátní možnost hrát s vlastní armádou na mobilních zařízení, avšak registrovaní hráči mohou využít rozšířenější jednotky a dostupnost více map.",
        "reference":"Imperium je real-time strategická hra, která jistě připomene PC hráčům doby bitev v Command & Conquer. Tato hra má ale výhodu, že se nechá vzít s sebou a navíc lze do této Psioní aplikace na PC vytvářet i mapy",
        "reference_contexts":[
            "Jistě si uživatelé PC vzpomínají na známou real-time strategii na PC, která nesla název Command and Conquer. Tato \"rýltajmovka\" si získala srdce mnoha hráčů. Tak se stalo především díky své svižnosti, rozmanitosti jednotek a dalším příznakům, které jen zvyšovaly hratelnost. Na Psion nyní přichází jakýsi klon této geniální hry. Imperium je totiž název pro menší verzi C&C, která se vejde na Psion. Jedná se o akční realtime strategii. Hru lze nainstalovat jak na disk C:, tak na disk D:. Pokud Imperium vlastníte neregistrované, lze stavět pouze některé základní jednotky, se kterými lze dohrát každý level, ale jste ochuzeni o další, rozšířené jednotky. Bez těch je pak poměrně těžké dohrát pokročilejší levely ve hře. Registraci si může zařídit každý po zaplacení 15 liber, což není na hru mnoho, ale na druhou stranu je otázka, zda si raději koupíte hru na PC nebo na Psiona. Imperium má jednu velkou výhodu oproti C&C a to, že se nechá hrát téměř všude, jelikož si s sebou svého miláčka většinou nosíme. Pokud tedy nemůžete vydržet bez akce a taktiky, není problém si nosit s sebou vlastní miniarmádu vojáčků a autíček z tekutých krystalů. To je menší nevýhoda, jelikož na PC měly vojenské jednotky alespoň barevné odlišení, ale na Psionu je již musíme rozeznávat podle stupně světlosti\/šedosti, abychom si nemysleli, že ti, co jdou k nám do základny nejdou na průzkum, ale zničit silo nebo heavy factory. Pro ty, kterým by nestačily úrovně implementované ve hře jsou na našem serveru (Mapy pro Imperium) a nebo na domovské stránce Imperia ke stažení další mapy a pro ty nejzarytější hráče je zde i editor map na PC ((Imperium map editor pro PC). Samotnou hru lze stáhnout rovněž na domovské stránce a nebo na našem serveru (Imperium pro Psion). Sám si myslím, že tato hra stojí alespoň za ozkoušení, protože minipočítače přeci neslouží 100% vždy pouze k práci. Stejně tak, jako osobní počítače, kde minimálně jednou každý z nás spustil ."
        ]
    },
    {
        "user_input":"Shrň tento článek do stručného shrnutí.",
        "retrieved_contexts":[
            "Liberec vyběhl do stopy v kompletní sestavě. Mezi solidní lyžaře tradičně patří liberečtí odchovanci Lexa s Čapkem, na lyžích jsou jako doma i Janáček, Klago, Riedl a další borci. Peloton naopak většinou uzavírá argentinský útočník Lazzaro s mladým Dvořákem. Do běžecké stopy se pravidelně vydává i asistent trenéra Josef Petřík, trenér Ladislav Škorpil zatím harrachovskou trať neokusil. Běžecký okruh fotbalistů v Harrachově měří zhruba dvanáct kilometrů, začíná i končí u hotelu Fortuna na Rýžovišti. Včera ho hráči Slovanu absolvovali dvakrát, v závěru je navíc čekal prudký sjezd. \"Výběhy jsou velice těžké a kopcovité, řekl bych až extrémní,\" přiznává Ota Petráček, který působí u libereckých fotbalistů ve funkci horského vůdce. Vybírá tratě, maže lyže, pomáhá při běhu s případnými problémy. Petráček jezdí s libereckými fotbalisty na lyže už sedmým rokem. Jeho služeb však využívá i trenér Petržela z Bohemians, který kdysi v Liberci lyžařská soustředění zavedl. \"Před týdnem jsem byl s Bohemkou na šumavském Špičáku. Petržela dával hráčům do těla. Během pěti dnů naběhali skoro dvě stě čtyřicet kilometrů. Mezi nejlepší patřili exliberečtí Culek s Vomáčkou,\" tvrdí \"horský vůdce\" Petráček. V Harrachově se v těchto dnech připravují i fotbalisté Slavie a Teplic. Slavia přijela bez lyží, Tepličtí sice lyžují, ale první den špatně namazali, a tak se spíš trápili. \"Není divu, když v mrazu použili vosk na čerstvý sníh. My mažeme jedině modrý klistr a jede to parádně,\" prozradil Ota Petráček. Hned po návratu z Krkonoš sehraje liberecký Slovan v pořadí druhé přátelské utkání zimní přípravy. V sobotu se na umělé trávě U Nisy utká s třetiligovým celkem Varnsdorfu."
        ],
        "response":"Liberečský klub Slovan vyběh do stoly v komplettované sestavbě, kde se mezi lyžaři představuje řada tradici občanů města, včetně trenéra Oty Petráčka. Trenér Petržel z Bohemia, který zde lyžaření před týdnom navštívil, zdůrazňuje, že v mraze a na čeršvém sněhu běžecka trasa v Harrachu vyžaduje opatrnost a často vyžadí použití vosku. Po návrat ze zimních cvič",
        "reference":"Fotbalisté prvoligového Slovanu Liberec odložili kopačky, obuli lyžařské boty a postavili se na běžky. Během čtyřdenního soustředění v Krkonoších, které začali v úterý, naběhají na tratích v okolí Harrachova přes sto dvacet kilometrů. \"Ráno běháme na lyžích, odpoledne po svých. Lepší je to na těch lyžích,\" povídal v cíli včerejší lyžařské \"etapy\" dlouholetý hráč Slovanu Libor Janáček. \"Je fajn, že nám nádherně vychází počasí,\" dodal při pohledu na azurově modré nebe",
        "reference_contexts":[
            "Liberec vyběhl do stopy v kompletní sestavě. Mezi solidní lyžaře tradičně patří liberečtí odchovanci Lexa s Čapkem, na lyžích jsou jako doma i Janáček, Klago, Riedl a další borci. Peloton naopak většinou uzavírá argentinský útočník Lazzaro s mladým Dvořákem. Do běžecké stopy se pravidelně vydává i asistent trenéra Josef Petřík, trenér Ladislav Škorpil zatím harrachovskou trať neokusil. Běžecký okruh fotbalistů v Harrachově měří zhruba dvanáct kilometrů, začíná i končí u hotelu Fortuna na Rýžovišti. Včera ho hráči Slovanu absolvovali dvakrát, v závěru je navíc čekal prudký sjezd. \"Výběhy jsou velice těžké a kopcovité, řekl bych až extrémní,\" přiznává Ota Petráček, který působí u libereckých fotbalistů ve funkci horského vůdce. Vybírá tratě, maže lyže, pomáhá při běhu s případnými problémy. Petráček jezdí s libereckými fotbalisty na lyže už sedmým rokem. Jeho služeb však využívá i trenér Petržela z Bohemians, který kdysi v Liberci lyžařská soustředění zavedl. \"Před týdnem jsem byl s Bohemkou na šumavském Špičáku. Petržela dával hráčům do těla. Během pěti dnů naběhali skoro dvě stě čtyřicet kilometrů. Mezi nejlepší patřili exliberečtí Culek s Vomáčkou,\" tvrdí \"horský vůdce\" Petráček. V Harrachově se v těchto dnech připravují i fotbalisté Slavie a Teplic. Slavia přijela bez lyží, Tepličtí sice lyžují, ale první den špatně namazali, a tak se spíš trápili. \"Není divu, když v mrazu použili vosk na čerstvý sníh. My mažeme jedině modrý klistr a jede to parádně,\" prozradil Ota Petráček. Hned po návratu z Krkonoš sehraje liberecký Slovan v pořadí druhé přátelské utkání zimní přípravy. V sobotu se na umělé trávě U Nisy utká s třetiligovým celkem Varnsdorfu."
        ]
    },
    {
        "user_input":"Shrň tento článek do stručného shrnutí.",
        "retrieved_contexts":[
            "\"Měli jste vidět ten šrumec, jaký tady byl minulý čtvrtek,\" vzpomíná sekretářka Jaroslava Došková na první hodiny, kdy začala konkursní správkyně Kateřina Pavlíková se dvěma pomocníky zjišťovat, v jakém stavu klub je. \"Chtěli vidět všechny účetní doklady, smlouvy hráčů i ostatních zaměstnanců. Začali rozhodovat o penězích. Když jsem chtěla koupit za pětistovku prášek na praní na dresy, musela to schválit paní Pavlíková.\" Podle manažera brněnského celku Karla Kroupy bylo první starostí managementu sehnat peníze pro hráče. \"Kdybychom jim něco dlužili, mohli by se vyvázat ze smlouvy kvůli jejímu neplnění a byli by volní za tabulkové hodnoty. Za necelé dva dny jsme dali dohromady přibližně dva miliony korun a všechny závazky dodrželi,\" popsal Kroupa. Konkursem skončily pravomoci šéfa klubu Lubomíra Hrstky i manažera Kroupy, který měl spolu s Hrstkou podpisové právo. Jediným partnerem fotbalového svazu je nyní právnička Pavlíková. \"Respektujeme to, ale rozhodli jsme se udělat mimořádné opatření. Abychom Brnu pomohli, zablokovali jsme všechny přestupy do klubu i ven,\" vysvětlil sportovní ředitel ze svazu Ivo Lubas. Znamená to, že z Brna nemůže v současnosti odejít žádný hráč. Přitom například druholigový Synot Staré Město projevil zájem o pět fotbalistů, Sparta nezastírá, že chce záložníka Poláka. \"Mezi oběma kluby je rozdíl,\" srovnává Kroupa. \"Jestliže má Synot zájem o Pacandu, Poláka nebo Švancaru, je to totéž, jako bychom my chtěli bratry Doškovy nebo Rosického. Jednání Sparty mohu ale ocenit. Její zástupci byli seriózní, chtěli brněnskému fotbalu pomoci. Vlastně z chování většiny svazových i ligových činovníků mám dobrý pocit. Všichni říkají, že si ligu bez Brna nedokážou představit. Rozhodně nás nikdo nechce potopit.\" Konkursní správkyně by měla po prozkoumání všech dokumentů sdělit, co bude s klubem dál. Manažer Kroupa věří, že její verdikt bude pro brněnský fotbal příznivý. \"Konkurs na společnost neuvalil soud kvůli fotbalu. Ten je soběstačný, dluhy byly kvůli jiným aktivitám,\" tvrdí Kroupa. Nechce si připustit, že může nastat i katastrofická verze, která fotbal ve městě pohřbí. Pavlíková může uspokojit věřitele tím, že postupně mužstvo rozprodá. Kroupa už přemýšlí, jak fotbalu v Brně pomoci. Společně s Pavlíkovou navštívili primátora i šéfy Brněnských veletrhů a výstav, největší firmy ve městě. Jednání o případném vzniku nové akciové společnosti, která by klub koupila a potom řídila, však komplikuje fakt, že fotbalový stadion vlastní nadále Hrstka. Patří totiž do jeho jiné společnosti, která v konkursu není. Město už dřív chtělo od Hrstky stadion bezplatně převzít a slíbilo za to investovat do rekonstrukce 350 milionů. Neúspěšný podnikatel však odmítl, chtěl peníze. \"Budoucnost brněnského fotbalu nyní závisí na panu Hrstkovi,\" míní primátor Petr Duchoň. \"Nikdo přece nekoupí fotbalový klub, když nebude mít záruku, kde s ním může hrát.\""
        ],
        "response":"Konkurční správcyně Kateřína Pavlíкова provedla inspekci klubu, během kterého byla zjištěna situace, kdy manažer Karl Kroupova a šéf Lubomír Hrstká působili mimo zákon. Prodloužení konkursu a blokada přestupů jsou důsledkem toho, že soudní řízení o fotbalovém klubu probíhá samostatně a nevytvořilo novou akcickou společnost. Finální rozhodnutí Správce konkurzu a budoucí osuda klubu tedy závis",
        "reference":"Polák, Pacanda, Zúbek a další brněnští fotbalisté, o něž se zajímají domácí a zahraniční kluby, vyběhli ve čtvrtek dopoledne do soběšických lesů kousek za městem k dalšímu dílu zimní přípravy. Kdo netuší, v jak svízelné situaci se jejich oddíl nachází, z chování hráčů nic nepozná. Přitom fotbalovému Brnu hrozí zánik, neboť obchodní soud vyhlásil konkurs na společnost, která klub vlastní",
        "reference_contexts":[
            "\"Měli jste vidět ten šrumec, jaký tady byl minulý čtvrtek,\" vzpomíná sekretářka Jaroslava Došková na první hodiny, kdy začala konkursní správkyně Kateřina Pavlíková se dvěma pomocníky zjišťovat, v jakém stavu klub je. \"Chtěli vidět všechny účetní doklady, smlouvy hráčů i ostatních zaměstnanců. Začali rozhodovat o penězích. Když jsem chtěla koupit za pětistovku prášek na praní na dresy, musela to schválit paní Pavlíková.\" Podle manažera brněnského celku Karla Kroupy bylo první starostí managementu sehnat peníze pro hráče. \"Kdybychom jim něco dlužili, mohli by se vyvázat ze smlouvy kvůli jejímu neplnění a byli by volní za tabulkové hodnoty. Za necelé dva dny jsme dali dohromady přibližně dva miliony korun a všechny závazky dodrželi,\" popsal Kroupa. Konkursem skončily pravomoci šéfa klubu Lubomíra Hrstky i manažera Kroupy, který měl spolu s Hrstkou podpisové právo. Jediným partnerem fotbalového svazu je nyní právnička Pavlíková. \"Respektujeme to, ale rozhodli jsme se udělat mimořádné opatření. Abychom Brnu pomohli, zablokovali jsme všechny přestupy do klubu i ven,\" vysvětlil sportovní ředitel ze svazu Ivo Lubas. Znamená to, že z Brna nemůže v současnosti odejít žádný hráč. Přitom například druholigový Synot Staré Město projevil zájem o pět fotbalistů, Sparta nezastírá, že chce záložníka Poláka. \"Mezi oběma kluby je rozdíl,\" srovnává Kroupa. \"Jestliže má Synot zájem o Pacandu, Poláka nebo Švancaru, je to totéž, jako bychom my chtěli bratry Doškovy nebo Rosického. Jednání Sparty mohu ale ocenit. Její zástupci byli seriózní, chtěli brněnskému fotbalu pomoci. Vlastně z chování většiny svazových i ligových činovníků mám dobrý pocit. Všichni říkají, že si ligu bez Brna nedokážou představit. Rozhodně nás nikdo nechce potopit.\" Konkursní správkyně by měla po prozkoumání všech dokumentů sdělit, co bude s klubem dál. Manažer Kroupa věří, že její verdikt bude pro brněnský fotbal příznivý. \"Konkurs na společnost neuvalil soud kvůli fotbalu. Ten je soběstačný, dluhy byly kvůli jiným aktivitám,\" tvrdí Kroupa. Nechce si připustit, že může nastat i katastrofická verze, která fotbal ve městě pohřbí. Pavlíková může uspokojit věřitele tím, že postupně mužstvo rozprodá. Kroupa už přemýšlí, jak fotbalu v Brně pomoci. Společně s Pavlíkovou navštívili primátora i šéfy Brněnských veletrhů a výstav, největší firmy ve městě. Jednání o případném vzniku nové akciové společnosti, která by klub koupila a potom řídila, však komplikuje fakt, že fotbalový stadion vlastní nadále Hrstka. Patří totiž do jeho jiné společnosti, která v konkursu není. Město už dřív chtělo od Hrstky stadion bezplatně převzít a slíbilo za to investovat do rekonstrukce 350 milionů. Neúspěšný podnikatel však odmítl, chtěl peníze. \"Budoucnost brněnského fotbalu nyní závisí na panu Hrstkovi,\" míní primátor Petr Duchoň. \"Nikdo přece nekoupí fotbalový klub, když nebude mít záruku, kde s ním může hrát.\""
        ]
    },
    {
        "user_input":"Shrň tento článek do stručného shrnutí.",
        "retrieved_contexts":[
            "Zatímco před rokem absolvoval náročnou zimní přípravu v Baníku Ostrava, letos se udržuje v kondici sám, aby na první landesligu, což je čtvrtá nejvyšší soutěž v Rakousku, stačil. Do Amstettenu letos poprvé zamíří příští týden v úterý. \"Uvidím, co bude, ale pokud vím, měli bychom jet do Chorvatska na nějaké soustředění. Nepočítám však s tím, že bych se připravoval s tamějším mužstvem po celou ligovou přestávku. Předpokládám, že tam budu opět dvakrát týdně na tréninky dojíždět. Doma chodím běhat do Bělského lesa, takže co kluci odběhají, zvládnu tady sám.\" Amstetten do jarní části soutěže půjde z druhého místa. \"Na vedoucí Krems ztrácíme čtyři body, ale o postupu nikdo nemluví,\" upozornil Vrťo. \"Jsme nováčkem a vedení klubu je rádo, že jsme tak vysoko. Hlavním úkolem pořád je nesestoupit.\" V Rakousku se Dušan Vrťo vrátil na post libera. \"To mi vyhovuje, vždycky jsem hrál posledního, akorát minulé roky v Baníku mě trenéři posunuli do zálohy,\" podotkl Vrťo, který je v Amstettenu jediným cizincem. \"Už mi ale říkali, že by od léta uvítali ještě jednoho, abych se po někom na Ostravsku poohlédl. Chtějí útočníka nebo záložníka.\" Dušan Vrťo zvolna pomýšlí na případnou trenérskou budoucnost. Proto přijal nabídku představitelů Školské fotbalové ligy, která se loni rozjela v Ostravě Jih, kde bydlí, aby trénoval jedno z mužstev. Vede žáky Základní školy ve Formanově ulici v Ostravě-Dubině. \"Oslovili mě pánové Mokrohajský a Prejda, když viděli, že končím v Baníku, kde mi práci s mládeží nenabídli. Věděli, že mám trenérskou dvojku a chci studovat jedničku. Je to pro mě dobrý začátek. Tréninky máme dvakrát týdně a když v sobotu kvůli povinnostem v Rakousku nemohu přijít na zápasy, zastoupí mě manželka nebo kamarádi.\""
        ],
        "response":"Dušan Vrňo, bývalý hráč a trenér z Baníka Ostravy, se v roce 2024 stal prvním cizinci v rakouské Landesligě, když nastoupil do amstetenského klubu Amsteten jako jediný zahraniční hráč. Po úspěšném zimním tréninku v Chorvatu se vrátil do Rakouska, kde se snaží udržet vysokou formu a dosáhnout postupu do jara, zatímco jeho trenérská kariéra pokračuje",
        "reference":"Bezmála padesát tisíc kilometrů najezdil někdejší obránce Baníku Ostrava Dušan Vrťo během podzimu do svého rakouského působiště v Amstettenu. \"Je to nedaleko Lince, takže tam a zpět jsem pokaždé urazil kolem devíti set kilometrů,\" počítal Vrťo. \"Do klubu jsem jezdil dvakrát týdně na jeden trénink, po něm v noci domů a o víkendu zase na zápas. Totéž mě čeká na jaře.\"",
        "reference_contexts":[
            "Zatímco před rokem absolvoval náročnou zimní přípravu v Baníku Ostrava, letos se udržuje v kondici sám, aby na první landesligu, což je čtvrtá nejvyšší soutěž v Rakousku, stačil. Do Amstettenu letos poprvé zamíří příští týden v úterý. \"Uvidím, co bude, ale pokud vím, měli bychom jet do Chorvatska na nějaké soustředění. Nepočítám však s tím, že bych se připravoval s tamějším mužstvem po celou ligovou přestávku. Předpokládám, že tam budu opět dvakrát týdně na tréninky dojíždět. Doma chodím běhat do Bělského lesa, takže co kluci odběhají, zvládnu tady sám.\" Amstetten do jarní části soutěže půjde z druhého místa. \"Na vedoucí Krems ztrácíme čtyři body, ale o postupu nikdo nemluví,\" upozornil Vrťo. \"Jsme nováčkem a vedení klubu je rádo, že jsme tak vysoko. Hlavním úkolem pořád je nesestoupit.\" V Rakousku se Dušan Vrťo vrátil na post libera. \"To mi vyhovuje, vždycky jsem hrál posledního, akorát minulé roky v Baníku mě trenéři posunuli do zálohy,\" podotkl Vrťo, který je v Amstettenu jediným cizincem. \"Už mi ale říkali, že by od léta uvítali ještě jednoho, abych se po někom na Ostravsku poohlédl. Chtějí útočníka nebo záložníka.\" Dušan Vrťo zvolna pomýšlí na případnou trenérskou budoucnost. Proto přijal nabídku představitelů Školské fotbalové ligy, která se loni rozjela v Ostravě Jih, kde bydlí, aby trénoval jedno z mužstev. Vede žáky Základní školy ve Formanově ulici v Ostravě-Dubině. \"Oslovili mě pánové Mokrohajský a Prejda, když viděli, že končím v Baníku, kde mi práci s mládeží nenabídli. Věděli, že mám trenérskou dvojku a chci studovat jedničku. Je to pro mě dobrý začátek. Tréninky máme dvakrát týdně a když v sobotu kvůli povinnostem v Rakousku nemohu přijít na zápasy, zastoupí mě manželka nebo kamarádi.\""
        ]
    },
    {
        "user_input":"Shrň tento článek do stručného shrnutí.",
        "retrieved_contexts":[
            "\"Jejich chování značně poškodilo pověst klubu a nemá nic společného se sportovním chováním,\" zdůvodnilo vedení týmu výši pokut. Třetím vyloučeným hráčem týmu byl Christian Karembeu. Ten vyvázne s jiným trestem, který ještě bnebyl oznámen. Maradona se bude léčit v TorontuDo centra léčby drogové závislosti v Torontu nastoupí do konce týdne bývalá fotbalová hvězda Diego Maradona. Slavný Argentinec měl nabídku na léčbu i z Kuby, nakonec si však vybral kanadské město, protože v něm žije jeho bratr Lalo. Maradona už v Kanadě pobýval v roce 1997, kdy spolupracoval při tréninku se sprinterem Benem Johnsonem. Devětatřicetiletý mistr světa z roku 1986 byl minulý týden během dovolené v Uruguayi hospitalizován v nemocnici se srdečními problémy. Laboratorní vyšetření odhalilo v Maradonově krvi a moči stopy kokainu. Ronaldo bude hrát snad až v dubnuZhruba za měsíc by měl začít s tréninkem brazilský fotbalista Ronaldo, který koncem listopadu podstoupil operaci zraněného pravého kolena. Podle lékařů se však v sestavě Interu Milán objeví nejdřív začátkem dubna. Ronaldo si poranil vazy v pravém koleni 21. listopadu při ligovém utkání s Lecce. Světlice přišly italské kluby drahoV přepočtu téměř půl milionu korun (13 250 dolarů), musí zaplatit Lazio Řím z rozhodnutí vedení italské fotbalové ligy za to, že jeho fanoušek hodil při nedělním utkání s Boloňou na hřiště světlici a zranil televizního kameramana. Ten musel být hospitalizován. Ve stejný den vybuchla světlice v ruce příznivci Udine. Lékaři mu museli poraněnou končetinu amputovat."
        ],
        "response":"Bývalý argentinský fotbalista Diego Maradona byl hospitalizovan v Torantu kvůli drogovému závislostemu a bude pokračovat ve své léčbě do konce měsíce. Naopak brazilský hráč Ronaldo, kterému bylo zranění pravého kolenya, bude mít možnost odehrát první zápas v dubnovém ročníku. Zároveň se objevila nová scéna v Itálii, když Lazio muselo zaplatiti vysokou částku za zranitelnost televizního cameramana, který byl ohrožen světlic",
        "reference":"Draho přijde fotbalisty Roberta Carlose a Gutiho vyloučení v pondělním zápasu Realu Madrid s Rajou Casablanca na mistrovství světa klubů. Zaplatí svému klubu pokutu 30 000 dolarů (přes milion korun). Roberto Carlos dostal červenou kartu za napadení protihráče Mubarkího, Guti musel odejít ze hřiště proto, že do ležícího Mubarkího několikrát kopl. Real dohrál zápas jen s osmi fotbalisty, přesto zvítězil 3:2",
        "reference_contexts":[
            "\"Jejich chování značně poškodilo pověst klubu a nemá nic společného se sportovním chováním,\" zdůvodnilo vedení týmu výši pokut. Třetím vyloučeným hráčem týmu byl Christian Karembeu. Ten vyvázne s jiným trestem, který ještě bnebyl oznámen. Maradona se bude léčit v TorontuDo centra léčby drogové závislosti v Torontu nastoupí do konce týdne bývalá fotbalová hvězda Diego Maradona. Slavný Argentinec měl nabídku na léčbu i z Kuby, nakonec si však vybral kanadské město, protože v něm žije jeho bratr Lalo. Maradona už v Kanadě pobýval v roce 1997, kdy spolupracoval při tréninku se sprinterem Benem Johnsonem. Devětatřicetiletý mistr světa z roku 1986 byl minulý týden během dovolené v Uruguayi hospitalizován v nemocnici se srdečními problémy. Laboratorní vyšetření odhalilo v Maradonově krvi a moči stopy kokainu. Ronaldo bude hrát snad až v dubnuZhruba za měsíc by měl začít s tréninkem brazilský fotbalista Ronaldo, který koncem listopadu podstoupil operaci zraněného pravého kolena. Podle lékařů se však v sestavě Interu Milán objeví nejdřív začátkem dubna. Ronaldo si poranil vazy v pravém koleni 21. listopadu při ligovém utkání s Lecce. Světlice přišly italské kluby drahoV přepočtu téměř půl milionu korun (13 250 dolarů), musí zaplatit Lazio Řím z rozhodnutí vedení italské fotbalové ligy za to, že jeho fanoušek hodil při nedělním utkání s Boloňou na hřiště světlici a zranil televizního kameramana. Ten musel být hospitalizován. Ve stejný den vybuchla světlice v ruce příznivci Udine. Lékaři mu museli poraněnou končetinu amputovat."
        ]
    },
    {
        "user_input":"Shrň tento článek do stručného shrnutí.",
        "retrieved_contexts":[
            "Arkan podlehl vážnému zranění během převozu do nemocnice. Při střelbě v hotelu přišel o život také jeden z Arkanových strážců a další osoba byla vážně zraněna. Potvrdila to oficiální jugoslávská agentura Tanjug. Ostatní zdroje rovněž uvádějí, že při útoku byla zraněna i Arkanova švagrová. Podle korespondenta BBC v Bělehradě byl útok zřejmě předem velmi dobře připraven. Po incidentu přijela k hotelu policejní auta a policisté zatarasili hlavní vchod do hotelu, aby zabránili novinářům ve vstupu. Nejsou známy žádné informace ohledně motivu, podezřelých či zadržených. Zdroje v hotelu uvedly, že útočník zřejmě uprchl poté, co kulka zasáhla Arkana do oka. Arkan byl v roce 1997 Mezinárodním trestním tribunálem pro bývalou Jugoslávii (ICTY) obviněn z válečných zločinů, kterých se dopustil v roce 1991 za válečného konfliktu v Chorvatsku a během války v Bosně (1992-1995). Podrobnosti obžaloby nebyly zveřejněny, ale je známo, že se jeho garda, nazývaná Tygři, podílela na etnických čistkách v Bosně a v Chorvatsku. Željka Ražnatoviče, jemuž bylo 47 let a jenž patřil k nejbohatším lidem v Srbsku, hledala také mezinárodní policie Interpol kvůli sérii bankovních loupeží v západní Evropě, které byly spáchány v 70. a 80. letech. Arkan byl v roce 1992 poslancem srbského parlamentu. Později z politiky odešel a koupil fotbalový klub Obilić Bělehrad. Pracovníci hotelu odnášejí tělo neidentifikované oběti útoku, při němž byl smrtelně zraněn bývalý velitel srbských polovojenský oddílů Željko Ražnatovič, známý jako Arkan"
        ],
        "response":"Bělehradský hotel Arkanho stráže po útocích v roce přišl o život a další osoby vážným zranením; podle informací z BBC byl útoček zřejmě připravován předem. Útočníkem, který byl v minulosti obviněn z válek v Chorvátsku a Bosně, je pravděpodobně Željco Ražnovič, bývalá velitel Srbské armády.",
        "reference":"Bývalý velitel srbských polovojenských gard Željko Ražnatović, známý pod přezdívkou Arkan, který je na seznamu válečných zločinců, byl v neděli v bělehradském hotelu Intercontinental smrtelně zraněn. Uvedla to nezávislá agentura Beta s odvoláním na lékařské zdroje. Svědkové se při popisu události rozcházejí. Někteří říkají, že na Arkana zaútočila skupina maskovaných útočníků, další vypovídají o jednom střelci. Jugoslávská nezávislá televize Studio B hovořila o dvou ozbrojencích",
        "reference_contexts":[
            "Arkan podlehl vážnému zranění během převozu do nemocnice. Při střelbě v hotelu přišel o život také jeden z Arkanových strážců a další osoba byla vážně zraněna. Potvrdila to oficiální jugoslávská agentura Tanjug. Ostatní zdroje rovněž uvádějí, že při útoku byla zraněna i Arkanova švagrová. Podle korespondenta BBC v Bělehradě byl útok zřejmě předem velmi dobře připraven. Po incidentu přijela k hotelu policejní auta a policisté zatarasili hlavní vchod do hotelu, aby zabránili novinářům ve vstupu. Nejsou známy žádné informace ohledně motivu, podezřelých či zadržených. Zdroje v hotelu uvedly, že útočník zřejmě uprchl poté, co kulka zasáhla Arkana do oka. Arkan byl v roce 1997 Mezinárodním trestním tribunálem pro bývalou Jugoslávii (ICTY) obviněn z válečných zločinů, kterých se dopustil v roce 1991 za válečného konfliktu v Chorvatsku a během války v Bosně (1992-1995). Podrobnosti obžaloby nebyly zveřejněny, ale je známo, že se jeho garda, nazývaná Tygři, podílela na etnických čistkách v Bosně a v Chorvatsku. Željka Ražnatoviče, jemuž bylo 47 let a jenž patřil k nejbohatším lidem v Srbsku, hledala také mezinárodní policie Interpol kvůli sérii bankovních loupeží v západní Evropě, které byly spáchány v 70. a 80. letech. Arkan byl v roce 1992 poslancem srbského parlamentu. Později z politiky odešel a koupil fotbalový klub Obilić Bělehrad. Pracovníci hotelu odnášejí tělo neidentifikované oběti útoku, při němž byl smrtelně zraněn bývalý velitel srbských polovojenský oddílů Željko Ražnatovič, známý jako Arkan"
        ]
    },
    {
        "user_input":"Shrň tento článek do stručného shrnutí.",
        "retrieved_contexts":[
            "Nejdříve několik drobností. Český Mobil chystá ke spuštění funkci ALS, tedy Alternative Subscriber Line. Díky této funkci můžete mít na jedné SIM kartě dvě telefonní čísla, pod kterými jste dostupní a přepínáním na telefonu si můžete vybírat, které z čísel má být vaše odchozí (jako příchozí jsou obě čísla aktivní najednou a můžete si i současné hovory propojovat do konference). Tuto funkci provozují především skandinávští operátoři, dalším jejím velkým propagátorem je britský Orange a několik dalších operátorů. Dokonce je možné, tam kde je již trh liberalizovaný, jedno z těchto čísel udělat jako číslo v pevné síti - příchozí hovor je pak účtován jako hovor do pevné sítě a volající tedy platí méně. To u nás zatím ale nepůjde - na to má faktický monopol Český Telecom. Dobrou funkcí bude také AoC, informace o provolané sumě. Ta vám po skončení hovoru ukáže, kolik jste provolali - podobně jako u Go a Twistu. V případě Českého Mobilu ale u všech tarifních programů. Funkce zatím ale nefunguje, nicméně uvedena do provozu bude prý brzy. Nyní k velkým službám. Tou první, na kterou se podíváme, bude WAP. WAP zatím provozuje pouze EuroTel, v síti Paegasu není zatím běžnému klientovi možno WAPovat. I Český Mobil hodlá WAP nabídnout - technologicky je již prý připraven, pracuje ale na WAP službách. Technologie samotná, bez služby, je k ničemu - s čímž lze souhlasit, takže podobně, jako oba operátoři, hodlá Český Mobil připravit soubor základních služeb vhodných pro WAPování, jako jsou zprávy, kurzy, programy kin, televizí atd. S WAPem tedy lze zřejmě počítat k datu ostrého startu, tedy na březen. Podobné je to s GPRS - Český Mobil bude používat technologii obou dodavatelů, u GPRS je zatím největší brzdou pro všechny nedostatek funkčních terminálů s podporou GPRS. I na GPRS se ale můžeme těšit brzy - dokonce se dá čekat, že GPRS přijde do sítě Českého Mobilu ještě dříve, než první řádná vlna zákazníků, takže pro surfování by mohlo být docela volno. Český Mobil by měl pro GPRS disponovat dostatečnou kapacitou, takže je velmi pravděpodobné, že surfování přes GPRS vyjde cenově nastejno, jako dnešní rychlost 9600 bps. Zajímavá byla debata o tarifech s homezone. Právě homezone patří mezi oblíbené taháky při bojích o třetí licenci, kdy vlastně nikdo si nedovolí homezone nenabídnout. Postoj Českého Mobilu je zajímavý - homezone je sice slibně znějící služba, ale v praxi z ní nepanuje až takové nadšení E2-Interkom Viag v Německu Homezone tlačí, seč mu síly stačí, ale zájem o jeho síť se díky tomu nijak radikálně nezvýšil. Zdá se, že čas homezone přijde až s druhou generací této technologie a především s větším průnikem telekomunikační svobody na (i západní!) trhy. Homezone totiž má nejzajímavější možnost chytnout se právě jako konkurence pevným linkám, ale zase k takové velké cenové redukci sami mobilní operátoři nesáhnout, dokud nebudou spojeni s pevnými operátory. A to zase není snadné sousto pro regulátory... prostě je to s homezone zatím dosti nahnuté. To je zatím o velkých novinkách všechno, těch drobných se jistě urodí dostatek ještě časem. I tak to ale vypadá, že se službami se u Českého Mobilu chýlí k lepším časům a to je něco, co potřebujeme jako soli."
        ],
        "response":"Český Mobil připravuje funkci ALS umožňující dvojího odběratele na jediné SIM kartu, která však zatím funguje pouze v rámci libéralizovaných trhů. Operátor plánuje nabídku WAP a GPRS služeb, avšak technická podpora GPRS v České republice je zatím nejvíce omezena nedostatkem funkčních zařízení.",
        "reference":"Pokračování přehledu zajímavostí, které pro nás Český Mobil chystá. Jak to bude s GPRS, WAP, ALS a AoC?",
        "reference_contexts":[
            "Nejdříve několik drobností. Český Mobil chystá ke spuštění funkci ALS, tedy Alternative Subscriber Line. Díky této funkci můžete mít na jedné SIM kartě dvě telefonní čísla, pod kterými jste dostupní a přepínáním na telefonu si můžete vybírat, které z čísel má být vaše odchozí (jako příchozí jsou obě čísla aktivní najednou a můžete si i současné hovory propojovat do konference). Tuto funkci provozují především skandinávští operátoři, dalším jejím velkým propagátorem je britský Orange a několik dalších operátorů. Dokonce je možné, tam kde je již trh liberalizovaný, jedno z těchto čísel udělat jako číslo v pevné síti - příchozí hovor je pak účtován jako hovor do pevné sítě a volající tedy platí méně. To u nás zatím ale nepůjde - na to má faktický monopol Český Telecom. Dobrou funkcí bude také AoC, informace o provolané sumě. Ta vám po skončení hovoru ukáže, kolik jste provolali - podobně jako u Go a Twistu. V případě Českého Mobilu ale u všech tarifních programů. Funkce zatím ale nefunguje, nicméně uvedena do provozu bude prý brzy. Nyní k velkým službám. Tou první, na kterou se podíváme, bude WAP. WAP zatím provozuje pouze EuroTel, v síti Paegasu není zatím běžnému klientovi možno WAPovat. I Český Mobil hodlá WAP nabídnout - technologicky je již prý připraven, pracuje ale na WAP službách. Technologie samotná, bez služby, je k ničemu - s čímž lze souhlasit, takže podobně, jako oba operátoři, hodlá Český Mobil připravit soubor základních služeb vhodných pro WAPování, jako jsou zprávy, kurzy, programy kin, televizí atd. S WAPem tedy lze zřejmě počítat k datu ostrého startu, tedy na březen. Podobné je to s GPRS - Český Mobil bude používat technologii obou dodavatelů, u GPRS je zatím největší brzdou pro všechny nedostatek funkčních terminálů s podporou GPRS. I na GPRS se ale můžeme těšit brzy - dokonce se dá čekat, že GPRS přijde do sítě Českého Mobilu ještě dříve, než první řádná vlna zákazníků, takže pro surfování by mohlo být docela volno. Český Mobil by měl pro GPRS disponovat dostatečnou kapacitou, takže je velmi pravděpodobné, že surfování přes GPRS vyjde cenově nastejno, jako dnešní rychlost 9600 bps. Zajímavá byla debata o tarifech s homezone. Právě homezone patří mezi oblíbené taháky při bojích o třetí licenci, kdy vlastně nikdo si nedovolí homezone nenabídnout. Postoj Českého Mobilu je zajímavý - homezone je sice slibně znějící služba, ale v praxi z ní nepanuje až takové nadšení E2-Interkom Viag v Německu Homezone tlačí, seč mu síly stačí, ale zájem o jeho síť se díky tomu nijak radikálně nezvýšil. Zdá se, že čas homezone přijde až s druhou generací této technologie a především s větším průnikem telekomunikační svobody na (i západní!) trhy. Homezone totiž má nejzajímavější možnost chytnout se právě jako konkurence pevným linkám, ale zase k takové velké cenové redukci sami mobilní operátoři nesáhnout, dokud nebudou spojeni s pevnými operátory. A to zase není snadné sousto pro regulátory... prostě je to s homezone zatím dosti nahnuté. To je zatím o velkých novinkách všechno, těch drobných se jistě urodí dostatek ještě časem. I tak to ale vypadá, že se službami se u Českého Mobilu chýlí k lepším časům a to je něco, co potřebujeme jako soli."
        ]
    },
    {
        "user_input":"Shrň tento článek do stručného shrnutí.",
        "retrieved_contexts":[
            "\"Nechtěl jsem se nechat prosit, to, že vystoupím beru jako čest,\" řekl zpěvák, který chtěl svou účast na Expo 2000 odvolat poté, co v Lidových novinách vyšel článek architekta a historika umění Zdeňka Lukeše, kde autor označil jeho případné vystoupení na výstavě za podbízivou šmíráckou show a jeho samotného za zombieho, který od poloviny 60. let kazí vkus v Čechách a nyní ho pojede kazit do Německa.Ministr kultury Pavel Dostál byl po schůzce s Karlem Gottem rád, že zpěvák nakonec účast na výstavě přislíbil. \"Touto kampaní alespoň naše země ušetřila za propagaci koncertu,\" uzavřel. Zpěvák Karel Gott už zvrátil své rozhodnutí nevystoupit v červnu na světové výstavě Expo 2000 v rozhovoru pro pondělní vydání hannoverského listu Neue Presse. \"Po reakcích mého publika jsem změnil názor,\" vysvětlil náhlou změnu postoje.O víkendu uspořádali Gotttovi fanoušci na několika místech v Německu demonstrace, na nichž zpívali kupříkladu píseň ze seriálu o včelce Máje. Proti jednomu z příznivců musela zasáhnout policie, protože v hračkářství sebral velikou plyšovou figurku včelky Máji a odmítal ji policii vydat, dokud zpěvák neslíbí, že na výstavu přijede. Na sobotním srazu v hannoverské kavárně Expo přednesli jeho fanoušci popěvek z Včelky Máji a skandovali \"Komm, Karl, Komm\" - \"Přijeď, Karle, přijeď\". PŘEDCHOZÍ VÝVOJ:Kritika v Lidových novináchKarel Gott se rozhodl svou účast na Expo odvolat poté, co v Lidových novinách vyšel dvaadvacetiřádkový článek architekta a historika umění Zdeňka Lukeše. V článku \"Hannovergott\" označil jeho vystoupení na EXPO 2000 za podbízivou šmíráckou show a jeho samotného za zombieho, který od poloviny 60. let kazí vkus v Čechách a nyní ho pojede kazit do Německa. \"Nechci být přemlouván, chtěl jsem jen dát lidem najevo, že nemohu vystoupit s pocitem, že jsem šmíra, své rozhodnutí nyní přehodnocuji a promýšlím,\" řekl Gott ve čtvrtek. Autor kritiky si podle něho vyřizuje s organizátory české účasti na výstavě Expo osobní účty. \"Mě tam dal, aby to udělal zajímavé,\" míní zpěvák. Způsob kritiky své osoby považuje za sprosťárnu a čeká omluvu. Zpěvák musí být podle Gotta vnitřně v pohodě, aby v jeho písni byla radost. Útok proti sobě považuje Český slavík za akci temných sil, které chtějí dělat blbou náladu a které vědí, že cílené zranění mu vezme chuť do práce. Rozhlasoví fanoušci rozžhavili telefonní linky Během rozhlasové relace \"Přijeď, Karle, přijeď\" stovky posluchařů severoněmeckého veřejnoprávního rozhlasového a televizního okruhu Norddeutscher Rundfunk podle agentury AP úplně rozžhavili telefonní linky. Žádost o Gottovo vystoupení se objevila v další stovce faxů. Německo: neúčast Gotta by byla katastrofa\"Když po USA odřekne účast ještě Karel Gott, byla by to skutečná katastrofa,\" řekl v pátek moderátor kanálu NDR-2 Uwe Bahn v narážce na americkou neochotu organizovat na Expo vlastní expozici. Primátor Hannoveru Herbert Schmalstieg označil Gotta za jednoho z nejoblíbenějších interpretů populární hudby. \"Nejenže svými písněmi baví, ale přináší lidem také radost,\" uvedl. Když nepojede Gott, nebude na expu český pop\"Nebude-li v Hannoveru při našem národním dnu sedmého června zpívat Karel Gott, nebude tam ani jiný český pop, nicméně to pochopitelně neznamená, že tam nebude v kulturním programu nic jiného,\" prohlásil minulý týden generální komisař účasti České republiky na EXPO 2000 Václav Bartuška. Je ovšem limitován šesti miliony korun určenými na tento den v celkovém rozpočtu 330 milionů. Komisař by například rád docílil toho, aby měli v dějišti výstavy na své lodi divadelní představení bratři Formanové, chystající na léto pro Prahu - Evropské město kultury roku 2000 projekt s tlačným remorkérem. \"Ve městě přeplněném akcemi by jejich připlutí bylo něco originálního,\" soudí Bartuška. Bartuška je přesvědčen, že národní den České republiky se neobejde ani bez klasické hudby, v jejíž interpretaci je země pro svět zajímavá. Na EXPO 2000 má vystoupit i Hudba Hradní stráže.Karel Gott, Václav Bartuška, Pavel Dostál a Miloš Zapletal před novináři."
        ],
        "response":"Zpěvácká skupina Karel a Milena Gottová odvolala svůj plán na vystouPENÍ na Expo v Hannoverě poté, když architektonický kritik Zdeněk Lukeš v Lidově novinách označil jejich účinkování za „podbízivé show\" a zpěváka za „zombie\", který by mohl zpíhat v Německu. Ministr kultury po schvaluji této odvolávky vyjádřil nadšení, zatímco německé fanoušky a policie reagovali protest",
        "reference":"Zpěvák Karel Gott po schůzce s ministrem kultury Pavlem Dostálem, generálním komisařem české účasti na Expo 2000 a organizátory kulturního programu, definitivně potvrdil, že pojede 7. června na Expo 2000 do Hannoveru.\"Všechno zlé je k něčemu dobré. Nyní vím, že mám stále tolik fanoušků,\" řekl Gott",
        "reference_contexts":[
            "\"Nechtěl jsem se nechat prosit, to, že vystoupím beru jako čest,\" řekl zpěvák, který chtěl svou účast na Expo 2000 odvolat poté, co v Lidových novinách vyšel článek architekta a historika umění Zdeňka Lukeše, kde autor označil jeho případné vystoupení na výstavě za podbízivou šmíráckou show a jeho samotného za zombieho, který od poloviny 60. let kazí vkus v Čechách a nyní ho pojede kazit do Německa.Ministr kultury Pavel Dostál byl po schůzce s Karlem Gottem rád, že zpěvák nakonec účast na výstavě přislíbil. \"Touto kampaní alespoň naše země ušetřila za propagaci koncertu,\" uzavřel. Zpěvák Karel Gott už zvrátil své rozhodnutí nevystoupit v červnu na světové výstavě Expo 2000 v rozhovoru pro pondělní vydání hannoverského listu Neue Presse. \"Po reakcích mého publika jsem změnil názor,\" vysvětlil náhlou změnu postoje.O víkendu uspořádali Gotttovi fanoušci na několika místech v Německu demonstrace, na nichž zpívali kupříkladu píseň ze seriálu o včelce Máje. Proti jednomu z příznivců musela zasáhnout policie, protože v hračkářství sebral velikou plyšovou figurku včelky Máji a odmítal ji policii vydat, dokud zpěvák neslíbí, že na výstavu přijede. Na sobotním srazu v hannoverské kavárně Expo přednesli jeho fanoušci popěvek z Včelky Máji a skandovali \"Komm, Karl, Komm\" - \"Přijeď, Karle, přijeď\". PŘEDCHOZÍ VÝVOJ:Kritika v Lidových novináchKarel Gott se rozhodl svou účast na Expo odvolat poté, co v Lidových novinách vyšel dvaadvacetiřádkový článek architekta a historika umění Zdeňka Lukeše. V článku \"Hannovergott\" označil jeho vystoupení na EXPO 2000 za podbízivou šmíráckou show a jeho samotného za zombieho, který od poloviny 60. let kazí vkus v Čechách a nyní ho pojede kazit do Německa. \"Nechci být přemlouván, chtěl jsem jen dát lidem najevo, že nemohu vystoupit s pocitem, že jsem šmíra, své rozhodnutí nyní přehodnocuji a promýšlím,\" řekl Gott ve čtvrtek. Autor kritiky si podle něho vyřizuje s organizátory české účasti na výstavě Expo osobní účty. \"Mě tam dal, aby to udělal zajímavé,\" míní zpěvák. Způsob kritiky své osoby považuje za sprosťárnu a čeká omluvu. Zpěvák musí být podle Gotta vnitřně v pohodě, aby v jeho písni byla radost. Útok proti sobě považuje Český slavík za akci temných sil, které chtějí dělat blbou náladu a které vědí, že cílené zranění mu vezme chuť do práce. Rozhlasoví fanoušci rozžhavili telefonní linky Během rozhlasové relace \"Přijeď, Karle, přijeď\" stovky posluchařů severoněmeckého veřejnoprávního rozhlasového a televizního okruhu Norddeutscher Rundfunk podle agentury AP úplně rozžhavili telefonní linky. Žádost o Gottovo vystoupení se objevila v další stovce faxů. Německo: neúčast Gotta by byla katastrofa\"Když po USA odřekne účast ještě Karel Gott, byla by to skutečná katastrofa,\" řekl v pátek moderátor kanálu NDR-2 Uwe Bahn v narážce na americkou neochotu organizovat na Expo vlastní expozici. Primátor Hannoveru Herbert Schmalstieg označil Gotta za jednoho z nejoblíbenějších interpretů populární hudby. \"Nejenže svými písněmi baví, ale přináší lidem také radost,\" uvedl. Když nepojede Gott, nebude na expu český pop\"Nebude-li v Hannoveru při našem národním dnu sedmého června zpívat Karel Gott, nebude tam ani jiný český pop, nicméně to pochopitelně neznamená, že tam nebude v kulturním programu nic jiného,\" prohlásil minulý týden generální komisař účasti České republiky na EXPO 2000 Václav Bartuška. Je ovšem limitován šesti miliony korun určenými na tento den v celkovém rozpočtu 330 milionů. Komisař by například rád docílil toho, aby měli v dějišti výstavy na své lodi divadelní představení bratři Formanové, chystající na léto pro Prahu - Evropské město kultury roku 2000 projekt s tlačným remorkérem. \"Ve městě přeplněném akcemi by jejich připlutí bylo něco originálního,\" soudí Bartuška. Bartuška je přesvědčen, že národní den České republiky se neobejde ani bez klasické hudby, v jejíž interpretaci je země pro svět zajímavá. Na EXPO 2000 má vystoupit i Hudba Hradní stráže.Karel Gott, Václav Bartuška, Pavel Dostál a Miloš Zapletal před novináři."
        ]
    },
    {
        "user_input":"Shrň tento článek do stručného shrnutí.",
        "retrieved_contexts":[
            "\"Zhodnocení záznamu nám může ukázat, jak proces probíhal, ukázat, jaká byla atmosféra,\" řekl Tomáš Havlík z Nejvyššího státního zastupitelství. Už navrhl, aby se záznamem začal zabývat vyšetřovatel z Úřadu pro dokumentaci a vyšetřování zločinů komunismu. Nahrávka se tak možná stane jedním z důkazů proti někdejšímu přísedícímu soudci Pavlu Vítkovi - jedinému, kdo se z zinscenovananého procesu dnes může ještě zodpovídat. Záznam objevil Hájek náhodou. Připravoval dokument pro televizní cyklus Třicet návratů a řekl si, že by nebylo špatné oživit jej nějakým dobovým zvukovým záznamem.\"Zadali jsme vyhledat nahrávky na téma Babice a ono nám to vyhodilo tohle. Hned jsme vlítli do archivu, stočili si jej a ukázalo se, že je to materiál, který je strašně důležitý. Takže se dá říct, že jsme na to přišli náhodou,\" popisuje Hájek. NAHRÁVKA POMŮŽE VYŠETŘOVATELŮM Malý úryvek nahrávky slyšeli televizní diváci, kteří sledovali dokument navazující na jeden díl seriálu Majora Zemana, nazvaný Vrah se skrývá v poli. Význam nahrávky je však mnohem větší: může pomoci objasnit okolnosti procesu, metody, jakými postupovala tajná bezpečnost, a roli soudce Vítka, který bude před soudem zřejmě čelit obvinění ze spoluúčasti na vraždě. Ostatní aktéři procesu včetně předsedy a prokurátora jsou již po smrti. Vítkův kolega, rovněž někdejší přísedící soudce Jaroslav Demczak, byl z případného trestního stíhání vyřazen kvůli duševní chorobě. \"To je fakt zajímavé, že ta nahrávka existuje. Stálo by za to porovnat, zda záznam je v souladu s písemným protokolem. To svůj význam může mít, zvlášť kdyby se zjistilo, že došlo k překrucování a zkreslování fakt,\" řekl jihlavský státní zástupce Arif Salichov, který kauzu soudce Vítka původně dozoroval. Zároveň však upozornil, že ani odborné vyhodnocení nahrávky zřejmě nepřinese žádné převratné překvapení. \"Velké excesy se sotva objeví, vše bylo pečlivě připraveno,\" řekl.Podobný názor má i Dušan Purkar z Úřadu pro dokumentaci a vyšetřování zločinů komunismu, který má kauzu Babice na starosti. \"Pokud dostaneme pokyn, záznam si vyžádáme. Ale důkazy, které jsme dosud shromáždili, považujeme za dostatečné,\" řekl Purkar. Záznam procesu však může mít velký význam i pro objasnění sporu, zda Vítek už během procesu věděl, či nevěděl o tom, že přelíčení je jen zinscenovanou fraškou. Poslech nahrávky, kdy posluchači běhá mráz po zádech, totiž nikoho nenechá na pochybách, o co jde. Hájek nevylučuje, že se časem objeví další důkazy, které vnesou světlo do půlstoletí staré tragédie. \"Původně jsme si mysleli, že uděláme jen jakési shrnutí toho případu. Je deset let po listopadu, pracovala na tom řada novinářů, co se může objevit nového? A vidíte, objevili jsme převratné věci. Mám z toho velkou radost. Současně to však ukazuje, jak je ten případ složitý,\" řekl Hájek. OKOLNOSTI ÚTOKU JSOU STÁLE NEJASNÉ Proces s takzvanými babickými vrahy se konal v Jihlavě v létě 1951. Rozsudky předem schválila takzvaná bezpečnostní pětka, vrcholný stranický orgán, soudci je jen vyhlásili. Záminkou k procesu se stal útok ozbrojeného komanda na funkcionáře KSČ ve škole v Babicích na Třebíčsku. Útok vedl Ladislav Malý, který se vydával za agenta americké tajné služby a podle některých názorů byl provokatérem StB. Útok se stal záminkou k obrovským represáliím, desítky lidí skončily ve vězení, přišly o majetek a byly z kraje vystěhovány. Skutečné okolnosti útoku a roli Ladislava Malého se dodnes nepodařilo zcela objasnit. \"Tajná bezpečnost však tragédii využila dobře,\" soudí Hájek."
        ],
        "response":"Hlavnímu státem zapsané záznamek z inscenovaného procesu „babických vražd\" může sloužit jako klíčový důkaz proti bývalému přísedajícímu soudcovi Pavlu Vítku, který by měl být nyní odsouzen. Tento archivovaný materiál, nalezený náhodně při přípravě dokumentárního cyklu, dokládá, že proces byl plně zinscenován a jeho výsledky byly pečlivé manipulace, což potvrzuje obviněné role tajné bezpeč",
        "reference":"Novinář Pavel Hájek po osmačtyřiceti letech slyšel hlasy soudců a odsouzených v zinscenovaném babickém procesu. Slyšel i hlasy těch, kteří byli tehdy odsouzeni k smrti a v roce 1951 popraveni. Byl překvapen. Nikdo z odborníků totiž nevěděl, že by mohl existovat zvukový záznam ze smutně proslulého procesu, navíc dlouhý několik hodin a zachycující výpovědi většiny obžalovaných. V přelíčení sledovaném osobně tehdejším prezidentem Gottwaldem bylo sedm lidí odsouzeno k trestu smrti",
        "reference_contexts":[
            "\"Zhodnocení záznamu nám může ukázat, jak proces probíhal, ukázat, jaká byla atmosféra,\" řekl Tomáš Havlík z Nejvyššího státního zastupitelství. Už navrhl, aby se záznamem začal zabývat vyšetřovatel z Úřadu pro dokumentaci a vyšetřování zločinů komunismu. Nahrávka se tak možná stane jedním z důkazů proti někdejšímu přísedícímu soudci Pavlu Vítkovi - jedinému, kdo se z zinscenovananého procesu dnes může ještě zodpovídat. Záznam objevil Hájek náhodou. Připravoval dokument pro televizní cyklus Třicet návratů a řekl si, že by nebylo špatné oživit jej nějakým dobovým zvukovým záznamem.\"Zadali jsme vyhledat nahrávky na téma Babice a ono nám to vyhodilo tohle. Hned jsme vlítli do archivu, stočili si jej a ukázalo se, že je to materiál, který je strašně důležitý. Takže se dá říct, že jsme na to přišli náhodou,\" popisuje Hájek. NAHRÁVKA POMŮŽE VYŠETŘOVATELŮM Malý úryvek nahrávky slyšeli televizní diváci, kteří sledovali dokument navazující na jeden díl seriálu Majora Zemana, nazvaný Vrah se skrývá v poli. Význam nahrávky je však mnohem větší: může pomoci objasnit okolnosti procesu, metody, jakými postupovala tajná bezpečnost, a roli soudce Vítka, který bude před soudem zřejmě čelit obvinění ze spoluúčasti na vraždě. Ostatní aktéři procesu včetně předsedy a prokurátora jsou již po smrti. Vítkův kolega, rovněž někdejší přísedící soudce Jaroslav Demczak, byl z případného trestního stíhání vyřazen kvůli duševní chorobě. \"To je fakt zajímavé, že ta nahrávka existuje. Stálo by za to porovnat, zda záznam je v souladu s písemným protokolem. To svůj význam může mít, zvlášť kdyby se zjistilo, že došlo k překrucování a zkreslování fakt,\" řekl jihlavský státní zástupce Arif Salichov, který kauzu soudce Vítka původně dozoroval. Zároveň však upozornil, že ani odborné vyhodnocení nahrávky zřejmě nepřinese žádné převratné překvapení. \"Velké excesy se sotva objeví, vše bylo pečlivě připraveno,\" řekl.Podobný názor má i Dušan Purkar z Úřadu pro dokumentaci a vyšetřování zločinů komunismu, který má kauzu Babice na starosti. \"Pokud dostaneme pokyn, záznam si vyžádáme. Ale důkazy, které jsme dosud shromáždili, považujeme za dostatečné,\" řekl Purkar. Záznam procesu však může mít velký význam i pro objasnění sporu, zda Vítek už během procesu věděl, či nevěděl o tom, že přelíčení je jen zinscenovanou fraškou. Poslech nahrávky, kdy posluchači běhá mráz po zádech, totiž nikoho nenechá na pochybách, o co jde. Hájek nevylučuje, že se časem objeví další důkazy, které vnesou světlo do půlstoletí staré tragédie. \"Původně jsme si mysleli, že uděláme jen jakési shrnutí toho případu. Je deset let po listopadu, pracovala na tom řada novinářů, co se může objevit nového? A vidíte, objevili jsme převratné věci. Mám z toho velkou radost. Současně to však ukazuje, jak je ten případ složitý,\" řekl Hájek. OKOLNOSTI ÚTOKU JSOU STÁLE NEJASNÉ Proces s takzvanými babickými vrahy se konal v Jihlavě v létě 1951. Rozsudky předem schválila takzvaná bezpečnostní pětka, vrcholný stranický orgán, soudci je jen vyhlásili. Záminkou k procesu se stal útok ozbrojeného komanda na funkcionáře KSČ ve škole v Babicích na Třebíčsku. Útok vedl Ladislav Malý, který se vydával za agenta americké tajné služby a podle některých názorů byl provokatérem StB. Útok se stal záminkou k obrovským represáliím, desítky lidí skončily ve vězení, přišly o majetek a byly z kraje vystěhovány. Skutečné okolnosti útoku a roli Ladislava Malého se dodnes nepodařilo zcela objasnit. \"Tajná bezpečnost však tragédii využila dobře,\" soudí Hájek."
        ]
    },
    {
        "user_input":"Shrň tento článek do stručného shrnutí.",
        "retrieved_contexts":[
            "\" Prý jste byl dost vyhecovaný nedávnou kritikou v tisku.Byl jsem pořádně naštvaný. Minulé pondělí nás vyřadil z Anglického poháru druholigový Blackburn a novináři to hodili na mě, přestože to nešlo skoro nikomu. Myslíte, že jste je vítěznou brankou do sítě Watfordu umlčel? Doufám, ale to se teprve uvidí. Nemrzí vás, že ten gól neviděl váš tchán Ladislav Vízek, který u vás nedávno byl téměř měsíc na návštěvě? Ani ne, hned po zápase jsem mu volal a podrobně referoval. Jako první z rodiny tu branku viděla v televizním šotu maminka, která je u nás na návštěvě právě teď. V zápase na Watfordu zazářil hlavně váš kamarád a spoluhráč Berger. Trenér Houllier se nad ním prý rozplýval.Patrikovi to opravdu sedlo. Anglicky už docela dobře čtu a v novinách se to hemžilo Houllierovými výroky ve smyslu, že Patrika dovede k absolutní špičce a že z něj udělá světového hráče. Od příchodu do Liverpoolu vám dělá těžkosti zraněný kotník. O jaké potíže vlastně jde? V šestnácti jsem měl na pravém kotníku natržené vazy a ono se to občas ozývá.Loni v létě na začátku dovolené jsem si kotník zvrtnul při zápase za Vízkovu Kozlovnu. V přípravě mě pobolíval, po druhém ligovém zápase jsem musel vysadit. Pak jsem si natáhl levý a po něm pravý stehenní sval, zase tři týdny pauza. Potom jsem dával pozor na stehno, zapomněl na kotník, a zase to bylo v háji. Teď hraju s otejpovanou nohou a čekám na zázrak. Jak to myslíte? Vízkův kamarád a bývalý spoluhráč Luděk Macela zná nějakého čínského doktora, který mi po něm pošle speciální obvaz, něčím zázračným napuštěný. Měl by mít i zaručené léčebné účinky, tak jsem na to opravdu moc zvědav. Jste po prvním ligovém gólu v pohodě? Já byl v klidu i předtím, to zase jen místní novináři přehnali, že jsem frustrován. Byl jsem spíš otrávený z těch zranění. Navíc v polovině prosince jsme se přestěhovali do většího domku. V tom předchozím jsme byli dočasně, ani jsme ze spousty krabic neměli vybalené věci, co jsme si v létě přivezli z Francie. Teď se konečně cítíme jako doma. Jaký je váš nejbližší cíl? Přizpůsobit se anglickému hernímu stylu. Agresivita je tu na samé hranici únosnoti a to mně jako technickému hráči nikdy nesedělo. Nesmím si prostě připouštět, že jde o nohy. Smlouvu mám do léta 2003 a chci ji v Liverpoolu dodržet. Ze sedmnácti zápasů jsem sice dvanáctkrát nastoupil v základní sestavě, ale to je málo. Musím si vydobýt tak neochvějnou pozici, jakou tu má Patrik Berger."
        ],
        "response":"Liverpoolský hráč Patrik Langer se po kritice z anglického tisku snaží vrátit k své původní roli, zatímco jeho bývalí spoluhráči Berger a Houlliera ho oceňují. Hráč si však všiml, že se jeho zdravotní stav (natržená kotníková vazy) zhoršuje a očekává zázrac od čínské lékařské pomoci, zatím než se připraví na další sezónu.",
        "reference":"Konečně, oddechl si v sobotu fotbalový reprezentant Vladimír Šmicer, když po půlroce v Liverpoolu vstřelil do sítě Watfordu svůj první gól v anglické Premier League. \"Nebyla to žádná bomba, spíš povedený míč k tyči,\" popsal Šmicer střelu, jíž devatenáct minut před koncem rozhodl o vítězství svého týmu 3:2. \"Šel jsem na hřiště za stavu dva dva a měl jsem s tím něco udělat",
        "reference_contexts":[
            "\" Prý jste byl dost vyhecovaný nedávnou kritikou v tisku.Byl jsem pořádně naštvaný. Minulé pondělí nás vyřadil z Anglického poháru druholigový Blackburn a novináři to hodili na mě, přestože to nešlo skoro nikomu. Myslíte, že jste je vítěznou brankou do sítě Watfordu umlčel? Doufám, ale to se teprve uvidí. Nemrzí vás, že ten gól neviděl váš tchán Ladislav Vízek, který u vás nedávno byl téměř měsíc na návštěvě? Ani ne, hned po zápase jsem mu volal a podrobně referoval. Jako první z rodiny tu branku viděla v televizním šotu maminka, která je u nás na návštěvě právě teď. V zápase na Watfordu zazářil hlavně váš kamarád a spoluhráč Berger. Trenér Houllier se nad ním prý rozplýval.Patrikovi to opravdu sedlo. Anglicky už docela dobře čtu a v novinách se to hemžilo Houllierovými výroky ve smyslu, že Patrika dovede k absolutní špičce a že z něj udělá světového hráče. Od příchodu do Liverpoolu vám dělá těžkosti zraněný kotník. O jaké potíže vlastně jde? V šestnácti jsem měl na pravém kotníku natržené vazy a ono se to občas ozývá.Loni v létě na začátku dovolené jsem si kotník zvrtnul při zápase za Vízkovu Kozlovnu. V přípravě mě pobolíval, po druhém ligovém zápase jsem musel vysadit. Pak jsem si natáhl levý a po něm pravý stehenní sval, zase tři týdny pauza. Potom jsem dával pozor na stehno, zapomněl na kotník, a zase to bylo v háji. Teď hraju s otejpovanou nohou a čekám na zázrak. Jak to myslíte? Vízkův kamarád a bývalý spoluhráč Luděk Macela zná nějakého čínského doktora, který mi po něm pošle speciální obvaz, něčím zázračným napuštěný. Měl by mít i zaručené léčebné účinky, tak jsem na to opravdu moc zvědav. Jste po prvním ligovém gólu v pohodě? Já byl v klidu i předtím, to zase jen místní novináři přehnali, že jsem frustrován. Byl jsem spíš otrávený z těch zranění. Navíc v polovině prosince jsme se přestěhovali do většího domku. V tom předchozím jsme byli dočasně, ani jsme ze spousty krabic neměli vybalené věci, co jsme si v létě přivezli z Francie. Teď se konečně cítíme jako doma. Jaký je váš nejbližší cíl? Přizpůsobit se anglickému hernímu stylu. Agresivita je tu na samé hranici únosnoti a to mně jako technickému hráči nikdy nesedělo. Nesmím si prostě připouštět, že jde o nohy. Smlouvu mám do léta 2003 a chci ji v Liverpoolu dodržet. Ze sedmnácti zápasů jsem sice dvanáctkrát nastoupil v základní sestavě, ale to je málo. Musím si vydobýt tak neochvějnou pozici, jakou tu má Patrik Berger."
        ]
    },
    {
        "user_input":"Shrň tento článek do stručného shrnutí.",
        "retrieved_contexts":[
            "Nejprve se zranil a na podzim chyběl na trávníku pro to, že Reggiana sestoupila do třetí ligy, v níž cizinci nesmějí startovat. \"Hlavně teď potřebuji pravidelně hrávat. To mi v minulých měsících chybělo. Možná ale na mě po dvou, třech zápasech přijde nějaká krize.\" Osmadvacetiletý Edvard Lasota bydlí v Třinci, kde s fotbalem začínal. Postupně prošel Brnem, Duklou Praha, Olomoucí, Drnovicemi a Slavií Praha. Myslíte, že se podaří dohodnout hostování v Opavě?Doufám v to, jinak bych zřejmě další půlrok nemohl hrát, a to by už asi bylo zralé na psychiatra. Byly by to dva roky, což by bylo moc. Uplynulý rok a půl už je hodně. Zřejmě záleží i na vás, na vašem jednání s Reggianou.Mám v Reggianě smlouvu ještě na rok a půl a asi budu muset slevit. Snad se nějak rozumně domluvíme. Je nařízení, že ve třetí italské lize nesmějí působit cizinci rozumné?Je to správné, protože v italském fotbale je hodně cizinců. V Itálii je vůbec přebytek fotbalistů. I čtvrtá liga je profesionální a v kempech jednotlivých klubů jsou další hráči, kteří nehrávají. Doslova a do písmene je tam obrovský boj o místa. Každé mužstvo má v kádru pětadvacet osmadvacet hráčů, prosadit se je hrozně těžké. Nemůže se stát, že půjdete jinam než do Opavy?Pro nadcházející půlrok připadá v úvahu jen Opava. Už bych ani s nikým jiným, kdyby přišel, nejednal. Sledoval jste z Itálie tuzemskou první ligu?Zběžně. Za dva a půl roku, co jsem tady nebyl, přibylo hodně nových hráčů. Třeba opavský Lumír Sedláček byl ještě dorostenec, když jsem odcházel a teď jsem slyšel, že se z něho stal vynikající hráč. Ale podobné je to i jinde, třeba ve Slavii. Znáte blíže některé opavské fotbalisty?Pavlem Harazimem jsem působil v Drnovicích, s Radkem Onderkou v Olomouci a s Míšou Štefkou v Brně. Ty tři znám osobně. Proti dalším, těm starším, jsem hrával. Trenér Bartl vás zařadil na pravou stranu zálohy s tím, že se v případě potřeby stáhnete na kraj obrany. Vyhovuje vám to?Je mi jedno jestli hraju na pravé nebo levé straně. Minulých čtyři, pět let jsem hrával na kraji sestavy, takže pokud by mě chtěl postavit do středu zálohy, musel bych tam odehrát celou přípravu, abych se zabydlel. Problém by to ale nebyl."
        ],
        "response":"Edvard Lasot, bývalý hráč brněnské Slavia, se nyní nachází v Italské třetí lize u klubu Reggia, kde mu nedostatek zkušeností a změna ligové struktury vyžadují návrat do základny. Klíčovým problémem je absence pravidelných zápasů, které by byly nezbytné pro udržení sportovního stavu, a zároveň musí řešit otázku hostování, zejména v Opávě, která je jedinou dostupnou alternativou pro sezónu.",
        "reference":"Ochoten částečně slevit z výhodné smlouvy s italskou Reggianou, jen aby mohl hrát, je fotbalový záložník Edvard Lasota. Dnes odjíždí do Itálie, aby se se svým klubem domluvil na podmínkách hostování ve Slezském FC Opava. S ním se už připravuje na jarní část první ligy a v zápase s Ratíškovicemi parádně přihrál na rozhodující gól Janouškovi. \"Jsem rád, že konečně hraji,\" řekl Lasota, jemuž rok a půl schází rytmus pravidelné soutěže",
        "reference_contexts":[
            "Nejprve se zranil a na podzim chyběl na trávníku pro to, že Reggiana sestoupila do třetí ligy, v níž cizinci nesmějí startovat. \"Hlavně teď potřebuji pravidelně hrávat. To mi v minulých měsících chybělo. Možná ale na mě po dvou, třech zápasech přijde nějaká krize.\" Osmadvacetiletý Edvard Lasota bydlí v Třinci, kde s fotbalem začínal. Postupně prošel Brnem, Duklou Praha, Olomoucí, Drnovicemi a Slavií Praha. Myslíte, že se podaří dohodnout hostování v Opavě?Doufám v to, jinak bych zřejmě další půlrok nemohl hrát, a to by už asi bylo zralé na psychiatra. Byly by to dva roky, což by bylo moc. Uplynulý rok a půl už je hodně. Zřejmě záleží i na vás, na vašem jednání s Reggianou.Mám v Reggianě smlouvu ještě na rok a půl a asi budu muset slevit. Snad se nějak rozumně domluvíme. Je nařízení, že ve třetí italské lize nesmějí působit cizinci rozumné?Je to správné, protože v italském fotbale je hodně cizinců. V Itálii je vůbec přebytek fotbalistů. I čtvrtá liga je profesionální a v kempech jednotlivých klubů jsou další hráči, kteří nehrávají. Doslova a do písmene je tam obrovský boj o místa. Každé mužstvo má v kádru pětadvacet osmadvacet hráčů, prosadit se je hrozně těžké. Nemůže se stát, že půjdete jinam než do Opavy?Pro nadcházející půlrok připadá v úvahu jen Opava. Už bych ani s nikým jiným, kdyby přišel, nejednal. Sledoval jste z Itálie tuzemskou první ligu?Zběžně. Za dva a půl roku, co jsem tady nebyl, přibylo hodně nových hráčů. Třeba opavský Lumír Sedláček byl ještě dorostenec, když jsem odcházel a teď jsem slyšel, že se z něho stal vynikající hráč. Ale podobné je to i jinde, třeba ve Slavii. Znáte blíže některé opavské fotbalisty?Pavlem Harazimem jsem působil v Drnovicích, s Radkem Onderkou v Olomouci a s Míšou Štefkou v Brně. Ty tři znám osobně. Proti dalším, těm starším, jsem hrával. Trenér Bartl vás zařadil na pravou stranu zálohy s tím, že se v případě potřeby stáhnete na kraj obrany. Vyhovuje vám to?Je mi jedno jestli hraju na pravé nebo levé straně. Minulých čtyři, pět let jsem hrával na kraji sestavy, takže pokud by mě chtěl postavit do středu zálohy, musel bych tam odehrát celou přípravu, abych se zabydlel. Problém by to ale nebyl."
        ]
    },
    {
        "user_input":"Shrň tento článek do stručného shrnutí.",
        "retrieved_contexts":[
            "Zdá se, že místo zadního stopera obsadí Bakeš, talentovaný dvaadvacetiletý hráč, který na sebe upozornil v Krči, jež si jej vyhlédla v Chrudimi. \"Zatím si vede překvapivě dobře,\" pozoruje Petržela. Jeho definitivní příchod komplikují jednání ohledně odstupného. \"Podepsal s námi smlouvu, to je na prvním místě. Chceme se dohodnout s Krčí, kde má ještě hostování do konce sezony, i s Chrudimí. Budeme muset zaplatit zřejmě oběma klubům, ale Bakeš vypadá, že za to bude stát.\" Nad další kariérou skvělého libera Kamenického, Bakešova předchůdce, se stahují mračna. \"Celkem třináctkrát byl na operaci s kolenem, za mého působení v Bohemce to byla už osmá,\" říká kouč Bohemians. \"Zřejmě trpí těžkou artrózou. Odjel do lázní, děláme, co můžeme, abychom mu prodloužili fotbalový život o nějaký pátek, alespoň o rok o dva. Nechci dělat nad někým předčasné soudy co se týče zdravotního stavu, ale doktoři nejsou moc optimističtí,\" říká Petržela. V útoku se střídají fotbalisté vesměs z nižších soutěží. Nejnovější akvizicí na hrot je Doseděl z Kolína. \"Zatím ho nebudu hodnotit, je s námi krátce. Bednář fyzicky nestačí, při běhání je daleko poslední, ale na hřišti je vidět, že kopat umí. Na ligu by bylo potřeba, aby to bylo agresivnější. Něco v sobě má. Do zítra mu řekneme, co a jak. Kulvajt vypadal ve dvou utkáních dobře, ale ve třetím byl tragický. Možná že za to může únava nebo jsem ho někde pochválil a on to neunesl. Veleba, když k nám na podzim přišel, měl problémy s fyzičkou. Měl dovolenou na to, aby dohnal tréninkové manko, ale asi doma oslavoval, že půjde do Bohemky. Začíná od nuly.\" Do začátku ligy bude klub podle Petržely jednat o příchodu útočníka, který už ligu hrál. \"Napadají mě Barbarič nebo Klago z Liberce. Musíme si vybírat hráče pro náš styl, který je založen na napadání už na útočné polovině.\" Na dotaz, zda by se mohl v dresu Bohemians objevit Zdráhal, jenž by se měl v dubnu vrátit z angažmá v Turecku, Petržela odpověděl: \"Abych přiznal, tak s ním moc nepočítám. Ne že by byl špatný, ale byl úplně zblblý, jak viděl dolary. Nedalo se s ním komunikovat.\""
        ],
        "response":"Vítězství Bohemian FC v sezoně 2017\/2020 je potvrzeno tím, že v úterý nastoupil na hru proti Pardubicím. Po vítězství v domácí hře proti Karlovým Varhamům se v sobotu v 18. hodině odehrála hra proti Pardubickým Univerzitním sportovním klubu.",
        "reference":"Základní kameny sestavy Bohemians pro mistrovskou soutěž jsou již podle kouče Vlastimila Petržely položeny, byť se tým nachází teprve v první třetině zimní přípravy. \"Culek je jednička na postu defenzivního záložníka. Víme že Petrouš může hrát z pravé strany, z druhé Mareš, Kulig, nebo Jůn, to máme otestované. Uzdravil se Návrat, měl by se tam také někde objevit. Jediným naším problémem jsou útočníci. Každý zápas zkoušíme, hledáme, ale úplně spokojený nejsem.\"",
        "reference_contexts":[
            "Zdá se, že místo zadního stopera obsadí Bakeš, talentovaný dvaadvacetiletý hráč, který na sebe upozornil v Krči, jež si jej vyhlédla v Chrudimi. \"Zatím si vede překvapivě dobře,\" pozoruje Petržela. Jeho definitivní příchod komplikují jednání ohledně odstupného. \"Podepsal s námi smlouvu, to je na prvním místě. Chceme se dohodnout s Krčí, kde má ještě hostování do konce sezony, i s Chrudimí. Budeme muset zaplatit zřejmě oběma klubům, ale Bakeš vypadá, že za to bude stát.\" Nad další kariérou skvělého libera Kamenického, Bakešova předchůdce, se stahují mračna. \"Celkem třináctkrát byl na operaci s kolenem, za mého působení v Bohemce to byla už osmá,\" říká kouč Bohemians. \"Zřejmě trpí těžkou artrózou. Odjel do lázní, děláme, co můžeme, abychom mu prodloužili fotbalový život o nějaký pátek, alespoň o rok o dva. Nechci dělat nad někým předčasné soudy co se týče zdravotního stavu, ale doktoři nejsou moc optimističtí,\" říká Petržela. V útoku se střídají fotbalisté vesměs z nižších soutěží. Nejnovější akvizicí na hrot je Doseděl z Kolína. \"Zatím ho nebudu hodnotit, je s námi krátce. Bednář fyzicky nestačí, při běhání je daleko poslední, ale na hřišti je vidět, že kopat umí. Na ligu by bylo potřeba, aby to bylo agresivnější. Něco v sobě má. Do zítra mu řekneme, co a jak. Kulvajt vypadal ve dvou utkáních dobře, ale ve třetím byl tragický. Možná že za to může únava nebo jsem ho někde pochválil a on to neunesl. Veleba, když k nám na podzim přišel, měl problémy s fyzičkou. Měl dovolenou na to, aby dohnal tréninkové manko, ale asi doma oslavoval, že půjde do Bohemky. Začíná od nuly.\" Do začátku ligy bude klub podle Petržely jednat o příchodu útočníka, který už ligu hrál. \"Napadají mě Barbarič nebo Klago z Liberce. Musíme si vybírat hráče pro náš styl, který je založen na napadání už na útočné polovině.\" Na dotaz, zda by se mohl v dresu Bohemians objevit Zdráhal, jenž by se měl v dubnu vrátit z angažmá v Turecku, Petržela odpověděl: \"Abych přiznal, tak s ním moc nepočítám. Ne že by byl špatný, ale byl úplně zblblý, jak viděl dolary. Nedalo se s ním komunikovat.\""
        ]
    },
    {
        "user_input":"Shrň tento článek do stručného shrnutí.",
        "retrieved_contexts":[
            "Do Poslanecké sněmovny by se podle STEM dostaly ještě KDU-ČSL s preferencemi 12 procent a Unie svobody, kterou preferuje 10,6 procenta z 1658 dotázaných. K volbám je určitě rozhodnuto jít 49 procent lidí, 31 procent není rozhodnuto a 20 procent lidí jít volit nehodlá.Velký a střední zájem o politické dění v České republice podle agentury nyní projevuje 44 procent obyvatel, což je o 16 procent méně než v únoru 1998 a o pět procent proti lednu 1999. Největší zájem o politiku projevují voliči ODS, proti tomu výsledek Unie svobody a KDU-ČSL by závisel na hlasech méně motivovaných voličů. Lidé, kteří jsou i nyní rozhodnuti volit ČSSD, tvoří zřejmě \"tvrdé jádro\".Mezi voliči ODS a Unie svobody převažují lidé spokojení se životem a se zájmem o politiku, voliči lidovců jsou z většiny lidé spokojení, kteří se ale o politiku nezajímají. U ČSSD převažují spokojení lidé, u nichž je zájem a nezájem o politiku vyrovnán. Příznivci KSČM jsou většinou nespokojení lidé bez zájmu o politické dění. Porovnání výsledků průzkumů volebních preferencí agentury STEM v prosinci 1999 a lednu 2000"
        ],
        "response":"Volební průzkumník agentury STEAM zjistil, že 42 % občanů České republiky má velký zájem k politickému dění, zatímco předchozí data ukazovala vyšší míru zájmenosti. Výsledky průzkumu odrážejí změnu v sociálních preferencích voliče, zejména mezi ODS (spokojenými) a Uníí svobody či KDU–ČSL (zřetelněji závislou na motivaci), zatímco tradiční strany jako ČSS",
        "reference":"Dvě nejsilnější politické strany, ČSSD a ODS, který nyní jednají o prohloubení opoziční smlouvy, si v posledním průzkumu volebních preferencí mírně polepšily. ODS přibyly od prosince skoro tři procenta a na začátku ledna ji podporovalo 22,1 procenta lidí, ČSSD si přičetla téměř dvě procenta a má nyní 15,4 procenta. Mezi tyto strany se vklínila KSČM s 17,9 procenta hlasů, což je však o jeden a půl procenta méně než v prosinci",
        "reference_contexts":[
            "Do Poslanecké sněmovny by se podle STEM dostaly ještě KDU-ČSL s preferencemi 12 procent a Unie svobody, kterou preferuje 10,6 procenta z 1658 dotázaných. K volbám je určitě rozhodnuto jít 49 procent lidí, 31 procent není rozhodnuto a 20 procent lidí jít volit nehodlá.Velký a střední zájem o politické dění v České republice podle agentury nyní projevuje 44 procent obyvatel, což je o 16 procent méně než v únoru 1998 a o pět procent proti lednu 1999. Největší zájem o politiku projevují voliči ODS, proti tomu výsledek Unie svobody a KDU-ČSL by závisel na hlasech méně motivovaných voličů. Lidé, kteří jsou i nyní rozhodnuti volit ČSSD, tvoří zřejmě \"tvrdé jádro\".Mezi voliči ODS a Unie svobody převažují lidé spokojení se životem a se zájmem o politiku, voliči lidovců jsou z většiny lidé spokojení, kteří se ale o politiku nezajímají. U ČSSD převažují spokojení lidé, u nichž je zájem a nezájem o politiku vyrovnán. Příznivci KSČM jsou většinou nespokojení lidé bez zájmu o politické dění. Porovnání výsledků průzkumů volebních preferencí agentury STEM v prosinci 1999 a lednu 2000"
        ]
    },
    {
        "user_input":"Shrň tento článek do stručného shrnutí.",
        "retrieved_contexts":[
            "\"Srdečně chci pozdravit všechny lidi v Holguínu a také na celé Kubě,\" řekl Maradona po příletu. \"Doufám, že mé srdce je v pořádku a fanoušci mě ještě někdy spatří ve fotbalové exhibici,\" dodal. Zhruba po hodině nasedl do letadla do Havany, kde se podrobí vyšetření. Teprve pak se vrátí na kliniku v Holguínu. Během krátké zastávky v Holguínu si Maradona na letišti oblékl bílé tričko s portrétem revolucionáře Che Guevary. \"Jsem rebel,\" prohlásil s úsměvem Maradona, když si tričko oblékl. Prezident Castro osobně Maradonu na Kubu pozval, protože je jeho přítelem a velkým fanouškem. Nikdo z lékařů zatím neprozradil, jak dlouho se bude Maradona na Kubě léčit, podle Cahea to bude zhruba tři až šest měsíců. K odvykací kúře se někdejší slavný fotbalista rozhodl poté, co se před dvěma týdny na dovolené v Uruguayi málem předávkoval kokainem a s kardiovaskulárními problémy byl hospitalizován. Diego Maradona se brání kameramanům na letišti v Havaně"
        ],
        "response":"Maradona se po přistání v Havane podrobuje vyšetřování a čeká na léčebnou kúru, která trvá několik měsíců, kvůli své minulosti s drogami a kardiovasculárním problému. Na letišти v Hance si oblékal bílé šaty s portretem Che Gueva jako symbol svobodného boje proti režimu.",
        "reference":"Na Kubě se bude léčit z drogové závislosti fotbalový mistr světa z roku 1986 Diego Maradona, protože v Kanadě a USA by mohl mít problémy s udělením víza. Devětatřicetiletý Argentinec měl na výběr pro léčebnou kúru všechny tři země, které mu nabídly své služby.V Holguínu na východě kubánského ostrova přistál dnes ráno místního času za doprovodu manželky Claudie Villafaneové, rodičů, manažera Guillerma Coppoly, osobního lékaře Alfreda Cahea, neurologa a kardiologa",
        "reference_contexts":[
            "\"Srdečně chci pozdravit všechny lidi v Holguínu a také na celé Kubě,\" řekl Maradona po příletu. \"Doufám, že mé srdce je v pořádku a fanoušci mě ještě někdy spatří ve fotbalové exhibici,\" dodal. Zhruba po hodině nasedl do letadla do Havany, kde se podrobí vyšetření. Teprve pak se vrátí na kliniku v Holguínu. Během krátké zastávky v Holguínu si Maradona na letišti oblékl bílé tričko s portrétem revolucionáře Che Guevary. \"Jsem rebel,\" prohlásil s úsměvem Maradona, když si tričko oblékl. Prezident Castro osobně Maradonu na Kubu pozval, protože je jeho přítelem a velkým fanouškem. Nikdo z lékařů zatím neprozradil, jak dlouho se bude Maradona na Kubě léčit, podle Cahea to bude zhruba tři až šest měsíců. K odvykací kúře se někdejší slavný fotbalista rozhodl poté, co se před dvěma týdny na dovolené v Uruguayi málem předávkoval kokainem a s kardiovaskulárními problémy byl hospitalizován. Diego Maradona se brání kameramanům na letišti v Havaně"
        ]
    },
    {
        "user_input":"Shrň tento článek do stručného shrnutí.",
        "retrieved_contexts":[
            "Leeds opět lovil v PerthuAnglický fotbalový klub Do Leedsu United míří z týmu Perth Glory jedenadvacetiletý gólman australského olympijského výběru Danny Milosevic. Angličané za něho zaplatili 100 000 liber a podepsali s ním tříletou smlouvu. Zástupci Leedsu si vyhlédli z australského Perthu už druhého hráče, loni přišel do týmu novozélandský obránce Danny Hay. Chilan jde do ReggianyObranu Reggiany, nováčka italské ligy, posílí chilský reprezentant Jorge Vargas. Podle zprávy italské tiskové agentury ANSA se třiadvacetiletý fotbalista dnes podrobí kompletnímu lékařskému vyšetření a poprvé by měl za Reggianu nastoupit v sobotu proti Juventusu Turín."
        ],
        "response":"Do Leedsu přestěhoval se třináctiletý australský gólmani Danny Milusević na základě smlouvajícího se tříletým kontrahem za 150 400 liber. Odborník Reggianě poslal chilejský obránca Jorge Vargas, který podle informací agentury Ansa bude v sobotní utkání proti Juventosu Turínu.",
        "reference":"Čtyřletou smlouvu podepsal s FC Liverpool obránce Markus Babbel z Bayernu Mnichov. Sedmadvacetiletý fotbalista to oznámil na soustředění Bayernu ve Španělsku. Do Liverpoolu odjede po sezoně zadarmo, protože mu v Bayernu, kde kromě dvou let v Hamburku hrál od roku 1981, mu v červnu končí smlouva. \"Už se na Liverpool hrozně těším, protože jako dítě jsem rád sledoval jeho zápasy. Je to můj životní sen,\" prozradil Babbel",
        "reference_contexts":[
            "Leeds opět lovil v PerthuAnglický fotbalový klub Do Leedsu United míří z týmu Perth Glory jedenadvacetiletý gólman australského olympijského výběru Danny Milosevic. Angličané za něho zaplatili 100 000 liber a podepsali s ním tříletou smlouvu. Zástupci Leedsu si vyhlédli z australského Perthu už druhého hráče, loni přišel do týmu novozélandský obránce Danny Hay. Chilan jde do ReggianyObranu Reggiany, nováčka italské ligy, posílí chilský reprezentant Jorge Vargas. Podle zprávy italské tiskové agentury ANSA se třiadvacetiletý fotbalista dnes podrobí kompletnímu lékařskému vyšetření a poprvé by měl za Reggianu nastoupit v sobotu proti Juventusu Turín."
        ]
    },
    {
        "user_input":"Shrň tento článek do stručného shrnutí.",
        "retrieved_contexts":[
            "\"Spokojen jsem asi z devadesáti procent, měli jsme ještě nějaké představy, které se nakonec nepodařilo realizovat,\" přiznal trenér národního mužstva Jozef Chovanec a dodal, že takový výsledek považuje za dobrý. Ještě v letošním roce sehraje reprezentace tři kvalifikační zápasy. Začne v zářijovém termínu v Bulharsku a v říjnu ji čeká první dvojzápas: v sobotu 7.10. hostí Island a už ve středu 11.10. nastoupí k utkání na Maltě. Zbývajících sedm duelů ji čeká v roce 2001. Deset procent, které trenérovi chybí k naprosté spokojenosti, lze přičíst především termínům soubojů s největším soupeřem ve skupině, s Dánskem. Chovanec chtěl se Seveřany nejprve hrát na jejich hřišti, ale jednání dospělo k opačné variantě a česká strana ji musela nakonec přijmout. \"Dánové zase chtěli u nás hrát až v samotném závěru kvalifikace, to se jim také nepodařilo prosadit, takže jsme oba ustoupili stejně,\" tuší Chovanec. V případě, že se soupeři na termínech nedohodnou, určí závazný program losem přímo FIFA. \"Výhodou pražské schůzky bylo, že se všichni chtěli tomuto kroku vyhnout. Třem zemím se něco takového stalo v minulé kvalifikaci, a podruhé si to zopakovat nechtěli,\" podotkl Chovanec. Využité domácí prostředíPořadatelé pražské schůzky dokázali využít domácího prostředí. Jako jediní si připravili písemný návrh termínové listiny a od něho se nakonec celé jednání odvíjelo. \"Snažili jsme se připravit termíny tak, aby nevyhovovaly jen nám, ale aby vycházely vstříc i ostatním soupeřům,\" řekl hlavní strůjce rozpisu reprezentační asistent Karel Brückner a prozradil pár svých základních tezí. \"Rozdělil jsem skupinu na tři dvojice podle výkonnosti: nás a Dány jako A, Bulhary s Islanďany jsem označil B a céčko jsem dal Severnímu Irsku a Maltě.\" Karel Brückner je známým fotbalovým stratégem a milovníkem šachu. Obě dovednosti mu přišly vhod. \"Pokud my začínáme v Bulharsku, měli by Dánové hrát na Islandu,\" uvedl jednu z idejí a pokračoval: \"Hrajeme-li jedno utkání týdenního dvojzápasu proti Dánům, není možné, abychom my pak hráli se slabou Maltou, zatímco soupeř musel nastoupit proti Bulharům,\" rozkrýval Brückner další tajnosti ze své strategie. Dalším důležitým momentem, na nějž si museli dát strůjci pozor, jsou klimatické podmínky, které v určitém ročním období limitují hru na Maltě a na Islandu. \"Naši partneři nejprve chtěli o termínech jednat od nuly, ale když si prostudovali písemný návrh, shodli se na tom, že by se z něj mělo vyjít a snažit se jen zohledňovat některé další potřeby jednotlivých mužstev,\" uvedl mluvčí fotbalového svazu Jaroslav Kolář. Brzy se ukázalo, že jediné, s čím Brücknerův návrh nepočítal, bylo přání Severního Irska hrát všechny své domácí zápasy o sobotách. \"Jde o bezpečnost, protože v sobotu se dá hrát odpoledne za denního světla, kdy nehrozí vážnější problémy s diváky,\" naznačil Kolář. Severoirský pořadavek si vynutil určité přesuny v termínech, které nakonec donutily Chovance přijmout zmíněný kompromis s opačným pořadím zápasů s Dánskem. \"Shodou okolností to byl bod bod, v němž jsme se rozcházeli. Já osobně jsem totiž chtěl s Dány raději začínat doma,\" přiznal s úsměvem Karel Brückner, který vede tým do 21 let, jehož program kvalifikačních zápasů přesně kopíruje termínovou listinu áčka. Program kvalifikace mistrovství světa 2002Rok 20002. září: Bulharsko - ČR, Island - Dánsko, Sev. Irsko - Malta7. října: ČR - Island, Sev. Irsko - Dánsko, Bulharsko - Malta11. října: Malta - ČR, Island - Sev. Irsko, Dánsko - Bulharsko Rok 200124. března: Sev. Irsko - ČR, Malta - Dánsko, Bulharsko - Island28. března: ČR - Dánsko, Bulharsko - Sev. Irsko25. dubna: Malta - Island2. června: Dánsko - ČR, Island - Malta, Sev. Irsko - Bulharsko6. června: ČR - Sev. Irsko, Island - Bulharsko, Dánsko - Malta1. září: Island - ČR, Dánsko - Sev. Irsko, Malta - Bulharsko5. září: ČR - Malta, Bulharsko - Dánsko, Sev. Irsko - Island6. října: ČR - Bulharsko, Dánsko - Island, Malta - Sev. Irsko Trenéři čtyř ze šesti týmů třetí skupiny kvalifikace pro MS 2002 pózují fotografům před jednáním o termínech v Praze. Zleva Olsen (Dánsko), Chovanec, Mladenov (Bulharsko) a Evaldson (Island)."
        ],
        "response":"Trenér národních mužství Jozéf Chovanek a strateg Karel Bruckner uspořádali v Prazi jednání o termínových listinách kvalifikací mistrovského turnaje 2.02, které byly navrženy tak, abyste zajistily rovnováhu mezi týmy a respektovali bezpečnostní potřeбы jednotlivých klubů.\n\nZávazná termínová listina byla schválena, avšak kvůli konfliktu s požadavkem Severního Írska na hraní",
        "reference":"Na diplomatickém poli se český fotbal uvedl jako lídr 3. kvalifikační skupiny o postup na MS v roce 2003. Fotbalovému svazu se totiž v Praze podařilo uspořádat schůzku o termínové listině takovým způsobem, že už po osmdesátiminutovém jednání zástupci všech stran ochotně podepsali protokol přijatelný pro každého, který vycházel z návrhu předloženému hostitelskou stranou. Český tým začne kvalifikaci letos 2. září v Bulharsku a poslední utkání sehraje se stejným soupeřem doma 6. října 2001",
        "reference_contexts":[
            "\"Spokojen jsem asi z devadesáti procent, měli jsme ještě nějaké představy, které se nakonec nepodařilo realizovat,\" přiznal trenér národního mužstva Jozef Chovanec a dodal, že takový výsledek považuje za dobrý. Ještě v letošním roce sehraje reprezentace tři kvalifikační zápasy. Začne v zářijovém termínu v Bulharsku a v říjnu ji čeká první dvojzápas: v sobotu 7.10. hostí Island a už ve středu 11.10. nastoupí k utkání na Maltě. Zbývajících sedm duelů ji čeká v roce 2001. Deset procent, které trenérovi chybí k naprosté spokojenosti, lze přičíst především termínům soubojů s největším soupeřem ve skupině, s Dánskem. Chovanec chtěl se Seveřany nejprve hrát na jejich hřišti, ale jednání dospělo k opačné variantě a česká strana ji musela nakonec přijmout. \"Dánové zase chtěli u nás hrát až v samotném závěru kvalifikace, to se jim také nepodařilo prosadit, takže jsme oba ustoupili stejně,\" tuší Chovanec. V případě, že se soupeři na termínech nedohodnou, určí závazný program losem přímo FIFA. \"Výhodou pražské schůzky bylo, že se všichni chtěli tomuto kroku vyhnout. Třem zemím se něco takového stalo v minulé kvalifikaci, a podruhé si to zopakovat nechtěli,\" podotkl Chovanec. Využité domácí prostředíPořadatelé pražské schůzky dokázali využít domácího prostředí. Jako jediní si připravili písemný návrh termínové listiny a od něho se nakonec celé jednání odvíjelo. \"Snažili jsme se připravit termíny tak, aby nevyhovovaly jen nám, ale aby vycházely vstříc i ostatním soupeřům,\" řekl hlavní strůjce rozpisu reprezentační asistent Karel Brückner a prozradil pár svých základních tezí. \"Rozdělil jsem skupinu na tři dvojice podle výkonnosti: nás a Dány jako A, Bulhary s Islanďany jsem označil B a céčko jsem dal Severnímu Irsku a Maltě.\" Karel Brückner je známým fotbalovým stratégem a milovníkem šachu. Obě dovednosti mu přišly vhod. \"Pokud my začínáme v Bulharsku, měli by Dánové hrát na Islandu,\" uvedl jednu z idejí a pokračoval: \"Hrajeme-li jedno utkání týdenního dvojzápasu proti Dánům, není možné, abychom my pak hráli se slabou Maltou, zatímco soupeř musel nastoupit proti Bulharům,\" rozkrýval Brückner další tajnosti ze své strategie. Dalším důležitým momentem, na nějž si museli dát strůjci pozor, jsou klimatické podmínky, které v určitém ročním období limitují hru na Maltě a na Islandu. \"Naši partneři nejprve chtěli o termínech jednat od nuly, ale když si prostudovali písemný návrh, shodli se na tom, že by se z něj mělo vyjít a snažit se jen zohledňovat některé další potřeby jednotlivých mužstev,\" uvedl mluvčí fotbalového svazu Jaroslav Kolář. Brzy se ukázalo, že jediné, s čím Brücknerův návrh nepočítal, bylo přání Severního Irska hrát všechny své domácí zápasy o sobotách. \"Jde o bezpečnost, protože v sobotu se dá hrát odpoledne za denního světla, kdy nehrozí vážnější problémy s diváky,\" naznačil Kolář. Severoirský pořadavek si vynutil určité přesuny v termínech, které nakonec donutily Chovance přijmout zmíněný kompromis s opačným pořadím zápasů s Dánskem. \"Shodou okolností to byl bod bod, v němž jsme se rozcházeli. Já osobně jsem totiž chtěl s Dány raději začínat doma,\" přiznal s úsměvem Karel Brückner, který vede tým do 21 let, jehož program kvalifikačních zápasů přesně kopíruje termínovou listinu áčka. Program kvalifikace mistrovství světa 2002Rok 20002. září: Bulharsko - ČR, Island - Dánsko, Sev. Irsko - Malta7. října: ČR - Island, Sev. Irsko - Dánsko, Bulharsko - Malta11. října: Malta - ČR, Island - Sev. Irsko, Dánsko - Bulharsko Rok 200124. března: Sev. Irsko - ČR, Malta - Dánsko, Bulharsko - Island28. března: ČR - Dánsko, Bulharsko - Sev. Irsko25. dubna: Malta - Island2. června: Dánsko - ČR, Island - Malta, Sev. Irsko - Bulharsko6. června: ČR - Sev. Irsko, Island - Bulharsko, Dánsko - Malta1. září: Island - ČR, Dánsko - Sev. Irsko, Malta - Bulharsko5. září: ČR - Malta, Bulharsko - Dánsko, Sev. Irsko - Island6. října: ČR - Bulharsko, Dánsko - Island, Malta - Sev. Irsko Trenéři čtyř ze šesti týmů třetí skupiny kvalifikace pro MS 2002 pózují fotografům před jednáním o termínech v Praze. Zleva Olsen (Dánsko), Chovanec, Mladenov (Bulharsko) a Evaldson (Island)."
        ]
    },
    {
        "user_input":"Shrň tento článek do stručného shrnutí.",
        "retrieved_contexts":[
            "Když před lety chodil Luboš Kozel na pedagogickou fakultu, vybral si za obor matematiku. Zřejmě i proto je jeho paměť na data dokonalá, na dvě z nich nezapomene prý do smrti: 20. dubna 1996 a 4. května 1999. Tehdy zažil svá nejtěžší zranění, přetrhl si křížový vaz v koleni, pro fotbalistu znamenající půlroční pauzu a nejistou budoucnost. Najde se jen málo těžších zranění, jež mohou fotbalistu potkat na hřišti. \"Když si někdo zlomí kost, většinou mu bez problémů sroste. U křížových vazů je riziko větší, ještě před deseti lety byla úspěšnost plastiky vazu půl na půl, teď je ale mnohem vyšší,\" říká slávistický lékař Josef Maurer. Kozel si nejprve poranil křížový vaz na pravé noze, pak na levé, v obou případech musel na plastiku vazu, kterou mu prováděl vyhlášený specialista Vít Dvořák z pražské nemocnice na Bulovce. Je to skutečně náhoda a osud, když se jednomu hráči vracejí pořád zranění? Nebo něco dědičného? Na první pohled má Kozel ideálně vytvarovanou atletickou postavu, je symbolem zdraví a pohody. \"Bavil jsem se s doktorem, který říkal, že přetržené křížové vazy vidí více u hráčů, kteří mají šlachovité tělo jako já,\" tvrdí hráč, jemuž bude zanedlouho sedmadvacet let. Neštěstí je o to větší, že těžká zranění přišla v nejméně vhodnou chvíli. Na jaře 1995, kdy nakročoval do národního mužstva, ho zbrdil chronický zánět v koleně, kvůli němuž musel na operaci. Pak přišly problémy s vazy. V červnu 1996 ležel doma, zatímco jiní reprezentanti si užívali skvělého tažení až do finále mistrovství Evropy, kde je zastavilo Německo. Loni v květnu mu zbývalo pár dní do skončení smlouvy ve Slavii, dojednával si angažmá v německé bundeslize, ale znovu svůj životní krok nedokončil. Zranil se při střetu se sparťanem Pavlem Novotným, bývalým spoluhráčem ze Slavie. \"Tehdy mě vůbec nenapadlo, že je to tak vážné, dokonce jsem si stoupnul a zkusil chvíli hrát,\" vzpomíná. \"Bolest byla nesrovnatelně menší než při prvním přetržení vazu, kdy mě odnesli a ještě po hodině jsem s nohou nepohnul.\" Až druhý den při prohlídce na magnetické rezonanci s hrůzou zjistil, co se stalo. Operace - rehabilitace - s fotbalem začínat odznovu. Scénář, podle něhož jel v životě už potřetí. Když se to opakuje, člověka napadají nejhorší myšlenky. Má to cenu, co když se mi zranění vrátí? Není lepší s fotbalem skončit? \"Luboš je nesmírně inteligentní a citlivý člověk a právě takoví lidé nesou podobné situace těžce,\" vypráví trenér Cipro. Touha být co nejrychleji na hřišti Kozla loni na podzim přemohla. Jezdil na kole, posiloval, až operované koleno \"uštval\" - měl v kloubu problémy se zvápněním. Návrat se odložil o dva měsíce. Jenže v prosinci byla doba dovolených, tak se připravoval alespoň ve dvou se spoluhráčem Martinem Hyským. Ví, jak důležité jaro ho čeká. Slavia hraje o mistrovský titul, osmifinále Poháru UEFA s italským Udine a blíží se evropský šampionát. \"Evropa? Ta je pro mě hodně v dáli. Já budu mít problémy dostat se do sestavy Slavie, kluci hráli na podzim skvěle a říká se přeci, že vítězná sestava se nemění. Ale musím být hlavně zdravý, na to jediné myslím.\" Když byl měsíc v rehabilitačním centru v německém Řezně, potkával se na chodbách s německým fotbalovým hrdinou Mathiasem Sammerem. Ten kvůli vleklým potížím hraje poslední léta jen výjimečně, víc než dva roky vůbec ne. \"Je v Regensburgu jako domácí host, má tam svůj stálý pokoj. Klaus Eder, ředitel rehabilitačního sanatoria, je jeho přítelem. Takhle dopadnout, abych měl mezi doktory svůj druhý domov, bych ale nechtěl.\" Dnes čeká Slavii přípravný zápas v Mladé Boleslavi, poprvé po dlouhé době by si Kozel mohl zahrát. \"Natrénováno mám, cítím se fit. Těším se, snad mě trenér postaví,\" přeje si."
        ],
        "response":"Luboše Kozele, bývaleho slávického fotbalisty, se v roce 1009 opakovalo těžké zraněné kříže v kuse, které mu způsobily operaci a dlouhodobou rehabilitaci. Po návratu do sportu však v roce téhož roku znovu přetrhal křížený vaz na levém kolení, což mu způsobil další dlouhodobé ztráty a nutnost opětovné operace.",
        "reference":"Vyšvihne se, už sahá po reprezentačním dresu a vzápětí padá dolů. Fotbalová kariéra Luboše Kozla se vlní jako voda při mořské bouři, srážejí jej zranění. \"Na někom se musí smůla vyřádit,\" říká obránce Slavie. Od začátku ledna usiluje o svůj další návrat. V přípravě před ligou maká jako každý jiný z mužstva, bez úlev. \"Je zdráv a klepu to na dřevo,\" raduje se trenér František Cipro. \"Neztratil rychlost, do osobních soubojů jde naplno. Časem přijde i sebevědomí a rozehranost.\"",
        "reference_contexts":[
            "Když před lety chodil Luboš Kozel na pedagogickou fakultu, vybral si za obor matematiku. Zřejmě i proto je jeho paměť na data dokonalá, na dvě z nich nezapomene prý do smrti: 20. dubna 1996 a 4. května 1999. Tehdy zažil svá nejtěžší zranění, přetrhl si křížový vaz v koleni, pro fotbalistu znamenající půlroční pauzu a nejistou budoucnost. Najde se jen málo těžších zranění, jež mohou fotbalistu potkat na hřišti. \"Když si někdo zlomí kost, většinou mu bez problémů sroste. U křížových vazů je riziko větší, ještě před deseti lety byla úspěšnost plastiky vazu půl na půl, teď je ale mnohem vyšší,\" říká slávistický lékař Josef Maurer. Kozel si nejprve poranil křížový vaz na pravé noze, pak na levé, v obou případech musel na plastiku vazu, kterou mu prováděl vyhlášený specialista Vít Dvořák z pražské nemocnice na Bulovce. Je to skutečně náhoda a osud, když se jednomu hráči vracejí pořád zranění? Nebo něco dědičného? Na první pohled má Kozel ideálně vytvarovanou atletickou postavu, je symbolem zdraví a pohody. \"Bavil jsem se s doktorem, který říkal, že přetržené křížové vazy vidí více u hráčů, kteří mají šlachovité tělo jako já,\" tvrdí hráč, jemuž bude zanedlouho sedmadvacet let. Neštěstí je o to větší, že těžká zranění přišla v nejméně vhodnou chvíli. Na jaře 1995, kdy nakročoval do národního mužstva, ho zbrdil chronický zánět v koleně, kvůli němuž musel na operaci. Pak přišly problémy s vazy. V červnu 1996 ležel doma, zatímco jiní reprezentanti si užívali skvělého tažení až do finále mistrovství Evropy, kde je zastavilo Německo. Loni v květnu mu zbývalo pár dní do skončení smlouvy ve Slavii, dojednával si angažmá v německé bundeslize, ale znovu svůj životní krok nedokončil. Zranil se při střetu se sparťanem Pavlem Novotným, bývalým spoluhráčem ze Slavie. \"Tehdy mě vůbec nenapadlo, že je to tak vážné, dokonce jsem si stoupnul a zkusil chvíli hrát,\" vzpomíná. \"Bolest byla nesrovnatelně menší než při prvním přetržení vazu, kdy mě odnesli a ještě po hodině jsem s nohou nepohnul.\" Až druhý den při prohlídce na magnetické rezonanci s hrůzou zjistil, co se stalo. Operace - rehabilitace - s fotbalem začínat odznovu. Scénář, podle něhož jel v životě už potřetí. Když se to opakuje, člověka napadají nejhorší myšlenky. Má to cenu, co když se mi zranění vrátí? Není lepší s fotbalem skončit? \"Luboš je nesmírně inteligentní a citlivý člověk a právě takoví lidé nesou podobné situace těžce,\" vypráví trenér Cipro. Touha být co nejrychleji na hřišti Kozla loni na podzim přemohla. Jezdil na kole, posiloval, až operované koleno \"uštval\" - měl v kloubu problémy se zvápněním. Návrat se odložil o dva měsíce. Jenže v prosinci byla doba dovolených, tak se připravoval alespoň ve dvou se spoluhráčem Martinem Hyským. Ví, jak důležité jaro ho čeká. Slavia hraje o mistrovský titul, osmifinále Poháru UEFA s italským Udine a blíží se evropský šampionát. \"Evropa? Ta je pro mě hodně v dáli. Já budu mít problémy dostat se do sestavy Slavie, kluci hráli na podzim skvěle a říká se přeci, že vítězná sestava se nemění. Ale musím být hlavně zdravý, na to jediné myslím.\" Když byl měsíc v rehabilitačním centru v německém Řezně, potkával se na chodbách s německým fotbalovým hrdinou Mathiasem Sammerem. Ten kvůli vleklým potížím hraje poslední léta jen výjimečně, víc než dva roky vůbec ne. \"Je v Regensburgu jako domácí host, má tam svůj stálý pokoj. Klaus Eder, ředitel rehabilitačního sanatoria, je jeho přítelem. Takhle dopadnout, abych měl mezi doktory svůj druhý domov, bych ale nechtěl.\" Dnes čeká Slavii přípravný zápas v Mladé Boleslavi, poprvé po dlouhé době by si Kozel mohl zahrát. \"Natrénováno mám, cítím se fit. Těším se, snad mě trenér postaví,\" přeje si."
        ]
    },
    {
        "user_input":"Shrň tento článek do stručného shrnutí.",
        "retrieved_contexts":[
            "\"Nemám žádný plán, jak by mělo pořadí zápasů vypadat. Určitě se ale nějak domluvíme,\" říkal s úsměvem modrooký muž, když včera odpoledne vplul do ruzyňské letištní haly.Jen jeho šedivé vlasy připomínaly, že mu už bylo padesát. Na sobě měl moderní kostkované sako, kabát přehozený přes ruku.Olsen je největší osobností schůzky. V osmdesátých letech patřil mezi nejlepší obránce na světě, v národním týmu sehrál přes stovku zápasů, hýčkali si ho v Anderlechtu Brusel i v Kolíně nad Rýnem.Minulé léto uzavřel smlouvu s dánskou federací, že převezme národní tým. Dánsko nemělo do poslední chvilky účast na EURO 2000 jistou, mezi evropskou elitu prošlo až z baráže. \"Nakonec jsem rád, že ještě půlrok budu hráče jen sledovat. Bude to příjemné.\" Pokud by Dánové nepostoupili, nastala by chvíle pro Olsena mnohem dřív, od Nového roku, takhle tým povede ještě na mistrovství Evropy švédský expert Bo Johansson.Je kuriózní, že Česko se s Dánskem střetne jak ve skupině mistrovství Evropy, tak v kvalifikačních duelech o mistrovství světa.Který ze tří zápasů bude nejdůležitější? \"Ten nejbližší,\" odpověděl Olsen, přestože v něm ještě trénovat nebude. Bude to 21. června večer v Lutychu, poslední zápas základní skupiny evropského šampionátu.Na podzim už Morten Olsen usedne na reprezentační lavičku.A nejspíš ho čeká obměna mužstva. Hráči ze základní kostry týmu dávno přesáhli třicítku. \"Ne, ne, to si nemyslím,\" reagoval překvapivě. Jen šikovný záložník Brian Laudrup se nadobro vzdal reprezentace. Skvělého gólmana Petera Schmeichela zná Olsen jako kamaráda a je přesvědčen, že zatím neskončí. \"Když se mu vyhne těžké zranění, bude chytat dál.\" Totéž obránce Jes Högh.A další bek Jan Heintze? \"Vždyť mu je sotva šestatřicet. Proč by končil?\" Sám Olsen ukončil kariéru až v devětatřiceti na mistrovství Evropy 1988. Hned potom začal trénovat. Jako kouč se uvedl náramně: průměrné Bröndby Kodaň dovedl do semifinále Poháru UEFA.Naposledy vedl slavný Ajax Amsterdam, ale tam moc nepochodil. \"Když mě předloni v zimě propustili, začal jsem létat po Evropě a díval se, co je nového.Baví mě to, podrobně se seznamuji se všemi dánskými fotbalisty, kteří pro reprezentaci přicházejí v úvahu.\" Budoucí trenér reprezentace má teď před sebou těžký úkol: dovést Dánsko na mistrovství světa 2002.O postup z kvalifikační skupiny se zřejmě porve především s českými fotbalisty. Ještě jako hráč nastoupil proti bývalému Československu pětkrát, ale ani v jednom zápase nezažil vítězství.\"Vím, Češi jsou silní, techničtí, vytvořili kompaktní tým. Jsou hlavními favority,\" tvrdil Olsen.\"Ale fotbal je dnes hrozně vyrovnaný, takže postoupit může klidně Island.\""
        ],
        "response":"Modrooká Olseň, který již v roce 1888 odešel do důchodu, se nyní snaží získat místo trenéra Dánského národního týmu. Jeho cílem je dovézt tým na mistrovsství světa v roce dvěma, což je podle něj nejvyšší úkol, který mu zbývá.",
        "reference":"Ještě půl roku nebude Morten Olsen trenérem, přitom už dnes začne vyjednávat jako kouč dánské fotbalové reprezentace. Zástupci šesti zemí ze třetí kvalifikační skupiny o mistrovství světa 2002 se mají v Praze dohodnout na termínové listině zápasů. Kromě Česka a Dánska jsou ve skupině Severní Irsko, Bulharsko, Malta a Island",
        "reference_contexts":[
            "\"Nemám žádný plán, jak by mělo pořadí zápasů vypadat. Určitě se ale nějak domluvíme,\" říkal s úsměvem modrooký muž, když včera odpoledne vplul do ruzyňské letištní haly.Jen jeho šedivé vlasy připomínaly, že mu už bylo padesát. Na sobě měl moderní kostkované sako, kabát přehozený přes ruku.Olsen je největší osobností schůzky. V osmdesátých letech patřil mezi nejlepší obránce na světě, v národním týmu sehrál přes stovku zápasů, hýčkali si ho v Anderlechtu Brusel i v Kolíně nad Rýnem.Minulé léto uzavřel smlouvu s dánskou federací, že převezme národní tým. Dánsko nemělo do poslední chvilky účast na EURO 2000 jistou, mezi evropskou elitu prošlo až z baráže. \"Nakonec jsem rád, že ještě půlrok budu hráče jen sledovat. Bude to příjemné.\" Pokud by Dánové nepostoupili, nastala by chvíle pro Olsena mnohem dřív, od Nového roku, takhle tým povede ještě na mistrovství Evropy švédský expert Bo Johansson.Je kuriózní, že Česko se s Dánskem střetne jak ve skupině mistrovství Evropy, tak v kvalifikačních duelech o mistrovství světa.Který ze tří zápasů bude nejdůležitější? \"Ten nejbližší,\" odpověděl Olsen, přestože v něm ještě trénovat nebude. Bude to 21. června večer v Lutychu, poslední zápas základní skupiny evropského šampionátu.Na podzim už Morten Olsen usedne na reprezentační lavičku.A nejspíš ho čeká obměna mužstva. Hráči ze základní kostry týmu dávno přesáhli třicítku. \"Ne, ne, to si nemyslím,\" reagoval překvapivě. Jen šikovný záložník Brian Laudrup se nadobro vzdal reprezentace. Skvělého gólmana Petera Schmeichela zná Olsen jako kamaráda a je přesvědčen, že zatím neskončí. \"Když se mu vyhne těžké zranění, bude chytat dál.\" Totéž obránce Jes Högh.A další bek Jan Heintze? \"Vždyť mu je sotva šestatřicet. Proč by končil?\" Sám Olsen ukončil kariéru až v devětatřiceti na mistrovství Evropy 1988. Hned potom začal trénovat. Jako kouč se uvedl náramně: průměrné Bröndby Kodaň dovedl do semifinále Poháru UEFA.Naposledy vedl slavný Ajax Amsterdam, ale tam moc nepochodil. \"Když mě předloni v zimě propustili, začal jsem létat po Evropě a díval se, co je nového.Baví mě to, podrobně se seznamuji se všemi dánskými fotbalisty, kteří pro reprezentaci přicházejí v úvahu.\" Budoucí trenér reprezentace má teď před sebou těžký úkol: dovést Dánsko na mistrovství světa 2002.O postup z kvalifikační skupiny se zřejmě porve především s českými fotbalisty. Ještě jako hráč nastoupil proti bývalému Československu pětkrát, ale ani v jednom zápase nezažil vítězství.\"Vím, Češi jsou silní, techničtí, vytvořili kompaktní tým. Jsou hlavními favority,\" tvrdil Olsen.\"Ale fotbal je dnes hrozně vyrovnaný, takže postoupit může klidně Island.\""
        ]
    },
    {
        "user_input":"Shrň tento článek do stručného shrnutí.",
        "retrieved_contexts":[
            "\"Věřil jsem, že budu chytat, ale i nový trenér brankářů Ivo Viktor prosazoval Tomáše Poštulku a sedět na lavičce jsem považoval za ztrátu času,\" vysvětlil Michal Čaloun, proč přistoupil ke změně působiště. \"Navíc mi ve Spartě chyběl pocit, že mě mužstvo potřebuje.\" Hned jak vstoupily Čalounovy plány ve známost, mezi kluby se o brankáře strhl lítý boj. Svůj zájem však veřejně projevily jen Viktoria Žižkov a Příbram. \"Rozhodlo rychlejší a serióznější jednání pana Starky. Kromě toho tady dělá trenéra brankářů Franta Kopač, se kterým se znám už ze Sparty. A v neposlední řadě je v Příbrami mnohem fotbalovější prostředí než na Žižkově a z Plzně to sem mám kousek,\" vypočítává Čaloun, jemuž se již zajídal život v hlavním městě. V Příbrami podle svých slov našel partu dobrých kluků, kteří ve fotbale touží něco dokázat, a on jim k tomu chce pomoci. Nebojí se ani tíhy odpovědnosti, která na něm bude ležet. \"Počítám s tím. Myslím, že jsem natolik zkušený, abych tuhle roli zvládnul,\" tvrdí sebevědomě Čaloun, jenž se stal nejdražším hráčem v historii příbramské kopané. \"Opravdu? To jsem nevěděl. Budu se to snažit svými výkony splatit.\" Na angažmá v pražské Spartě, kam zamířil jako člen širšího reprezentačního kádru v létě 1996 z rodné Plzně, bude vzpomínat prý v dobrém, byť mu v poslední době pobyt na Letné zhořkl. \"Spartu beru za školu fotbalového života. Každý, kdo má šanci, by to měl ve Spartě zkusit, protože nakoukne do světa velkého fotbalu,\" vybavuje si Čaloun bitvy o ligové tituly a starty v pohárové Evropě, z nichž mu uvízly v paměti především zápasy s italskou Fiorentinou. Zpočátku se v brance Sparty objevoval pravidelně, po příchodu Tomáše Poštulky stále častěji usedal s pocitem křivdy na lavičku. \"Trenérem brankářů byl nejdřív Tomášův otec a ten ho protežoval. I když se před sezonou řeklo, že chytat bude ten, kdo bude vypadat v přípravě lépe, nakonec se do branky postavil on,\" vzpomíná s hořkostí Čaloun, jehož vztahy s konkurentem prý přesto vždy byly korektní. \"Brali jsme to jako profesionálové, ale že bychom byli kamarádi, to se říct nedá.\" V novém působišti, kde se setkal s bývalým plzeňským kumpánem Danem Šmejkalem a Davidem Nehodou, kamarádem z vojny, má za sebou opálený gólman necelých čtrnáct dní tréninkové dřiny. Jak se zimní příprava liší od těch, co prožíval na Letné? \"Bolela ve Spartě, bolí i tady,\" povzdychne si. \"Ale v jednom se přece jen liší. Zatímco se Spartou jsme stále jezdili někde po soustředěních, tady se připravujeme většinou v Příbrami, takže jsem víc doma, což mi maximálně vyhovuje.\""
        ],
        "response":"Michal Čáloun, nejdražitej hráč historie Příbramy, přestoupil do klubu kvůli potlačení pocitů, že mu tým potřebuje, a hledal prostředí, které by mu umožnilo se cítit více „doma\". Přespitek s bývajícím trenérem Tomášem Poštulkou a zkušenostmi z letné sezóny v Praze ho vedl k rozhodnutí, které se stalo důrazným tématem mezi klubbami.",
        "reference":"Ani případný zisk dalšího mistrovského titulu a možnost startů v prestižní Lize mistrů neodradily fotbalového brankáře Michala Čalouna od úmyslu opustit po třech a půl letech pražskou Spartu. Věčný boj o post brankářské jedničky na Letné směnil v zimě za jistotu stálého místa mezi tyčemi v provinční Dukle Příbram. Rozhodnutí o přestupu v devětadvacetiletém gólmanovi dozrálo během podzimu, jehož valnou část strávil na lavičce náhradníků",
        "reference_contexts":[
            "\"Věřil jsem, že budu chytat, ale i nový trenér brankářů Ivo Viktor prosazoval Tomáše Poštulku a sedět na lavičce jsem považoval za ztrátu času,\" vysvětlil Michal Čaloun, proč přistoupil ke změně působiště. \"Navíc mi ve Spartě chyběl pocit, že mě mužstvo potřebuje.\" Hned jak vstoupily Čalounovy plány ve známost, mezi kluby se o brankáře strhl lítý boj. Svůj zájem však veřejně projevily jen Viktoria Žižkov a Příbram. \"Rozhodlo rychlejší a serióznější jednání pana Starky. Kromě toho tady dělá trenéra brankářů Franta Kopač, se kterým se znám už ze Sparty. A v neposlední řadě je v Příbrami mnohem fotbalovější prostředí než na Žižkově a z Plzně to sem mám kousek,\" vypočítává Čaloun, jemuž se již zajídal život v hlavním městě. V Příbrami podle svých slov našel partu dobrých kluků, kteří ve fotbale touží něco dokázat, a on jim k tomu chce pomoci. Nebojí se ani tíhy odpovědnosti, která na něm bude ležet. \"Počítám s tím. Myslím, že jsem natolik zkušený, abych tuhle roli zvládnul,\" tvrdí sebevědomě Čaloun, jenž se stal nejdražším hráčem v historii příbramské kopané. \"Opravdu? To jsem nevěděl. Budu se to snažit svými výkony splatit.\" Na angažmá v pražské Spartě, kam zamířil jako člen širšího reprezentačního kádru v létě 1996 z rodné Plzně, bude vzpomínat prý v dobrém, byť mu v poslední době pobyt na Letné zhořkl. \"Spartu beru za školu fotbalového života. Každý, kdo má šanci, by to měl ve Spartě zkusit, protože nakoukne do světa velkého fotbalu,\" vybavuje si Čaloun bitvy o ligové tituly a starty v pohárové Evropě, z nichž mu uvízly v paměti především zápasy s italskou Fiorentinou. Zpočátku se v brance Sparty objevoval pravidelně, po příchodu Tomáše Poštulky stále častěji usedal s pocitem křivdy na lavičku. \"Trenérem brankářů byl nejdřív Tomášův otec a ten ho protežoval. I když se před sezonou řeklo, že chytat bude ten, kdo bude vypadat v přípravě lépe, nakonec se do branky postavil on,\" vzpomíná s hořkostí Čaloun, jehož vztahy s konkurentem prý přesto vždy byly korektní. \"Brali jsme to jako profesionálové, ale že bychom byli kamarádi, to se říct nedá.\" V novém působišti, kde se setkal s bývalým plzeňským kumpánem Danem Šmejkalem a Davidem Nehodou, kamarádem z vojny, má za sebou opálený gólman necelých čtrnáct dní tréninkové dřiny. Jak se zimní příprava liší od těch, co prožíval na Letné? \"Bolela ve Spartě, bolí i tady,\" povzdychne si. \"Ale v jednom se přece jen liší. Zatímco se Spartou jsme stále jezdili někde po soustředěních, tady se připravujeme většinou v Příbrami, takže jsem víc doma, což mi maximálně vyhovuje.\""
        ]
    },
    {
        "user_input":"Shrň tento článek do stručného shrnutí.",
        "retrieved_contexts":[
            "Jen jeho šedivé vlasy připomínaly, že mu už bylo padesát. Na sobě měl moderní kostkované sako, kabát přehozený přes ruku. Olsen je největší osobností schůzky. V osmdesátých letech patřil mezi nejlepší obránce na světě, v národním týmu sehrál přes stovku zápasů, hýčkali si ho v Anderlechtu Brusel i v Kolíně nad Rýnem. Minulé léto uzavřel smlouvu s dánskou federací, že převezme národní tým. Dánsko nemělo do poslední chvilky účast na EURO 2000 jistou, mezi evropskou elitu prošlo až z baráže. \"Nakonec jsem rád, že ještě půlrok budu hráče jen sledovat. Bude to příjemné.\" Pokud by Dánové nepostoupili, nastala by chvíle pro Olsena mnohem dřív, od Nového roku, takhle tým povede ještě na mistrovství Evropy švédský expert Bo Johansson. Je kuriózní, že Česko se s Dánskem střetne jak ve skupině mistrovství Evropy, tak v kvalifikačních duelech o mistrovství světa. Který ze tří zápasů bude nejdůležitější? \"Ten nejbližší,\" odpověděl Olsen, přestože v něm ještě trénovat nebude. Bude to 21. června večer v Lutychu, poslední zápas základní skupiny evropského šampionátu. Na podzim už Morten Olsen usedne na reprezentační lavičku. A nejspíš ho čeká obměna mužstva. Hráči ze základní kostry týmu dávno přesáhli třicítku. \"Ne, ne, to si nemyslím,\" reagoval překvapivě. Jen šikovný záložník Brian Laudrup se nadobro vzdal reprezentace. Skvělého gólmana Petera Schmeichela zná Olsen jako kamaráda a je přesvědčen, že zatím neskončí. \"Když se mu vyhne těžké zranění, bude chytat dál.\" Totéž obránce Jes Högh. A další bek Jan Heintze? \"Vždyť mu je sotva šestatřicet. Proč by končil?\" Sám Olsen ukončil kariéru až v devětatřiceti na mistrovství Evropy 1988. Hned potom začal trénovat. Jako kouč se uvedl náramně: průměrné Bröndby Kodaň dovedl do semifinále Poháru UEFA. Naposledy vedl slavný Ajax Amsterdam, ale tam moc nepochodil. \"Když mě předloni v zimě propustili, začal jsem létat po Evropě a díval se, co je nového. Baví mě to, podrobně se seznamuji se všemi dánskými fotbalisty, kteří pro reprezentaci přicházejí v úvahu.\" Budoucí trenér reprezentace má teď před sebou těžký úkol: dovést Dánsko na mistrovství světa 2002. O postup z kvalifikační skupiny se zřejmě porve především s českými fotbalisty. Ještě jako hráč nastoupil proti bývalému Československu pětkrát, ale ani v jednom zápase nezažil vítězství. \"Vím, Češi jsou silní, techničtí, vytvořili kompaktní tým. Jsou hlavními favority,\" tvrdil Olsen. \"Ale fotbal je dnes hrozně vyrovnaný, takže postoupit může klidně Island.\""
        ],
        "response":"Morten Olsen, nejvýznamnější dánská fotbalista, uzavřele smlouvou s federací a plánuje pokračovat v tréninkovém procesu, aby mohl být trenérem reprezentace na mistrovišti Evropy. Jeho zkušenosti jako hráče a kouče mu umožňují analyzovat dny českého týmu, který se v této etapě kvalifikace nachází v pozici favorita, avšak Olsen zdůrazňuje, že fotbal je velmi vyrovнанý a postupu může dosáhnout i men",
        "reference":"Ještě půl roku nebude Morten Olsen trenérem, přitom už dnes začne vyjednávat jako kouč dánské fotbalové reprezentace. Zástupci šesti zemí ze třetí kvalifikační skupiny o mistrovství světa 2002 se mají v Praze dohodnout na termínové listině zápasů. Kromě Česka a Dánska jsou ve skupině Severní Irsko, Bulharsko, Malta a Island. \"Nemám žádný plán, jak by mělo pořadí zápasů vypadat. Určitě se ale nějak domluvíme,\" říkal s úsměvem modrooký muž, když včera odpoledne vplul do ruzyňské letištní haly",
        "reference_contexts":[
            "Jen jeho šedivé vlasy připomínaly, že mu už bylo padesát. Na sobě měl moderní kostkované sako, kabát přehozený přes ruku. Olsen je největší osobností schůzky. V osmdesátých letech patřil mezi nejlepší obránce na světě, v národním týmu sehrál přes stovku zápasů, hýčkali si ho v Anderlechtu Brusel i v Kolíně nad Rýnem. Minulé léto uzavřel smlouvu s dánskou federací, že převezme národní tým. Dánsko nemělo do poslední chvilky účast na EURO 2000 jistou, mezi evropskou elitu prošlo až z baráže. \"Nakonec jsem rád, že ještě půlrok budu hráče jen sledovat. Bude to příjemné.\" Pokud by Dánové nepostoupili, nastala by chvíle pro Olsena mnohem dřív, od Nového roku, takhle tým povede ještě na mistrovství Evropy švédský expert Bo Johansson. Je kuriózní, že Česko se s Dánskem střetne jak ve skupině mistrovství Evropy, tak v kvalifikačních duelech o mistrovství světa. Který ze tří zápasů bude nejdůležitější? \"Ten nejbližší,\" odpověděl Olsen, přestože v něm ještě trénovat nebude. Bude to 21. června večer v Lutychu, poslední zápas základní skupiny evropského šampionátu. Na podzim už Morten Olsen usedne na reprezentační lavičku. A nejspíš ho čeká obměna mužstva. Hráči ze základní kostry týmu dávno přesáhli třicítku. \"Ne, ne, to si nemyslím,\" reagoval překvapivě. Jen šikovný záložník Brian Laudrup se nadobro vzdal reprezentace. Skvělého gólmana Petera Schmeichela zná Olsen jako kamaráda a je přesvědčen, že zatím neskončí. \"Když se mu vyhne těžké zranění, bude chytat dál.\" Totéž obránce Jes Högh. A další bek Jan Heintze? \"Vždyť mu je sotva šestatřicet. Proč by končil?\" Sám Olsen ukončil kariéru až v devětatřiceti na mistrovství Evropy 1988. Hned potom začal trénovat. Jako kouč se uvedl náramně: průměrné Bröndby Kodaň dovedl do semifinále Poháru UEFA. Naposledy vedl slavný Ajax Amsterdam, ale tam moc nepochodil. \"Když mě předloni v zimě propustili, začal jsem létat po Evropě a díval se, co je nového. Baví mě to, podrobně se seznamuji se všemi dánskými fotbalisty, kteří pro reprezentaci přicházejí v úvahu.\" Budoucí trenér reprezentace má teď před sebou těžký úkol: dovést Dánsko na mistrovství světa 2002. O postup z kvalifikační skupiny se zřejmě porve především s českými fotbalisty. Ještě jako hráč nastoupil proti bývalému Československu pětkrát, ale ani v jednom zápase nezažil vítězství. \"Vím, Češi jsou silní, techničtí, vytvořili kompaktní tým. Jsou hlavními favority,\" tvrdil Olsen. \"Ale fotbal je dnes hrozně vyrovnaný, takže postoupit může klidně Island.\""
        ]
    },
    {
        "user_input":"Shrň tento článek do stručného shrnutí.",
        "retrieved_contexts":[
            "Skuhravý v sobotu večer se svou Škodou Octavií vjel na Smíchově ve značné rychlosti do protisměru a čelně se střetl s protijedoucím vozem Mercedes. Zranění obou řidičů byla díky airbagům jen lehká, Skuhravý má roztrženou ruku a zlomených pět žeber. škoda na automobilech je kolem dvou milionů korun, protože mercedes se vzňal. Podle vyšetřujícího policisty Skuhravého dechová zkouška na alkohol ukázala 1,89 promile a podle předběžného šetření Skuhravý nehodu zavinil. Svědci havárie tvrdí, že Skuhravý se spolujezdcem okamžitě zmizeli a u zničených aut se objevili až po téměř hodině. Čtyřiatřicetiletý Skuhravý, jehož dnes zaměstnává Dukla Příbram coby marketingového ředitele, je v pracovní nechopnosti. Z jeho předchozích vyjádření vyplývá, že si téměř na nic nepamatuje, protože při nárazu do protijedoucího vozu se silně udeřil do hlavy. Tento internacionál střelecky zazářil na mistrovství světa 1990 v Itálii, kde za Československo vstřelil pět gólů. Poté se jako kanonýr prosadil v italském FC Janov a vysloužil si přezdívku \"Bomber\". Během pěti a půl roku v Janově rozbil tři přepychová auta, nejvážnější nehodu měl s luxusním Mitsubishi 3000. Tehdy v listopadu 1993 podle vlastních slov podcenil mokrou silnici, vyletěl ze zatáčky a rozmlátil předek auta o svodidla. Klubový mercedes naboural také při krátkém působení ve Sportingu Lisabon. Loni 27. září Skuhravý pro MF DNES uvedl: \"Člověk si až po čase uvědomí, co všechno ho v těch šílených rychlostech mohlo potkat. Když se za těmi maléry ohlédnu, jde mi až mráz po zádech. Říkám si, buď rád, že žiješ. Teď už za volantem neblázním jako dřív.\" Svědci nehody odhadují, že Skuhravý se smíchovskou Nádražní ulicí řítil stotřicetikilometrovou rychlostí."
        ],
        "response":"V sobotu se 43letý Skuhravy při jízdě Škodovou Octaviou na Smichově v rychlosti sto třicetikilometrů do protistřelu s Mercedesem zranil zlomenými žebry a roztrhanou rukou; jeho dechové zkoušky ukázaly 1.89 % alkoholu a nehodu se zavinily. Po tragické nehodě, kdy se auto zničilo a řidiče okamžitěji zmizely, je muž v pracovním nezaměst",
        "reference":"Bývalý fotbalový reprezentant Tomáš Skuhravý, který v sobotu havaroval, nemíní o této autonehodě cokoli říkat. \"Tomáš leží a s nikým mluvit nechce,\" oznámila včera v poledne Radka Skuhravá u pootevřených dveří bytu v jednom z paneláků motolského sídliště. Na opakovanou žádost o rozhovor se tiše vytratila za manželem, po chvíli se vrátila a zopakovala, že muž opravdu s nikým nehodlá mluvit",
        "reference_contexts":[
            "Skuhravý v sobotu večer se svou Škodou Octavií vjel na Smíchově ve značné rychlosti do protisměru a čelně se střetl s protijedoucím vozem Mercedes. Zranění obou řidičů byla díky airbagům jen lehká, Skuhravý má roztrženou ruku a zlomených pět žeber. škoda na automobilech je kolem dvou milionů korun, protože mercedes se vzňal. Podle vyšetřujícího policisty Skuhravého dechová zkouška na alkohol ukázala 1,89 promile a podle předběžného šetření Skuhravý nehodu zavinil. Svědci havárie tvrdí, že Skuhravý se spolujezdcem okamžitě zmizeli a u zničených aut se objevili až po téměř hodině. Čtyřiatřicetiletý Skuhravý, jehož dnes zaměstnává Dukla Příbram coby marketingového ředitele, je v pracovní nechopnosti. Z jeho předchozích vyjádření vyplývá, že si téměř na nic nepamatuje, protože při nárazu do protijedoucího vozu se silně udeřil do hlavy. Tento internacionál střelecky zazářil na mistrovství světa 1990 v Itálii, kde za Československo vstřelil pět gólů. Poté se jako kanonýr prosadil v italském FC Janov a vysloužil si přezdívku \"Bomber\". Během pěti a půl roku v Janově rozbil tři přepychová auta, nejvážnější nehodu měl s luxusním Mitsubishi 3000. Tehdy v listopadu 1993 podle vlastních slov podcenil mokrou silnici, vyletěl ze zatáčky a rozmlátil předek auta o svodidla. Klubový mercedes naboural také při krátkém působení ve Sportingu Lisabon. Loni 27. září Skuhravý pro MF DNES uvedl: \"Člověk si až po čase uvědomí, co všechno ho v těch šílených rychlostech mohlo potkat. Když se za těmi maléry ohlédnu, jde mi až mráz po zádech. Říkám si, buď rád, že žiješ. Teď už za volantem neblázním jako dřív.\" Svědci nehody odhadují, že Skuhravý se smíchovskou Nádražní ulicí řítil stotřicetikilometrovou rychlostí."
        ]
    },
    {
        "user_input":"Shrň tento článek do stručného shrnutí.",
        "retrieved_contexts":[
            "\"Dobře se známe ještě z Pardubic,\" připomněl útočník skutečnost, že Říha na východě Čech působil tři sezony. Na led karlovarského stadionu vyjel Martinec poprvé v pondělí. Tréninkové manko, způsobené chřipkou, však doháněl společně s juniory. Kvůli nemoci nestihl poslední tři zápasy Becherovky, mimo jiné také nedělní duel s pražskou Spartou, jejíž dres obléká Martincův starší bratr Patrik. \"Už to pro nás není nic nového. Nastoupili jsme proti sobě již několikrát. Faktem ale je, že bych raději hrál. Pro hokejistu není dobré, když zápasy sleduje z hlediště nebo jen z novin,\" řekl Martinec. Letošní sezonu v Pardubicích nezačal Tomáš Martinec podle svého přání. V sestavě uvolnil místo pro Eliáše s Morissonem, kteří po několika zápasech zamířili za oceán do týmu NHL New Jersey Devils, v lednu ho čekal odchod do Becherovky. \"V Pardubicích jsme si od začátku sezony nepadli do oka s trenérem Milanem Chalupou. To letošní sezonu poznamenalo,\" tvrdí hráč, který letos vstřelil v pětadvaceti utkáních šest gólů a připsal si pět asistencí. V loni nasbíral třicet bodů za jedenáct gólů a devatenáct přihrávek. Na západě Čech je 174 centimetrů vysoký a 74 kilogramů vážící hráč na hostování do konce sezony. Nevylučuje však, že by se jeho působení mohlo prodloužit. \"Uvidí se po skončení sezony. Každopádně Pardubice i Karlovy Vary mají shodné cíle. Pokud se nepovede postup do play off, tak udělat všechno pro to, aby se tým vyhnul barážovým starostem,\" doplnil Martinec. Ten včera trénoval v útoku společně s centrem Josefem Podlahou a levým křídlem Miroslavem Barusem."
        ],
        "response":"Tomáš Martinc, bývalý reprezentant, se v této sezoně vrátil do Karlových Varů, kde nastoupil ve všech osmi utkání a dosáhl 6 gólům a 5 asistancím. Hráč si uvědomil, že jeho absence kvůli chřibce byla pro tým zásadní, protože mu bylo vadit vidět zápasy z hřiště. Po ukončení sezóny má možnost odejít zpátky do Pardubic, zatímco v současnosti se připravuje na další soutěžní",
        "reference":"Ačkoliv se hokejový útočník Tomáš Martinec dozvěděl o přestupu do týmu karlovarské Becherovky před týdnem, s novými spoluhráči trénoval poprvé až včera. V Pardubicích, kde donedávna působil, totiž doléčoval chřipku. \"Výměna do Karlových Varů mne zaskočila, zvlášť když to bylo na poslední chvíli těsně před uzávěrkou soupisek,\" přiznal Tomáš Martinec. Šestadvacetiletého hokejistu však potěšilo, že celek Becherovky vede trenér Miloš Říha",
        "reference_contexts":[
            "\"Dobře se známe ještě z Pardubic,\" připomněl útočník skutečnost, že Říha na východě Čech působil tři sezony. Na led karlovarského stadionu vyjel Martinec poprvé v pondělí. Tréninkové manko, způsobené chřipkou, však doháněl společně s juniory. Kvůli nemoci nestihl poslední tři zápasy Becherovky, mimo jiné také nedělní duel s pražskou Spartou, jejíž dres obléká Martincův starší bratr Patrik. \"Už to pro nás není nic nového. Nastoupili jsme proti sobě již několikrát. Faktem ale je, že bych raději hrál. Pro hokejistu není dobré, když zápasy sleduje z hlediště nebo jen z novin,\" řekl Martinec. Letošní sezonu v Pardubicích nezačal Tomáš Martinec podle svého přání. V sestavě uvolnil místo pro Eliáše s Morissonem, kteří po několika zápasech zamířili za oceán do týmu NHL New Jersey Devils, v lednu ho čekal odchod do Becherovky. \"V Pardubicích jsme si od začátku sezony nepadli do oka s trenérem Milanem Chalupou. To letošní sezonu poznamenalo,\" tvrdí hráč, který letos vstřelil v pětadvaceti utkáních šest gólů a připsal si pět asistencí. V loni nasbíral třicet bodů za jedenáct gólů a devatenáct přihrávek. Na západě Čech je 174 centimetrů vysoký a 74 kilogramů vážící hráč na hostování do konce sezony. Nevylučuje však, že by se jeho působení mohlo prodloužit. \"Uvidí se po skončení sezony. Každopádně Pardubice i Karlovy Vary mají shodné cíle. Pokud se nepovede postup do play off, tak udělat všechno pro to, aby se tým vyhnul barážovým starostem,\" doplnil Martinec. Ten včera trénoval v útoku společně s centrem Josefem Podlahou a levým křídlem Miroslavem Barusem."
        ]
    },
    {
        "user_input":"Shrň tento článek do stručného shrnutí.",
        "retrieved_contexts":[
            "Pracovnice tiskového oddělení pražské policejní správy Martina Bártová uvedla, že u Skuhravého dechová zkouška na přítomnost alkoholu v krvi byla pozitivní a vykázala 1,89 promile alkoholu. Policie zatím nemá k dispozici výsledky krevního rozboru, který by s jistotou prokázal, zda Skuhravý před jízdou skutečně požil alkohol. \"Podezření, že tam byl alkohol je velké, proto jsem proti panu Skuhravému zahájil trestní stíhání,\" uvedl vyšetřovatel, podle nějž policie výsledky krevní zkoušky od zdravotníků obdrží do čtrnácti dní od odběru. Podle dostupných informací vjel Skuhravý se svou Škodou Octavia v Nádražní ulici v Praze 5 do protisměru, kde se ve velké rychlosti čelně srazil s řidičem protijedoucího vozu Mercedes 230, který krátce po nárazu vzplál. Řidič mercedesu vyvázl s lehkým poraněním hlavy a břicha, Skuhravý s pěti zlámanými žebry a tržnou ránou na ruce. Škoda způsobená na obou vozech byla dva miliony korun. Vyšetření případu potrvá podle vyjádření policie ještě zhruba dva měsíce."
        ],
        "response":"Pracovník tiskové oddělití pražského policejního státního orgánu Martina Barta tvrdí, že na vozidle Skuhrava bylo detekováno 1.89 % alkoholu v krve, což vedlo k zahájení trestního stíhá. Po dopravním nehodě, při které Skuhravec s Škodovou Octaviou zranil řidiče Mercedesu, se nyní čekají výsledky krvních testů, které budou mít zásadní dopad na proces",
        "reference":"Obviněn z trestného činu obecného ohrožení pod vlivem alkoholu byl bývalý fotbalový reprezentant Tomáš Skuhravý. Populární \"bomber\", který nyní působí ve funkci marketingového ředitele příbramské Dukly, o víkendu způsobil v Praze vážnou dopravní nehodu a hrozí mu až roční vězení nebo zákaz řízení motorových vozidel či peněžitý trest",
        "reference_contexts":[
            "Pracovnice tiskového oddělení pražské policejní správy Martina Bártová uvedla, že u Skuhravého dechová zkouška na přítomnost alkoholu v krvi byla pozitivní a vykázala 1,89 promile alkoholu. Policie zatím nemá k dispozici výsledky krevního rozboru, který by s jistotou prokázal, zda Skuhravý před jízdou skutečně požil alkohol. \"Podezření, že tam byl alkohol je velké, proto jsem proti panu Skuhravému zahájil trestní stíhání,\" uvedl vyšetřovatel, podle nějž policie výsledky krevní zkoušky od zdravotníků obdrží do čtrnácti dní od odběru. Podle dostupných informací vjel Skuhravý se svou Škodou Octavia v Nádražní ulici v Praze 5 do protisměru, kde se ve velké rychlosti čelně srazil s řidičem protijedoucího vozu Mercedes 230, který krátce po nárazu vzplál. Řidič mercedesu vyvázl s lehkým poraněním hlavy a břicha, Skuhravý s pěti zlámanými žebry a tržnou ránou na ruce. Škoda způsobená na obou vozech byla dva miliony korun. Vyšetření případu potrvá podle vyjádření policie ještě zhruba dva měsíce."
        ]
    },
    {
        "user_input":"Shrň tento článek do stručného shrnutí.",
        "retrieved_contexts":[
            "Suchý: Miroslave, říkal jsem si, na co se bavit o prkotinách - probereme něco zásadního. Přemýšlel jsem o svobodě. Nadnesu tezi a můžeme si o ní povídat. Svoboda a demokracie pracuje vždycky zvolna na svojí sebezáhubě, protože dává...Horníček: (mu skočí do řeči) ... možnosti...Suchý: (přikyvuje)... stejné lidem slušnejm jako neslušnejm, přičemž ty slušný to nezneužijou a neslušný zneužijou, čili jsou nepřímo zvýhodňováni. Co si o tom myslíš?Horníček: To je pravda. Ovšem také bych k tomu podotkl, že svoboda je schopnost být svoboden. A tady nemohu nevidět příbuznost se štěstím. Štěstí není v tom, co mám nebo kolik mám, štěstí je schopnost být šťasten. Někdo ovšem není schopen svobody ani štěstí.Suchý: To je pravda, já si pamatuju, že i v dobách takzvaně totalitních jsem se vlastně necítil být příliš nesvoboden, protože jsem si začal hledat svobodu v jiných sférách. A nebýt útlaku, tak jsem se možná do těchto sfér vůbec nedostal.Horníček: Vidíš, to byla tvoje odpověď na problém.Suchý: Takže do jistý míry může být člověk svobodnej i v koncentračním táboře, když chce.Horníček:... když chce. Když je uvnitř svobodnej. Pak není uvnitř tábora.Suchý: No, ne že bych po tom zrovna prahl.Horníček: Také bych volil jiné druhy svobody.Suchý: Tak v tomhle bodě jsme se celkem shodli. O svobodě mezi námi dvěma asi žádná diskuse nebude, neboť k té tu chybí rozporné názory. Na druhou stranu, říkám si, jak se teď všeobecně celý národ hádá, skoro každý s každým, není to zas tak úplně špatný. Je to rozhodně lepší, než když celý národ drží hubu a jednotně hlasuje. Sice je to trochu smutný, když konečně máme šanci dělat co chceme a my ji využijeme k hádání, ale nakonec, proč ne?Horníček: Nepopíratelně je to jeden z projevů svobody - moci se hádat.Suchý: Tak co kdybychom využili tuto svobodnou možnost? Pohádáme se?Horníček: A já myslím, abys mi dal rovnou facku... jaképak řeči kolem toho.(Oba se smějí)Suchý: Hele, když už jsme u facky, tak se mi hned vybaví klaunskej humor. Humor ve své nejčistší podobě. Tam i ta facka či kopanec má své oprávnění. Ty si si to klaunství ochutnal...Horníček: Kdepak, já jsem ho nikdy neochutnal. To, co jsem dělal s Janem Werichem, byly sice takové klaunské dialogy ještě z dob Voskovce a Wericha, ale když jsme jednou chtěli udělat klaunské číslo s Mirkem Lipským, Werich nám tehdy říkal: To nemůžete, to nedoděláte, herec může občas hrát klauna, ale to ještě neznamená, že klaun je. A je v tom opravdu velký rozdíl.Suchý: Pravda však je, že pokud jsem viděl klauny v cirkuse, ne vždy to bylo k smíchu.Horníček: Ano, protože jsou to obyčejně spíš takoví zaměstnanci cirkusu, kteří pomáhají překlenout pauzu, než přijde lev nebo zebra. Ale to není čisté klaunství. Podívej se, skutečný klaun byl třeba Grock. Viděl jsem jej v Praze v celovečerním programu a bylo to fantastický.Suchý: Já zase ve filmu Na shledanou, pane Grocku. Jeden můj přítel, propagační grafik, byl kdysi pověřenej, aby mu udělal plakát. A vyprávěl mi, jak šel za ním domů a Grock tam seděl a zašíval si ponožky...(Horníček už se v předtuše směje)Suchý: Taková osobnost, a zašívá si ponožky! A Grock tomu překvapenému grafikovi říká - já když dělám tyhlety domácí práce, tak mne napadá nejvíc volovinek, při nich mně vznikají nejlepší etudy!Horníček: Výborná rada, od zítřka si také začnu štupovat ponožky!Suchý: A já se vždycky za měsíc přijdu podívat na tvoje nové číslo. Kdybys jich měl málo, myslím těch ponožek, tak ti nějaké přinesu. Svoje, samozřejmě, a vypraný, to se spolehni!Horníček: (zasměje se a pak se zahledí do minulosti): No a kdybychom měli jmenovat někoho z Čechů, tak rozhodně Béda Lak, jeho fantastické číslo: házel kuželky do číší a před nimi měl při tom dvě malé židličky a na nich cylindr. A on vždycky přerušil házení, šel k prvnímu cylindru, vzal jej a přelil z něj vodu do druhého. Prázdnej cylindr vrátil zpátky. Pak házel dál a znovu šel k onomu jakoby prázdnýmu cylindru a znovu z něj vylil vodu - voda neubejvala v jednom a nepřibejvala v druhém. Jednou byl na představení i prezident Zápotocký se ženou a Béda za nimi pak šel do lóže a paní Zápotocká se ptala: pane Lak, jak to děláte s těmi cylindry? A on jí odpověděl: Milostivá paní, já už to dělám třicet let a víte, že to nevím?Suchý: Jo, jo, humor je strašně krásná věc. My jsme ho s Jirkou Šlitrem někdy až přeceňovali. Byl pro nás tak rozhodující, že nám lidi bez humoru byli až podezřelí. Dnes vím, že ono to tak být nemusí, humor je dar a někdo jej nedostal. Může to být hodnej, slušnej a vzdělanej člověk, jen se neumí srdečně zasmát...Horníček: Tos mi připomněl, jak se na mém představení nesmál Miloš Kopecký. Přišel a povídá: Nezlob se, ale já se nebudu smát. Že prý bude studovat to představení jako obuvník cizí botu; jak je udělaná, jakou má fazonu a tvar. A také říkal: A dneska trošku uber, abych neměl mindráky. Pak přišel po představení a říká: Tos nemusel tolik ubírat...Suchý: Také v muzikantském humoru by se našla plejáda různých fórků. Třeba - ty hraješ den ze dne hůř a dneska si hrál už jako pozejtří.Horníček: A Miloš Kopecký to používal - ovšem opačně - na dívky: vy jste den ode dne krásnější, dneska vypadáte už jako pozejtří.Suchý: Karel Vlach se zase prý po představení ptal: Doufám, že jsme si tady dneska nezkazili žádnou ostudu!(Horníček se směje)Suchý: No a já jsem to nedávno také zkusil na pořadatele po jednom vystoupení: Doufám, že jsme si tady nezkazili ostudu, říkám a oni: Ne, ne, bylo to velice dobrý...(Smějí se oba).Suchý: Slavný Benny Hill měl něco podobného - přichází na scénu a moderátor říká: Tady je pan Benny Hill. A on na to: Je to velká čest, že mohu vystupovat právě ve vašem programu. A ten moderátor říká: No ne, pro nás je to čest. Benny odvětí: Tak jsem to myslel.Horníček: To jsou ty nádherný věci, které člověk nemůže zapomenout. Jako bratry Marxe. Miluju tu scénu, jak jeden z nich chce být zvěrolékařem v sanatoriu. Přijde se představit do salonu majitelky. Za ní na stěně visí v nadživotní velikosti portrét muže v žaketu z minulého století. A on povídá: Á, vaši paní matku jsem znal, před lety jsem ji požádal o ruku. A ona: Ale to je můj otec. On na to: Tak proto mne tenkrát odmítla!Suchý: Měli zvláštní, absurdní humor. Povídá jeden druhému: mám informaci, že v sousedním domě je poklad. A druhý namítne - no jo, ale vedle žádnej dům není! Tak ho tam postavíme!Horníček: Hahá, to mi připomíná typicky anglickej fór, jak velice bohatý Angličan koupí pozemek na kraji džungle, všude jen strašná divoká příroda, bažiny, hadi. Tady jsi koupil pozemek? říkají mu. A on odvětí - Přijďte za tři roky a uvidíte. A oni přijedou, tam nádherný anglický park, tři domy. To je tvoje? - Ano, to jsem tady vybudoval, jak jsem vám říkal. - A co tři domy? V jednom bydlím, ve druhém je klub, kam chodím každý pátek. - A v tom třetím? - Tam je klub, kam zásadně nechodím...Suchý: No ale abychom nezůstali jen u minulosti, mám pocit, že do té první klaunské kategorie by se dal zařadit také Bolek Polívka.Horníček: Bolek Polívka, ano, ten má čísla vysloveně klaunská.Suchý: Jednou mne pozval do Brna na natáčení pro televizi. Byl jsem nervózní, že mně neposlali žádnej scénář, ale pak jsem nahlédl do té jeho tvůrčí dílny: ani on jej neměl! Věděl jen, že bude mít na hlavě - bylo to o Vánocích, v době, kdy ho opustila Chantal - parohy ozdobené vánočníma koulema. A tak tam čekal, aby jej kamarádi bavili a trošičku rozdováděli z toho smutku. Chvilku seděl a přemýšlel, co budeme dělat. A byl tam takovej starej prošlapanej perskej koberec a on mně říká - helejte, co kdybyste mě hádal z koberce, jako se hádá z lógru! A my jsme na to udělali docela povedený číslo. A druhý den se točilo naostro a on zas mluvil jinak, celý večer byl vlastně zase trochu jiný. Což mně ostatně připomnělo tebe a Wericha - vždycky jsem záviděl, jak se vaše představení pořád drobně měnilo, žilo, kostra byla stejná, ale vždy přibyl fóreček...Horníček: Už za Voskovce lidi říkali: Ti dva jsou denně jiný. Nebyla to pravda. My jsme taky nebyl denně jiný, ale po tejdnu, po měsíci...Suchý: To je pravda, málokdo si koupí lístky na šest dní za sebou, aby to porovnal.Suchý: Když už mluvíme o současném humoru, jak se ti líbí Česká soda?Horníček: Tu neznám. Já to moc nesleduju. Ale dávám přednost koňaku.Suchý: Satiru bychom ovšem opomenout neměli. Já se v ní tedy moc nevyznám, když se jí někdy dopustím, tak spíš tak levou rukou...Horníček: To je to správný slovo: dopustit se. Já také někdy utrousím něco, co vypadá satiricky, a přitom to nechce být. Já nemám rád satiru, tak jako ji neměl rád Werich, však on také chtěl odbourat ten název Divadlo satiry a změnil jej na Divadlo ABC - on, který byl satirický herec číslo jedna. Jo, ale to bylo v době, která satirické projevy z jeviště vyžadovala, potřebovala. Až potom přišla doba, kdy nám vytýkali, že neděláme satiru. Na co jsme ji však měli dělat? Na zlé domácí pány na Vinohradech? Na boháče?Suchý: My měli to samý - že prý proč neútočíme na nešvary! A ať prý tepeme, že holič bere úplatky a číšníci spropitné!Horníček: Z toho dělat komickou záležitost - to bych teda nemohl, to ne.Suchý: Možná by šlo udělat komickou záležitost z těch lidí, kteří nás takhle nabádali... Horníček: Ale to se zase nesmělo...Suchý: Také by mne zajímal tvůj názor na toto: abych předeslal, já sprosťárny nemám rád. Ale viděl jsem jednu scénku Šípa s Bohdalovou, on dělá erotické služby do domu a ona myslí, že pozvala malíře. A ten výstup byl lascivní, ale tak vtipnej a tak nabitej - tak jsem uznal, že i humor, který by normálně člověk považoval za pokleslý, může být výborný. Co ty na to?Horníček: Werich vždycky říkal - Nemám rád sprostá slova a sprosté anekdoty. Ale kde je nutno říci slovo hovno, tak ho řekněte tak, jako byste řekl slovo růže nebo koleno, jen to tam nedodávat jako špek!Suchý: Někdy jde o problém nezastupitelný. Mám na něj jeden recept - když použiju sprostý slovo, pak v kontextu, který to slovo ospravedlňuje. Například když v Semaforu v Kytici matka nabízí svou dceru králi, povídá: Její nit, toť hedváb! A on říká: Seru na hedváb, babice. Kdyby tam nebyl hedváb a řekl já se na to vy..., tak to by nešlo, ale v kombinaci s hedvábem myslím, že to zaznělo.Horníček: Ovšem dnes tato slova v televizi prší, publikum se tomu směje - ale ne té kombinaci s hedvábem, ale jen tomu, že člověk řekl sprostý slovo. A nebo se smějou, protože bavič dodá ještě vlastní úšklebek, vydá nějaký zvuk nebo smích. A za úplný zločin dneška považuji mixování smíchu do pořadů. Smích je přece organický projev, nikoli organizovaný.Suchý: Což mohu doložit. Když jsme natáčeli loňského Silvestra, moderátor se obrátil na publikum a říkal: Podívejte, s jedním publikem natáčíme teď odpoledne a s jiným večer. Které bude líp reagovat, to v televizi bude. No a co se stalo. My jsme vyšli s naším skečem, který už máme nazkoušený z divadla. Řekli jsme první větu - která nebyla nic moc - a najednou strašný smích a potlesk. Řekli jsme druhou a zase - hahaha. Lidé se smáli, ne našim vtipům, ale aby se viděli v televizi. Rozsekali nám skeč, až ho zničili. Hurónský smích, kde by možná stačil úsměv. Zlaté divadlo!Horníček: To je přesně to, co chci říct. Mně je milejší úsměv než přehnaný smích. Nedostatek smíchu mi samozřejmě vadí, zvlášť když se nedostaví tam, kde jsem v něj doufal, ale když je ho přebytek... Jako v Neváhej a toč, kde lidi padají ze židle a drží se za hlavy, zmítají se... Říkal jsem to autorům pořadu i Edovi Hrubešovi: Přebytek smíchu je něco strašného. Ovšem nejen z tohoto pořadu, ale z televize vůbec mám špatný pocit, ubývá humoru a přibývá dělání legrace. Ubývá komiků a přibývá bavičů. A v tom je podstatnej rozdíl. Ne že by mne to trápilo, já to opíšu latinsky: sere mne to. Suchý: Miroslave, abychom nezůstali jen u humoru, já jsem se tě chtěl zeptat ještě na jednu věc. Totiž: Na peníze. Když teď žijeme v tržní době. Kdybys byl chamtivec, tak toto téma taktně přejdu, ale protože vím, že nejsi, tak se ptám: Jaký máš vlastně vztah k penězům?Horníček: Já vlastně žádný pořádný vztah nemám. Vyrůstal jsem u rodičů a vůbec ani nevěděl, kolik má tatínek příjmu. Své peníze jsem nepotřeboval, když jsem šel do tanečních, tak mi dali padesát kaček na víno. Pak jsem byl už jen s maminkou, táta odešel, a zase jsem se nestaral o peníze. Když jsem žil s Bělou, peníze zase byly její starost. Já ani nevěděl, jestli jsme pojištění a kdo a kolik se platí telefon. Teď Běla není a já jsem se musel začít o peníze poprvé zajímat. Naštěstí Karel Koliš, který byl také u Wericha, mně udělal fantastickou službu - všechno spočítal a sečetl, a řekl mi kolik mám, kolik můžu mít a kam uložit peníze...Suchý: Já k penězům také nemám vztah. Ale jsem na tom hůř, neboť jsem podnikatel. Takže jsem sám sobě sponzorem, všechny své podniky musím dotovat ze svých jiných výdělků. Ale to už má zase co do činění s tou svobodou, o které jsme mluvili. Hlavní je, aby se na nich člověk nestal závislej.Horníček: No pozor, ze mne se stává Harpagon, řekl jsem Karlu Kolišovi, aby mi koupil kovovou kasičku. Tu mám v šuplíku. Pravda, nemám ji zamčenou.Suchý: Ale je kovová!Horníček: A já si někdy večer sednu a počítám peníze. Dojdu do pěti, šesti a zapomenu, kolik to bylo, tak ji zavřu a jdu spát. Čili já asi k těm penězům pořád nemám vztah. Zatím prej mám dost.Suchý: Vzpomínám na pana Wericha, on se velice dobře vyznal v antickejch mincích. A říkal mně: Já nesbírám mince jako sběratel. Ale občas jdu a nějakou zlatou minci si koupím a schovám. A víte proč? Já jednoho letního dne stáhnu žaluzie a ty mince, ty zlatý mince vysypu na stůl a budu se v nich přehrabovat.Horníček: Ha há, taky Harpagon!Suchý: No, ale nevím, jestli vůbec k tomu přehrabování dospěl.Horníček: Tos mi teď připomněl, volala tuhle taková starší dáma, čímž myslím, že byla asi v mejch letech...Suchý: Takže holka! Taková starší holka.Horníček: No ano, a ta starší holka říká: Pane Horníček, já bych vám chtěla vyprávět vzpomínku, kterou bych si nerada odnesla s sebou. Jednou jsme večeřeli v New Yorku s Voskovcem a on najednou začal opakovat větu. - On to ten Werich neřekne a neřekne. - Nikdo nevěděl, o co jde. A když to opakoval asi popáté, zeptali jsme se - Co by měl říct? - Měl by říct, že jsem byl lepší, než ten Horníček! Miroslav Horníček a Jiří Suchý během rozhovoru"
        ],
        "response":"Během rozhovору s Mirooslavem Horníčkem a Jiřím Suchým se objevily klíčové témata týkající se svobody, humoru a ekonomického stavu českých publicistů. Oba hosté diskutují o paradoxu svobody a štěstě, kde štěstící lidé často nejsou schopni být svobodní, zatímco jejich humornost je často spojována s „klaunstvím\" nebo s přehnutým smíchem. Konkrétně zmínili i ekonomickou situaci, kde někter",
        "reference":"Miroslavu Horníčkovi je jedenaosmdesát let, ale pořád o stáří nerad slyší, i když už na něm neúprosně zanechává své stopy. Po obědě chodí spát, a pak odchází do pracovny, aby se věnoval svým kolážím. Od smrti manželky žije ve svém bytě ve vile na hranici Vinohrad a Vršovic sám, ale obklopen přáteli.Jedním z nich je i Jiří Suchý. Rozhovor, který vedl s Miroslavem Horníčkem pro Magazín MF DNES, není opravdovým novinářským rozhovorem. Je spíš divadelním dialogem, vzpomínáním dvou lidí, kteří prožili nejlepší léta ve společném světě",
        "reference_contexts":[
            "Suchý: Miroslave, říkal jsem si, na co se bavit o prkotinách - probereme něco zásadního. Přemýšlel jsem o svobodě. Nadnesu tezi a můžeme si o ní povídat. Svoboda a demokracie pracuje vždycky zvolna na svojí sebezáhubě, protože dává...Horníček: (mu skočí do řeči) ... možnosti...Suchý: (přikyvuje)... stejné lidem slušnejm jako neslušnejm, přičemž ty slušný to nezneužijou a neslušný zneužijou, čili jsou nepřímo zvýhodňováni. Co si o tom myslíš?Horníček: To je pravda. Ovšem také bych k tomu podotkl, že svoboda je schopnost být svoboden. A tady nemohu nevidět příbuznost se štěstím. Štěstí není v tom, co mám nebo kolik mám, štěstí je schopnost být šťasten. Někdo ovšem není schopen svobody ani štěstí.Suchý: To je pravda, já si pamatuju, že i v dobách takzvaně totalitních jsem se vlastně necítil být příliš nesvoboden, protože jsem si začal hledat svobodu v jiných sférách. A nebýt útlaku, tak jsem se možná do těchto sfér vůbec nedostal.Horníček: Vidíš, to byla tvoje odpověď na problém.Suchý: Takže do jistý míry může být člověk svobodnej i v koncentračním táboře, když chce.Horníček:... když chce. Když je uvnitř svobodnej. Pak není uvnitř tábora.Suchý: No, ne že bych po tom zrovna prahl.Horníček: Také bych volil jiné druhy svobody.Suchý: Tak v tomhle bodě jsme se celkem shodli. O svobodě mezi námi dvěma asi žádná diskuse nebude, neboť k té tu chybí rozporné názory. Na druhou stranu, říkám si, jak se teď všeobecně celý národ hádá, skoro každý s každým, není to zas tak úplně špatný. Je to rozhodně lepší, než když celý národ drží hubu a jednotně hlasuje. Sice je to trochu smutný, když konečně máme šanci dělat co chceme a my ji využijeme k hádání, ale nakonec, proč ne?Horníček: Nepopíratelně je to jeden z projevů svobody - moci se hádat.Suchý: Tak co kdybychom využili tuto svobodnou možnost? Pohádáme se?Horníček: A já myslím, abys mi dal rovnou facku... jaképak řeči kolem toho.(Oba se smějí)Suchý: Hele, když už jsme u facky, tak se mi hned vybaví klaunskej humor. Humor ve své nejčistší podobě. Tam i ta facka či kopanec má své oprávnění. Ty si si to klaunství ochutnal...Horníček: Kdepak, já jsem ho nikdy neochutnal. To, co jsem dělal s Janem Werichem, byly sice takové klaunské dialogy ještě z dob Voskovce a Wericha, ale když jsme jednou chtěli udělat klaunské číslo s Mirkem Lipským, Werich nám tehdy říkal: To nemůžete, to nedoděláte, herec může občas hrát klauna, ale to ještě neznamená, že klaun je. A je v tom opravdu velký rozdíl.Suchý: Pravda však je, že pokud jsem viděl klauny v cirkuse, ne vždy to bylo k smíchu.Horníček: Ano, protože jsou to obyčejně spíš takoví zaměstnanci cirkusu, kteří pomáhají překlenout pauzu, než přijde lev nebo zebra. Ale to není čisté klaunství. Podívej se, skutečný klaun byl třeba Grock. Viděl jsem jej v Praze v celovečerním programu a bylo to fantastický.Suchý: Já zase ve filmu Na shledanou, pane Grocku. Jeden můj přítel, propagační grafik, byl kdysi pověřenej, aby mu udělal plakát. A vyprávěl mi, jak šel za ním domů a Grock tam seděl a zašíval si ponožky...(Horníček už se v předtuše směje)Suchý: Taková osobnost, a zašívá si ponožky! A Grock tomu překvapenému grafikovi říká - já když dělám tyhlety domácí práce, tak mne napadá nejvíc volovinek, při nich mně vznikají nejlepší etudy!Horníček: Výborná rada, od zítřka si také začnu štupovat ponožky!Suchý: A já se vždycky za měsíc přijdu podívat na tvoje nové číslo. Kdybys jich měl málo, myslím těch ponožek, tak ti nějaké přinesu. Svoje, samozřejmě, a vypraný, to se spolehni!Horníček: (zasměje se a pak se zahledí do minulosti): No a kdybychom měli jmenovat někoho z Čechů, tak rozhodně Béda Lak, jeho fantastické číslo: házel kuželky do číší a před nimi měl při tom dvě malé židličky a na nich cylindr. A on vždycky přerušil házení, šel k prvnímu cylindru, vzal jej a přelil z něj vodu do druhého. Prázdnej cylindr vrátil zpátky. Pak házel dál a znovu šel k onomu jakoby prázdnýmu cylindru a znovu z něj vylil vodu - voda neubejvala v jednom a nepřibejvala v druhém. Jednou byl na představení i prezident Zápotocký se ženou a Béda za nimi pak šel do lóže a paní Zápotocká se ptala: pane Lak, jak to děláte s těmi cylindry? A on jí odpověděl: Milostivá paní, já už to dělám třicet let a víte, že to nevím?Suchý: Jo, jo, humor je strašně krásná věc. My jsme ho s Jirkou Šlitrem někdy až přeceňovali. Byl pro nás tak rozhodující, že nám lidi bez humoru byli až podezřelí. Dnes vím, že ono to tak být nemusí, humor je dar a někdo jej nedostal. Může to být hodnej, slušnej a vzdělanej člověk, jen se neumí srdečně zasmát...Horníček: Tos mi připomněl, jak se na mém představení nesmál Miloš Kopecký. Přišel a povídá: Nezlob se, ale já se nebudu smát. Že prý bude studovat to představení jako obuvník cizí botu; jak je udělaná, jakou má fazonu a tvar. A také říkal: A dneska trošku uber, abych neměl mindráky. Pak přišel po představení a říká: Tos nemusel tolik ubírat...Suchý: Také v muzikantském humoru by se našla plejáda různých fórků. Třeba - ty hraješ den ze dne hůř a dneska si hrál už jako pozejtří.Horníček: A Miloš Kopecký to používal - ovšem opačně - na dívky: vy jste den ode dne krásnější, dneska vypadáte už jako pozejtří.Suchý: Karel Vlach se zase prý po představení ptal: Doufám, že jsme si tady dneska nezkazili žádnou ostudu!(Horníček se směje)Suchý: No a já jsem to nedávno také zkusil na pořadatele po jednom vystoupení: Doufám, že jsme si tady nezkazili ostudu, říkám a oni: Ne, ne, bylo to velice dobrý...(Smějí se oba).Suchý: Slavný Benny Hill měl něco podobného - přichází na scénu a moderátor říká: Tady je pan Benny Hill. A on na to: Je to velká čest, že mohu vystupovat právě ve vašem programu. A ten moderátor říká: No ne, pro nás je to čest. Benny odvětí: Tak jsem to myslel.Horníček: To jsou ty nádherný věci, které člověk nemůže zapomenout. Jako bratry Marxe. Miluju tu scénu, jak jeden z nich chce být zvěrolékařem v sanatoriu. Přijde se představit do salonu majitelky. Za ní na stěně visí v nadživotní velikosti portrét muže v žaketu z minulého století. A on povídá: Á, vaši paní matku jsem znal, před lety jsem ji požádal o ruku. A ona: Ale to je můj otec. On na to: Tak proto mne tenkrát odmítla!Suchý: Měli zvláštní, absurdní humor. Povídá jeden druhému: mám informaci, že v sousedním domě je poklad. A druhý namítne - no jo, ale vedle žádnej dům není! Tak ho tam postavíme!Horníček: Hahá, to mi připomíná typicky anglickej fór, jak velice bohatý Angličan koupí pozemek na kraji džungle, všude jen strašná divoká příroda, bažiny, hadi. Tady jsi koupil pozemek? říkají mu. A on odvětí - Přijďte za tři roky a uvidíte. A oni přijedou, tam nádherný anglický park, tři domy. To je tvoje? - Ano, to jsem tady vybudoval, jak jsem vám říkal. - A co tři domy? V jednom bydlím, ve druhém je klub, kam chodím každý pátek. - A v tom třetím? - Tam je klub, kam zásadně nechodím...Suchý: No ale abychom nezůstali jen u minulosti, mám pocit, že do té první klaunské kategorie by se dal zařadit také Bolek Polívka.Horníček: Bolek Polívka, ano, ten má čísla vysloveně klaunská.Suchý: Jednou mne pozval do Brna na natáčení pro televizi. Byl jsem nervózní, že mně neposlali žádnej scénář, ale pak jsem nahlédl do té jeho tvůrčí dílny: ani on jej neměl! Věděl jen, že bude mít na hlavě - bylo to o Vánocích, v době, kdy ho opustila Chantal - parohy ozdobené vánočníma koulema. A tak tam čekal, aby jej kamarádi bavili a trošičku rozdováděli z toho smutku. Chvilku seděl a přemýšlel, co budeme dělat. A byl tam takovej starej prošlapanej perskej koberec a on mně říká - helejte, co kdybyste mě hádal z koberce, jako se hádá z lógru! A my jsme na to udělali docela povedený číslo. A druhý den se točilo naostro a on zas mluvil jinak, celý večer byl vlastně zase trochu jiný. Což mně ostatně připomnělo tebe a Wericha - vždycky jsem záviděl, jak se vaše představení pořád drobně měnilo, žilo, kostra byla stejná, ale vždy přibyl fóreček...Horníček: Už za Voskovce lidi říkali: Ti dva jsou denně jiný. Nebyla to pravda. My jsme taky nebyl denně jiný, ale po tejdnu, po měsíci...Suchý: To je pravda, málokdo si koupí lístky na šest dní za sebou, aby to porovnal.Suchý: Když už mluvíme o současném humoru, jak se ti líbí Česká soda?Horníček: Tu neznám. Já to moc nesleduju. Ale dávám přednost koňaku.Suchý: Satiru bychom ovšem opomenout neměli. Já se v ní tedy moc nevyznám, když se jí někdy dopustím, tak spíš tak levou rukou...Horníček: To je to správný slovo: dopustit se. Já také někdy utrousím něco, co vypadá satiricky, a přitom to nechce být. Já nemám rád satiru, tak jako ji neměl rád Werich, však on také chtěl odbourat ten název Divadlo satiry a změnil jej na Divadlo ABC - on, který byl satirický herec číslo jedna. Jo, ale to bylo v době, která satirické projevy z jeviště vyžadovala, potřebovala. Až potom přišla doba, kdy nám vytýkali, že neděláme satiru. Na co jsme ji však měli dělat? Na zlé domácí pány na Vinohradech? Na boháče?Suchý: My měli to samý - že prý proč neútočíme na nešvary! A ať prý tepeme, že holič bere úplatky a číšníci spropitné!Horníček: Z toho dělat komickou záležitost - to bych teda nemohl, to ne.Suchý: Možná by šlo udělat komickou záležitost z těch lidí, kteří nás takhle nabádali... Horníček: Ale to se zase nesmělo...Suchý: Také by mne zajímal tvůj názor na toto: abych předeslal, já sprosťárny nemám rád. Ale viděl jsem jednu scénku Šípa s Bohdalovou, on dělá erotické služby do domu a ona myslí, že pozvala malíře. A ten výstup byl lascivní, ale tak vtipnej a tak nabitej - tak jsem uznal, že i humor, který by normálně člověk považoval za pokleslý, může být výborný. Co ty na to?Horníček: Werich vždycky říkal - Nemám rád sprostá slova a sprosté anekdoty. Ale kde je nutno říci slovo hovno, tak ho řekněte tak, jako byste řekl slovo růže nebo koleno, jen to tam nedodávat jako špek!Suchý: Někdy jde o problém nezastupitelný. Mám na něj jeden recept - když použiju sprostý slovo, pak v kontextu, který to slovo ospravedlňuje. Například když v Semaforu v Kytici matka nabízí svou dceru králi, povídá: Její nit, toť hedváb! A on říká: Seru na hedváb, babice. Kdyby tam nebyl hedváb a řekl já se na to vy..., tak to by nešlo, ale v kombinaci s hedvábem myslím, že to zaznělo.Horníček: Ovšem dnes tato slova v televizi prší, publikum se tomu směje - ale ne té kombinaci s hedvábem, ale jen tomu, že člověk řekl sprostý slovo. A nebo se smějou, protože bavič dodá ještě vlastní úšklebek, vydá nějaký zvuk nebo smích. A za úplný zločin dneška považuji mixování smíchu do pořadů. Smích je přece organický projev, nikoli organizovaný.Suchý: Což mohu doložit. Když jsme natáčeli loňského Silvestra, moderátor se obrátil na publikum a říkal: Podívejte, s jedním publikem natáčíme teď odpoledne a s jiným večer. Které bude líp reagovat, to v televizi bude. No a co se stalo. My jsme vyšli s naším skečem, který už máme nazkoušený z divadla. Řekli jsme první větu - která nebyla nic moc - a najednou strašný smích a potlesk. Řekli jsme druhou a zase - hahaha. Lidé se smáli, ne našim vtipům, ale aby se viděli v televizi. Rozsekali nám skeč, až ho zničili. Hurónský smích, kde by možná stačil úsměv. Zlaté divadlo!Horníček: To je přesně to, co chci říct. Mně je milejší úsměv než přehnaný smích. Nedostatek smíchu mi samozřejmě vadí, zvlášť když se nedostaví tam, kde jsem v něj doufal, ale když je ho přebytek... Jako v Neváhej a toč, kde lidi padají ze židle a drží se za hlavy, zmítají se... Říkal jsem to autorům pořadu i Edovi Hrubešovi: Přebytek smíchu je něco strašného. Ovšem nejen z tohoto pořadu, ale z televize vůbec mám špatný pocit, ubývá humoru a přibývá dělání legrace. Ubývá komiků a přibývá bavičů. A v tom je podstatnej rozdíl. Ne že by mne to trápilo, já to opíšu latinsky: sere mne to. Suchý: Miroslave, abychom nezůstali jen u humoru, já jsem se tě chtěl zeptat ještě na jednu věc. Totiž: Na peníze. Když teď žijeme v tržní době. Kdybys byl chamtivec, tak toto téma taktně přejdu, ale protože vím, že nejsi, tak se ptám: Jaký máš vlastně vztah k penězům?Horníček: Já vlastně žádný pořádný vztah nemám. Vyrůstal jsem u rodičů a vůbec ani nevěděl, kolik má tatínek příjmu. Své peníze jsem nepotřeboval, když jsem šel do tanečních, tak mi dali padesát kaček na víno. Pak jsem byl už jen s maminkou, táta odešel, a zase jsem se nestaral o peníze. Když jsem žil s Bělou, peníze zase byly její starost. Já ani nevěděl, jestli jsme pojištění a kdo a kolik se platí telefon. Teď Běla není a já jsem se musel začít o peníze poprvé zajímat. Naštěstí Karel Koliš, který byl také u Wericha, mně udělal fantastickou službu - všechno spočítal a sečetl, a řekl mi kolik mám, kolik můžu mít a kam uložit peníze...Suchý: Já k penězům také nemám vztah. Ale jsem na tom hůř, neboť jsem podnikatel. Takže jsem sám sobě sponzorem, všechny své podniky musím dotovat ze svých jiných výdělků. Ale to už má zase co do činění s tou svobodou, o které jsme mluvili. Hlavní je, aby se na nich člověk nestal závislej.Horníček: No pozor, ze mne se stává Harpagon, řekl jsem Karlu Kolišovi, aby mi koupil kovovou kasičku. Tu mám v šuplíku. Pravda, nemám ji zamčenou.Suchý: Ale je kovová!Horníček: A já si někdy večer sednu a počítám peníze. Dojdu do pěti, šesti a zapomenu, kolik to bylo, tak ji zavřu a jdu spát. Čili já asi k těm penězům pořád nemám vztah. Zatím prej mám dost.Suchý: Vzpomínám na pana Wericha, on se velice dobře vyznal v antickejch mincích. A říkal mně: Já nesbírám mince jako sběratel. Ale občas jdu a nějakou zlatou minci si koupím a schovám. A víte proč? Já jednoho letního dne stáhnu žaluzie a ty mince, ty zlatý mince vysypu na stůl a budu se v nich přehrabovat.Horníček: Ha há, taky Harpagon!Suchý: No, ale nevím, jestli vůbec k tomu přehrabování dospěl.Horníček: Tos mi teď připomněl, volala tuhle taková starší dáma, čímž myslím, že byla asi v mejch letech...Suchý: Takže holka! Taková starší holka.Horníček: No ano, a ta starší holka říká: Pane Horníček, já bych vám chtěla vyprávět vzpomínku, kterou bych si nerada odnesla s sebou. Jednou jsme večeřeli v New Yorku s Voskovcem a on najednou začal opakovat větu. - On to ten Werich neřekne a neřekne. - Nikdo nevěděl, o co jde. A když to opakoval asi popáté, zeptali jsme se - Co by měl říct? - Měl by říct, že jsem byl lepší, než ten Horníček! Miroslav Horníček a Jiří Suchý během rozhovoru"
        ]
    },
    {
        "user_input":"Shrň tento článek do stručného shrnutí.",
        "retrieved_contexts":[
            "GSM telefon je celkem oblíbená věc. Je zajímavé, jak si jej lidé hýčkají. To je ovšem pravda pouze do doby, než jim nevypadne signál. V takovém případě je velmi zábavné pozorovat reakce lidí. Test vysílače šumů v pásmu 900MHz jsem vám slíbil včera. Blackbox vám zatím nemohu ukázat zevnitř, jelikož si to tak přeje autor, ale to snad nevadí. Do předu ale připomínáme, že toto zařízení nemá homologaci a jeho používáním je porušován zákon. Jelikož jsme zákona dbalí, tak jsme zařízení samozřejmě nepoužívali, pro barvitost následujícího vyprávění se ale budeme tvářít, jako bychom ho opravdu používali... Nejprve popíši vnější příznaky. Jedná se o černou krabičku (to ale není hlavní, jelikož finální výrobek pravděpodobně dozná designerských změn), která má z jedné strany zelenou diodu a vstupní konektor pro napájení. Ti bystřejší již určitě přišli na to, že dioda slouží k detekci funkčnosti přístroje. Konektor pro napájení je také zřejmý, ale nebojte. Sice se rušička napájí ze zásuvky, ale pouze za účelem nabíjení vestavěných akumulátorů. Nabíjení krabičky se odehrává po dobu asi 3 až 5 hodin univerzální nabíječkou s napětím 9V až 15V. Ideálně ale 12V o dobu 4 hodin. Další strana nám skýtá jediný ovládací prvek, takže obsluhu rušičky zvládne i stařičký člověk a nebo malé dítě. Modrý knoflíček má pouze dvě polohy a slouží k tomu, abyste přístroj zapnuli, vypnuli a nebo abyste spínač nešikovností ulomili. Někdo bz preferoval raději šoupátko nebo více zapuštěný spínač, ale mně osobně vyhovuje i tento, jelikož snadněji rozeznám, kdy je přístroj zapnutý. Celá záležitost má hmotnost cca 170 gramů až 190 gramů odhadem. Rozměry odpovídá malé krabičce od džusu. Výdrž na akumulátory je 30 až 45 minut, což odpovídá skutečnosti. Není to sice mnoho, ale vzhledem k tomu, že akumulátory nedělala profesionální forma, jedná se o slušný výkon. Navíc se jedná defacto o mobilní telefon, který neustále vysílá (hovoříte s ním), takže je výdrž ještě celkem slušná. Jak jsem nastínil v preview, přístroj pracuje tak, že vysílá na frekvenci 900MHz rušící šumy, které mobilní telefon interpretuje tak, že při přesažení určité hranice těchto rušivých vln nahlásí, že není dostupná síť. Tento jev se na mobilu neobjevuje ihned po zapnutí rušičky, ale po cca 10 až 30 sekundách, což je frekvence, se kterou mobil zjišťuje stav signálu nebo komunikuje s vysílačem. To je ovšem v případě klidového stavu - tzn., že nehovoříme. Pokud se odhodláme z mobilu zavolat, tak asi po 5 sekundách po zapnutí rušičky nelze uskutečnit hovor i přesto, že svítí na displeji logo operátora a měřič signálu ukazuje \"plný kotel\". Pokud již telefonujeme a zapneme rušičku, pak se to projeví postupně tak, že my přestaneme nejprve slyšet druhou stranu a po té vypadne i hlas na druhé straně, případně vás druhá strana špatně slyší, ale vy již zavěšujete, jelikož vy nic neslyšíte. Pokud je telefon v bližší vzdálenosti, pak mu v některých případech rušička také úplně zruší signál. To ale nefunguje u všech telefonů. Každopádně po ukončení hovoru nastává situace popisovaná o odstavec výše. Rušička se mi velmi zalíbila v autě, kdy mi na Sokolské ulici celkem neotřelým způsobem řidič Passatu naznačil, že chce na mé místo v pruhu, kde jsem jel já. Po té, co jsem se přesunul mírným odskokem do posledního pruhu vpravo, zjistil jsem, že si mne řidič všimnout nemohl. Měl u ucha telefon a zjevně měl jakýsi důležitý projev, který mu ovšem během dalších dvaceti vteřin z neznámých důvodů přerušil. Po dobře odvedené práci jsem se pousmál a řekl si, že je to tak lepší, protože už bude dávat pozor na řízení. To je jedno z možných použití, které mne napadlo. Mít rušičky v autech, které by se odpojily automaticky po vložení mobilu do handsfree sady. Tím by se mohl vyřešit připravovaný zákon o používání HF sad v automobilech. Nebo by bylo možné dokonce i zabudovat silnější vysílač do přední části auta. Ten by se pak mohl aktivovat se zatroubením. Případy, kdy totiž někdo nedává pozor díky telefonování totiž nejsou neznámé a kdyby se mu při zatroubení přerušil hovor, už by se mohl soustředit na řízení. Mezi dalšími vhodnými lokalitami, které mě napadly byla samozřejmě kina, divadla a různé podobné prostory, kde je telefonování nevhodné. Mezi ně se řadí i některé restaurace. Vbudováním rušiček do restaurací by se tak mohly začít odlišovat restaurace \"manažerské\" a restaurace pro \"normální lidi\", kteří se chtějí najíst. Způsobů využití tohoto přístroje je opravdu mnoho. Ovšem daleko více je způsobů zneužití, čehož se autoři rušičky obávají nejvíce. Proto zde nebudeme zveřejňovat kontakt na výrobce. Ona firma nehodlá rušičky prodávat hromadně a už vůbec ne komukoliv. Účel musí být dobře prokazatelný, aby si nekoupil rušičku například nějaký člověk, který by ji používal i bezdůvodně by mohl způsobit poměrně nepříjemnou situaci, kdy by bylo například potřeba zavolat alespoň na linku 112, která samozřejmě s použitím rušičky nefunguje. A malý poznatek na závěr. Rušička vážně pracuje v celém pásmu 900MHz, jelikož dokáže (i když jen ve standby modu) odrušit i DECT telefony. Při hovoru se projevuje horší kvalita zvuku a v klidovém stavu absence signálu."
        ],
        "response":"Autor testuje GSM rušitelku, která vysílající šum na frekvenční 910 MHz simuluje přerušení mobilního signálu, čímž umožňuje řešit problémy s řízením vozidel a provozem v kulturních prostorách. Přístroj funguje pouze v klidu a při hovoru zhoršuje kvalitu zvuku, ale zároveň je upozorněn, že jeho používání je v České republice zakázáno a výrobce ho neprodeje veřejnosti.",
        "reference":"Včera jsme vám přinesli zajímavou zprávu o rušičce mobilních telefonů GSM. Dnes vám přinášíme její bližší popis, včetně toho, co dělá za neplechu, pokud někdo stiskne \"ten modrý čudlíček\"",
        "reference_contexts":[
            "GSM telefon je celkem oblíbená věc. Je zajímavé, jak si jej lidé hýčkají. To je ovšem pravda pouze do doby, než jim nevypadne signál. V takovém případě je velmi zábavné pozorovat reakce lidí. Test vysílače šumů v pásmu 900MHz jsem vám slíbil včera. Blackbox vám zatím nemohu ukázat zevnitř, jelikož si to tak přeje autor, ale to snad nevadí. Do předu ale připomínáme, že toto zařízení nemá homologaci a jeho používáním je porušován zákon. Jelikož jsme zákona dbalí, tak jsme zařízení samozřejmě nepoužívali, pro barvitost následujícího vyprávění se ale budeme tvářít, jako bychom ho opravdu používali... Nejprve popíši vnější příznaky. Jedná se o černou krabičku (to ale není hlavní, jelikož finální výrobek pravděpodobně dozná designerských změn), která má z jedné strany zelenou diodu a vstupní konektor pro napájení. Ti bystřejší již určitě přišli na to, že dioda slouží k detekci funkčnosti přístroje. Konektor pro napájení je také zřejmý, ale nebojte. Sice se rušička napájí ze zásuvky, ale pouze za účelem nabíjení vestavěných akumulátorů. Nabíjení krabičky se odehrává po dobu asi 3 až 5 hodin univerzální nabíječkou s napětím 9V až 15V. Ideálně ale 12V o dobu 4 hodin. Další strana nám skýtá jediný ovládací prvek, takže obsluhu rušičky zvládne i stařičký člověk a nebo malé dítě. Modrý knoflíček má pouze dvě polohy a slouží k tomu, abyste přístroj zapnuli, vypnuli a nebo abyste spínač nešikovností ulomili. Někdo bz preferoval raději šoupátko nebo více zapuštěný spínač, ale mně osobně vyhovuje i tento, jelikož snadněji rozeznám, kdy je přístroj zapnutý. Celá záležitost má hmotnost cca 170 gramů až 190 gramů odhadem. Rozměry odpovídá malé krabičce od džusu. Výdrž na akumulátory je 30 až 45 minut, což odpovídá skutečnosti. Není to sice mnoho, ale vzhledem k tomu, že akumulátory nedělala profesionální forma, jedná se o slušný výkon. Navíc se jedná defacto o mobilní telefon, který neustále vysílá (hovoříte s ním), takže je výdrž ještě celkem slušná. Jak jsem nastínil v preview, přístroj pracuje tak, že vysílá na frekvenci 900MHz rušící šumy, které mobilní telefon interpretuje tak, že při přesažení určité hranice těchto rušivých vln nahlásí, že není dostupná síť. Tento jev se na mobilu neobjevuje ihned po zapnutí rušičky, ale po cca 10 až 30 sekundách, což je frekvence, se kterou mobil zjišťuje stav signálu nebo komunikuje s vysílačem. To je ovšem v případě klidového stavu - tzn., že nehovoříme. Pokud se odhodláme z mobilu zavolat, tak asi po 5 sekundách po zapnutí rušičky nelze uskutečnit hovor i přesto, že svítí na displeji logo operátora a měřič signálu ukazuje \"plný kotel\". Pokud již telefonujeme a zapneme rušičku, pak se to projeví postupně tak, že my přestaneme nejprve slyšet druhou stranu a po té vypadne i hlas na druhé straně, případně vás druhá strana špatně slyší, ale vy již zavěšujete, jelikož vy nic neslyšíte. Pokud je telefon v bližší vzdálenosti, pak mu v některých případech rušička také úplně zruší signál. To ale nefunguje u všech telefonů. Každopádně po ukončení hovoru nastává situace popisovaná o odstavec výše. Rušička se mi velmi zalíbila v autě, kdy mi na Sokolské ulici celkem neotřelým způsobem řidič Passatu naznačil, že chce na mé místo v pruhu, kde jsem jel já. Po té, co jsem se přesunul mírným odskokem do posledního pruhu vpravo, zjistil jsem, že si mne řidič všimnout nemohl. Měl u ucha telefon a zjevně měl jakýsi důležitý projev, který mu ovšem během dalších dvaceti vteřin z neznámých důvodů přerušil. Po dobře odvedené práci jsem se pousmál a řekl si, že je to tak lepší, protože už bude dávat pozor na řízení. To je jedno z možných použití, které mne napadlo. Mít rušičky v autech, které by se odpojily automaticky po vložení mobilu do handsfree sady. Tím by se mohl vyřešit připravovaný zákon o používání HF sad v automobilech. Nebo by bylo možné dokonce i zabudovat silnější vysílač do přední části auta. Ten by se pak mohl aktivovat se zatroubením. Případy, kdy totiž někdo nedává pozor díky telefonování totiž nejsou neznámé a kdyby se mu při zatroubení přerušil hovor, už by se mohl soustředit na řízení. Mezi dalšími vhodnými lokalitami, které mě napadly byla samozřejmě kina, divadla a různé podobné prostory, kde je telefonování nevhodné. Mezi ně se řadí i některé restaurace. Vbudováním rušiček do restaurací by se tak mohly začít odlišovat restaurace \"manažerské\" a restaurace pro \"normální lidi\", kteří se chtějí najíst. Způsobů využití tohoto přístroje je opravdu mnoho. Ovšem daleko více je způsobů zneužití, čehož se autoři rušičky obávají nejvíce. Proto zde nebudeme zveřejňovat kontakt na výrobce. Ona firma nehodlá rušičky prodávat hromadně a už vůbec ne komukoliv. Účel musí být dobře prokazatelný, aby si nekoupil rušičku například nějaký člověk, který by ji používal i bezdůvodně by mohl způsobit poměrně nepříjemnou situaci, kdy by bylo například potřeba zavolat alespoň na linku 112, která samozřejmě s použitím rušičky nefunguje. A malý poznatek na závěr. Rušička vážně pracuje v celém pásmu 900MHz, jelikož dokáže (i když jen ve standby modu) odrušit i DECT telefony. Při hovoru se projevuje horší kvalita zvuku a v klidovém stavu absence signálu."
        ]
    },
    {
        "user_input":"Shrň tento článek do stručného shrnutí.",
        "retrieved_contexts":[
            "Hádek uvedl, že se Vízek dopustil dvou trestných činů: pomluvy a poškozování cizích práv. Avšak vzhledem k tomu, že Vízek je občanem Švýcarska, kde také tyto činy spáchal, předá česká Kopie zfalšovaného \"bamberského memoranda\" (klikněte zde) Kopie originální smlouvy (klikněte zde)policie případ tamním úřadům. Vyšetřovatelé však pracovali hlavně se Zemanovou verzí příběhu: s nápadem na kupčení se státními posty přišli švýcarští podnikatelé, ale ČSSD to odmítla. Policejní vyšetřování podle Hádka dospělo k závěru, že jediným člověkem, který v souvislosti s \"kauzou Bamberk\" spáchal trestný čin, je právě Vízek. \"Vízek si vytvořil fiktivní zápisy o jednáních, ke kterým nikdy nedošlo, a přetáhl na ně podpisy ze zápisu o jiném jednání,\" vysvětlil Hádek. Falešný dokum Co je v kauze Bamberg jasné - vedoucí představitelé ČSSD jednali na podzim 1995 se skupinou švýcarských podnikatelů vedených Janem Vízkem - obě strany se dohodly na spolupráci v letech 1996-2000 - obě strany sepsaly záznam z jednání a podepsaly ho - Jan Vízek zfalšoval memorandum a z předchozího ručně psaného záznamu na něj zkopíroval podpisy zúčastněných - Jan Vízek záměrně vypustil informaci o jednání před volbami 1998, aby Miloše Zemana zkompromitoval Co v kauze Bamberg zůstává nejasné - co přesně představitelé ČSSD a švýcarských představitelů dojednali - proč Miloš Zeman a jeho lidé do Bambergu jezdili - co měli představitelé ČSSD po vyhraných volbách udělat a zda tuto dohodu plníent měl vytvořit ve své kanceláři v Bernu. O tom, že je to podvrh, přitom nebylo pochyb od samého začátku aféry. Klíčová je však otázka: Jaký obchod špičky ČSSD včetně Zemana na podzim 1995 domlouvaly se skupinou švýcarských podnikatelů vedených Janem Vízkem? Karel Machovec, kterého aféra stála místo ve straně, v září 1999 poprvé veřejně přiznal, že podnikatelé slíbili sociální demokracii finanční injekci na předvolební kampaň v roce 1996 a kompromitující materiály na ODS. Výměnou měli získat ekonomický vliv ve státě. Machovec dosud tyto okolnosti odmítal uveřejnit a mlčel o nich i Zeman. \"Vždycky se tam mluvilo o tom, že oni mají v republice skupinu svých odborníků, kteří by po volebním vítězství ČSSD byli straně k dispozici k formulování ekonomických doktrín, hospodářské politiky a tak dále. Pokud by se tito lidé dostali do pozice poradců, tak by měli vliv na chod ekonomiky státu,\" řekl Karel Machovec 1. září 1999 zpravodajce MF DNES. Machovec dodal, že tuto ústní dohodu skrývá bod číslo 1 v zápisu z jednání, který v Bambergu 29. září 1995 podepsal on a Zeman. V něm stojí: \"Představitelé obou stran se zavazují plně podporovat a zajišťovat splnění závěrů přijatých na společném jednání.\" To, co měli sociální demokraté splnit výměnou za peníze podnikatelů, bylo dojednáno jen ústně. Ale Vízek to německy sepsal a zkopíroval podpisy z rukou psaného zápisu z jednání. Tak vzniklo německé memorandum, jehož zveřejnění loni na jaře aféru odstartovalo. Vízek později přiznal, že memorandum doručil novinářům úmyslně, aby Zemanovi před volbami podtrhl stranickou židli. \"Po vlastních zkušenostech se Zemanem mi jeho styl smrdí čistkami jako dřív. Ukazuje, co by dělal, kdyby se dostal k moci. To mě vedlo k tomu, že jsem to přes určité kontakty zveřejnil,\" sdělil Vízek v rozhovoru, který poskytl v roce 1998 MF DNES."
        ],
        "response":"Jan Vízek byl obviněn z pomluv a poškování cizím práv za účelem zkomplikování volební kampaně Miloše Zemanova; avšak jeho falešné dokumenty byly zkopírány z původního ručního zázpisu, který již existoval, a které byly napsány v němčině.\n\nZávěrečné policejní důkazy naznačují, že jediné skutečné osoby, které v této kauze spáchaly trestné činy, je samot",
        "reference":"Vyšetřovatel Martin Hádek oznámil, že českošvýcarský podnikatel Jan Vízek zfalšoval \"bamberské memorandum\", tedy dohodu s vedoucími představiteli tehdejší opoziční ČSSD, v níž údajně slíbili, že po vítězství ve volbách nabídnou českošvýcarským podnikatelům za příslib půjčky vliv na ekonomický vývoj v Česku. Tato skutečnost už je však skoro dva roky známa. Podstata sporu, proč Zeman do Bambergu jezdil, ovšem zůstává nevyřešena. \"To nebylo předmětem tohoto trestního řízení,\" řekl Hádek zpravodajce MF DNES",
        "reference_contexts":[
            "Hádek uvedl, že se Vízek dopustil dvou trestných činů: pomluvy a poškozování cizích práv. Avšak vzhledem k tomu, že Vízek je občanem Švýcarska, kde také tyto činy spáchal, předá česká Kopie zfalšovaného \"bamberského memoranda\" (klikněte zde) Kopie originální smlouvy (klikněte zde)policie případ tamním úřadům. Vyšetřovatelé však pracovali hlavně se Zemanovou verzí příběhu: s nápadem na kupčení se státními posty přišli švýcarští podnikatelé, ale ČSSD to odmítla. Policejní vyšetřování podle Hádka dospělo k závěru, že jediným člověkem, který v souvislosti s \"kauzou Bamberk\" spáchal trestný čin, je právě Vízek. \"Vízek si vytvořil fiktivní zápisy o jednáních, ke kterým nikdy nedošlo, a přetáhl na ně podpisy ze zápisu o jiném jednání,\" vysvětlil Hádek. Falešný dokum Co je v kauze Bamberg jasné - vedoucí představitelé ČSSD jednali na podzim 1995 se skupinou švýcarských podnikatelů vedených Janem Vízkem - obě strany se dohodly na spolupráci v letech 1996-2000 - obě strany sepsaly záznam z jednání a podepsaly ho - Jan Vízek zfalšoval memorandum a z předchozího ručně psaného záznamu na něj zkopíroval podpisy zúčastněných - Jan Vízek záměrně vypustil informaci o jednání před volbami 1998, aby Miloše Zemana zkompromitoval Co v kauze Bamberg zůstává nejasné - co přesně představitelé ČSSD a švýcarských představitelů dojednali - proč Miloš Zeman a jeho lidé do Bambergu jezdili - co měli představitelé ČSSD po vyhraných volbách udělat a zda tuto dohodu plníent měl vytvořit ve své kanceláři v Bernu. O tom, že je to podvrh, přitom nebylo pochyb od samého začátku aféry. Klíčová je však otázka: Jaký obchod špičky ČSSD včetně Zemana na podzim 1995 domlouvaly se skupinou švýcarských podnikatelů vedených Janem Vízkem? Karel Machovec, kterého aféra stála místo ve straně, v září 1999 poprvé veřejně přiznal, že podnikatelé slíbili sociální demokracii finanční injekci na předvolební kampaň v roce 1996 a kompromitující materiály na ODS. Výměnou měli získat ekonomický vliv ve státě. Machovec dosud tyto okolnosti odmítal uveřejnit a mlčel o nich i Zeman. \"Vždycky se tam mluvilo o tom, že oni mají v republice skupinu svých odborníků, kteří by po volebním vítězství ČSSD byli straně k dispozici k formulování ekonomických doktrín, hospodářské politiky a tak dále. Pokud by se tito lidé dostali do pozice poradců, tak by měli vliv na chod ekonomiky státu,\" řekl Karel Machovec 1. září 1999 zpravodajce MF DNES. Machovec dodal, že tuto ústní dohodu skrývá bod číslo 1 v zápisu z jednání, který v Bambergu 29. září 1995 podepsal on a Zeman. V něm stojí: \"Představitelé obou stran se zavazují plně podporovat a zajišťovat splnění závěrů přijatých na společném jednání.\" To, co měli sociální demokraté splnit výměnou za peníze podnikatelů, bylo dojednáno jen ústně. Ale Vízek to německy sepsal a zkopíroval podpisy z rukou psaného zápisu z jednání. Tak vzniklo německé memorandum, jehož zveřejnění loni na jaře aféru odstartovalo. Vízek později přiznal, že memorandum doručil novinářům úmyslně, aby Zemanovi před volbami podtrhl stranickou židli. \"Po vlastních zkušenostech se Zemanem mi jeho styl smrdí čistkami jako dřív. Ukazuje, co by dělal, kdyby se dostal k moci. To mě vedlo k tomu, že jsem to přes určité kontakty zveřejnil,\" sdělil Vízek v rozhovoru, který poskytl v roce 1998 MF DNES."
        ]
    },
    {
        "user_input":"Shrň tento článek do stručného shrnutí.",
        "retrieved_contexts":[
            "\"Trvat na uvolnění legionářů by nebylo rozumné. Zbytečně bychom si vyčerpali část kvóty, kterou ještě budeme potřebovat,\" vysvětlil trenér. \"Hráči, kteří střídali, si teď mohou vyzkoušet, jaké to je nastupovat od začátku. A nováčci mají šanci ukázat, že hrají dobře nejen v lize,\" řekl Chovanec. Zdůraznil, že mužstvo, byť není v nejsilnějším složení, má jeho důvěru. Od všech očekává, že budou v Hongkongu bojovat o svou šanci hrát na mistrvoství Evropy. Pořadatelé si žádnou podmínku účasti známých hvězd nekladli. Jen pivovar Carlsberg, který sponzoruje nejen turnaj, ale i FC Liverpool, údajně usiloval o přítomnost Bergera a Šmicera, ale u trenéra Houlliera neuspěl. Kluby jsou podle reglementu FIFA povinny uvolnit hráče jen na sedm reprezentačních zápasů v roce. Trenér nepozval ani hráče z rakouské ligy, která má také zimní přestávku. Turnaj v Hongkongu však vzbuzoval obavy i u českých klubů, neboť se uskuteční v době vrcholící přípravy na jaro. Ve stejném termínu budou například Sparta v Dubaji, Slavia v Portugalsku a Teplice ve Spojených státech. Podle Chovance však nikdo nepožádal, aby jeho hráči v nominaci nebyli. Přesto v ní trochu překvapivě scházejí Baranek a Horňák ze Sparty a Ulich ze Slavie. První soupeř je pro Chovance zatím velkou neznámou. \"Domácí mužstvo bude hrát pod hlavičkou výběru ligy, takže v něm nastoupí i někteří zahraniční hráči působící v Hongkongu,\" vysvětlil vedoucí mužstva Jaroslav Dudl. Další dva týmy Chovanec zná. S Japonci hrál jeho tým před půldruhým rokem na Kirin Cupu a také o Mexičanech, kteří loni vyhráli Pohár FIFA, má prý český kouč dost informací. Navíc v Hongkongu uvidí jejich vzájemný duel, jímž turnaj začne. Národní tým vstoupí do turnaje 5. února s výběrem Hongkongu. Druhou dvojici tvoří Mexiko a Japonsko. Vítězové postoupí do finále, které je na pořadu 8. února. Ve stejný den se bude hrát také o třetí místo. Vítěz turnaje získá čtyřicet tisíc dolarů, odstupňované částky dostanou i týmy na dalších místech. Nominace pro turnaj v HongkonguBrankáři: Černý (Slavia), Poštulka (Sparta), obránci: E. Brabec (Drnovice), Gabriel (Sparta), Rada, Vlček (oba Slavia), Veselý (Ostrava), záložníci: Hašek (Sparta), Horváth (Slavia), Kolomazník (Teplice), Polák (Brno), Jankulovski, Slončík (oba Ostrava), útočníci: Lokvenc (Sparta), Verbíř (Teplice), Kincl (Žižkov), Heinz, Vlček (oba Olomouc). Upřesněn byl i další jarní program reprezentačního mužstva. Dosud volný termín 26. dubna vyplní s největší pravděpodobností zápas doma s Izraelem. Ještě před tím se bude hrát 23. února s Irskem v Dublinu a 29. března s Austrálií v Teplicích. Na tyto zápasy už trenér počítá i s legionáři. Generálkou na EURO bude 3. června utkání s Německem. Jeho dějiště by mělo být definitivně domluveno v příštím týdnu v rámci oslav 100 let německého fotbalu v Lipsku, kam se chystá s gratulací i česká delegace."
        ],
        "response":"Trenér Chovanců tvrdí, že uvolňování legionářům by bylo nezbytné kvůli zachování kvót pro budoucí sezónu, avšak národní tým se v Hong Kongu představí bez nich. Turnaje v tomto termínu se účastní pouze tři týmy – Hongkong, Japonská reprezentace a Mexiko –, zatímco domácí mužstvo nebude v nominacích.",
        "reference":"Se sedmi nováčky a bez fotbalistů ze zahraničích klubů odletí reprezentace na únorový turnaj do Hongkongu. Trenér Jozef Chovanec nominoval poprvé i trojici z týmu do jedenadvaceti let: drnovického obránce Brabce, ostravského záložníka Jankulovského a olomouckého útočníka Heinze. Reprezentační premiéra čeká i teplického záložníka Kolomazníka, útočníka Vlčka z Olomouce a krále střelců podzimní části ligy Kincla z Viktorie Žižkov. Prvně by mohl nastoupit i slávistický brankář Radek Černý, který už dvakrát nominovaný byl",
        "reference_contexts":[
            "\"Trvat na uvolnění legionářů by nebylo rozumné. Zbytečně bychom si vyčerpali část kvóty, kterou ještě budeme potřebovat,\" vysvětlil trenér. \"Hráči, kteří střídali, si teď mohou vyzkoušet, jaké to je nastupovat od začátku. A nováčci mají šanci ukázat, že hrají dobře nejen v lize,\" řekl Chovanec. Zdůraznil, že mužstvo, byť není v nejsilnějším složení, má jeho důvěru. Od všech očekává, že budou v Hongkongu bojovat o svou šanci hrát na mistrvoství Evropy. Pořadatelé si žádnou podmínku účasti známých hvězd nekladli. Jen pivovar Carlsberg, který sponzoruje nejen turnaj, ale i FC Liverpool, údajně usiloval o přítomnost Bergera a Šmicera, ale u trenéra Houlliera neuspěl. Kluby jsou podle reglementu FIFA povinny uvolnit hráče jen na sedm reprezentačních zápasů v roce. Trenér nepozval ani hráče z rakouské ligy, která má také zimní přestávku. Turnaj v Hongkongu však vzbuzoval obavy i u českých klubů, neboť se uskuteční v době vrcholící přípravy na jaro. Ve stejném termínu budou například Sparta v Dubaji, Slavia v Portugalsku a Teplice ve Spojených státech. Podle Chovance však nikdo nepožádal, aby jeho hráči v nominaci nebyli. Přesto v ní trochu překvapivě scházejí Baranek a Horňák ze Sparty a Ulich ze Slavie. První soupeř je pro Chovance zatím velkou neznámou. \"Domácí mužstvo bude hrát pod hlavičkou výběru ligy, takže v něm nastoupí i někteří zahraniční hráči působící v Hongkongu,\" vysvětlil vedoucí mužstva Jaroslav Dudl. Další dva týmy Chovanec zná. S Japonci hrál jeho tým před půldruhým rokem na Kirin Cupu a také o Mexičanech, kteří loni vyhráli Pohár FIFA, má prý český kouč dost informací. Navíc v Hongkongu uvidí jejich vzájemný duel, jímž turnaj začne. Národní tým vstoupí do turnaje 5. února s výběrem Hongkongu. Druhou dvojici tvoří Mexiko a Japonsko. Vítězové postoupí do finále, které je na pořadu 8. února. Ve stejný den se bude hrát také o třetí místo. Vítěz turnaje získá čtyřicet tisíc dolarů, odstupňované částky dostanou i týmy na dalších místech. Nominace pro turnaj v HongkonguBrankáři: Černý (Slavia), Poštulka (Sparta), obránci: E. Brabec (Drnovice), Gabriel (Sparta), Rada, Vlček (oba Slavia), Veselý (Ostrava), záložníci: Hašek (Sparta), Horváth (Slavia), Kolomazník (Teplice), Polák (Brno), Jankulovski, Slončík (oba Ostrava), útočníci: Lokvenc (Sparta), Verbíř (Teplice), Kincl (Žižkov), Heinz, Vlček (oba Olomouc). Upřesněn byl i další jarní program reprezentačního mužstva. Dosud volný termín 26. dubna vyplní s největší pravděpodobností zápas doma s Izraelem. Ještě před tím se bude hrát 23. února s Irskem v Dublinu a 29. března s Austrálií v Teplicích. Na tyto zápasy už trenér počítá i s legionáři. Generálkou na EURO bude 3. června utkání s Německem. Jeho dějiště by mělo být definitivně domluveno v příštím týdnu v rámci oslav 100 let německého fotbalu v Lipsku, kam se chystá s gratulací i česká delegace."
        ]
    },
    {
        "user_input":"Shrň tento článek do stručného shrnutí.",
        "retrieved_contexts":[
            "To také byl jediný kritický moment celé schůzky.\" Dánové ovšem museli také slevit, jelikož požadovali, aby se odveta v Česku hrála až příští rok na podzim. Podle konečné dohody však dánský tým přicestuje k odvetě už v červnu. \"Splnilo se mi, že s Čechy budeme hrát až v příštím roce i že nejdřív nastoupíme u nich,\" pochvaloval si trenér Morten Olsen, který dánskou reprezentaci přebírá po letošním mistrovství Evropy.O termínech se debatovalo nečekaně krátce, jen něco málo přes hodinu. \"Tak rychlou jízdu kolem termínů jsem ještě nezažil,\" žasnul i ostřílený mezinárodní činovník Rudolf Baťa. Stalo se tak především dík Chovancovu asistentovi Karlu Brücknerovi. Ten v předvečer jednání zpracoval harmonogram zápasů skupiny, který pak byl na začátku jednání předložen všem zúčastněným. \"Nebylo to nic složitého, zakombinoval jsem si rád,\" řekl Brückner, mimochodem vášnivý šachista, jemuž jsou i nejsložitější kombinace vlastní. \"Znali jsme představy naše, daly se odhadnout i představy soupeřů. Takže to jen chtělo nikoho neošidit, termíny musely být přijatelné pro všechny.\" Kouč Chovanec přitom zdůraznil, že výsledky podobných jednání nic neznamenají. \"O kvalifikačních bodech se bude rozhodovat na hřišti, když se to tak vezme, na pořadí zápasů ani tak moc nezáleží.\" Bulharům se sice splnilo přání začínat domácím zápasem s Českem, ale jednu chvíli se jim nezdálo, že příští rok v červnu mají během pěti dnů hrát dvakrát na hřišti soupeře. \"Nakonec jim došlo, že zápasy v Severním Irsku a na Islandu můžou vzít jedním tahem a ušetřit složité cestování,\" poznamenal tiskový mluvčí svazu Jaroslav Kolář. V hotelu Praha se vedle termínů dohodly i další záležitosti souvisící s kvalifikací. V protokolu je například uvedeno, že domácím náleží volba dresů, jednotlivé svazy poskytnou soupeřům videozáznamy z domácích zápasů, šedesát dnů předem se musí hostům nahlásit, s jakými se bude hrát míči. PROGRAM NÁRODNÍHO MUŽSTVA Sobota 2. září 2000: Bulharsko - Česko. Sobota 7. října: Česko - Island. Středa 11. října: Malta - Česko. Sobota 24.března 2001: Sev. Irsko - Česko. Středa 28. března: Česko Dánsko. Sobota 2. června: Dánsko - Česko. Středa 6. června: Česko - Sev. Irsko. Sobota 1. září: Island - Česko. Středa 5. září: Česko - Malta. Sobota 6. října: Česko - Bulharsko."
        ],
        "response":"Dánská reprezentace přiblížila svůj plán na odvetu proti Bulgarii tím, že se v červeném roku v Severní Írsku a Islandu utká s českým týmem, čímž se vyhnula složitému cestování. Na základě harmonogramu připraveného Chovance a Brücknere byla dohodnutá séria domácího utkání v Česka, které zahrnuje i zápas s Dáncem.",
        "reference":"Zářijovým zápasem v Bulharsku vstoupí fotbaloví reprezentanti do kvalifikace o účast na mistrovství světa 2002, jehož pořadateli jsou Japonsko a Korea. Rozhodla o tom včerejší pražská schůzka zástupců šesti národních týmů z třetí kvalifikační skupiny. \"Jsem spokojen na devadesát procent,\" prohlásil trenér národního mužstva Jozef Chovanec, jenž si přál začínat kvalifikační boje na hřišti soupeře. \"V podstatě jsme museli ustoupit jen z jediného požadavku, chtěli jsme první zápas s Dánskem hrát venku, ale začínáme s ním doma",
        "reference_contexts":[
            "To také byl jediný kritický moment celé schůzky.\" Dánové ovšem museli také slevit, jelikož požadovali, aby se odveta v Česku hrála až příští rok na podzim. Podle konečné dohody však dánský tým přicestuje k odvetě už v červnu. \"Splnilo se mi, že s Čechy budeme hrát až v příštím roce i že nejdřív nastoupíme u nich,\" pochvaloval si trenér Morten Olsen, který dánskou reprezentaci přebírá po letošním mistrovství Evropy.O termínech se debatovalo nečekaně krátce, jen něco málo přes hodinu. \"Tak rychlou jízdu kolem termínů jsem ještě nezažil,\" žasnul i ostřílený mezinárodní činovník Rudolf Baťa. Stalo se tak především dík Chovancovu asistentovi Karlu Brücknerovi. Ten v předvečer jednání zpracoval harmonogram zápasů skupiny, který pak byl na začátku jednání předložen všem zúčastněným. \"Nebylo to nic složitého, zakombinoval jsem si rád,\" řekl Brückner, mimochodem vášnivý šachista, jemuž jsou i nejsložitější kombinace vlastní. \"Znali jsme představy naše, daly se odhadnout i představy soupeřů. Takže to jen chtělo nikoho neošidit, termíny musely být přijatelné pro všechny.\" Kouč Chovanec přitom zdůraznil, že výsledky podobných jednání nic neznamenají. \"O kvalifikačních bodech se bude rozhodovat na hřišti, když se to tak vezme, na pořadí zápasů ani tak moc nezáleží.\" Bulharům se sice splnilo přání začínat domácím zápasem s Českem, ale jednu chvíli se jim nezdálo, že příští rok v červnu mají během pěti dnů hrát dvakrát na hřišti soupeře. \"Nakonec jim došlo, že zápasy v Severním Irsku a na Islandu můžou vzít jedním tahem a ušetřit složité cestování,\" poznamenal tiskový mluvčí svazu Jaroslav Kolář. V hotelu Praha se vedle termínů dohodly i další záležitosti souvisící s kvalifikací. V protokolu je například uvedeno, že domácím náleží volba dresů, jednotlivé svazy poskytnou soupeřům videozáznamy z domácích zápasů, šedesát dnů předem se musí hostům nahlásit, s jakými se bude hrát míči. PROGRAM NÁRODNÍHO MUŽSTVA Sobota 2. září 2000: Bulharsko - Česko. Sobota 7. října: Česko - Island. Středa 11. října: Malta - Česko. Sobota 24.března 2001: Sev. Irsko - Česko. Středa 28. března: Česko Dánsko. Sobota 2. června: Dánsko - Česko. Středa 6. června: Česko - Sev. Irsko. Sobota 1. září: Island - Česko. Středa 5. září: Česko - Malta. Sobota 6. října: Česko - Bulharsko."
        ]
    },
    {
        "user_input":"Shrň tento článek do stručného shrnutí.",
        "retrieved_contexts":[
            "Vydání deseti a dvacetikorunových mincí k roku 2000 schválila bankovní rada ČNB v rámci mimořádných emisí České národní banky ke konci druhého a počátku třetího tisíciletí. Obě mince mají stejné technické parametry jako existující platné mince těchto hodnot. Pro zachování jednotného stylu bylo výtvarné řešení rubových stran mincí svěřeno autorovi příslušné nominální hodnoty. Autor desetikorunové mince akademický sochař Ladislav Kozák ztvárnil jako ústřední motiv fragment kotvového hodinového strojku, text \"ROK 2000\" v českém jazyce se opakuje v latinském jazyce \"ANNO MM\" a v Braillově slepeckém písmu. Iniciály autorova jména \"L.K.\" jsou umístěny nahoře vedle části ozubeného kolečka pod druhou nulou čísla 2000. Akademický sochař Vladimír Oppl, který je autorem dvacetikorunové mince, ztvárnil fragment astrolábu, nejstaršího astronomického přístroje používaného ve starověku a středověku k určování poloh kosmických těles, zeměpisných souřadnic i času. Text v opisu \"ROK 2000\" se stále opakuje. Iniciály autorova jména, do ležatě oválného \"O\" vložené \"V\", vytvářejí stylizovanou špičku linky znázorňující osu astrolábu. Česká národní banka uvedla 12. ledna do oběhu desetikorunové a dvacetikorunové mince vzoru 2000. Obě mince zachovávají lícní strany současných platných deseti a dvacetikorun, na rubových stranách je pak ztvárněno téma vztahující se k roku 2000."
        ],
        "response":"Bankovní rada České národních bank schválilo vydání desítky a dvacítikorunových mincí pro rok 2.001 s novými výtvoři sochařími Ladislávem Kozákem a Vladimírem Opplem. Mince zachovaly původní design lícnicích stran a na rubích byly ztvärněny tematické motivy odkazující na astronomii a mechaniku. Českou národní Banka uvedla tyto mince do obchodu 11. led",
        "reference":"Česká národní banka uvedla 12. ledna do oběhu desetikorunové a dvacetikorunové mince vzoru 2000. Obě mince zachovávají lícní strany současných platných deseti a dvacetikorun, na rubových stranách je pak ztvárněno téma vztahující se k roku 2000. Na desetikoruně je zobrazen fragment kotvového hodinového strojku a na dvacetikoruně fragment starého astronomického přístroje astrolábu. Nově vydané mince mají podle tiskového mluvčího ČNB Milana Tománka stejnou platnost jako desetikoruny a dvacetikoruny vydané v roce 1993",
        "reference_contexts":[
            "Vydání deseti a dvacetikorunových mincí k roku 2000 schválila bankovní rada ČNB v rámci mimořádných emisí České národní banky ke konci druhého a počátku třetího tisíciletí. Obě mince mají stejné technické parametry jako existující platné mince těchto hodnot. Pro zachování jednotného stylu bylo výtvarné řešení rubových stran mincí svěřeno autorovi příslušné nominální hodnoty. Autor desetikorunové mince akademický sochař Ladislav Kozák ztvárnil jako ústřední motiv fragment kotvového hodinového strojku, text \"ROK 2000\" v českém jazyce se opakuje v latinském jazyce \"ANNO MM\" a v Braillově slepeckém písmu. Iniciály autorova jména \"L.K.\" jsou umístěny nahoře vedle části ozubeného kolečka pod druhou nulou čísla 2000. Akademický sochař Vladimír Oppl, který je autorem dvacetikorunové mince, ztvárnil fragment astrolábu, nejstaršího astronomického přístroje používaného ve starověku a středověku k určování poloh kosmických těles, zeměpisných souřadnic i času. Text v opisu \"ROK 2000\" se stále opakuje. Iniciály autorova jména, do ležatě oválného \"O\" vložené \"V\", vytvářejí stylizovanou špičku linky znázorňující osu astrolábu. Česká národní banka uvedla 12. ledna do oběhu desetikorunové a dvacetikorunové mince vzoru 2000. Obě mince zachovávají lícní strany současných platných deseti a dvacetikorun, na rubových stranách je pak ztvárněno téma vztahující se k roku 2000."
        ]
    },
    {
        "user_input":"Shrň tento článek do stručného shrnutí.",
        "retrieved_contexts":[
            "Klienti si u této pojišťovny sjednali povinné ručení pro více než 33 000 vozidel. \"Celkový výsledek, který představuje 65 milionů korun pojistného, odpovídá záměru majoritního vlastníka jak v objemu pojistného, tak i ve výběru rizika,\" dodal Ujec. Pojišťovnu, která připravuje změnu obchodního jména na ČSOB pojišťovna, vlastní z téměř 76 procent společnost KBC Insurance a patří tak spolu s ČSOB do skupiny KBC Group. Chmelařská pojišťovna zahájila činnost 1. ledna 1996 a její základní jmění je 447,3 milionu korun. Hospodářský výsledek za rok 1999 zatím podle Ujce není k dispozici. Rok 1998 společnost zakončila ztrátou 67 miliónů korun."
        ],
        "response":"Pojišťovnina ČSOBU se ujala povinnosti ručit za více než třicet tisíc vozidel s celkovým výše pojistných činěním přesahujícím šedesát milionů Kč. Společnost, která má podíl na skupině KBC, zahájí svou činnost již od roku 1896, ale hospodářské výsledky za rok předtím byly ztráty.",
        "reference":"Chmelařská pojišťovna, jeden z dvanácti ústavů poskytujících povinné ručení, loni svým klientům předepsala platbu pojistného ve výši 177,99 milionu korun, což znamenalo meziroční nárůst o více než 50 procent. Podle mluvčího této společnosti Vladimíra Ujce se na celkové částce nejvíce podílelo zemědělské pojištění (64,9 milionu korun), pojištění průmyslu a podnikatelů (56,8 milionu korun) a pojištění občanů (3,6 milionu korun). V oblasti životního pojištění bylo celkové pojistné 5,3 milionu korun",
        "reference_contexts":[
            "Klienti si u této pojišťovny sjednali povinné ručení pro více než 33 000 vozidel. \"Celkový výsledek, který představuje 65 milionů korun pojistného, odpovídá záměru majoritního vlastníka jak v objemu pojistného, tak i ve výběru rizika,\" dodal Ujec. Pojišťovnu, která připravuje změnu obchodního jména na ČSOB pojišťovna, vlastní z téměř 76 procent společnost KBC Insurance a patří tak spolu s ČSOB do skupiny KBC Group. Chmelařská pojišťovna zahájila činnost 1. ledna 1996 a její základní jmění je 447,3 milionu korun. Hospodářský výsledek za rok 1999 zatím podle Ujce není k dispozici. Rok 1998 společnost zakončila ztrátou 67 miliónů korun."
        ]
    },
    {
        "user_input":"Shrň tento článek do stručného shrnutí.",
        "retrieved_contexts":[
            "Radek Slončík strávil celý čtvrtek v Praze a absolvoval zde vedle diskusí o smlouvě se Spartou především podrobnou lékařskou prohlídku. Zdravotní stav totiž už delší čas brzdí kariéru nesmírně nadaného fotbalisty. \"Slončíka prohlédl náš lékař a měli jsme k dispozici i rentgenové snímky z mnichovské kliniky. Doktor Váchal konstatoval, že stav hráčova kolena sice není ideální, ale situace se dá řešit a po vhodném zákroku se může ještě vylepšit,\" prohlásil Pelta a dodal, že klub je s fotbalistou domluven a Slončík má zájem přestoupit. \"Chceme, aby k nám Slončík přišel hned, ale možná se s Baníkem dohodneme až na červnovém přestupu, kdy fotbalistovi končí smlouva,\" prohlásil Miroslav Pelta, který se k jednáním na Moravu chystá v první polovině příštího týdne. \"Zatím se naše stanoviska s novým vedením Baníku neshodují. Ostrava si pořád představuje, že bychom měli za Slončíka zaplatit částky, o jakých mluvil předchozí majitel Sparty, jenž nabízel řádově desítky milionů korun. Tolik však za hráče, jemuž za pět měsíců končí smlouva, zaplatit nemůžeme.\" Ostrava si svého kapitána velmi cení, Slončík má v Baníku výbornou smlouvu a klub se mu chystá předložit návrh na její prodloužení. \"Máme jeho příslib, že chce jít do Sparty, ale ve fotbale je možné všechno. Zatím nám nic nepodepsal,\" dodal Pelta. Pražský klub včera konečně podepsal smlouvu s Eurotelem, který se stal jeho oficiálním generálním sponzorem. Fotbalisté už logo této společnosti nosili na dresech celý podzim, kdy byla uzavřena pouze předběžná dohoda o budoucí smlouvě."
        ],
        "response":"Fotbalista Radek Šlončík prošel lékařskou kontrolou, která naznačuje, že jeho koleno bude vyžadovat operaci, což brání jeho okamžitému přestupování do Baníka. Kluby se zatím neshodovaly o částkách za hráše, zatímco Šlončník stále nemá podpisany smluvu u baníckého klubu.",
        "reference":"Odtajnění \"mediálního embarga\", které Sparta vyhlásila v souvislosti s chystaným přestupem fotbalového reprezentanta Radka Slančíka z Baníku Ostrava, žádný konkrétní výsledek nepřineslo. \"Po lékařské prohlídce jsme se rozhodli, že budeme o Slončíka dále usilovat,\" řekl jen generální ředitel Sparty Miroslav Pelta. Tajení tohoto faktu tak bylo zřejmě pouze snahou přilákat větší pozornost k dopolední tiskové konferenci, při níž Letenští podepsali novou sponzorskou smlouvu",
        "reference_contexts":[
            "Radek Slončík strávil celý čtvrtek v Praze a absolvoval zde vedle diskusí o smlouvě se Spartou především podrobnou lékařskou prohlídku. Zdravotní stav totiž už delší čas brzdí kariéru nesmírně nadaného fotbalisty. \"Slončíka prohlédl náš lékař a měli jsme k dispozici i rentgenové snímky z mnichovské kliniky. Doktor Váchal konstatoval, že stav hráčova kolena sice není ideální, ale situace se dá řešit a po vhodném zákroku se může ještě vylepšit,\" prohlásil Pelta a dodal, že klub je s fotbalistou domluven a Slončík má zájem přestoupit. \"Chceme, aby k nám Slončík přišel hned, ale možná se s Baníkem dohodneme až na červnovém přestupu, kdy fotbalistovi končí smlouva,\" prohlásil Miroslav Pelta, který se k jednáním na Moravu chystá v první polovině příštího týdne. \"Zatím se naše stanoviska s novým vedením Baníku neshodují. Ostrava si pořád představuje, že bychom měli za Slončíka zaplatit částky, o jakých mluvil předchozí majitel Sparty, jenž nabízel řádově desítky milionů korun. Tolik však za hráče, jemuž za pět měsíců končí smlouva, zaplatit nemůžeme.\" Ostrava si svého kapitána velmi cení, Slončík má v Baníku výbornou smlouvu a klub se mu chystá předložit návrh na její prodloužení. \"Máme jeho příslib, že chce jít do Sparty, ale ve fotbale je možné všechno. Zatím nám nic nepodepsal,\" dodal Pelta. Pražský klub včera konečně podepsal smlouvu s Eurotelem, který se stal jeho oficiálním generálním sponzorem. Fotbalisté už logo této společnosti nosili na dresech celý podzim, kdy byla uzavřena pouze předběžná dohoda o budoucí smlouvě."
        ]
    },
    {
        "user_input":"Shrň tento článek do stručného shrnutí.",
        "retrieved_contexts":[
            "\"Jsem rád, že jsem na Žižkově. V Olomouci jsem byl dlouho, chtělo to změnu,\" říká Pižanowski. Jablonecké angažmá považuje za významné z hlediska zkušeností. \"Odchytal jsem další zápasy. To je pro brankáře důležité.\" Na dotaz, zda je připraven na tlak, který na něj bude na jaře vyvíjen jako na jednoho z klíčových hráčů sestavy, navíc u posledního mužstva tabulky, Pižanowski reagoval: \"Dole je namočeno šest týmů, nemyslím si, že by to na Žižkově bylo těžší než jinde.\" Pokud jde o Olomouc, která z loňského čtvrtého místa hodně slevila a nyní je až čtrnáctá, těžko se mu hodnotí její podzimní výkony. \"Už na jaře mohlo být hůř. Kdyby nepřišel Pavel Hapal na hostování z Tenerife, skončili bychom třeba až desátí.\" Na Žižkově dostal smlouvu na čtyři roky. S přestěhováním z Moravy zatím nespěchá. V kvapu zimní přípravy na to nebyl čas. \"Až bude den volna, vrhnu se na to.\" Přiveze s sebou i přítelkyni Katku, jež dokončuje vysokou školu v Ostravě. \"Do Prahy se už těší.\""
        ],
        "response":"Západní český brankář Pižánowski na Žitkově podepsal čtyřletou smlouvou a uvádí ji jako důkaz své kvality, zatímco jeho výkon v Olomuci je podle něj nedostatečný. Přestěhování do Prahy není plánováno, ale již se těší k jeho přítelkině Katce.",
        "reference":"První týden v novém klubu má za sebou Petr Pižanowski, fotbalový brankář Viktorie Žižkov, který dorazil do metropole z Olomouce. Pětadvacetiletý gólman v podzimní části hostoval v Jablonci. Měl se vrátit na Hanou a začít chytat v Olomouci, jenže nepodepsal tam novou smlouvu. Hned nato se ozvala Viktoria Žižkov",
        "reference_contexts":[
            "\"Jsem rád, že jsem na Žižkově. V Olomouci jsem byl dlouho, chtělo to změnu,\" říká Pižanowski. Jablonecké angažmá považuje za významné z hlediska zkušeností. \"Odchytal jsem další zápasy. To je pro brankáře důležité.\" Na dotaz, zda je připraven na tlak, který na něj bude na jaře vyvíjen jako na jednoho z klíčových hráčů sestavy, navíc u posledního mužstva tabulky, Pižanowski reagoval: \"Dole je namočeno šest týmů, nemyslím si, že by to na Žižkově bylo těžší než jinde.\" Pokud jde o Olomouc, která z loňského čtvrtého místa hodně slevila a nyní je až čtrnáctá, těžko se mu hodnotí její podzimní výkony. \"Už na jaře mohlo být hůř. Kdyby nepřišel Pavel Hapal na hostování z Tenerife, skončili bychom třeba až desátí.\" Na Žižkově dostal smlouvu na čtyři roky. S přestěhováním z Moravy zatím nespěchá. V kvapu zimní přípravy na to nebyl čas. \"Až bude den volna, vrhnu se na to.\" Přiveze s sebou i přítelkyni Katku, jež dokončuje vysokou školu v Ostravě. \"Do Prahy se už těší.\""
        ]
    },
    {
        "user_input":"Shrň tento článek do stručného shrnutí.",
        "retrieved_contexts":[
            "\"Kdybych nevěřil v kubánskou medicínu, tak se tady neobjevím,\" řekl zpravodaji agentury AP a složil poklonu tamním lékařům. Není ale větším důvodem jeho náklonnost ke Kubě? Přátelí se s Fidelem Castrem, jednou s ním strávil Vánoce. Aby doložil svůj obdiv ke Kubě, hned na letišti si navlékl tričko v portrétem dalšího revolucionáře Ernesta Che Guevary a pyšně ukázal, že ho má vytetovaného i na pravém rameni.\"Jsem také rebel,\" pronesl a pousmál se, když ho zpovídal reportér vládního Radia Rebelde (Rebel). Jako by tím dal najevo, že ještě není zcela na dně. Muži, který byl jako aktivní fotbalista třikrát nachytán při dopingu, nedávno málo chybělo, aby sám sebe zničil. Začátkem ledna při dovolené v uruguayském letovisku Puenta del Este šňupal kokain.Ne poprvé v životě, jenže tentokrát to přehnal. Odvezli jej do nemocnice se zvýšeným krevním tlakem a srdeční arytmií. Při vyšetření lékaři zjistili, že srdce mu pracovalo na méně než půl výkonu.V devětatřiceti letech je šourající se troskou. Fotbalový král Pelé, jemuž letos bude už šedesát, je proti němu elegantní švihák budící úctu. U Maradony, považovaného mnohými za druhého nejlepšího fotbalistu historie, přerůstá pohrdání v soucit. Tady už nejde o vršící se počet jeho skandálů, nýbrž o holý život uhaslé argentinské hvězdy.Pořád má kolem sebe lidi, kteří jej dokáží zuby nehty bránit. Manažer Guillermo Coppola se ho snažil zachránit před veřejností a dokonce zfalšoval výsledky testů na kokain. Zaplatil za to 15 000 dolarů. Pletky s uruguayskou policií se Maradonovi vyhnuly, v zemi není užívání drog zakázáno, trestáno je pouze překupnictví. Mohl se tedy v klidu vrátit domů, na starost si ho vzali lékaři na klinice Fleni v Buenos Aires. Neměli to jednoduché.Jednou brzy ráno vnikl do Maradonova pokoje muž v bílém plášti a se stetoskopem, převlečený za lékaře. Pokusil se mu vnutit drogu.\"Myslím, že Maradona pochopil, že se musí definitivně vyléčit ze závislosti na drogách. Je na to připraven,\" oznámil po pár dnech ředitel nemocnice Ramon Leiguarda. Doložila to i bývalá hvězda. Maradona nejprve zapózoval v argentinském národním dresu na nemocničním balkónu, poté promluvil pro kabelovou televizi Fox Sports. \"Nechci odejít z tohoto světa, hodlám bojovat po zbytek svého života,\" dušoval se v emotivním projevu.Před novináři občas nesrozumitelně mumlal, pak najednou zavtipkoval a rozesmál se. Přesně tak nevyrovnaný je v životě.Dostal doporučení odjet se léčit do USA, ale tato možnost padla. Měl by problémy s udělením vstupního víza, Američané mu nezapomněli, jak pošpinil \"jejich\" světový šampionát v roce 1994 dopingovým skandálem. Proto se nakonec rozhodl pro zamilovanou Kubu.Vyrazil běžnou leteckou linkou, ne žádným speciálem, zato s početným doprovodem: s manželkou Claudií Villafaneovou, rodiči, manažerem, osobním lékařem Alfredem Caheem, neurologem a kardiologem. Vstupuje možná do nejtěžšího období svého života.\"Teď se musím starat jen o sebe a dělat věci, které mi lékaři řeknou,\" řekl. Bylo to skutečné zmoudření, nebo slova do větru, jako když Tomáš Skuhravý před časem sliboval, že autem nebude už jezdit bláznivě rychle?"
        ],
        "response":"Argentinský fotbalista Diego Maradona se rozhodl opustit svou kariéru kvůli těžké závislosti a dopingu a přestoupil do kubánského zdravotnického systému. Po úspěšném návratu do Argentiny však již v roce následujícím po svém odchodu z reprezentace dostal doporučení na léčbu v USA, což mu však kvůli minulému dopingovému skandálu a problémům s vízami nepovedlo.",
        "reference":"Baculatý chlapík v černých brýlích se objevil začátkem týdne na letišti v kubánském Holguínu a vyvolal rozruch. Reportéři se přetlačovali, aby se mu příblížili k tělu a mohli položit pár otázek. Na čilý zájem o osobu byl Diego Maradona zvyklý od sedmnácti let. Teď ho ale nenutili, aby vzpomínal na taje fotbalové dovednosti, nýbrž vysvětloval, proč se hodlá léčit ze závislosti na kokain právě na \"ostrově svobody\"",
        "reference_contexts":[
            "\"Kdybych nevěřil v kubánskou medicínu, tak se tady neobjevím,\" řekl zpravodaji agentury AP a složil poklonu tamním lékařům. Není ale větším důvodem jeho náklonnost ke Kubě? Přátelí se s Fidelem Castrem, jednou s ním strávil Vánoce. Aby doložil svůj obdiv ke Kubě, hned na letišti si navlékl tričko v portrétem dalšího revolucionáře Ernesta Che Guevary a pyšně ukázal, že ho má vytetovaného i na pravém rameni.\"Jsem také rebel,\" pronesl a pousmál se, když ho zpovídal reportér vládního Radia Rebelde (Rebel). Jako by tím dal najevo, že ještě není zcela na dně. Muži, který byl jako aktivní fotbalista třikrát nachytán při dopingu, nedávno málo chybělo, aby sám sebe zničil. Začátkem ledna při dovolené v uruguayském letovisku Puenta del Este šňupal kokain.Ne poprvé v životě, jenže tentokrát to přehnal. Odvezli jej do nemocnice se zvýšeným krevním tlakem a srdeční arytmií. Při vyšetření lékaři zjistili, že srdce mu pracovalo na méně než půl výkonu.V devětatřiceti letech je šourající se troskou. Fotbalový král Pelé, jemuž letos bude už šedesát, je proti němu elegantní švihák budící úctu. U Maradony, považovaného mnohými za druhého nejlepšího fotbalistu historie, přerůstá pohrdání v soucit. Tady už nejde o vršící se počet jeho skandálů, nýbrž o holý život uhaslé argentinské hvězdy.Pořád má kolem sebe lidi, kteří jej dokáží zuby nehty bránit. Manažer Guillermo Coppola se ho snažil zachránit před veřejností a dokonce zfalšoval výsledky testů na kokain. Zaplatil za to 15 000 dolarů. Pletky s uruguayskou policií se Maradonovi vyhnuly, v zemi není užívání drog zakázáno, trestáno je pouze překupnictví. Mohl se tedy v klidu vrátit domů, na starost si ho vzali lékaři na klinice Fleni v Buenos Aires. Neměli to jednoduché.Jednou brzy ráno vnikl do Maradonova pokoje muž v bílém plášti a se stetoskopem, převlečený za lékaře. Pokusil se mu vnutit drogu.\"Myslím, že Maradona pochopil, že se musí definitivně vyléčit ze závislosti na drogách. Je na to připraven,\" oznámil po pár dnech ředitel nemocnice Ramon Leiguarda. Doložila to i bývalá hvězda. Maradona nejprve zapózoval v argentinském národním dresu na nemocničním balkónu, poté promluvil pro kabelovou televizi Fox Sports. \"Nechci odejít z tohoto světa, hodlám bojovat po zbytek svého života,\" dušoval se v emotivním projevu.Před novináři občas nesrozumitelně mumlal, pak najednou zavtipkoval a rozesmál se. Přesně tak nevyrovnaný je v životě.Dostal doporučení odjet se léčit do USA, ale tato možnost padla. Měl by problémy s udělením vstupního víza, Američané mu nezapomněli, jak pošpinil \"jejich\" světový šampionát v roce 1994 dopingovým skandálem. Proto se nakonec rozhodl pro zamilovanou Kubu.Vyrazil běžnou leteckou linkou, ne žádným speciálem, zato s početným doprovodem: s manželkou Claudií Villafaneovou, rodiči, manažerem, osobním lékařem Alfredem Caheem, neurologem a kardiologem. Vstupuje možná do nejtěžšího období svého života.\"Teď se musím starat jen o sebe a dělat věci, které mi lékaři řeknou,\" řekl. Bylo to skutečné zmoudření, nebo slova do větru, jako když Tomáš Skuhravý před časem sliboval, že autem nebude už jezdit bláznivě rychle?"
        ]
    },
    {
        "user_input":"Shrň tento článek do stručného shrnutí.",
        "retrieved_contexts":[
            "\"Ve finále EURO jsem kopl mnohem větší silou, tehdy jsem dal do střely opravdu absolutně všechno,\" zavzpomínal Patrik Berger na dosud největší okamžik své kariéry, když v roce 1996 proměnil ve finále ME v Londýně pokutový kop. \"Kdyby to nebyla taková rána, tak ji brankář Kopke možná chytil, vždyť skákal správným směrem. Vloni jsme spolu při jednom večírku vypili kupu piv, a tak jsme si o tom pěkně popovídali,\" přiznal fotbalista. V Písku se však obával dalšího uklouznutí, a tak byl opatrnější. Fotbalové slavnosti v Písku probíhaly celý víkend. Začalo se sobotním halovým turnajem, v němž dominoval tým místní radnice, v neděli si po celý den návštěvníci fotbalového pavilonu zkoušeli sedm míčových dovedností a všichni s napětím vyčkávali příjezd hlavního hrdiny dne. Nepřízeň počasí, ale i jiné trable s cestováním, totiž už předtím několikrát zasáhly do průběhu píseckého víkendu. Televizní komentátor Robert Záruba, který měl být jednou z opor novinářské jedenáctky při sobotním turnaji, ukončil svoji cestu na svodidlech příbramské dálnice, dopravní nehoda (naštěstí také jen lehká) předčasně ukončila i cestu sparťana Romana Lengyela na nedělní autogramiádu. Další z hráčů Sparty Martin Hašek se bouračkám vyhnul, jenže místo do Písku dorazil i s celou svojí rodinou do Tábora. Spletl si cestu, a tak na slavnostní vyhlášení přijel těsně před jeho skončením. \"Asi měl ještě v hlavě zápas v Barceloně,\" připomněl sparťanský debakl 0:5 v Lize mistrů Patrik Berger, jenž byl nakonec v Písku oproti předpokladům dříve, než sparťanský záložník. Berger si totiž vyzvedl smůlu už doma, v anglickém Liverpoolu, kde před několika dny zjistil, že ztratil letenku, na níž měl v neděli na otočku cestovat do České republiky. \"Nakonec mi to pomohl vyřešit jeden z organizačních pracovníků klubu, který mi nechal nějakým způsobem vystavit novou,\" usmíval se Berger. Počasí v Čechách jej sice zaskočilo (\"V Liverpoolu není po sněhu ani památky.\"), ale nezdrželo, takže do píseckého kulturního domu dorazil ještě o chvilku dříve, než se očekávalo. Ještě v kabátě se Berger vrhl na občerstvení, kde ho nejvíce zaujaly nakládané špekáčky, utopence. \"Něco takového v Anglii nemáme,\" liboval si nejlepší český fotbalista, když si šel ještě pro přídavek. Šmak, s jakým hráč českou lahůdku konzumoval, neunikl ani hostitelům, kteří mu na rozloučenou dali celou láhev nakládaných buřtů ne cestu. \"Utopence si odvezu do Anglie, cena zůstane v Praze,\" připustil Berger, který desetikilogramovou bronzovou trofej nechá v péči svého manažera. Liverpoolský záložník měl v nohou sobotní ligové utkání s Middlesborourghem (0:0), trochu jej pobolívalo tříslo, a tak se mu do sportovních soutěží v Písku moc nechtělo. Souboj s fotobuňkou, která měřila síla kopu, byl z tohoto pohledu obzvlášť nebezpečný, přesto se Berger nakonec nechal vyhecovat. Zaujal jej totiž duel dvou švagrů, hráčů divizní Čížové, kteří v průběhu dne bojovali o rekordní kop. Když zvedli laťku až na 103,1 km\/h, rozhodl se vyhlášený kanonýr Berger do jejich souboje vstoupit. Při prvním pokusu podklouzl a počítač ukázal rychlost jen 9,6 km\/h, napodruhé se už rekord zatřásl (103,0) a do třetice Berger svůj úkol splnil: míč vyslal na bránu rychlostí 105,9 km\/h. \"Sám jsem jako malý kluk startoval na podobné dovednostní soutěži 8x z abecedy fotbalu, sílu kopu mi však ještě nikdo neměřil,\" přiznal úspěšný reprezentant, jehož v Písku s obdivem sledovaly stovky mladých fotbalistů. Hvězda, kterou všichni dosud znali jen z televize, najednou stála mezi nimi, nechala se s nimi fotografovat a ochotně čelila nekonečné frontě při 45minutové autogramiádě. \"Pro malé kluky musel být zdejší program obrovský zážitek, i mě se tady moc líbilo, a to jsem tu byl jenom chvilku. Odvážím si spoustu dojmů a určitě budu mít v Liverpoolu o čem vyprávět,\" řekl Berger, který teprve během své návštěvy zjistil, že nemusí mít tolik naspěch, jak se původně čekalo. \"Měl jsem už před osmou hodinou večer letět zpátky domů, ale nakonec jsme všichni v Liverpoolu dostali v neděli i v pondělí volno a já jsem právě dozvěděl, že se podařilo přeložit mou letenku,\" pochvaloval si fotbalista. \"Takže mám čas projít se po Praze, kde jsem už hodně dlouho nebyl,\" těší se. Podrobnější informace o novinářské anketě Zlatý míč včetně výsledků minulých ročníků najdete ZDE."
        ],
